username,orario,text
TransportDems,2023-06-28 18:30:01+00:00,"The #InfrastructureDecade continues!

Thanks to $2.2 BILLION in Bipartisan Infrastructure Law funding, communities big and small will invest in projects that improve the safety, connectivity, and sustainability of their infrastructure—all while creating good-paying jobs. https://t.co/ItsOPYPoTT"
HouseDemocrats,2023-06-28 18:34:45+00:00,"RT @Thanks to @POTUS and Democrats in Congress, we've made historic gains for Americans. 

Nearly 1 year ago—after 30 years of federal inaction on gun violence and countless shootings—we passed the Safer Communities Act to ensure we work to protect our loved ones from gun violence."
RepWilson,2023-06-28 17:39:04+00:00,"Thanks to @POTUS and Democrats in Congress, we've made historic gains for Americans. 

Nearly 1 year ago—after 30 years of federal inaction on gun violence and countless shootings—we passed the Safer Communities Act to ensure we work to protect our loved ones from gun violence."
HouseDemocrats,2023-06-28 17:12:17+00:00,"House Democrats wish Muslims across America and around the world a joyous Eid al-Adha.

Eid Mubarak!"
HouseDemocrats,2023-06-28 16:50:48+00:00,"RT @A big deal. $17 million in federal funding from the Infrastructure Law is heading to New London to transform the downtown transit infrastructure. This comes after six years of persistent, diligent work by the city and the CT congressional delegation. 

https://t.co/TNuAUMI84C"
RepJoeCourtney,2023-06-24 20:48:55+00:00,"A big deal. $17 million in federal funding from the Infrastructure Law is heading to New London to transform the downtown transit infrastructure. This comes after six years of persistent, diligent work by the city and the CT congressional delegation. 

https://t.co/TNuAUMI84C"
HouseDemocrats,2023-06-27 20:28:56+00:00,"Extreme MAGA Republicans are breaking our nation’s promise to our seniors by trying to cut Social Security and Medicare. 

Their reckless plan puts seniors’ retirement security on the chopping block."
HouseDemocrats,2023-06-27 20:06:10+00:00,"RT @Every American should have access to the internet in their home. 

Thanks to the Bipartisan Infrastructure Law, we're delivering $1+ billion to create additional broadband infrastructure in Illinois and lower costs for families."
RepSchneider,2023-06-27 19:50:00+00:00,"Every American should have access to the internet in their home. 

Thanks to the Bipartisan Infrastructure Law, we're delivering $1+ billion to create additional broadband infrastructure in Illinois and lower costs for families."
NTIAgov,2023-06-26 18:26:39+00:00,"A milestone moment for the nearly 8.5M homes &amp; small businesses across 🇺🇸 who lack Internet access!

Every state and territory in America now know how much 💰 they’ll need to connect everyone to affordable, reliable, high-speed #InternetForAll.

📖More⬇️
https://t.co/gKnUInqUmO https://t.co/Avvnxcnjai"
HouseDemocrats,2023-06-27 16:55:34+00:00,"RT @Today’s ruling is a major victory for free and fair elections in North Carolina and across the country. 

One branch of state government should not have unfettered and unchecked power over state election laws and maps."
RepDeborahRoss,2023-06-27 16:42:47+00:00,"Today’s ruling is a major victory for free and fair elections in North Carolina and across the country. 

One branch of state government should not have unfettered and unchecked power over state election laws and maps."
nytimes,2023-06-27 16:30:31+00:00,Breaking News: The Supreme Court rejected a legal theory that would have radically reshaped how federal elections are conducted and allowed state lawmakers nearly unchecked power over them. https://t.co/9qfSrOv9z0
HouseDemocrats,2023-06-27 16:48:35+00:00,"RT @California has been an oasis of reproductive freedom in the year since the Dobbs decision.

Yet, it's clearer than ever that Republicans won't stop until abortion is banned in every state. That's why @HouseDemocrats are fighting to enshrine abortion rights into law. https://t.co/v0t68XPFAg"
RepPeteAguilar,2023-06-27 01:04:31+00:00,"California has been an oasis of reproductive freedom in the year since the Dobbs decision.

Yet, it's clearer than ever that Republicans won't stop until abortion is banned in every state. That's why @HouseDemocrats are fighting to enshrine abortion rights into law. https://t.co/v0t68XPFAg"
HouseDemocrats,2023-06-26 22:29:20+00:00,"RT @Thrilled to share that Illinois will receive over $1 billion from @POTUS's visionary plan to expand high-speed internet access across the U.S  This is a significant stride to close the digital divide, empowering our businesses &amp; families across our state.
https://t.co/2oV326gjrq"
rep_jackson,2023-06-26 21:39:40+00:00,"Thrilled to share that Illinois will receive over $1 billion from @POTUS's visionary plan to expand high-speed internet access across the U.S  This is a significant stride to close the digital divide, empowering our businesses &amp; families across our state.
https://t.co/2oV326gjrq"
HouseDemocrats,2023-06-26 21:20:45+00:00,"RT @The internet is crucial for access to school, work, finances, and healthcare, but it's not affordable for everyone.

Now, PA is receiving $1.1B to help families stay connected.

Excited to see this investment in action — especially in rural areas of my district like Berks County."
RepDean,2023-06-26 20:56:26+00:00,"The internet is crucial for access to school, work, finances, and healthcare, but it's not affordable for everyone.

Now, PA is receiving $1.1B to help families stay connected.

Excited to see this investment in action — especially in rural areas of my district like Berks County."
MitchLandrieu46,2023-06-26 16:00:05+00:00,"Today, @POTUS &amp; @VP will announce over $40 billion to every state, territory, &amp; D.C. for high-speed internet infrastructure. This is THE single largest federal investment in high-speed internet in our nation’s history. 

https://t.co/8LyLW6hsI5"
HouseDemocrats,2023-06-26 20:50:32+00:00,"Today, the Biden-Harris administration announced the largest-ever investment in high-speed internet.

This funding, which is made possible by the Bipartisan Infrastructure Law, will help bridge our country’s digital divide."
HouseDemocrats,2023-06-26 19:29:23+00:00,"RT @🚨 House Republicans’ new plan would cut Social Security benefits for nearly 10 million Illinois residents.

https://t.co/BVuHeKbpdv"
RepUnderwood,2023-06-26 18:50:02+00:00,"🚨 House Republicans’ new plan would cut Social Security benefits for nearly 10 million Illinois residents.

https://t.co/BVuHeKbpdv"
HouseDemocrats,2023-06-26 18:08:17+00:00,"RT @.@HouseDemocrats have played a crucial role in creating more than 13 million jobs since January 2021.

The work isn’t finished, but we’re investing in Washington state and across the country to grow the middle class, bring supply chains back home, and make more in America. https://t.co/YPZ4HuNJKD"
RepDerekKilmer,2023-06-26 18:00:02+00:00,".@HouseDemocrats have played a crucial role in creating more than 13 million jobs since January 2021.

The work isn’t finished, but we’re investing in Washington state and across the country to grow the middle class, bring supply chains back home, and make more in America. https://t.co/YPZ4HuNJKD"
HouseDemocrats,2023-06-26 17:46:08+00:00,"RT @In the last few years, we've seen a resurgence of American manufacturing thanks to policies like the Bipartisan Infrastructure Law &amp; the Inflation Reduction Act⚒️🔩

➡️Check out https://t.co/QMvM1WMHX8 to see how our economic policies are bringing jobs &amp; investment to CT."
RepJahanaHayes,2023-06-26 17:00:18+00:00,"In the last few years, we've seen a resurgence of American manufacturing thanks to policies like the Bipartisan Infrastructure Law &amp; the Inflation Reduction Act⚒️🔩

➡️Check out https://t.co/QMvM1WMHX8 to see how our economic policies are bringing jobs &amp; investment to CT."
HouseDemocrats,2023-06-26 16:44:39+00:00,"One year ago, Democrats enacted the Bipartisan Safer Communities Act — the most significant gun safety legislation in 30 years.

While this legislation is saving lives, we know we must do more to end the gun violence epidemic in America."
HouseDemocrats,2023-06-26 16:36:49+00:00,"RT @The Bipartisan Safer Communities Act has:

🚩 Provided over $230M for tools like red flag laws
🏫 Delivered over $1.5B for school safety &amp; mental health services
🥼 Hired &amp; trained 14,000 mental health professionals to work at schools
✅ Saved lives &amp; helped prevent gun violence"
RepThompson,2023-06-26 16:16:04+00:00,"The Bipartisan Safer Communities Act has:

🚩 Provided over $230M for tools like red flag laws
🏫 Delivered over $1.5B for school safety &amp; mental health services
🥼 Hired &amp; trained 14,000 mental health professionals to work at schools
✅ Saved lives &amp; helped prevent gun violence"
HouseDemocrats,2023-06-25 23:39:22+00:00,"RT @One year ago, President Joe Biden signed the most significant gun violence prevention legislation in 30 years into law.

On this anniversary, we celebrate the positive impact of this historic law but also renew our commitment to ending gun violence."
RepThompson,2023-06-25 17:28:20+00:00,"One year ago, President Joe Biden signed the most significant gun violence prevention legislation in 30 years into law.

On this anniversary, we celebrate the positive impact of this historic law but also renew our commitment to ending gun violence."
HouseDemocrats,2023-06-25 23:38:27+00:00,"RT @One year ago, the Bipartisan Safer Communities Act was signed into law to fight senseless gun violence.

I'm proud to have fought for the first major gun reform bill in a generation. We continue the fight for safer neighborhoods &amp; communities, every day.
https://t.co/J3NDIUHwe4"
RepLucyMcBath,2023-06-25 15:05:00+00:00,"One year ago, the Bipartisan Safer Communities Act was signed into law to fight senseless gun violence.

I'm proud to have fought for the first major gun reform bill in a generation. We continue the fight for safer neighborhoods &amp; communities, every day.
https://t.co/J3NDIUHwe4"
HouseDemocrats,2023-06-25 23:38:10+00:00,"RT @One year ago, @POTUS signed into law the most significant gun safety legislation in 30 years: the Bipartisan Safer Communities Act.

This law included my red flag measure, protections for domestic abuse victims, and enhanced background checks. https://t.co/bB3czs8zXM"
RepCarbajal,2023-06-25 18:58:38+00:00,"One year ago, @POTUS signed into law the most significant gun safety legislation in 30 years: the Bipartisan Safer Communities Act.

This law included my red flag measure, protections for domestic abuse victims, and enhanced background checks. https://t.co/bB3czs8zXM"
HouseDemocrats,2023-06-25 23:22:44+00:00,"RT @The Safer Communities Act, passed last year, was an important step to protect American families from gun violence.

But the fight is far from over – more progress is needed to eliminate gun violence and protect our communities.

We cannot stop working until our children are safe."
RepDanGoldman,2023-06-25 22:46:13+00:00,"The Safer Communities Act, passed last year, was an important step to protect American families from gun violence.

But the fight is far from over – more progress is needed to eliminate gun violence and protect our communities.

We cannot stop working until our children are safe."
HouseDemocrats,2023-06-25 20:48:30+00:00,"Extreme Republicans want to make it harder for people to exercise their sacred right to vote.

House Democrats want to make it easier.

It’s really that simple."
HouseAdm_Dems,2023-06-25 16:44:52+00:00,"Read Subcommittee on Elections Ranking Member @RepTerriSewell op-ed on a #DecadeofShelby and the path forward to protect the sacred right to vote.⬇️

https://t.co/XbGOpEjv8u"
HouseDemocrats,2023-06-24 19:18:28+00:00,"RT @Today marks 1 year since SCOTUS overturned the right to choose with their decision in Dobbs v. Jackson. GOP state legislatures have since raced to pass laws that ban practically all abortions.

Democrats will keep fighting to restore access to reproductive health care nationwide."
RepJamesClyburn,2023-06-24 17:11:30+00:00,"Today marks 1 year since SCOTUS overturned the right to choose with their decision in Dobbs v. Jackson. GOP state legislatures have since raced to pass laws that ban practically all abortions.

Democrats will keep fighting to restore access to reproductive health care nationwide."
HouseDemocrats,2023-06-24 19:16:05+00:00,"RT @Right-wing extremists on the Supreme Court shamefully overturned #RoevWade 1 yr ago.

MAGA Republicans in Congress want to impose a nationwide ban on abortion care.

House Dems are working hard to stop these extremists and restore reproductive freedom.

Together we will win."
RepJeffries,2023-06-24 17:23:23+00:00,"Right-wing extremists on the Supreme Court shamefully overturned #RoevWade 1 yr ago.

MAGA Republicans in Congress want to impose a nationwide ban on abortion care.

House Dems are working hard to stop these extremists and restore reproductive freedom.

Together we will win."
HouseDemocrats,2023-06-24 19:13:36+00:00,"RT @Today marks 1 year since the overturning of Roe v. Wade. We codified the right to choose in CO, but states across the country have been rolling back reproductive rights.

As a member of @ProChoiceCaucus, we're pushing for an immediate vote on the Women’s Health Protection Act. https://t.co/wAuZSdyU4z"
RepPettersen,2023-06-24 18:04:46+00:00,"Today marks 1 year since the overturning of Roe v. Wade. We codified the right to choose in CO, but states across the country have been rolling back reproductive rights.

As a member of @ProChoiceCaucus, we're pushing for an immediate vote on the Women’s Health Protection Act. https://t.co/wAuZSdyU4z"
HouseDemocrats,2023-06-24 19:12:44+00:00,"RT @For 365 days, too many women haven’t had the choice to decide what happens to their body. I’m thankful that Pennsylvanians can, but that wasn’t always a guarantee. We must pass the Women’s Health Protection Act to codify the right to an abortion."
RepHoulahan,2023-06-24 18:18:52+00:00,"For 365 days, too many women haven’t had the choice to decide what happens to their body. I’m thankful that Pennsylvanians can, but that wasn’t always a guarantee. We must pass the Women’s Health Protection Act to codify the right to an abortion."
HouseDemocrats,2023-06-24 19:08:25+00:00,"RT @ProChoiceCaucus: One year.

We hope you will keep fighting with us.

 https://t.co/nZGdOif0xk"
ProChoiceCaucus,2023-06-24 14:00:44+00:00,"One year.

We hope you will keep fighting with us.

 https://t.co/nZGdOif0xk"
HouseDemocrats,2023-06-24 19:08:01+00:00,"RT @It's been a year since SCOTUS' ruling to overturn Roe V. Wade started the worst maternal mortality crisis in modern history — a tragedy Black women are 3x as likely to face.

Democrats are acting to force a vote to secure our right to abortion, and we will succeed."
RepYvetteClarke,2023-06-24 18:37:51+00:00,"It's been a year since SCOTUS' ruling to overturn Roe V. Wade started the worst maternal mortality crisis in modern history — a tragedy Black women are 3x as likely to face.

Democrats are acting to force a vote to secure our right to abortion, and we will succeed."
HouseDemocrats,2023-06-24 16:39:34+00:00,"One year ago, SCOTUS overturned Roe v. Wade — leaving millions of Americans without access to essential health care.

Every day since the Dobbs decision, House Democrats have fought to restore reproductive freedom and protect access to contraception.

We won’t back down. https://t.co/jMVeGicHiw"
HouseDemocrats,2023-06-23 21:32:17+00:00,"RT @ICYMI: The Republican Study Committee represents nearly 80% of House Republicans.

They just released an extreme budget that raises the retirement age of 24 MILLION Texans, cutting their Social Security benefits and forcing them to work even longer for less. https://t.co/6PwERoGzx4"
RepEscobar,2023-06-23 21:19:27+00:00,"ICYMI: The Republican Study Committee represents nearly 80% of House Republicans.

They just released an extreme budget that raises the retirement age of 24 MILLION Texans, cutting their Social Security benefits and forcing them to work even longer for less. https://t.co/6PwERoGzx4"
HouseDemocrats,2023-06-23 20:55:27+00:00,"RT @I’m fighting to ensure every woman – no matter their zip code – has the right to an abortion. That’s why I signed a discharge petition to force a vote on the Women’s Health Protection Act. 

We must use every tool at our disposal to codify Roe into federal law."
Rep_Magaziner,2023-06-23 20:49:46+00:00,"I’m fighting to ensure every woman – no matter their zip code – has the right to an abortion. That’s why I signed a discharge petition to force a vote on the Women’s Health Protection Act. 

We must use every tool at our disposal to codify Roe into federal law."
HouseDemocrats,2023-06-23 20:28:55+00:00,"RT @Republicans are working on a radical tax bill that puts the wealthy and well-connected ahead of America's working families.

Meanwhile, Democrats have created 13 million jobs since @POTUS took office, growing the middle class from the bottom up and the middle out."
RepMarkPocan,2023-06-23 20:27:09+00:00,"Republicans are working on a radical tax bill that puts the wealthy and well-connected ahead of America's working families.

Meanwhile, Democrats have created 13 million jobs since @POTUS took office, growing the middle class from the bottom up and the middle out."
HouseDemocrats,2023-06-23 20:14:49+00:00,"RT @The Inflation Reduction Act continues to deliver for families across the country.

We're going to build the clean energy technology of the future here in America with good-paying jobs that grow the middle class. 🇺🇸
https://t.co/B253zq82Fp"
HouseBudgetDems,2023-06-23 19:32:01+00:00,"The Inflation Reduction Act continues to deliver for families across the country.

We're going to build the clean energy technology of the future here in America with good-paying jobs that grow the middle class. 🇺🇸
https://t.co/B253zq82Fp"
HouseDemocrats,2023-06-23 19:40:03+00:00,"RT @Proud to stand with ⁦@HouseDemocrats⁩ today to demand action on protecting abortion rights. 

Make no mistake, Extreme Republicans will not stop until they enact a national abortion ban. 

We will never let that happen. https://t.co/TD3cHeXZx2"
RepPeteAguilar,2023-06-23 19:03:46+00:00,"Proud to stand with ⁦@HouseDemocrats⁩ today to demand action on protecting abortion rights. 

Make no mistake, Extreme Republicans will not stop until they enact a national abortion ban. 

We will never let that happen. https://t.co/TD3cHeXZx2"
HouseDemocrats,2023-06-23 18:54:02+00:00,"RT @Our Women’s Health Protection Act would end the Dobbs disaster — and if a few patriotic Republicans join our discharge petition, we can bring this legislation to the Floor now.

Women’s most basic health decisions should be their own to make — not right-wing politicians. https://t.co/b3hR4phThL"
SpeakerPelosi,2023-06-23 18:51:14+00:00,"Our Women’s Health Protection Act would end the Dobbs disaster — and if a few patriotic Republicans join our discharge petition, we can bring this legislation to the Floor now.

Women’s most basic health decisions should be their own to make — not right-wing politicians. https://t.co/b3hR4phThL"
HouseDemocrats,2023-06-23 18:49:39+00:00,"RT @Ahead of the one-year anniversary of SCOTUS overturning #Roe, I joined my colleagues in demanding the Women's Health Protection Act be brought to the floor for a vote.  

We won't back down from radical attempts to control women. https://t.co/nTsnGayRCt"
RepBillFoster,2023-06-23 18:47:18+00:00,"Ahead of the one-year anniversary of SCOTUS overturning #Roe, I joined my colleagues in demanding the Women's Health Protection Act be brought to the floor for a vote.  

We won't back down from radical attempts to control women. https://t.co/nTsnGayRCt"
HouseDemocrats,2023-06-23 18:34:14+00:00,"RT @It's been nearly 1 year since this extremist #SCOTUS eviscerated abortion rights.

This week, 210 @HouseDemocrats signed a petition to force a vote on my Women's Health Protection Act —providing abortion rights nationwide. We need 8 Republicans to sign on to restore these rights. https://t.co/5squLPh8on"
RepJudyChu,2023-06-23 18:24:10+00:00,"It's been nearly 1 year since this extremist #SCOTUS eviscerated abortion rights.

This week, 210 @HouseDemocrats signed a petition to force a vote on my Women's Health Protection Act —providing abortion rights nationwide. We need 8 Republicans to sign on to restore these rights. https://t.co/5squLPh8on"
HouseDemocrats,2023-06-23 17:57:42+00:00,"RT @Every woman should have the freedom to make her own health care decisions.
 
On the eve of the Supreme Court’s decision to overturn Roe v. Wade, we are redoubling our efforts to restore American’s right to abortion care.
 
We will not back down. We will not go back. https://t.co/qa3gtlmYij"
RepDianaDeGette,2023-06-23 17:41:03+00:00,"Every woman should have the freedom to make her own health care decisions.
 
On the eve of the Supreme Court’s decision to overturn Roe v. Wade, we are redoubling our efforts to restore American’s right to abortion care.
 
We will not back down. We will not go back. https://t.co/qa3gtlmYij"
HouseDemocrats,2023-06-23 17:57:32+00:00,RT @RepJeffries: We will not rest until reproductive freedom has been restored throughout America. https://t.co/V2InYDOkRU
RepJeffries,2023-06-23 17:49:53+00:00,We will not rest until reproductive freedom has been restored throughout America. https://t.co/V2InYDOkRU
HouseDemocrats,2023-06-23 17:57:11+00:00,"RT @One year ago tomorrow, the Supreme Court overturned Roe v. Wade and ripped away a constitutional right for the first time in our history. 

@HouseDemocrats will not back down until we restore the right to bodily autonomy and reproductive freedom for every woman in America."
GerryConnolly,2023-06-23 16:46:02+00:00,"One year ago tomorrow, the Supreme Court overturned Roe v. Wade and ripped away a constitutional right for the first time in our history. 

@HouseDemocrats will not back down until we restore the right to bodily autonomy and reproductive freedom for every woman in America."
HouseDemocrats,2023-06-23 17:57:06+00:00,"RT @.@HouseDemocrats are investing in America.

In Washington state, the Bipartisan Infrastructure Law is helping to rebuild roads and bridges, bring clean water to more homes, and expand broadband access to rural communities. https://t.co/6vRmnRlFip"
RepDerekKilmer,2023-06-23 17:00:00+00:00,".@HouseDemocrats are investing in America.

In Washington state, the Bipartisan Infrastructure Law is helping to rebuild roads and bridges, bring clean water to more homes, and expand broadband access to rural communities. https://t.co/6vRmnRlFip"
HouseDemocrats,2023-06-23 16:18:48+00:00,"RT @Last Congress, @HouseDemocrats passed the #WomensHealthProtectionAct not once but twice.  

This week, we introduced it again as a discharge petition. 

So, @HouseGOP, are you on the side of freedom or extremism? 
https://t.co/8P0ehz1Bsb"
WhipKClark,2023-06-23 15:49:04+00:00,"Last Congress, @HouseDemocrats passed the #WomensHealthProtectionAct not once but twice.  

This week, we introduced it again as a discharge petition. 

So, @HouseGOP, are you on the side of freedom or extremism? 
https://t.co/8P0ehz1Bsb"
HouseDemocrats,2023-06-23 15:08:54+00:00,"This week marks one year since the Dobbs decision overturned Roe v. Wade.

People — not politicians — must be free to make their own health care decisions.

House Democrats will always fight for reproductive freedom."
HouseDemocrats,2023-06-22 23:30:30+00:00,"RT @To the LGBTQ+ community: Democrats have your back. We are fighting to protect the LGBTQ+ community from cruel attacks and defend your freedoms, including by passing a new law that protects the freedom to marry who you love. https://t.co/VMTYN0FxtB"
RepCardenas,2023-06-22 23:29:00+00:00,"To the LGBTQ+ community: Democrats have your back. We are fighting to protect the LGBTQ+ community from cruel attacks and defend your freedoms, including by passing a new law that protects the freedom to marry who you love. https://t.co/VMTYN0FxtB"
HouseDemocrats,2023-06-22 23:25:16+00:00,"RT @Guns are the number one killer of America’s kids. 

That's horrifying.

Democrats are fighting for stronger gun safety laws that stop dangerous people from buying guns and keep dangerous weapons off our streets."
RepShontelBrown,2023-06-22 22:55:00+00:00,"Guns are the number one killer of America’s kids. 

That's horrifying.

Democrats are fighting for stronger gun safety laws that stop dangerous people from buying guns and keep dangerous weapons off our streets."
HouseDemocrats,2023-06-22 19:27:10+00:00,"RT @While @HouseDemocrats are fighting to lower prescription drug costs and make health care more affordable, extreme MAGA Republicans are trying to raise costs for older Americans and women and threaten care for people with pre-existing conditions."
RepTedLieu,2023-06-22 19:26:13+00:00,"While @HouseDemocrats are fighting to lower prescription drug costs and make health care more affordable, extreme MAGA Republicans are trying to raise costs for older Americans and women and threaten care for people with pre-existing conditions."
HouseDemocrats,2023-06-22 18:43:45+00:00,"RT @A new survey shows the devastating effect that the GOP’s abortion bans are having on maternal health in this country.

This is exactly why Reps. Lee, Chu and I are pushing so hard to restore Roe nationwide.
https://t.co/xYDFAaHrbh"
