username,orario,text
HouseDemocrats,2023-05-08 20:49:42+00:00,"RT @The GOP is demanding VA cuts—threatening outpatient care for 165k veterans in SC—or threatening national default.

Their ransom note would also make it easier for corporations to cheat on taxes.

It's clear who their economic hostage-taking would benefit, and who it would harm."
RepJamesClyburn,2023-05-08 19:44:27+00:00,"The GOP is demanding VA cuts—threatening outpatient care for 165k veterans in SC—or threatening national default.

Their ransom note would also make it easier for corporations to cheat on taxes.

It's clear who their economic hostage-taking would benefit, and who it would harm."
HouseDemocrats,2023-05-08 20:44:57+00:00,"RT @The GOP’s “Default on America Act” would cause more than 100,000 people in #OH13 nearing retirement to lose money in their 401ks. I voted no on this bill and I will always fight to protect retirement benefits for Northeast Ohioans."
RepEmiliaSykes,2023-05-08 20:44:00+00:00,"The GOP’s “Default on America Act” would cause more than 100,000 people in #OH13 nearing retirement to lose money in their 401ks. I voted no on this bill and I will always fight to protect retirement benefits for Northeast Ohioans."
HouseDemocrats,2023-05-08 20:44:53+00:00,"RT @I'm a Head Start baby. Nuevo Mexicanos know that investing in our kids is an investment in our future.

The Republican Default on America steals that future from thousands of children in New Mexico. https://t.co/N2sBlTRGEC"
RepTeresaLF,2023-05-08 20:42:53+00:00,"I'm a Head Start baby. Nuevo Mexicanos know that investing in our kids is an investment in our future.

The Republican Default on America steals that future from thousands of children in New Mexico. https://t.co/N2sBlTRGEC"
HouseDemocrats,2023-05-08 16:53:37+00:00,"There have been more mass shootings than days this year.

It’s time for our Republican colleagues to say enough is enough and work with us to pass common sense gun safety legislation to save lives."
HouseDemocrats,2023-05-05 19:58:55+00:00,"This #SmallBusinessWeek we're celebrating America's small business boom.

Thanks to @POTUS and House Democrats' policies, small business applications reached a record high of 10.5 MILLION over the last two years 🎉"
HouseDemocrats,2023-05-05 19:46:16+00:00,"RT @Defaulting on our nation's bills would kill 7 million jobs, wipe out $10 trillion in household wealth, and plunge our economy into recession.

I will keep fighting this MAGA extremist scheme for families in FL-25 and across the country. https://t.co/r3lufurJoE"
RepDWStweets,2023-05-05 18:53:55+00:00,"Defaulting on our nation's bills would kill 7 million jobs, wipe out $10 trillion in household wealth, and plunge our economy into recession.

I will keep fighting this MAGA extremist scheme for families in FL-25 and across the country. https://t.co/r3lufurJoE"
HouseDemocrats,2023-05-05 19:44:48+00:00,"RT @In April, the U.S. added 253,000 new jobs &amp; the unemployment rate fell to 3.4%, the lowest rate since 1969!

@POTUS &amp; @HouseDemocrats will continue fighting to strengthen our economy, invest in the middle-class, &amp; create new opportunities for Americans. https://t.co/Yp0SEpXcvb"
RepMcClellan,2023-05-05 18:30:46+00:00,"In April, the U.S. added 253,000 new jobs &amp; the unemployment rate fell to 3.4%, the lowest rate since 1969!

@POTUS &amp; @HouseDemocrats will continue fighting to strengthen our economy, invest in the middle-class, &amp; create new opportunities for Americans. https://t.co/Yp0SEpXcvb"
HouseDemocrats,2023-05-05 18:30:56+00:00,"RT @Another strong jobs report today! Over a quarter million new jobs were created last month, and the unemployment rate drops back down to a record year low.

We've put our economy on a strong and stable track—and American workers are seeing the benefits.
https://t.co/BJEkKv62iT"
RepWexton,2023-05-05 18:10:16+00:00,"Another strong jobs report today! Over a quarter million new jobs were created last month, and the unemployment rate drops back down to a record year low.

We've put our economy on a strong and stable track—and American workers are seeing the benefits.
https://t.co/BJEkKv62iT"
HouseDemocrats,2023-05-05 18:20:08+00:00,"RT @#JobsDay numbers show that our economic recovery remains strong.

@POTUS's economic plan is working, but the GOP default bill puts this progress at risk.

We must continue building an economy that supports families &amp; meets our obligations to veterans, workers, kids &amp; retirees."
RepBrianHiggins,2023-05-05 18:02:18+00:00,"#JobsDay numbers show that our economic recovery remains strong.

@POTUS's economic plan is working, but the GOP default bill puts this progress at risk.

We must continue building an economy that supports families &amp; meets our obligations to veterans, workers, kids &amp; retirees."
economics,2023-05-05 14:35:49+00:00,"BREAKING: The US added 253,000 jobs in April, far more than the expected 185,000, while the unemployment rate fell to 3.4% https://t.co/J1lMq9wdpA https://t.co/EBvBWGMixf"
HouseDemocrats,2023-05-05 16:51:55+00:00,"RT @📈 Historic job gains and steady wage growth in every corner of the country. 

While Republicans are manufacturing an economic crisis, Democrats are putting our money where our mouth is and delivering for American workers and families."
WaysMeansCmte,2023-05-05 16:50:28+00:00,"📈 Historic job gains and steady wage growth in every corner of the country. 

While Republicans are manufacturing an economic crisis, Democrats are putting our money where our mouth is and delivering for American workers and families."
BLS_gov,2023-05-05 14:30:26+00:00,"Payroll employment rises by 253,000 in April; unemployment rate changes little at 3.4% https://t.co/ZwrVfLviqL #JobsReport #BLSdata"
HouseDemocrats,2023-05-05 16:46:17+00:00,"With 253,000 jobs created last month, that’s 12.7 million jobs added under the leadership of @POTUS and House Democrats! https://t.co/ObhINeRFai"
HouseDemocrats,2023-05-05 16:24:05+00:00,"RT @NEWS: Our economy added another 253,000 jobs last month.

Under the leadership of @POTUS and @HouseDemocrats, we've now added a total of 12.7 million jobs since January 2021."
HouseBudgetDems,2023-05-05 16:21:42+00:00,"NEWS: Our economy added another 253,000 jobs last month.

Under the leadership of @POTUS and @HouseDemocrats, we've now added a total of 12.7 million jobs since January 2021."
HouseDemocrats,2023-05-05 15:31:47+00:00,"Happy Cinco de Mayo! As we honor the Mexican Army’s courage and resiliency during the Battle of Puebla in 1862, we also celebrate the rich history and culture of the Mexican American community. https://t.co/7VTIJYrOGw"
HouseDemocrats,2023-05-05 15:22:14+00:00,"RT @.@HouseDemocrats have a plan to pay the country’s bills, slash our deficit, and make huge investments in communities like #OH13. While extremist House Republicans are threatening economic disaster, we’re putting #PeopleOverPolitics."
RepEmiliaSykes,2023-05-05 15:03:00+00:00,".@HouseDemocrats have a plan to pay the country’s bills, slash our deficit, and make huge investments in communities like #OH13. While extremist House Republicans are threatening economic disaster, we’re putting #PeopleOverPolitics."
HouseDemocrats,2023-05-04 21:46:52+00:00,Extreme MAGA Republicans are threatening to force America to default — an economic disaster that will devastate our communities.
HouseBudgetDems,2023-05-04 19:48:42+00:00,"Last week, House Republicans passed their #DefaultOnAmerica Act, demanding devastating cuts or a catastrophic default.

Watch Moody's Analytics Chief Economist @Markzandi break down what Republicans' dangerous schemes mean for American families. https://t.co/6ZWW9yZ163"
HouseDemocrats,2023-05-04 19:50:03+00:00,"RT @.@PeteAguilar told me he's ""scared"" of @SpeakerMcCarthy's plan to tie lifting the debt ceiling to cuts.

@HouseDemocrats chair: 

""I don’t know why when a Democrat is in the presidency it becomes an opportunity to try to enact painful cuts on our veterans &amp; on our healthcare?"" https://t.co/24DI4eq41B"
Elex_Michaelson,2023-05-04 05:58:32+00:00,".@PeteAguilar told me he's ""scared"" of @SpeakerMcCarthy's plan to tie lifting the debt ceiling to cuts.

@HouseDemocrats chair: 

""I don’t know why when a Democrat is in the presidency it becomes an opportunity to try to enact painful cuts on our veterans &amp; on our healthcare?"" https://t.co/24DI4eq41B"
HouseDemocrats,2023-05-04 19:23:23+00:00,"RT @Extreme MAGA Republicans are proving exactly what — and who — they value.

They want to put working families on the chopping block or else they're threatening to default on our nation's bills and unleash a devastating recession, killing jobs and crashing our economy. https://t.co/jKCfHlgo1q"
RepTedLieu,2023-05-04 17:15:00+00:00,"Extreme MAGA Republicans are proving exactly what — and who — they value.

They want to put working families on the chopping block or else they're threatening to default on our nation's bills and unleash a devastating recession, killing jobs and crashing our economy. https://t.co/jKCfHlgo1q"
HouseDemocrats,2023-05-04 17:15:27+00:00,"RT @Defaulting on our debt would be a disaster for American small businesses and the economy as a whole. 

There is nothing ""fiscally responsible"" about not paying America's bills, killing millions of jobs, and plunging our economy into recession.
https://t.co/wrfuUeJt4Z"
HSBCDems,2023-05-04 17:08:07+00:00,"Defaulting on our debt would be a disaster for American small businesses and the economy as a whole. 

There is nothing ""fiscally responsible"" about not paying America's bills, killing millions of jobs, and plunging our economy into recession.
https://t.co/wrfuUeJt4Z"
HouseDemocrats,2023-05-04 17:14:53+00:00,"RT @There's nothing principled about what MAGA Republicans are doing right now.

They want to gut support for working families and give massive handouts to the wealthy, and they're threatening to unleash a recession if they don't get their way. https://t.co/JuEJIRLOQ8"
HouseBudgetDems,2023-05-04 15:50:06+00:00,"There's nothing principled about what MAGA Republicans are doing right now.

They want to gut support for working families and give massive handouts to the wealthy, and they're threatening to unleash a recession if they don't get their way. https://t.co/JuEJIRLOQ8"
HouseDemocrats,2023-05-04 16:32:37+00:00,"RT @Every American deserves to live free from fear and threat of gun violence. 

We NEED common sense gun legislation. 

Our families. Our children. Our  communities. 

We CANNOT wait any longer."
RepEspaillat,2023-05-04 16:13:31+00:00,"Every American deserves to live free from fear and threat of gun violence. 

We NEED common sense gun legislation. 

Our families. Our children. Our  communities. 

We CANNOT wait any longer."
HouseDemocrats,2023-05-04 16:32:08+00:00,"RT @For the party that claims to be “fiscally responsible,” @SpeakerMcCarthy and @HouseGOP are ready to let the United States default on our bills to get what they want.

They're playing a dangerous game that needs to end.

Read my latest column in @TheHill ⬇️
https://t.co/d5HJCpqcr3"
RepLindaSanchez,2023-05-03 19:11:24+00:00,"For the party that claims to be “fiscally responsible,” @SpeakerMcCarthy and @HouseGOP are ready to let the United States default on our bills to get what they want.

They're playing a dangerous game that needs to end.

Read my latest column in @TheHill ⬇️
https://t.co/d5HJCpqcr3"
HouseDemocrats,2023-05-03 22:29:30+00:00,"RT @How many jobs are House Republicans willing to risk to protect tax cheats?

Turns out: More than the 100,000 already created from the #InflationReductionAct.

https://t.co/Gk0zSIsK6S"
WaysMeansCmte,2023-05-03 21:46:54+00:00,"How many jobs are House Republicans willing to risk to protect tax cheats?

Turns out: More than the 100,000 already created from the #InflationReductionAct.

https://t.co/Gk0zSIsK6S"
HouseDemocrats,2023-05-03 22:08:35+00:00,House Democrats are working to deliver policies that lower everyday costs and create good-paying jobs for all Americans.
HouseDemocrats,2023-05-03 21:55:38+00:00,"RT @I co-led the #PACTAct because millions of veterans — particularly from Iraq &amp; Afghanistan — weren’t getting the specialized care they needed. All of them who served in these &amp; other war zones lived near trash burn pits, and that smoke has led to a bunch of specific heath issues."
RepSlotkin,2023-05-03 20:52:30+00:00,"I co-led the #PACTAct because millions of veterans — particularly from Iraq &amp; Afghanistan — weren’t getting the specialized care they needed. All of them who served in these &amp; other war zones lived near trash burn pits, and that smoke has led to a bunch of specific heath issues."
VetAffairsDems,2023-04-27 21:59:11+00:00,"BIG NEWS! VA just announced that more than 3 million veterans have been screened for toxic exposure and 500,000+ have filed for toxic exposure-related benefits since our bill, the Honoring our PACT Act became law last year. We won't go back on our promise.
https://t.co/rLeatsTtv2"
HouseDemocrats,2023-05-03 18:40:42+00:00,"RT @Defaulting on our debt would kill 7M jobs, wipe out $10T in household wealth, and plunge our economy into recession.

MAGA Republicans want to gut support for families and give handouts to the wealthy, and they're threatening economic devastation if they don't get their way."
NydiaVelazquez,2023-05-03 18:38:31+00:00,"Defaulting on our debt would kill 7M jobs, wipe out $10T in household wealth, and plunge our economy into recession.

MAGA Republicans want to gut support for families and give handouts to the wealthy, and they're threatening economic devastation if they don't get their way."
HouseDemocrats,2023-05-03 16:22:00+00:00,"RT @Our country cannot afford a devastating default on our debt, but Republicans’ cruel cuts are no alternative: Jobs will be lost, families will suffer, and benefits for seniors and veterans will be cut. We can’t let that happen. https://t.co/gm8oxBPAXh"
RepSylviaGarcia,2023-05-03 16:15:46+00:00,"Our country cannot afford a devastating default on our debt, but Republicans’ cruel cuts are no alternative: Jobs will be lost, families will suffer, and benefits for seniors and veterans will be cut. We can’t let that happen. https://t.co/gm8oxBPAXh"
HouseDemocrats,2023-05-03 15:28:11+00:00,"RT @House Dems will continue to stand up for students, veterans and everyday Americans.

It’s time for House Republicans to drop their extreme ransom demands.

And do the same."
RepJeffries,2023-05-03 14:45:12+00:00,"House Dems will continue to stand up for students, veterans and everyday Americans.

It’s time for House Republicans to drop their extreme ransom demands.

And do the same."
HouseDemocrats,2023-05-03 15:27:01+00:00,"RT @We owe it to our veterans to provide them with access to the health care they deserve. But nearly 165K vets in WA could lose access to health care under Republicans’ default plan.

I will continue fighting to prevent this from happening."
RepDelBene,2023-05-03 03:43:00+00:00,"We owe it to our veterans to provide them with access to the health care they deserve. But nearly 165K vets in WA could lose access to health care under Republicans’ default plan.

I will continue fighting to prevent this from happening."
HouseDemocrats,2023-05-03 15:23:03+00:00,"Last year, Congressional Democrats passed the PACT Act — expanding VA benefits for toxic-exposed veterans and their families.

Now, more than 3 million veterans have been screened for toxic exposure.

House Dems will always take care of veterans who fought to defend out country."
HouseDemocrats,2023-05-02 21:49:21+00:00,"RT @Just last week RM @RepMarkTakano,  @RepDWStweets &amp; @RepDeluzio penned an op-ed about what the Republican budget cuts bill would mean for veterans' health care and benefits. Nothing in the bill that passed the House last week protects VA from cuts. https://t.co/dgot9oS3Cg"
VetAffairsDems,2023-05-02 21:44:39+00:00,"Just last week RM @RepMarkTakano,  @RepDWStweets &amp; @RepDeluzio penned an op-ed about what the Republican budget cuts bill would mean for veterans' health care and benefits. Nothing in the bill that passed the House last week protects VA from cuts. https://t.co/dgot9oS3Cg"
HouseDemocrats,2023-05-02 21:33:00+00:00,RT @RepJeffries: We will stop right-wing extremists from triggering a dangerous default on America’s debt.
RepJeffries,2023-05-02 21:30:35+00:00,We will stop right-wing extremists from triggering a dangerous default on America’s debt.
HouseDemocrats,2023-05-02 21:09:24+00:00,"RT @Kevin McCarthy's Default on America Act would cost 780,000 jobs by the end of 2024. 

We can't allow MAGAnomics to undo the progress we've made toward an economy that works for working families.
https://t.co/GBfPieSEZx"
WhipKClark,2023-05-02 21:07:20+00:00,"Kevin McCarthy's Default on America Act would cost 780,000 jobs by the end of 2024. 

We can't allow MAGAnomics to undo the progress we've made toward an economy that works for working families.
https://t.co/GBfPieSEZx"
HouseDemocrats,2023-05-02 20:05:28+00:00,"RT @On, #NationalTeacherAppreciationDay we recognize and thank all of our nation’s educators.

Congressional Democrats secured historic investments in education. Now, teachers have the support they need to help students get back on track and succeed. https://t.co/15agzSB8Ow"
EdWorkforceDems,2023-05-02 19:22:59+00:00,"On, #NationalTeacherAppreciationDay we recognize and thank all of our nation’s educators.

Congressional Democrats secured historic investments in education. Now, teachers have the support they need to help students get back on track and succeed. https://t.co/15agzSB8Ow"
HouseDemocrats,2023-05-02 16:38:09+00:00,"RT @Extreme MAGA Republicans are playing political games and threatening to default on our debt if they don’t get their way. That would cost millions of Americans their jobs, crash the stock market, and tank our economy. https://t.co/gB7zUwqZts"
RepTedLieu,2023-05-02 16:30:00+00:00,"Extreme MAGA Republicans are playing political games and threatening to default on our debt if they don’t get their way. That would cost millions of Americans their jobs, crash the stock market, and tank our economy. https://t.co/gB7zUwqZts"
HouseDemocrats,2023-05-02 15:54:14+00:00,"RT @Republicans are proposing cuts for veterans against the backdrop of holding our economy hostage. They're saying, ""If you don't want to put the economy into default...you have to cut veterans care.""

Two words: No Way.
https://t.co/JPrilQ22BZ"
RepDeluzio,2023-05-02 02:45:00+00:00,"Republicans are proposing cuts for veterans against the backdrop of holding our economy hostage. They're saying, ""If you don't want to put the economy into default...you have to cut veterans care.""

Two words: No Way.
https://t.co/JPrilQ22BZ"
HouseDemocrats,2023-05-02 15:52:04+00:00,"RT @DonaldNorcross: The dangers of the GOP’s #DefaultOnAmerica Act.

Extreme. Unacceptable. https://t.co/fjxiZXobxJ"
DonaldNorcross,2023-05-02 15:15:36+00:00,"The dangers of the GOP’s #DefaultOnAmerica Act.

Extreme. Unacceptable. https://t.co/fjxiZXobxJ"
HouseDemocrats,2023-05-02 15:50:17+00:00,"RT @Most adults enrolled in Medicaid already work, are a caregiver for a family member, are attending school, or have health problems that prevent them from working.

The Republicans' plan to impose work requirements for Medicaid puts health care at risk for 21 million Americans."
janschakowsky,2023-05-02 15:33:58+00:00,"Most adults enrolled in Medicaid already work, are a caregiver for a family member, are attending school, or have health problems that prevent them from working.

The Republicans' plan to impose work requirements for Medicaid puts health care at risk for 21 million Americans."
HouseDemocrats,2023-05-02 15:48:53+00:00,"May is Asian American, Native Hawaiian, and Pacific Islander Heritage Month, a time when we celebrate the outstanding contributions that AANHPIs have made to our nation. 

Let’s always stand united in the face of bigotry and uplift our #AANHPI communities. https://t.co/TWnYH9OIoH"
HouseDemocrats,2023-05-02 15:47:04+00:00,"RT @House Republicans claim they support our veterans.

So why does Speaker McCarthy's Default On America Act immediately cut $2 billion in funding for important veterans' programs?"
HouseBudgetDems,2023-05-02 15:20:54+00:00,"House Republicans claim they support our veterans.

So why does Speaker McCarthy's Default On America Act immediately cut $2 billion in funding for important veterans' programs?"
HouseDemocrats,2023-05-01 23:05:44+00:00,"Extreme MAGA Republicans are attempting to hold our economy hostage.

They're willing to default on our debt unless they can inflict cruel cuts to programs Americans depend on."
HouseDemocrats,2023-05-01 21:02:53+00:00,"RT @When Democrats passed the #InflationReductionAct, we capped the cost of insulin at $35/mo for seniors on Medicare. Now, two major manufacturers of insulin are following our lead &amp; reducing that cost.

At the @EdWorkforceDems hearing, I shared the impact of this law ⬇ https://t.co/CIP1wnlR0f"
RepKManning,2023-05-01 20:49:11+00:00,"When Democrats passed the #InflationReductionAct, we capped the cost of insulin at $35/mo for seniors on Medicare. Now, two major manufacturers of insulin are following our lead &amp; reducing that cost.

At the @EdWorkforceDems hearing, I shared the impact of this law ⬇ https://t.co/CIP1wnlR0f"
HouseDemocrats,2023-05-01 20:45:48+00:00,"Happy #JewishAmericanHeritageMonth! This month, we celebrate the contributions that Jewish Americans provide to the rich fabric of our nation and join forces in the fight against antisemitism."
HouseDemocrats,2023-05-01 19:49:48+00:00,"RT @House Republicans' Default on America Act repeals parts of the Inflation Reduction Act that support clean energy industries and American manufacturing, employing over 1.1 million Texans.

Their solution to the debt ceiling is eliminating jobs; @HouseDemocrats won't stand for it. https://t.co/vXArEgGRV4"
RepEscobar,2023-05-01 19:32:43+00:00,"House Republicans' Default on America Act repeals parts of the Inflation Reduction Act that support clean energy industries and American manufacturing, employing over 1.1 million Texans.

Their solution to the debt ceiling is eliminating jobs; @HouseDemocrats won't stand for it. https://t.co/vXArEgGRV4"
HouseDemocrats,2023-05-01 19:16:55+00:00,"RT @For 6 straight hours at the Rules Committee, Ranking Member @rosadelauro warned that this bill would harm veterans. You passed it anyway.

Section 201 immediately rescinds $2,000,000,000 in funding to support veterans’ health care. #protectveteranshealthcare"
AppropsDems,2023-05-01 19:07:33+00:00,"For 6 straight hours at the Rules Committee, Ranking Member @rosadelauro warned that this bill would harm veterans. You passed it anyway.

Section 201 immediately rescinds $2,000,000,000 in funding to support veterans’ health care. #protectveteranshealthcare"
HouseGOP,2023-04-30 15:17:00+00:00,"🚨 House Republicans are NOT going to cut the VA budget. 🚨

President Biden and extreme Democrats are continuing to lie and fearmonger about the Limit, Save, Grow Act.

Don’t believe them. Republicans have always prioritized veterans in our budgets."
HouseDemocrats,2023-05-01 19:16:02+00:00,"RT @The fight to codify abortion rights isn’t just about abortion.

Having access to reproductive care ensures that women and families have the freedom to decide their own futures.

We can’t go back on this. Politicians simply don’t belong in this private, personal decision."
RepAngieCraig,2023-05-01 19:12:58+00:00,"The fight to codify abortion rights isn’t just about abortion.

Having access to reproductive care ensures that women and families have the freedom to decide their own futures.

We can’t go back on this. Politicians simply don’t belong in this private, personal decision."
HouseDemocrats,2023-05-01 19:15:39+00:00,"RT @@HouseDemocrats know the American people need leadership, not political games. That’s why we are putting #PeopleOverPolitics to deliver for everyday Americans and have a plan to slash deficits by $3 trillion—that’s on top of the more than $1.5 trillion we’ve already cut. https://t.co/q3Jwuw9uLB"
RepJuanVargas,2023-05-01 19:10:19+00:00,"@HouseDemocrats know the American people need leadership, not political games. That’s why we are putting #PeopleOverPolitics to deliver for everyday Americans and have a plan to slash deficits by $3 trillion—that’s on top of the more than $1.5 trillion we’ve already cut. https://t.co/q3Jwuw9uLB"
HouseDemocrats,2023-05-01 18:48:20+00:00,"Extreme MAGA Republicans want to wage war against Social Security and Medicare, veterans health care and food assistance for seniors. https://t.co/k9ITUOhQ54"
HouseDemocrats,2023-05-01 16:17:35+00:00,"RT @The House GOP’s Default on America Act includes work requirements for Medicaid that will take away health care from an estimated 600,000 Americans. 

That is a cruel and failed policy. https://t.co/zDXuX9t1Ee"
RepGwenMoore,2023-05-01 16:03:00+00:00,"The House GOP’s Default on America Act includes work requirements for Medicaid that will take away health care from an estimated 600,000 Americans. 

That is a cruel and failed policy. https://t.co/zDXuX9t1Ee"
HouseDemocrats,2023-05-01 15:57:18+00:00,"RT @House Democrats have taken on Big Pharma to lower prescription drug prices. 

Our new law caps insulin prices at $35 a month and limits out of pocket costs for seniors on Medicare–saving millions of Americans money. https://t.co/vXgXhLwSSN"
