,username,orario,text
616,NateSilver538,2023-03-30 18:01:21+00:00,"It's worth remembering that media coverage (e.g. blanket coverage of his rallies on CNN) was generally pretty helpful to Trump in the 2016 primary* and I'm not sure the habits or incentives have changed all that much.

* Maybe the general election also, but for different reasons."
617,NateSilver538,2023-03-30 19:30:20+00:00,"It's not even subtle, there usually isn't even the pretense of trying to propose some non-DeSantis alternative to Trump. https://t.co/HrHyOeRQx0"
618,NateSilver538,2023-03-30 05:22:23+00:00,Thinking about signing a petition that takes a stand against petitions.
619,NateSilver538,2023-03-29 18:47:08+00:00,"I don't like the upcoming changes—no problem in principle with paying for Twitter, I just really don't think security features are the things you should have to pay for!

But also agree with this that Twitter hasn't changed that much so far under Elon.
https://t.co/PE9E8zNn8T https://t.co/aDvxTYSG9V"
620,NateSilver538,2023-03-29 18:47:08+00:00,"The biggest change I've seen so far is that Twitter is more politically pluralistic. There's less of a single dominant narrative, there are fewer pile-ons than before (though still a lot). More two-ships-passing-in-the-night. To me that's a net positive but your mileage may vary."
621,NateSilver538,2023-03-27 03:40:32+00:00,"Yep, the Democratic Party is currently more tolerant of moderates than the GOP. That's reflected in the data (self-ID'd moderates voted D by 15 points in the midterms). Progressive left spaces may be intolerant of dissent especially online but they are not the *Democratic Party*."
622,Noahpinion,2023-03-27 03:17:35+00:00,"Feel like Biden won the 2020 Dem primary by being a moderate, and almost all Dems in Congress are moderates, and non-moderate Dems are pretty consistently marginalized, and Republicans can't even make Marjorie Taylor Greene stop calling for civil war."
623,NateSilver538,2023-03-26 23:46:40+00:00,"If you're significantly adjusting your assumptions about who's going to win the 2024 primary between January and March 2023, you're probably doing something wrong."
624,NateSilver538,2023-03-26 23:54:31+00:00,"There's ""momentum"" in the sense that candidates go through cycles of positive and negative media coverage. Sometimes that has tangible effects. But momentum creates higher ""expectations"" and sets a candidate up for a fall as the media gets bored of the previous narrative."
625,NateSilver538,2023-03-26 23:59:05+00:00,"Probably the most tangible question *for now* is whether a viable non-DeSantis challenger emerges to Trump. If we get to September and it's still Trump, DeSantis and a bunch of people polling at 5%, I don't think today's ""momentum"" matters much."
626,NateSilver538,2023-03-26 23:47:33+00:00,RT @BenjySarlin: @NateSilver538 Knicks need to hire Luka’s dad immediately
627,BenjySarlin,2023-03-26 23:46:36+00:00,@NateSilver538 Knicks need to hire Luka’s dad immediately
628,NateSilver538,2023-03-26 21:33:33+00:00,"Luka to the Knicks for Barrett, Quickley, Toppin and 6 gajillion draft picks?"
629,espn_macmahon,2023-03-26 21:24:23+00:00,"The Mavs led for only 81 seconds of the 96 minutes they played against the Hornets this weekend. 

With those two losses, Dallas has a steep uphill climb just to make the play-in."
630,NateSilver538,2023-03-26 21:44:42+00:00,"The Hornets were 15½-point underdogs on Friday and 12-point underdogs today. All of their good players are injured (or ""injured"") and they are basically trying to lose. Don't think Mavs can use small sample size as an excuse when back-to-back losses are this much of an outlier."
631,NateSilver538,2023-03-26 04:15:34+00:00,"Sort of unfair to Gonzaga if they're going to enforce the ""textbook interpretation"" of the ""traveling rule""."
632,NateSilver538,2023-03-26 00:30:18+00:00,https://t.co/SIT0oWN8Bd
633,NateSilver538,2022-10-06 22:40:48+00:00,There's going to be more tanking this season than in the Battle of Prokhorovka.
634,NateSilver538,2023-03-25 19:59:28+00:00,"Tough table! Finished 2nd last two times I made one of these TV final tables so hoping for 1st, 3rd, 4th, 5th, 6th or 7th just to mix things up."
635,PokerGO,2023-03-25 19:52:28+00:00,"It's not a rerun! @nacho_barbero makes back-to-back final tables at the USPO!

@NateSilver538 leads the final seven players in Event #2 and will take on Barbero, @Erik_Seidel, @AramZobian, and more for the $231,000 top prize.

📺 - Watch Here at 1PM PT: https://t.co/MO8DylH0u7 https://t.co/4gGSu5ssM3"
636,NateSilver538,2023-03-25 23:59:26+00:00,Mission accomplished! (4th place.)
637,NateSilver538,2023-03-25 02:46:39+00:00,"There's also a question of whether one wants to be amplified. Like if I have something specific to sell or promote, sure, but being amplified is often extremely annoying."
638,bendreyfuss,2023-03-25 02:40:19+00:00,"One thing I don’t understand about all of this is…how many people actually get so many replies that they give a single fuck what order they appear in? Like, I get probably more replies than 96% of twitter users, and it has never occurred to me."
639,NateSilver538,2023-07-24 20:29:57+00:00,"Now that I'm writing a bit more, switched my newsletter over to a custom domain.

It's free for now but it's still much appreciated if you sign up for the mailing list!

https://t.co/knOIcqwuMp"
640,NateSilver538,2023-03-23 08:09:16+00:00,"Apparently I missed when Russia annexed Illinois?
https://t.co/n5YJyLt10r https://t.co/8B2uOpVybX"
641,NateSilver538,2023-03-23 08:19:45+00:00,I cover politics so I see dumb shit all the time but an Amercian sports team citing a Russian law as dictating its behavior in... Chicago... is one of the Top 5 dumbest things I've ever seen.
642,NateSilver538,2023-03-22 22:35:57+00:00,"In polling, a plurality of voters actually support a TikTok ban.

That isn't necessarily dispositive to what the political reaction would be. But I'd trust it before some hand-waving notion that OMG GEN Z WILL BE SO MAD AND WE HAVE TO APPEAL TO THE YOUTHS.
https://t.co/89c5LIsQNC"
643,ChuckRossDC,2023-03-22 21:23:18+00:00,Lol. Dem member of Congress speaks anonymously about the party’s TikTok dilemma. https://t.co/JrruLwiWqT https://t.co/qWCfQ94rO3
644,NateSilver538,2023-03-22 11:17:35+00:00,"RT @Cannot tell you what a bummer it is to discover that the Editor-in-Chief of Science thinks it’s not “acceptable”, and that people shouldn’t be given “permission”, to disagree with him on policy even if they accept 100% of the science."
645,StuartJRitchie,2023-03-22 11:08:38+00:00,"Cannot tell you what a bummer it is to discover that the Editor-in-Chief of Science thinks it’s not “acceptable”, and that people shouldn’t be given “permission”, to disagree with him on policy even if they accept 100% of the science."
646,NateSilver538,2023-03-22 07:20:11+00:00,Thus particular group of scientists have done a lot of damage to science consistently over the past 3 years.
647,profamirattaran,2023-03-22 02:21:04+00:00,"You know that so-called blockbuster that “proved” COVID came from an infected animal?  

Well, the scientists behind it are now in trouble, suspended from data access for unethically stealing credit from their colleagues. https://t.co/C06WAmzqAc"
648,NateSilver538,2023-03-22 06:57:44+00:00,"RT @I don't agree with this thread.

Scientists are entitled to political and policy views. But calling those views scientific is confused.

Scientist's political &amp; policy views, like anyone's, reflect facts and values.

They don't have any special claim to deference wrt  values. 
1/"
649,ethanbdm,2023-03-22 01:43:12+00:00,"I don't agree with this thread.

Scientists are entitled to political and policy views. But calling those views scientific is confused.

Scientist's political &amp; policy views, like anyone's, reflect facts and values.

They don't have any special claim to deference wrt  values. 
1/"
650,NateSilver538,2023-03-22 03:55:20+00:00,"RT @This is scary. 

ChatGPT has caught up with human intelligence. 

If you ask it to list 20 great things about Ohio, it struggles and just mentions ""it's affordable."" https://t.co/t5La8cXQ04"
651,ChrisJBakke,2023-03-22 01:33:54+00:00,"This is scary. 

ChatGPT has caught up with human intelligence. 

If you ask it to list 20 great things about Ohio, it struggles and just mentions ""it's affordable."" https://t.co/t5La8cXQ04"
652,NateSilver538,2023-03-22 00:00:22+00:00,"RT @If covid conclusively originated from a lab, it would be an abject disaster for the field of virology. Funding would dry up; scrutiny, restrictions, and oversight would go through the roof (as they should).

Most virologists are thus heavily biased toward natural (non-lab) origin"
653,dr_ilardi,2023-03-21 23:56:37+00:00,"If covid conclusively originated from a lab, it would be an abject disaster for the field of virology. Funding would dry up; scrutiny, restrictions, and oversight would go through the roof (as they should).

Most virologists are thus heavily biased toward natural (non-lab) origin"
654,WashburneAlex,2023-03-21 23:36:30+00:00,"Academic scientists are under extreme pressure to placate their peers for reviews, grants, collaborations, etc

As their peers are implicated in creating a pandemic &amp; other peers are covering it up, academic virologists are not an objective group.

They are an industrial lobby."
655,NateSilver538,2023-03-21 23:44:17+00:00,"AI-driven transcription services are pretty good and overall a real time saver if you're doing a bunch of interviews for a book. But they miss a lot of negations, e.g. ""can't"" sounds a lot like ""can"" or ""would"" sounds a lot like ""wouldn't"". So def not safe to use them verbatim."
656,NateSilver538,2023-03-20 05:36:12+00:00,"Am not trying to take a position on AI regulation here but worth remembering that the average senator is 64 years old, the president is 80 years old, the previous president is 76 years old, and the average SCOTUS justice serves until 79 years old. It's not a tech-savvy group."
657,michaelmina_lab,2023-03-20 05:28:50+00:00,"One of the most fascinating aspects of society is what we choose to regulate

Ex: we regulate the heck out of medical products, even those posing no risk

Yet we unleash GPT-4 w no regulation despite that it WILL massively impact all of society and every human on earth

Strange."
658,NateSilver538,2023-03-20 02:48:01+00:00,Never going to be part of any movement or clique where skepticism is negatively coded.
659,NateSilver538,2023-03-19 18:08:19+00:00,"Keep in mind that this is a self-selected sample of Democrats who saw this poll on Twitter. But still pretty interesting. By about a 4:3 ratio, Democrats who responded would prefer Trump to DeSantis as the GOP nominee. https://t.co/TxXFwQQh1M"
660,NateSilver538,2023-03-19 18:08:20+00:00,"There are various plausible reasons:
* Ds may think Trump is easier to beat.
* Ds may think DeSantis would be more effective if elected.
* Ds may think DeSantis is more conservative on some issues, e.g. entitlement cuts and gay and trans rights."
661,NateSilver538,2023-03-19 18:08:20+00:00,"DeSantis is also ""very online"", picking fights that generate a lot of heat—and this is a poll of Twitter users, so literally a very online group too.

Still! My sense had been a lot of recent commentary from Ds was implicitly rooting for Trump &gt; RDS, so not shocked to see this."
662,NateSilver538,2023-03-17 19:46:24+00:00,"RT @baseballot: Tired: ""Don't believe the fake polls!""
Wired: ""Polls are more reliable than actual election results"""
663,baseballot,2023-03-17 18:34:26+00:00,"Tired: ""Don't believe the fake polls!""
Wired: ""Polls are more reliable than actual election results"""
664,realLizUSA,2023-03-17 18:13:29+00:00,"The new @Rasmussen_Poll poll shows @KariLake likely won the governor’s race by 8 points, a landslide https://t.co/B2VpBqLPev"
665,NateSilver538,2023-03-17 14:37:18+00:00,"If you're a Democrat (or a Democratic ""leaner"" who isn't really considering voting Republican in 2024) who would you rather win the GOP nomination?"
666,NateSilver538,2023-03-17 14:15:14+00:00,"Yeah, in terms what's causing *shifts* in American politics, I think a lot of things are downstream from educational polarization. Not because a college degree is the most important predictor of political ID (e.g. race, religion are larger) but it's most increased in importance."
667,NateSilver538,2023-03-17 14:15:15+00:00,"But also, educational polarization is particularly important in how institutions that rely heavily on a workforce with substantial educational qualifications behave, such as media, academia and some parts of politics. And those institutions have a lot of downstream influence."
668,NateSilver538,2023-03-17 04:29:24+00:00,"That's actually a pretty important issue! A lot of scientists publishing on COVID origins have COIs! It doesn't mean you discount them completely. But in any other journalistic context, that would call for a fair amount of skepticism."
669,joshtpm,2023-03-17 04:26:54+00:00,This is a fascinating new approach in Lab Leak Discourse: scientists with domain knowledge are eliminated from conversation over conflicts of interest.
670,NateSilver538,2023-03-16 22:25:16+00:00,"This view is evidence-free and reductionist. A few super users would get annoyed. The others would just migrate to whatever platform replaced TikTok. And because young people live complicated lives, like adults do, it's just one of many factors that would influence their vote. https://t.co/MIl8Y0yFUH"
671,NateSilver538,2023-03-16 22:25:17+00:00,Take a look at COVID. Nearly everyone's lives were profoundly affected by COVID policy in a way far more profound than banning one social media platform. And yet it's still pretty hard to tell how it affected things. The 2020 election went about as you'd have expected pre-COVID.
672,NateSilver538,2023-07-24 20:29:57+00:00,"Now that I'm writing a bit more, switched my newsletter over to a custom domain.

It's free for now but it's still much appreciated if you sign up for the mailing list!

https://t.co/knOIcqwuMp"
673,NateSilver538,2023-03-16 22:25:16+00:00,"This view is evidence-free and reductionist. A few super users would get annoyed. The others would just migrate to whatever platform replaced TikTok. And because young people live complicated lives, like adults do, it's just one of many factors that would influence their vote. https://t.co/MIl8Y0yFUH"
674,NateSilver538,2023-03-16 19:40:25+00:00,"Yeah, I see it as a question of statistical inference or probabilistic reasoning for which the evidence comes in a variety of forms. For instance, China's lack of transparency probably ought to affect your estimate of P(LabLeak) even if it isn't an issue of the science per se."
675,WashburneAlex,2023-03-16 18:22:52+00:00,"@ggronvall @NateSilver538 @ggronvall this isn't a scientific issue, it's a forensic issue w/ many scientists having COIs of regulatory risk &amp; collaborations with primary suspects

Additionally, the evidence base pointing to LL is easily understood by the general public.

https://t.co/Yr3IZ6TLFb"
676,NateSilver538,2023-03-16 17:51:57+00:00,"I still think it's worth noting the public holds this view quite strongly despite a *lot* of effort to convince them otherwise. People have a strong instinct on this one, I think because (big coronavirus lab in Wuhan + China being shady = lab leak) is intuitively pretty legible."
677,ggronvall,2023-03-16 17:02:35+00:00,@NateSilver538 Still doesn’t matter— the majority of people could believe COVID came from aliens and it wouldn’t change the fact that there is little scientific support for that view. The important thing is to understand what actually happened—it is a scientific issue not a popularity contest.
678,NateSilver538,2023-03-16 17:51:58+00:00,"Should experts assign some credit to ""common sense""? Complicated question, but sometimes the answer is yes, especially in cases where the evidence is pretty weak either way. There's a whole literature on the wisdom of crowds &amp; how experts are often bad at probabilistic reasoning."
679,NateSilver538,2023-03-16 17:51:58+00:00,"But mostly this was a spectacular failure of scientific communication. Sanctioning discussion of a theory that's popular and seems intuitive is usually going to backfire. And the ""misinformation"" label isn't helping."
680,NateSilver538,2023-03-16 03:35:56+00:00,"At this point in 2015, Bush was polling at 10-15% in the polling average. DeSantis is at more like 30%. It's a reasonably big difference. He also was just reelected whereas Jeb! was a decade+ out from his last reelection in 2015. Far more signs of having traction with voters."
681,davidfrum,2023-03-15 22:16:53+00:00,"Quinnipiac March poll finds Trump 11 points ahead of DeSantis in a head-to-head matchup. In 2015, the big GOP money bet big on a Florida governor as its Trump-stopper - and failed. Is history repeating in 2023?https://t.co/Gr3PSL7rjD"
682,NateSilver538,2023-03-15 21:53:56+00:00,"The one political/linguistic hill I'm somewhat willing to die on is that I don't think people (or I guess it's really just us Americans) should use ""liberal"" as a synonym for ""left""."
683,NateSilver538,2023-03-15 16:42:20+00:00,"It's just sort of weird that the tech community thinks of AI alignment as a defining challenge of our time and yet it is almost completely off-the-radar for the American political community. Like, there's very little in the way of White House policy toward AI, for instance."
684,NateSilver538,2023-03-15 04:31:52+00:00,A very basic life rule is that you shouldn't cater to the most annoying people but that's sort of what you get stuck with if you get too hung up on trying to win approval on Twitter.
685,NateSilver538,2023-03-15 04:39:55+00:00,"Like at least on Instagram people are (sometimes via filters etc.) hot or whatever, it's just fundamentally weird to me that you'd give a shit what Twitter randos think."
686,NateSilver538,2023-03-14 07:18:22+00:00,My best analogy is to a gambler who bets 100% of his bankroll on red while the roulette wheel is still spinning and then claims it was the result of his highly proprietary model when the ball takes a last-second bounce into red.
687,adambonin,2023-03-13 17:15:19+00:00,My best analogy for the FoxNews/Arizona call is that it's like a football coach who goes against the analytics and makes an overly aggressive call on 4th down and it all works out anyway. A decision can be ex ante wrong while still working out.
688,NateSilver538,2023-03-14 01:30:27+00:00,RT @EricStangel: Great Britain’s jerseys look like they were designed on Microsoft Word https://t.co/aen3qYHP7A
689,EricStangel,2023-03-12 04:33:03+00:00,Great Britain’s jerseys look like they were designed on Microsoft Word https://t.co/aen3qYHP7A
690,NateSilver538,2023-03-13 19:12:28+00:00,"A lot of the problem is that the Eastern Time Zone is just much too wide. Indianapolis and Bangor, Maine shouldn't be in the same time zone. So no DST proposal is going to make everyone happy.

https://t.co/qHc1Ey3KZu https://t.co/xbAK1lgKDD"
691,NateSilver538,2023-03-13 17:56:32+00:00,"Not the main point of this story, which is good and you should read, but interesting how ""misspeak"" in PR-speak has come to connote roughly the opposite of its literal meaning (Mishkin explained himself quite clearly, but his assumptions were very wrong!)
https://t.co/OG0CRaz0m8 https://t.co/bHSqRsXhiS"
692,NateSilver538,2023-03-13 03:33:59+00:00,Moral hazard is underrated in an economic system that is exceptionally efficient about responding to its incentives.
693,NateSilver538,2023-03-13 02:12:05+00:00,"Houston 25%
Alabama 15%
Texas 8%
Purdue 5%
Kansas 5%
Gonzaga 4%
Arizona 4%
https://t.co/RQb3JntDP1"
694,NateSilver538,2023-03-13 00:42:36+00:00,"The White House is kind of in a no-win position on Silicon Valley Bank—a bailout would be unpopular, but a negative economic shock would also harm Biden's reelection—and it seems likely to further chill the relationship between the Democratic Party and the tech sector."
695,NateSilver538,2023-03-10 22:45:55+00:00,"DeSantis has way more buy-in from regular voters (polling in the 30s not the 10s) than Warren ever did. And also more from party elites. There were always concerns from D part elites about her ""electability"", whereas R party elites see that as a strength for DeSantis."
696,SamAdlerBell,2023-03-10 21:55:04+00:00,"In terms of vibes, the populist right has a Bernie/Warren situation:

DeSantis is Warren (plans, “competence,” preferable to party elites, similar ideology but no sauce)  

Trump is Bernie (actually leads a movement, scares party elites, GOATed w/ sauce)"
697,NateSilver538,2023-03-10 18:48:21+00:00,"""Not enough evidence to reject the null hypothesis"" is one of those claims that's inherently going to be too nuanced for public discussion on politically contentious issues. With that said, the lay translation of this finding is much closer to ""we don't know"" than ""no evidence""."
698,NateSilver538,2023-03-10 16:45:48+00:00,"Our new POLLSTER RATINGS are out and two big headlines.

1) Polls had their most accurate cycle ever* in the years covered by our comprehensive long-term database.

* Technically, tied with 2004 https://t.co/FnjO5oMZRg"
699,NateSilver538,2023-03-10 16:48:28+00:00,"Polls in the aggregate did NOT have a Republican bias in 2022. Technically they had a slight *Democratic* bias per our method, but it's close enough to zero that ""polls were unbiased"" is probably the right way to think about it. https://t.co/CMxHIfIcOr"
700,NateSilver538,2023-03-10 16:50:14+00:00,"I guess there's not really a nice way to put this, but a lot of people aren't interested in accuracy and just want narratives and vibes. They're wrong about how the polls did in 2022, but then again they're wrong about most things. The polls did great &amp; congrats to the pollsters!"
701,NateSilver538,2023-07-24 20:29:57+00:00,"Now that I'm writing a bit more, switched my newsletter over to a custom domain.

It's free for now but it's still much appreciated if you sign up for the mailing list!

https://t.co/knOIcqwuMp"
702,NateSilver538,2023-03-10 16:45:48+00:00,"Our new POLLSTER RATINGS are out and two big headlines.

1) Polls had their most accurate cycle ever* in the years covered by our comprehensive long-term database.

* Technically, tied with 2004 https://t.co/FnjO5oMZRg"
703,NateSilver538,2023-03-10 16:48:28+00:00,"Polls in the aggregate did NOT have a Republican bias in 2022. Technically they had a slight *Democratic* bias per our method, but it's close enough to zero that ""polls were unbiased"" is probably the right way to think about it. https://t.co/CMxHIfIcOr"
704,NateSilver538,2023-03-10 01:00:30+00:00,"Well, yeah, but I'm also interested in public opinion. And I'm interested in the media. And I think it's interesting that trying to suppress discussion of a theory that was always highly plausible under the guise of ""misinformation"" didn't work. The public saw through it."
705,ggronvall,2023-03-09 23:14:44+00:00,@NateSilver538 Where Covid came from is a scientific issue not a rhetorical debate… or a popularity contest. Good. Grief.
706,NateSilver538,2023-03-10 01:00:31+00:00,"It's been a big problem throughout COVID, starting with ""noble lies"" in March 2020 about not wearing masks. The media &amp; public health officials oversimplify, spin, or try to affect a desired outcome rather than just giving people honest info. And it backfires, almost every time."
707,NateSilver538,2023-03-09 22:34:00+00:00,"RT @📬 Mailbag episode!

@NateSilver538 and I answer your questions about artificial intelligence, whether scientists believe in God and when the U.S. could default on its debt.

https://t.co/LgAcgE0kQs"
708,galendruke,2023-03-09 22:31:54+00:00,"📬 Mailbag episode!

@NateSilver538 and I answer your questions about artificial intelligence, whether scientists believe in God and when the U.S. could default on its debt.

https://t.co/LgAcgE0kQs"
709,NateSilver538,2023-03-09 21:32:41+00:00,"This is a prominent example where attempts to label a claim as ""misinformation"" didn't work at all. Now a supermajority (66%) of Americans, including a majority of Democrats, lean toward a lab leak. This proportion has been growing over time (49% in 2020, 58% in 2021)."
710,Ayjchan,2023-03-09 21:19:09+00:00,"New @TheEconomist @YouGov poll
66% Americans surveyed lean toward lab #OriginOfCovid
54% Dem lean lab, 21% not sure, 25% lean natural
62% Ind lean lab, 23% not sure, 14% lean natural
86% Rep lean lab, 5% not sure, 9% lean natural
https://t.co/1kRwfudTl5 https://t.co/ru4ZZoTQry"
711,NateSilver538,2023-03-09 21:46:06+00:00,Most people's natural instinct if a claim seems plausible on the surface but the media wants to suppress discussion of it is going to be to believe that the claim is true.
712,NateSilver538,2023-03-09 21:46:06+00:00,"Whether or not the public is right about the lab leak, IDK, but I generally think people in media underestimate the sophistication of the public. How they get from what they hear/read to what they *believe* is complicated and not well-described by the notion of ""misinformation""."
713,NateSilver538,2023-02-02 18:45:07+00:00,"🧵1/ Our biennial forecast self-review is out! There’s lots of detail in the story, please check it out. We think it’s really important to do this. It’s also one of those years where it may clear up some misconceptions. 
https://t.co/NKSpfSMD8j"
714,NateSilver538,2023-02-02 18:56:39+00:00,"10/ It is of course a little…piquing…that some of the same vibes-based punditry that ignored polling averages or cherry-picked data to sell a ""red wave"" narrative then later turned around and blamed polls/data. But that’s why sites like 538 need to exist. Trust the process."
