,username,orario,text
819,NateSilver538,2023-02-02 18:45:07+00:00,"🧵1/ Our biennial forecast self-review is out! There’s lots of detail in the story, please check it out. We think it’s really important to do this. It’s also one of those years where it may clear up some misconceptions. 
https://t.co/NKSpfSMD8j"
820,NateSilver538,2023-02-02 18:55:33+00:00,"9/ More generally, it’s usually a huge mistake to “fight the last war” in forecasting. Much news coverage (and even some data-driven shops) way overcompensated for 2016/2020 by treating ""polls always underestimate Republicans"" as the new normal."
821,NateSilver538,2023-02-02 18:56:39+00:00,"10/ It is of course a little…piquing…that some of the same vibes-based punditry that ignored polling averages or cherry-picked data to sell a ""red wave"" narrative then later turned around and blamed polls/data. But that’s why sites like 538 need to exist. Trust the process."
822,NateSilver538,2023-01-30 23:23:00+00:00,You fell victim to one of the classic blunders! https://t.co/B7kzB9PJFK
823,BenjySarlin,2023-01-30 16:11:02+00:00,. @mckaycoppins on the central story of 2024 so far: The core of the GOP quietly predicting Trump will lose or drop out or disappear without doing anything to make it happen https://t.co/NXEvYf2bHf https://t.co/jo99TSHTD5
824,NateSilver538,2023-01-30 16:24:47+00:00,"Yeah, one issue with ""The Market needs to freak out to force a debt ceiling compromise"" is that it anthropomorphizes ""The Market"" into an individual actor who engages in strategic behavior when instead The Market is a collection of actors with wildly varying beliefs &amp; incentives."
825,MattZeitlin,2023-01-30 16:05:38+00:00,"the best thing the markets could do to ensure that nothing breaks with regards to the debt ceiling is start freaking out as if something is about to break, but they're doing the opposite, thus making a showdown over the debt ceiling appear harmless"
826,NateSilver538,2023-01-26 03:09:10+00:00,"This is one of my recent experiments with ChatGPT. If you ask it questions like this, the ""person"" sounds like a 9th grader in a creative writing seminar and the ""AI"" sounds almost stereotypically spectrum-y. https://t.co/V32isHQ3mm"
827,NateSilver538,2023-01-24 17:02:11+00:00,"Manchin won by 3 in 2018 in a *very* good year for Democrats and WV continues to grow redder. He's an outlier and Republicans are more than capable of blowing winnable races. OTOH, he could retire. You'd clearly have a good bet on the GOP at 50:50 odds."
828,LPDonovan,2023-01-24 16:56:41+00:00,"Would love for someone to sell me on the idea that WV is a tossup right now. Not that Manchin could win, or that Rs might light themselves on fire, but that Ds are even money to keep the seat in 2024."
829,NateSilver538,2023-07-24 20:29:57+00:00,"Now that I'm writing a bit more, switched my newsletter over to a custom domain.

It's free for now but it's still much appreciated if you sign up for the mailing list!

https://t.co/knOIcqwuMp"
830,NateSilver538,2023-01-24 01:37:35+00:00,"RT @🎧 New pod 🎧

What The Debt Ceiling And George Santos’s Career Have In Common

w/ @ameliatd, @NateSilver538 &amp; @baseballot 

https://t.co/rIhKfVrNae"
831,galendruke,2023-01-24 01:36:24+00:00,"🎧 New pod 🎧

What The Debt Ceiling And George Santos’s Career Have In Common

w/ @ameliatd, @NateSilver538 &amp; @baseballot 

https://t.co/rIhKfVrNae"
832,NateSilver538,2023-01-21 19:31:44+00:00,"I've seen people propose versions this idea before but still retweeting because it seems important. Clearly the headlines that say ""new variant is 50% more transmissable!"" don't tell the whole story, otherwise we'd be up to an R0 of 30 or something by now."
833,MoritzGerstung,2023-01-21 12:40:13+00:00,"Omicron and its subvariants descendants can break through our immunity walls.

One hypothesis is that susceptibility in the population is heterogeneous and variant specific. 

So each variant has its own niche in the population, but once it is exploited its advantage drops a bit."
834,NateSilver538,2023-01-21 05:05:16+00:00,"RT @It’s true—dolphins were spotted in the Bronx River this week! This is great news—it shows that the decades-long effort to restore the river as a healthy habitat is working. We believe these dolphins naturally found their way to the river in search of fish.
(Video: Nick Banco) https://t.co/40ZNgBjJZs"
835,NYCParks,2023-01-19 20:20:29+00:00,"It’s true—dolphins were spotted in the Bronx River this week! This is great news—it shows that the decades-long effort to restore the river as a healthy habitat is working. We believe these dolphins naturally found their way to the river in search of fish.
(Video: Nick Banco) https://t.co/40ZNgBjJZs"
836,NateSilver538,2023-01-20 18:08:49+00:00,Are there more persuasive #MintTheCoin advocates than these guys? Because these responses are not very reassuring (and that's putting it *very* politely) especially later in the thread where one of them says it would be good if we defaulted since it would force change to SCOTUS.
837,JStein_WaPo,2023-01-20 14:40:00+00:00,"I asked @rohangrey &amp; @NathanTankus — 2 of the leading theorists behind the “Mint the $1 Trillion Coin” idea — about some of the concerns I’d been hearing from those close to the White House about their plan Their responses, shared w/ permission, are worth reading https://t.co/7HijRiohXp"
838,NateSilver538,2023-01-20 05:24:14+00:00,There are a lot of super elite events that seem like they'd be fun if a little bit cringe but who the hell wants to go to Switzerland to be on a bunch of panels in mid-January?
839,NateSilver538,2023-01-20 04:15:30+00:00,"I can assure you that two-thirds of voters have no fucking clue what ""shadow banning"" is because (unlike me, I guess) they have a life. Don't trust polls that force respondents to make a choice about obscure issues instead of providing a don't know/haven't heard enough option."
840,shellenberger,2023-01-19 21:20:19+00:00,https://t.co/MZb7TvFtfr
841,NateSilver538,2023-01-16 20:03:09+00:00,"A lot of the Twitter Files is like ""SCOOP: person/group lobbied Twitter to inappropriately moderate content!"" but then sort of buries the lede that Twitter usually didn't actually take the bait."
842,NateSilver538,2023-01-16 20:03:09+00:00,"I still appreciate the attempt to report out the story but the net effect has been to somewhat improve my impression of previous Twitter management (from ""pretty bad"" to ""meh"")."
843,NateSilver538,2023-01-15 18:50:06+00:00,"RT @.@NateSilver538 breaks down whether GOP investigations could impact Pres. Biden’s political standing ahead of 2024. 

“Investigations could be see as being A) highly partisan and B) off-topic from issues like the economy, which voters care more about.” https://t.co/cEgigQvnPN https://t.co/c9DWdiLTvw"
844,ThisWeekABC,2023-01-15 18:43:07+00:00,".@NateSilver538 breaks down whether GOP investigations could impact Pres. Biden’s political standing ahead of 2024. 

“Investigations could be see as being A) highly partisan and B) off-topic from issues like the economy, which voters care more about.” https://t.co/cEgigQvnPN https://t.co/c9DWdiLTvw"
845,NateSilver538,2023-01-13 21:58:50+00:00,RT @Loved this discussion with Mike D'Antoni and partnering with THE @NateSilver538. We were unfiltered and Mike's insights on changing player acceptance and usage in-game is awesome.
846,jessicagelman,2023-01-13 21:01:58+00:00,Loved this discussion with Mike D'Antoni and partnering with THE @NateSilver538. We were unfiltered and Mike's insights on changing player acceptance and usage in-game is awesome.
847,SloanSportsConf,2023-01-13 16:09:10+00:00,"Trash Talking podcast drop - featuring NBA Coach of the Year, Mike D'Antoni! Hear the lessons Mike learned as point guard that translated to coaching, and how analytics is used as a tool to inform coaching decisions. Plus a special guest host, Nate Silver. https://t.co/Ze98sGzZMF https://t.co/mJW9c7K8io"
848,NateSilver538,2023-01-12 22:29:43+00:00,A little hard to put your finger on it but it sort of feels like Twitter in the Elon era is evolving from people yelling at one another to yelling past one another.
849,NateSilver538,2023-01-10 17:22:36+00:00,"RT @🎧 New pod 🎧

In which @KFaulders, @baseballot and @NateSilver538 catch me up on everything I missed re: Kevin McCarthy and George Santos.

https://t.co/JaBg66F6PN"
850,galendruke,2023-01-10 17:21:45+00:00,"🎧 New pod 🎧

In which @KFaulders, @baseballot and @NateSilver538 catch me up on everything I missed re: Kevin McCarthy and George Santos.

https://t.co/JaBg66F6PN"
851,NateSilver538,2023-01-09 17:00:40+00:00,"""Russian Facebook disinfo!"" also served as a convenient bit of cope for the media to deflect criticism of its own handing of 2016, e.g. ""BUT HER EMAILS""."
852,jaycaspiankang,2023-01-09 16:55:17+00:00,Should read ‘convincing the media’ instead of ‘Americans.’ The Russian disinfo bot story was parts of the American media making up a story out of what amounted to random bits of info and force feeding it to the public for a year. The premise was always ludicrous and dehumanizing
853,NateSilver538,2023-01-07 00:04:55+00:00,RT @TheStalwart: @NateSilver538 One step ahead of you https://t.co/NcV4jzIKvH
854,TheStalwart,2023-01-07 00:04:31+00:00,@NateSilver538 One step ahead of you https://t.co/NcV4jzIKvH
855,TheStalwart,2022-11-26 01:24:24+00:00,I’ve chosen a club to support. #MTFC
856,NateSilver538,2023-01-06 23:47:15+00:00,"""It's important to stand up to bullies"" is one of those obvious things that midwits don't get and Congress is kind of the kingdom of the midwit."
857,NateSilver538,2023-01-06 23:15:05+00:00,I think that probably gives too little responsibility to Schumer. Congressional leadership ought to have some persuasive ability and this shouldn't have been that hard a sell as the debt ceiling increase would have been in D electoral interest as well as the country's interest.
858,JohnJHarwood,2023-01-06 23:08:20+00:00,"fundamental difference:

RBG's retirement decision was entirely within her control

if raising debt limit had been within control of Pelosi and Schumer, they'd have done it

but in a 50-50 Senate, without Republican help, it wasn't"
859,NateSilver538,2023-01-06 22:52:14+00:00,Democrats had a good legislative term in 2022 but not passing a debt ceiling increase could be an RBG-not-retiring magnitude blunder.
860,NateSilver538,2023-01-05 03:04:20+00:00,LOL is this an NFL game? https://t.co/37M6Y8VhlX
861,NateSilver538,2023-01-05 02:42:20+00:00,This is not really a *prediction* of the effect this will have since people are bad at bargaining but it's not clear why this position ought to produce any leverage after a midterm in which shitty candidates cost the GOP the U.S. Senate as well as a fair number of House seats.
862,JakeSherman,2023-01-05 02:07:54+00:00,"@PunchbowlNews @club4growth @CLFSuperPAC CONSERVATIVES have long griped that CLF is playing in safe open seat primaries, trying to snuff out conservatives

CLF will now not spend in safe open seat primaries

BIG BIG agreement in the House Republican world. BIG WIN for conservatives."
863,NateSilver538,2023-01-05 02:49:38+00:00,"You have one or two dozen House Republicans who will be vulnerable for reelection in 2024, they have strong incentives not to empower the most extreme/wacky members of their caucus, and they can deny McCarthy (or anyone else) a majority; it's pretty decent leverage."
864,NateSilver538,2023-07-24 20:29:57+00:00,"Now that I'm writing a bit more, switched my newsletter over to a custom domain.

It's free for now but it's still much appreciated if you sign up for the mailing list!

https://t.co/knOIcqwuMp"
865,NateSilver538,2023-01-05 02:42:20+00:00,This is not really a *prediction* of the effect this will have since people are bad at bargaining but it's not clear why this position ought to produce any leverage after a midterm in which shitty candidates cost the GOP the U.S. Senate as well as a fair number of House seats.
866,JakeSherman,2023-01-05 02:07:54+00:00,"@PunchbowlNews @club4growth @CLFSuperPAC CONSERVATIVES have long griped that CLF is playing in safe open seat primaries, trying to snuff out conservatives

CLF will now not spend in safe open seat primaries

BIG BIG agreement in the House Republican world. BIG WIN for conservatives."
867,NateSilver538,2023-01-04 23:48:36+00:00,I like the author of this story but I find this point uncharacteristically short-sighted. In 2021 people were able to have a relatively normal life. In 2020 they weren't. Controlling for the amount of social activity the vaccines lowered death tolls a ton. https://t.co/VSv1bNZ5gj https://t.co/9X56Ft4RtD
868,NateSilver538,2023-01-04 23:36:05+00:00,"RT @@NateSilver538 Also, the R of Delta and Omicron is *so much greater than prior variants that the denominator was massively greater. But for vaccines, the death counts would have been dramatically greater."
869,jeremyfaust,2023-01-04 23:33:57+00:00,"@NateSilver538 Also, the R of Delta and Omicron is *so much greater than prior variants that the denominator was massively greater. But for vaccines, the death counts would have been dramatically greater."
870,NateSilver538,2023-01-04 23:31:43+00:00,I like the author of this story but I find this point uncharacteristically short-sighted. In 2021 people were able to have a relatively normal life. In 2020 they weren't. Controlling for the amount of social activity the vaccines lowered death tolls a ton. https://t.co/VSv1bNZD5R https://t.co/eN3pqtIZNg
871,NateSilver538,2023-01-04 18:58:55+00:00,"Predicting that civilization would end by 1985 counts as a pretty basic error, I'd think. To the extent he's received scientific accolades, it shows how unseriously the scientific community takes prediction. https://t.co/IAIhx8whY5"
872,PaulREhrlich,2023-01-03 19:14:13+00:00,"60 Minutes extinction story has brought the usual right-wing out in force.  If I'm always wrong so is science, since my work is always peer-reviewed, including the POPULATION BOMB and I've gotten virtually every scientific honor. Sure I've made some mistakes, but no basic ones"
873,NateSilver538,2023-01-04 17:45:33+00:00,I don't think this is Kaptur's intent but a Democrat offering support to McCarthy is probably not going to be helpful to McCarthy in consolidating the GOP vote.
874,HenryJGomez,2023-01-04 17:01:35+00:00,"!! Democrat Marcy Kaptur, who whenever she is sworn in for her next term will become the longest-serving woman in congressional history, signals she's open to voting for McCarthy. Her district has gotten redder in redistricting."
875,NateSilver538,2023-01-04 15:46:40+00:00,"This seems like the best analysis of the situation I've read. I tend to doubt that the moderates in the GOP coalition (yes there are a few) would go for e.g. Jordan as speaker. But ""anyone but McCarthy"" (even if similar to McCarthy) would still count as a win for the dissenters."
876,MattGlassman312,2023-01-04 06:20:32+00:00,"A lot can change, of course, but I think it’s becoming more and more clear that the rebels aren’t really bargaining. It’s just a flex, and what they mostly want is a scalp. And that probably means McCarthy is sunk. 1/"
877,NateSilver538,2023-01-03 16:45:19+00:00,"Pretty wild ""Other than that Mrs. Lincoln, how was the play?"" energy here. https://t.co/fqzC7l7IKp https://t.co/myYaG4wVHc"
878,NateSilver538,2023-01-01 01:13:58+00:00,It's 2023 where I am so Happy New Year everyone! 2022 &gt; 2021 &gt; 2020 so let's hope the streak continues.
879,NateSilver538,2022-12-31 15:38:45+00:00,The article should probably also have mentioned how the NYT spun its own polling that was obviously good for Democrats as having been great news for Republicans instead.
880,Wertwhile,2022-12-31 15:19:29+00:00,Have so many complaints about this article I don't know where to begin. https://t.co/qWsSZR3sAs
881,NateSilver538,2022-12-31 15:42:16+00:00,https://t.co/VuXyaeXVbx
882,NateSilver538,2022-10-28 15:35:26+00:00,"@Nate_Cohn Dude, the Ds in your polls are collectively outperforming Biden, who won the popular vote by 4.5 points! I don't know if this is a case where you don't want to throw your editors under the bus, but these are good polls for Ds and the narrative in the story doesn't match the data."
883,NateSilver538,2022-12-31 15:44:18+00:00,And yes NYT did reach out for comment and we declined to participate because it was clear from preliminary conversations that the premise of their article was dumb and ignored their own role in hyping the red wave *in contradiction* to what 538's forecasts showed.
884,NateSilver538,2022-12-31 14:22:18+00:00,"If you're gonna retweet some claim about a scary new COVID variant, you probably ought to verify that the person who made the claim hasn't falsely hyped other scary new COVID variants dozens of times over the past few years."
885,NateSilver538,2022-12-29 22:25:52+00:00,This is an interesting admission that public health has become a political movement more than a field based on medicine or science per se. https://t.co/DOw9p740Ti
886,NateSilver538,2022-12-29 21:55:09+00:00,What cities *haven't* you been to that an algorithm trained on your travel habits would incorrectly predict that you'd been to?
887,NateSilver538,2022-12-29 18:15:37+00:00,"One problem with political rhetoric is that one group of people may espouse moderate positions because they in fact hold moderate positions, while other people may espouse the same positions because they're more politically acceptable than the radical positions they in fact hold."
888,NateSilver538,2022-12-29 18:15:37+00:00,"e.g. in 2020/early 2021, both ""moderates"" and ""radicals"" would claim the COVID NPIs they were recommending were temporary (until vaccines etc.) which *was* an honest claim for many people but was also often claimed by people who in fact wanted permanent changes to society."
889,NateSilver538,2022-12-28 06:18:05+00:00,https://t.co/BOwCrEtUNv
890,NateSilver538,2022-12-28 06:31:25+00:00,"Only 60/20/10 game ever, tied for highest-scoring triple double ever, Mavs came back at ~250:1 odds down 9 with 45 seconds left *and* Luka had to intentionally brick the FT and hit game-tying shot at the end of regulation. Has to be the best individual player game in NBA history?"
891,NateSilver538,2022-12-27 22:05:33+00:00,"This is a good point. Strategically speaking, the filibuster isn't quite as much of an on-off switch as people assume. The credible threat of further blowing up the filibuster created additional leverage for Biden and Democrats."
892,stevebenen,2022-12-27 21:57:30+00:00,"Why has Biden scored so many bipartisan victories? The debate over filibuster reform, oddly enough, seems to have played a surprisingly significant role. https://t.co/8TvAOnH2cS"
893,NateSilver538,2023-07-24 20:29:57+00:00,"Now that I'm writing a bit more, switched my newsletter over to a custom domain.

It's free for now but it's still much appreciated if you sign up for the mailing list!

https://t.co/knOIcqwuMp"
894,NateSilver538,2022-12-26 23:57:31+00:00,"Yo @bariweiss @davidzweig as someone inclined to be sympathetic to critiques of how Twitter handled COVID information, you couldn't do more to turn me off than to center your case around Alex Berenson. https://t.co/rBNB9VsxJG"
895,NateSilver538,2022-12-27 05:18:11+00:00,Honestly @bariweiss as someone who I'd imagine views herself as valuing transparency a bit pathetic that you have no response to this.
896,NateSilver538,2022-12-27 00:25:54+00:00,"RT @@NateSilver538 @bariweiss @davidzweig As someone who has been very critical of how Covid debate was limited on social media and how poor science and politics from the CDC set the limits, have to agree that using Alex as a key example is an error. He was consistently wrong &amp; misled ppl. Even b4 the anti-vax stuff: https://t.co/1mV0sU4wMs"
897,AGHamilton29,2022-12-27 00:23:03+00:00,"@NateSilver538 @bariweiss @davidzweig As someone who has been very critical of how Covid debate was limited on social media and how poor science and politics from the CDC set the limits, have to agree that using Alex as a key example is an error. He was consistently wrong &amp; misled ppl. Even b4 the anti-vax stuff: https://t.co/1mV0sU4wMs"
898,NateSilver538,2022-12-26 17:29:33+00:00,"People don't distinguish enough between: 

1) A ~random cross-section of communications from person/organization X
2) A cherry-picked set of favorable examples from a ~comprehensive set of communications from X

The threshold to move your priors should be **MUCH** higher under 2."
899,NateSilver538,2022-12-26 16:58:29+00:00,10/10 I thought this was easy TBH! Maybe I can get a new job as a chatbot detector after the AI apocalypse. Fun quiz though.
900,KevinQ,2022-12-26 16:50:24+00:00,"Even @judyblume had a hard time telling the difference between essays by Chat-GPT-3 and real kids. Try for yourself in this quiz from @clairecm + @adamplayford + @Aaron_Krolik + @larrybuch (with extra-terrific LB art)

https://t.co/nms4PmEFbX"
901,NateSilver538,2022-12-25 19:31:51+00:00,"Haven't seen this flight status before. Everyone's doing their best but ""BEHIND SCHEDULE"" seems to be a euphemism for ""LOL, you thought it was a good idea to fly out of a Polar Vortex on Christmas morning?"". https://t.co/lzKtbNhaBA"
902,NateSilver538,2022-12-24 21:38:34+00:00,Blue states losing population to red states could shrink the Electoral College - popular vote gap.
903,nickgerli1,2022-12-24 21:33:17+00:00,"2) Texas (+231k) &amp; Florida (+319k) accounted for over 60% of Migration to the South.

But states like Tennessee and South Carolina also set records for people moving in in 2022. 📈

The losses in the West were mainly related to California. 📉 https://t.co/HfgOCsBHc7"
904,NateSilver538,2022-12-24 19:38:12+00:00,"2022 was a big year for mean reversion. Across quite a few domains, a lot of people and institutions who flew a little too close to the sun, with unsustainable long-term strategies, paid a price for it."
905,NateSilver538,2022-12-22 21:28:07+00:00,Biden has a LOT of significant bipartisan accomplishments in this term. Doesn't fit neatly into the narrative of ever-increasing partisanship.
906,sahilkapur,2022-12-22 21:22:43+00:00,"NEWS: Senate passes $1.7 trillion government funding bill that overhauls U.S. election law

The vote is 68-29.

This now goes to the House.

Then to Biden’s desk. https://t.co/6lhR8tO6FV"
907,NateSilver538,2022-12-22 17:33:41+00:00,"I find all the ""Why didn't opposition research pick up on George Santos?"" discourse weird when the more pressing question is why the media didn't. We don't want to rely on campaigns to do basic vetting and fact checking. And this is in NYC, which still has a robust local press."
908,NateSilver538,2022-12-20 23:12:51+00:00,"This is a bad use of polling. The poll *forces users to respond* on an issue many of them probably know little or nothing about. There is no option for ""don't know"" or ""not sure"". Many of them are just going off the limited information provided in the question prompt."
909,shellenberger,2022-12-20 17:41:37+00:00,"The mainstream media's blackout of the Twitter Files is appalling, but word is getting out anyway. A new Harvard-Harris poll finds that 76% of voters think former FBI official James Baker acted out of politics in censoring the Hunter Biden laptop story while at Twitter https://t.co/Ic8fXXodR4"
910,NateSilver538,2022-12-20 23:12:51+00:00,"And I say that as someone who would probably say ""acting out of politics"" myself. But again, the poll doesn't tell us anything at all about how widespread knowledge of this issue has become because people are forced to give a response no matter how much they know about it."
911,NateSilver538,2022-12-20 06:03:23+00:00,I take no pleasure in reporting this but COVID fear porn has reached the armadillos and corpses phase. https://t.co/Tlwjf84ykC
912,NateSilver538,2022-12-19 22:36:13+00:00,"Whole thread worth reading. What's surprising (though it shouldn't be surprising: it's a predictable consequence of how they're trained) is how much AI language models will flatter user's sensibilities without any ground conception of truth. Fundamentally, they're bullshitters."
913,EthanJPerez,2022-12-19 19:07:24+00:00,"Worrying behavior 2: LMs/RLHF models are people-pleasers, learning to repeat back dialog users’ views as their own (“sycophancy”). Sycophancy creates echo-chambers. Below, the same RLHF model gives opposite answers to a political question, in line with the user’s view: https://t.co/BT6AzMUMic"
914,NateSilver538,2022-12-19 02:00:32+00:00,Yes leading roughly 62-38 in last 1.2 million votes. What say you @Redistrict? https://t.co/1csuPCVsaV
915,NateSilver538,2022-12-18 20:39:14+00:00,Recent Twitter business decisions seem to be conducted on a time horizon approximately 80% as long as that of Cocaine Bear.
916,NateSilver538,2022-12-17 19:56:50+00:00,"Yeah, ""Democrats did well in the midterms despite poor urban turnout"" is a *bullish* story for Ds, for 2 reasons.

#1: Turnout in big cities is often poor in midterms. In 2024, if Ds keep the swing voters they won in 2022 and have typical POTUS-year urban turnout, they'd do well."
917,TylerDinucci,2022-12-17 19:33:23+00:00,Wouldn’t it be a bigger deal that the party with a favorable electorate still lost in key states despite poor turnout in major Democratic cities?
918,NateSilver538,2022-12-17 19:56:51+00:00,"#2: Cities punch below their weight in terms of their impact in the Senate and to a lesser degree the House and the Electoral College. I don't like how that's the case, but that's our system. A Democratic coalition less dependent on big cities will win more elections."
