,username,orario,text
306,JustinWolfers,2023-07-06 13:21:47+00:00,"The worst possible outcome would be if Elmo’s trolling pushes those who are left of center to threads, and those right of center stay here."
307,NateSilver538,2023-07-05 20:54:04+00:00,"Today is my 7th-ish (maybe 8th?) WSOP Main Event and I am pre-registering a chip update strategy. I will update this thread when and *only* when:

1. I bag a stack at the end of the day
2. I bust (hopefully this one won't come up)
3. I make the money
4. I win the tournament

LFG. https://t.co/uRizhHD5hs"
308,NateSilver538,2023-07-06 09:28:01+00:00,Bagging 64k from 60k starting. If I can just increase my stack by 7% per day I will WIN THE MAIN EVENT by August 2042. Never below 59k or above 82k all day about the least volatile day of tournament poker I've played. Back Friday. https://t.co/3UEXlbHPSJ
309,NateSilver538,2023-07-06 08:00:23+00:00,MY BOLDEST PREDICTION YET
310,WPT,2023-07-06 06:43:04+00:00,"Professional prognosticator @NateSilver538 is deep into the poker world with some strong results over the last few years.

As Silver takes part in the @WSOP Main Event, he predicts a record-breaking turnout once the dust settles.

See what he had to say:
https://t.co/gdXJ42EORB"
311,NateSilver538,2023-07-06 03:28:23+00:00,Link to platform that I probably won't use much for right now. Screenshot points to a platform that I am using. I'll also continue to use Twitter and hope that competition will drive them back to being a more open platform. https://t.co/NGCOUc6vkQ
312,NateSilver538,2023-07-06 02:31:05+00:00,"DW-Nominate scores use basically the same method for Congress (and have the same problems). I think both are a bit overused but DW-Nominate has for years been cited by the left as ""proof"" of asymmetric polarizaiton. If you abandon one, abandon both!"
313,imillhiser,2023-07-05 23:01:08+00:00,"Ok, time for me to get on a soapbox. Martin-Quinn scores are crap. They should not be used by journalists to measure SCOTUS ideology. Nor should they be used by scholars who don't understand their limits.

A quick thread explaining why..."
314,NateSilver538,2023-07-05 08:20:53+00:00,How *dare* you disrespect our new co-planet. https://t.co/peA7O3ZfZY
315,bendreyfuss,2023-07-05 08:10:16+00:00,Congratulations to whatever stoned college student they hired to program this thing
316,NateSilver538,2023-07-05 04:27:03+00:00,"RT @They sincerely should offer the option of subscribing to a special edition of the New York Times that appends (“… and this is bad”) to every headline that’s about the actions of GOP elected officials or conservative activists. 

A lot of people seem to want this."
317,mattyglesias,2023-07-04 21:53:12+00:00,"They sincerely should offer the option of subscribing to a special edition of the New York Times that appends (“… and this is bad”) to every headline that’s about the actions of GOP elected officials or conservative activists. 

A lot of people seem to want this."
318,jayrosen_nyu,2023-07-04 17:21:37+00:00,I wish I subscribed to a New York Times which led with the fact that Republicans in Congress have no grounds on which to impeach Biden (but they want to anyway...) instead of a New York Times focused on divisions among them and assorted maneuvers therein. https://t.co/hzi0J3rbEJ
319,NateSilver538,2023-07-04 22:47:37+00:00,"Yeah this article is a good example of how negative polarizaiton affects journalism, too. The fact that certain right-wing Republicans (among others) oppose warrantless spying leads the NYT to treat warrantless spying as self-evidently good! https://t.co/gihGqznwMg"
320,SamAdlerBell,2023-07-04 01:15:21+00:00,"this framing is bullshit. the piece could just as easily say ""bipartisan support for reforming warrantless spying."" 

instead it's about ""right wing Republicans"" and their odd beliefs. feels almost designed to negatively polarize NYT readers against reform https://t.co/2FGmuUjeZU"
321,NateSilver538,2023-07-04 05:59:37+00:00,"It's great he's acknowledging an error but this was both predictable and widely predicted. If you didn't recognize that keeping kids out of school for 3-18 months (depending on jurisdiction) might cause a few public health problems, may need to reevaluate a lot of your premises."
322,MonicaGandhi9,2023-07-04 01:25:31+00:00,"SCHOOLS: ""Dr. Carlos del Rio, interim dean at Emory, said public health experts didn’t foresee the effect of learning loss/isolationism on students. That impact could be the most long-lasting, UCSF professor Dr. Mark Smith said...We made a mistake with schools,” del Rio said. “I hope we don’t make it again.”
 https://t.co/hrKzoXBtp9"
323,NateSilver538,2023-07-04 03:53:01+00:00,"Played a poker tournament today*. Turned a set against a flopped straight. All-in. No help on river. Thought I'd busted. But they called me back. I had 6k chips left.

Doubled up. Again. Again. Made a great 3-bet value shove on the turn. Before I knew it I had 285k. Top 5 in chips.

Then I ran QQ into AA in a huge pot and lost a flip with 88 < AJs and busted 15 minutes later.

🤔 Moral of the story: Never give up in a poker tournament. If you stay patient and stick to your gameplan, there's always a more elaborate and painful bustout awaiting you later. All it takes is a chip and a chair.

* Not the Main Event."
324,NateSilver538,2023-07-03 21:48:55+00:00,"Legacy admissions seem like something where the societal consensus could shift very fast. Like, I dunno, maybe a 50% chance they basically don't exist in 10 years."
325,NateSilver538,2023-07-03 21:48:56+00:00,"Harvard etc care a lot about money but what they care about even more is their social standing/brand perception among bougie liberals. With liberals belatedly waking up to how cringe legacy admissions are, things could change fast."
326,NateSilver538,2023-07-03 16:37:59+00:00,Not sure if the Twitter Rate Limit thing is getting better or worse but I'll try posting this again just in case. https://t.co/dsT6QZUmbG
327,NateSilver538,2023-07-03 16:37:59+00:00,"Also, Friday was my last day at Disney/ABC News so...

SiGn Up FoR mY SuBsTaCk

It's free (for immediate future anyway). Not necessarily the long term plan. But I do really like the newsletter format and writing for a somewhat more self-selected audience."
328,NateSilver538,2023-07-03 00:29:58+00:00,Will likely be some regression but if you ~2x his numbers it's probably the best baseball season of all time.
329,Jared_Carrabis,2023-07-03 00:17:19+00:00,NUMBER 31 FOR SHOHEI OHTANI FOUR HUNDRED AND FIFTYYYY-FOUR FEET!! https://t.co/YpSfn60yfr
330,NateSilver538,2023-06-30 01:25:34+00:00,"Very bad to do a Spanish Inquisition with pollsters based on their political orientation. I love my ex-colleagues (this is coming from a new guy they hired) but if this is their practice, hope ABC will stop use of 538 brand so it isn't associated with me.
https://t.co/PCRrFhRKMf https://t.co/1v0ygL590N"
331,NateSilver538,2023-07-01 19:43:08+00:00,"Went *quite* long on this, hopefully as the last thing I'll say about it. https://t.co/dsT6QZTOm8"
332,NateSilver538,2023-06-30 18:44:10+00:00,"There's kind of a low-key live poker boom going on. First 60 events of @WSOP have had 134,606 entrants vs. 114,751 in 2021 (+17%) and $227m in buy-ins vs $184m (+23%).

If pace holds, would lead to a Main Event with 10k to 10.5k entrants."
333,NateSilver538,2023-06-30 22:59:37+00:00,"Oops, too late to edit; the comparisons are to **2022**, not 2021. (2021 heavily affected by COVID.) So they're beating last year, which was a relatively normal one."
334,NateSilver538,2023-07-24 20:29:57+00:00,"Now that I'm writing a bit more, switched my newsletter over to a custom domain.

It's free for now but it's still much appreciated if you sign up for the mailing list!

https://t.co/knOIcqwuMp"
335,NateSilver538,2023-06-30 18:44:10+00:00,"There's kind of a low-key live poker boom going on. First 60 events of @WSOP have had 134,606 entrants vs. 114,751 in 2021 (+17%) and $227m in buy-ins vs $184m (+23%).

If pace holds, would lead to a Main Event with 10k to 10.5k entrants."
336,NateSilver538,2023-06-30 01:25:34+00:00,"Very bad to do a Spanish Inquisition with pollsters based on their political orientation. I love my ex-colleagues (this is coming from a new guy they hired) but if this is their practice, hope ABC will stop use of 538 brand so it isn't associated with me.
https://t.co/PCRrFhRKMf https://t.co/1v0ygL590N"
337,NateSilver538,2023-06-29 16:45:55+00:00,Not really a comment either way about today's decision but it would probably be good in general if we all just agreed to lower the amount of esteem and attention given to elite private colleges and universities by about 50%.
338,NateSilver538,2023-06-29 01:17:23+00:00,"Yeah that's right and one thing that drives me a little crazy about the Nautre op ed is that they portray concern about AI risk as a fringe view when it's the mainstream (or at least *a* mainstream view, there's certainly plenty of disagreement) among experts in the field."
339,AndreTI,2023-06-28 17:54:53+00:00,"@HavocHammock @NateSilver538 He's likely thinking of this: https://t.co/x0wbEH9g5d

The topic is highly contentious within the field, and you could certainly find people who would confidently say 0%, but a significant number of experts are substantially concerned."
340,NateSilver538,2023-06-29 01:17:24+00:00,I'm very much *not* a stay-in-your-lane guy and think the AI debate would benefit from a wider range of voices. But I am anti-laziness and the @Nature Op Ed is just lazy for not even doing the basics to gauge expert opinion on the issue. Or it's misrepresenting it which is worse.
341,NateSilver538,2023-06-28 17:42:25+00:00,"Yeah, the median expert thinks that AI existential risk is a 5-10% threat. That might be wrong, but ""let's focus on other AI harms instead"" isn't really a good argument unless you're refuting that claim."
342,StefanFSchubert,2023-06-27 21:49:42+00:00,"One of the most notable things about this terrible editorial is that there's no argument whatsoever for the proposition that existential risk from AI is low.

This crucial aspect is simply assumed.

An anti-intellectual embarrasment to @Nature.

https://t.co/eC6w189OFA"
343,NateSilver538,2023-06-28 17:42:25+00:00,"I guess as AI has become more visible on the political agenda, people feel like they *have* to say something that *sounds* smart about it. So you're going to have a lot of midwit takes. But disappointing to see it in @nature."
344,NateSilver538,2023-06-28 17:42:26+00:00,"The ""focus"" argument is particularly dumb since it's not clear there's a trade-off in focus, i.e. interventions that reduce x-risk might *also* reduce quite-bad-but-short-of-catastrophic harms."
345,NateSilver538,2023-06-28 06:20:15+00:00,Liberal use of scare quotes (around politically salient words or phrases) reveals a *lot* of information about the writer's worldview so feel free to do it if that's your intention but know that it's a nonsubtle clue and you're tipping your hand a lot.
346,NateSilver538,2023-06-27 21:46:11+00:00,"There's this notion that Kennedy's doing kinda well in the polls and he just isn't. Despite very high name ID and a weak field of alternatives to Biden. Look, talk about him if you want. It's summer, we're all a little bored. Personally, I'd rather talk about NBA trade rumors."
347,daveweigel,2023-06-27 20:28:20+00:00,"Kennedy's surging media exposure has actually hurt him in the primary - he's just taking positions (and talking to media) that Democrats don't like. 

Compare these numbers to the March numbers when St. Anselm tested better-known Ds against Biden.

https://t.co/59NCN8kaWY https://t.co/I4wWoswuGg"
348,NateSilver538,2023-06-27 18:14:52+00:00,Not even being sarcastic I think a lot of it is that you have to be incredibly weird to opt into being a politician for federal office in an extremely polarized country like the US.
349,JamesSurowiecki,2023-06-27 17:56:28+00:00,"It's the same question that Alice was getting at in this tweet - why is it so hard for so many politicians to sound like real people?
https://t.co/KjgbDjxKAr"
350,NateSilver538,2023-06-27 18:15:31+00:00,You'll get some semi-sane ones that start by running for local office and make their way up the ranks but the people who go straight for a Senate seat or something are mostly batshit.
351,NateSilver538,2023-06-26 20:28:46+00:00,"Kind of amazed how well the ""Did You Possibly Feel A Small Pang of Joy? Here's A Reason To Stay Miserable"" genre continues to do, though it was a pandemic thing but still going strong. https://t.co/KGglw1a85j"
352,NateSilver538,2023-06-27 15:47:24+00:00,"I don't even necessarily disagree with the substantive recommendations in this article it's just a little bizarre to **want more despair** and the product of a certain kind of political mind to want policy-making-by-guilty-conscience.
https://t.co/aCARlMtB5A https://t.co/2KAJtpwslB"
353,NateSilver538,2023-06-25 00:01:07+00:00,People are being relatively responsible about their Russia takes and I'm left craving some baseless speculation.
354,NateSilver538,2023-06-24 04:44:56+00:00,I would totally have gone (if offered for ~free) on the Titanic cruise sort of suspect of people who claim otherwise.
355,NateSilver538,2023-06-24 00:18:18+00:00,"There's a robust middle ground between not wanting to engage in a theatrical debate against people with more experience and adopting a posture of  ""I'm a Scientist and therefore Pure as the Driven Snow"" (particularly if you often tailgate in the politics/science middle lane)."
356,NateSilver538,2023-06-24 00:35:12+00:00,"I've tried to take a principled stand against ""debate me, bro"" as being a good way to resolve intellectual disputes. It's not. But there's a degree of grenade-throwing behind the wall of credentialism, and other motte-and-bailey tactics, beyond which it becomes more appropriate."
357,NateSilver538,2023-06-23 21:28:18+00:00,Lazy Friday afternoon so I've got a fun little poker post for you: https://t.co/fWONdD20RS
358,NateSilver538,2023-06-23 21:30:49+00:00,Also one of the better use cases for when a chart really benefits from a log scale! https://t.co/jH64ODgowQ
359,NateSilver538,2023-07-24 20:29:57+00:00,"Now that I'm writing a bit more, switched my newsletter over to a custom domain.

It's free for now but it's still much appreciated if you sign up for the mailing list!

https://t.co/knOIcqwuMp"
360,NateSilver538,2023-06-23 21:28:18+00:00,Lazy Friday afternoon so I've got a fun little poker post for you: https://t.co/fWONdD20RS
361,NateSilver538,2023-06-22 18:51:44+00:00,"This doesn't make sense. Accusing someone of a crime etc doesn't imply 100% proof. Rather, an accusation is a call for further investigation in the presence of suspicious behavior. Poker players should absolutely call out suspicious behavior and game operators should investigate."
362,PokerRob24,2023-06-22 10:49:25+00:00,Doesn’t matter how much we dislike our peers or disagree with their bad behavior and tactics at the table but we shouldn’t accuse anyone of cheating without having 100% proof.
363,NateSilver538,2023-06-21 23:12:48+00:00,"Good test of Bayes 101 reasoning, the fact that China is destroying and/or refusing to provide evidence is of course important evidence! https://t.co/fRXmtd8dG2 https://t.co/PVCZJlCKJX"
364,NateSilver538,2023-06-21 03:04:37+00:00,This has been a significant event for calling out misaligned incentives (and sometimes outright corruption) in US public works projects. They can happen much faster. Media and voters should hold decision-makers to account for expensive and slow taxpayer projects.
365,AlecStapp,2023-06-21 02:06:07+00:00,"The highway overpass collapsed just ***9 days ago***

Progress is a policy choice. https://t.co/6McPofMZ8K"
366,NateSilver538,2023-06-21 02:25:30+00:00,This is interesting but I think a more likely explanation is that media culture (including the NYT of course) tends to focus on negative storylines and otherwise caters to people with high neuroticism. https://t.co/n4S8iIpBnA
367,NateSilver538,2023-06-21 02:31:24+00:00,"I basically think we should look at intensive news consumption like we look at junk food, a mostly benign and entirely understandable trait that there's no need to have a moral panic about (I love fast food) but certainly not something that we should view as wise or virtuous."
368,NateSilver538,2023-06-20 06:56:23+00:00,Bad karma to make poker brags before the tournament is over but gonna make an exception because I was down to one blind (45k) and ran it up to 13.3m in the @WSOP MonsterStack. About 40 of us left for Day 4 from 8000+ originally. https://t.co/WMOZdhZ0uH
369,NateSilver538,2023-06-20 22:54:00+00:00,"Out in 32nd standard spot where I had an auto 4-bet shove with AK but ran into AA.

Shouldn't have tweeted about it lol.

Still a fun tournament. Home for a bit then back for the Main and other stuff. Good luck to the remaining 31!"
370,NateSilver538,2023-06-19 07:31:57+00:00,"RT @AbbyHiggs: Debate me, boats https://t.co/kXLS21b2VL"
371,AbbyHiggs,2023-06-19 01:56:23+00:00,"Debate me, boats https://t.co/kXLS21b2VL"
372,NateSilver538,2023-06-18 04:26:49+00:00,"Turning down a ""debate me"" challenge isn't the own that people think. Having rhetorical skills in an adversarial format before a large audience is a nice but fairly niche skill that doesn't really correlate with underlying accuracy or really even courage of one's convictions."
373,NateSilver538,2023-06-18 04:26:50+00:00,"It's like: sometimes I've been tempted to publicly challenge someone whom I'm in a statistical argument with to a poker match. And believe me, I'd be thrilled to play and I'd have a big edge. But I've also spent 10k+ hours playing poker. It's not exactly a neutral playing field."
374,NateSilver538,2023-06-17 23:51:03+00:00,"Yeah this is the most underrated bias in polls, response rates are much higher among the politically engaged. Also not the fault of the polls per se, but people tend to feel pressured to give an answer even when they know little or nothing about the subject."
375,PeterHamby,2023-06-17 23:46:37+00:00,"Hopefully they would agree there’s absolutely no way 80% of Americans have an opinion either way on RFK, Jr."
376,NateSilver538,2023-06-16 22:16:32+00:00,I lurk on a lot of Knicks fan blogs and I don't get the lukewarmness on cheapish Zion. Yeah it miserably fails 65% of the time but the upside on the 35% is way higher than with Beal or whatever.
377,JCMacriNBA,2023-06-16 16:44:49+00:00,"Accounts like this are why I don’t engage on this app anymore. 

Are there pitfalls to Zion, like just about any player? 100%.

Is it absurd to consider the idea of buying low on arguably a top-10 talent? Of course not. 

Just like most things, there’s nuance. What foolishness."
378,NateSilver538,2023-06-15 10:01:48+00:00,"NBA commissioner playing WSOP?
https://t.co/kMgIpHUOrO https://t.co/I79eDsT5oy"
379,NateSilver538,2023-06-15 03:01:57+00:00,I fired off some really banger Tweets in July-Septmber 2021. Glad that they made the GPT 3.5 training cutoff and will help shape the future of humanity.
380,jeremybowers,2023-06-15 02:33:11+00:00,"Reminded by several examples this week that pre-2022 web scrapes will be the last of the non-synthetic human-generated content for LLMs, meaning that pre-2022 training data will be valuable like non-radioactive steel."
381,NateSilver538,2023-06-14 04:49:09+00:00,"Sort of ironic that Vegas is going to win this series 5-2, 7-2, 3-2, 8-3, basically all the worst possible poker hands."
382,NateSilver538,2023-06-14 00:35:11+00:00,"I mean c'mon, scientists had a lot of influence, and a lot of policies were justified by ""we're just following the science"".  If I (as an influential person) advocate for an idea, people actually listen and the policy is implemented, of course I deserve credit/blame."
383,guardian,2023-06-13 09:26:12+00:00,Don’t blame scientists for what went wrong with Covid – ministers were the ones calling the shots | Devi Sridhar https://t.co/Npd8kxFF6o
384,NateSilver538,2023-06-13 20:06:24+00:00,"RT @chrislhayes: ""With Jokic, on the other hand, RAPTOR has no idea what to do."""
385,chrislhayes,2023-06-13 20:03:24+00:00,"""With Jokic, on the other hand, RAPTOR has no idea what to do."""
386,NateSilver538,2023-06-13 19:57:57+00:00,"Went longish on Jokic, the Nuggets and the limits of rigid NBA empiricism. https://t.co/fICoKAMVYO"
387,NateSilver538,2023-06-13 19:58:34+00:00,This is a pretty fun list. https://t.co/mkseP9e4wD
388,NateSilver538,2023-06-13 20:05:22+00:00,I don't think they're going to run off 3 more titles (unless KD demands to be traded for Michael Porter Jr.) but there more similarities to the 2014-15 Warriors than you might think.
389,NateSilver538,2023-07-24 20:29:57+00:00,"Now that I'm writing a bit more, switched my newsletter over to a custom domain.

It's free for now but it's still much appreciated if you sign up for the mailing list!

https://t.co/knOIcqwuMp"
390,NateSilver538,2023-06-13 19:57:57+00:00,"Went longish on Jokic, the Nuggets and the limits of rigid NBA empiricism. https://t.co/fICoKAMVYO"
391,NateSilver538,2023-06-13 19:58:34+00:00,This is a pretty fun list. https://t.co/mkseP9e4wD
392,NateSilver538,2023-06-12 01:33:07+00:00,https://t.co/uZQPeLbyT2
393,NateSilver538,2023-06-11 05:04:04+00:00,"I've spent roughly as much time covering politics and sports in my career so have some unique Lived Experience and the answer is that politics ""fans"" are an order of magnitude more self-delusional than sports fans it isn't super close tbh."
394,wagesofwins,2023-06-11 04:47:09+00:00,"Siri: Show me a person who has never met a sports fan! 😃
(or a middle-aged man!!)"
395,NateSilver538,2023-06-10 23:25:22+00:00,It is lowkey hilarious how many people in the replies don't realize this is sarcastic
396,mattyglesias,2023-06-10 17:59:22+00:00,"Politics aside, it just seems out of character for Trump to do something as reckless and sloppy as what’s alleged in this indictment. 

Like the guy or not, I don’t care, but you have to admit something doesn’t fit here."
397,NateSilver538,2023-06-11 04:35:15+00:00,"Don't try the ""well the whole *point* is that you *can't even tell* if he was joking"" cope actually you can if you don't have an acute case of brainworms."
398,NateSilver538,2023-06-10 05:05:16+00:00,"If the Nuggets close this out there's going to be a lot of gaslighting about ""Nikola Jokic is a great *regular season* player"" and other pearls of conventional wisdom that implied he was a paper tiger."
399,NateSilver538,2023-06-07 16:53:40+00:00,"OK, folks. If you were to recommend a few canonical materials on AI existential risk *for a lay audience new to the debate* what would they be? Ideally looking for stuff that sorts through the evidence in a judicious and  approachable way. For a newsletter post coming soon."
400,NateSilver538,2023-06-07 16:53:40+00:00,"Books, podcasts, videos, articles all good. Obvious or non-obvious both OK. I think I could generate such a list myself but I'm sure I have a lot of blind spots. The approachability thing is key; I think people with expertise in the field can underestimate the learning curve."
401,NateSilver538,2023-06-06 23:54:51+00:00,"You need to adjust for news's negativity bias, otherwise news-watching can be an unhealthy hobby both emotionally and intellectually. Don't confuse watching the news constantly for being a well-informed citizen."
402,JustinWolfers,2023-06-06 23:35:59+00:00,This seems like a useful metaphor for understanding coverage of the economy. And it has implications for how readers should interpret econ news.
403,NateSilver538,2023-06-06 23:22:14+00:00,Getting to an extremely weird place where younger Americans are more risk-averse than older ones across a number of dimensions. Usually doesn't work like that.
404,emilyekins,2023-06-05 16:37:40+00:00,"NEW CATO SURVEY: Nearly a third of Gen Z support the government installing surveillance cameras in every household  to prevent crime and abuse.

Opposition to Orwelian-government monitoring has been assumed to be both overwhelming and obvious. But is it?

A #CatoPolls  [thread]… https://t.co/5BeLsp953m"
405,NateSilver538,2023-06-06 17:21:54+00:00,"World could use a podcast app that automatically adjusts to the speed of the speaker (within a pre-specified range, e.g. 1.0 to 1.5) and also keeps the musical bumpers at 1.0x."
406,JamesSurowiecki,2023-06-06 16:17:41+00:00,"Was listening to a podcast episode in the Apple app at 1.25x, then listened to the next episode on Amazon Music at 1.2x. Amazing how much slower the 2nd one sounded, even though the Apple version was only .05x faster."
407,NateSilver538,2023-06-06 09:19:44+00:00,It would be a hell of long con given that the EA/rationalist movement has been talking about AI risk for 10 or 20 years.
408,ProfNoahGian,2023-06-05 16:29:43+00:00,"Reeling from the reputational damage SBF caused to EA, this became somewhat of an existential risk to the EA movement itself: nukes are too obvious, mosquito nets are too small, putting AI x-risk on the map was the path to show the world the enormous value EA offers society."
409,NateSilver538,2023-06-06 00:33:08+00:00,"Got into Vegas for WSOP and got a free room upgrade and was like ""hell yeah this is my year"" then immediately had like 6 extremely annoying minor personal mishaps that are too embarrassing to detail here."
410,NateSilver538,2023-06-05 22:19:11+00:00,"Yeah, Political Twitter has been a miserable expirence for a long time, other than #ElectionTwitter which is still mostly here. I much prefer a Twitter where I can follow subinterests like the NBA and there's not an amplified Main Thread that's nearly always a political argument."
