username,orario,text,Unnamed: 0
Redistrict,2022-08-10 03:29:25+00:00,Trump-endorsed Tim Michels (R) looking quite strong vs. former Lt. Gov. Rebecca Kleefisch (R) so far in #WIGOV GOP primary.,763.0
Redistrict,2022-08-10 03:25:07+00:00,"So far, #MN05 Rep. Ilhan Omar (D) up just 53%-46% vs. former Minneapolis Councilman Don Samuels (D). Still early, but much closer than her 2020 primary.",764.0
Redistrict,2022-08-10 03:21:07+00:00,"Trump carried #MN01 54%-44% in 2020. So if Jeff Ettinger (D) were to finish within single digits of Brad Finstad (R) in tonight's special election, it would be a good result for Dems. 

If Finstad's margin is 5 pts or less, it would be a great result for Dems. We'll see.",765.0
Redistrict,2022-08-10 02:31:22+00:00,"RT @BREAKING @HerreraBeutler has conceded in statement. ""I’m proud that I always told the truth, stuck to my principles, and did what I knew to be best for our country."" #waelex https://t.co/1kZeNbQC1I",766.0
Jim_Brunner,2022-08-10 02:15:53+00:00,"BREAKING @HerreraBeutler has conceded in statement. ""I’m proud that I always told the truth, stuck to my principles, and did what I knew to be best for our country."" #waelex https://t.co/1kZeNbQC1I",767.0
Redistrict,2022-08-10 02:03:38+00:00,I've seen enough: Sanders-endorsed state Sen. Becca Balint (D) defeats Lt. Gov. Molly Gray (D) in the #VTAL Dem primary. @CookPolitical November rating: Solid D.,768.0
Redistrict,2022-08-10 02:07:20+00:00,"Balint is virtually certain to become the first woman ever elected to Congress from Vermont, the only state left that's never done so. #VTAL",769.0
Redistrict,2022-08-09 02:40:13+00:00,"Between retirements (Kinzinger, Gonzales, Upton, Katko, Jacobs) and primary defeats (McKinley, Davis, Rice, Meijer, Herrera Beutler), we're watching a slow-motion decimation of House GOP Trump skeptics and election certifiers.",770.0
Redistrict,2022-08-09 02:48:25+00:00,*Gonzalez (#OH16),771.0
Redistrict,2022-08-09 02:28:04+00:00,I've seen enough: #WA03 Rep. Jaime Herrera Beutler (R) has lost reelection. Marie Gluesenkamp Perez (D) and Joe Kent (R) will advance to November.,772.0
Redistrict,2022-08-09 02:32:06+00:00,"Herrera Beutler is the third pro-impeachment GOP incumbent to lose reelection. Kent, endorsed by Trump, is the clear favorite to win this R+5 seat (@CookPolitical PVI) in the fall.",773.0
Redistrict,2022-08-06 02:38:18+00:00,"New: pro-impeachment #WA04 Rep. Dan Newhouse (R) advances to the general election, where he's safe. But he's lucky: his pro-Trump GOP challengers split 49% of the vote six ways, while he scraped by w/ 25%.",774.0
Redistrict,2022-08-06 02:10:23+00:00,Pro-impeachment Rep. Jaime Herrera Beutler (R) needs a miracle. Trump-endorsed Joe Kent (R) now the strong favorite to knock her out of the top two. #WA03,775.0
Redistrict,2022-08-05 18:28:41+00:00,"Still a long way to go, but it's quite possible #WA04 Rep. Dan Newhouse (R) is the lone Republican of the 10 who voted to impeach Trump who is still a member of Congress in January.",776.0
Redistrict,2022-08-05 18:30:23+00:00,Four are retiring. Two have lost. #WYAL Rep. Liz Cheney (R) is on track to lose in a landslide. #WA03 Rep. Jaime Herrera Beutler (R) is in extreme danger of being locked out of the top two. #CA21 Rep. David Valadao (R) is in a Toss Up race against a Democrat.,777.0
Redistrict,2022-08-05 16:51:57+00:00,"Fact: in Michigan, Republicans nominated three Black congressional candidates. Democrats? Zero. For the first time in 68 years, Detroit won't have a Black member of Congress.",778.0
Redistrict,2022-08-05 15:47:17+00:00,"NEW at @CookPolitical: five House rating changes. Notably, #NE02 Rep. Don Bacon (R) moves from Likely R to Toss Up and #MI03 OPEN (R) moves from Toss Up to Lean D as Dems show signs of life. Full analysis: https://t.co/sFCWBpplJ1 https://t.co/pXM6QIFUbn",779.0
Redistrict,2022-08-05 04:31:43+00:00,I’ve seen enough: Andy Ogles (R) wins the #TN05 GOP primary. @CookPolitical November rating: Solid R.,780.0
Redistrict,2022-08-05 04:06:06+00:00,Pro-impeachment Rep. Jaime Herrera Beutler (R) not out of the woods yet. #WA03,781.0
Redistrict,2022-08-04 21:12:40+00:00,"In case you still thought Rep. Liz Cheney's goal is to win renomination to #WYAL on 8/16, here's the ad she just launched in a GOP primary in a 70% Trump state. https://t.co/ncTyubOoCl",782.0
Redistrict,2022-11-11 17:25:00+00:00,"Disclaimer: as has always been the case, the personal judgments offered by this account regarding election results are not official race ""calls"" and do not necessarily reflect the views of the Cook Political Report, NBC News or any other entity.",783.0
Redistrict,2022-08-03 18:44:26+00:00,"Although Kansas sent a loud message, the final margins in upcoming special elections in #MN01 (@CookPolitical PVI R+9), #AKAL (R+8) and #NY19 (R+2) will be much more instructive of the post-Dobbs environment for the fall.",784.0
Redistrict,2022-08-03 18:22:31+00:00,"Endorse, w/ caveat that R candidates with out-of-the-mainstream abortion positions (no exceptions) could pay a significant penalty.",785.0
Redistrict,2022-08-03 16:20:35+00:00,"And, total vote share for all Dems/left-leaning candidates adds up to 58%. In other words, looks like a fairly typical WA election.",786.0
amyewalter,2022-08-03 16:11:25+00:00,"Another bit of good news for D’s out of WA state where Sen. Patty Murray at 54% in all-party primary. Lots of votes yet to count, but a 50+ showing suggests that Murray not as vulnerable as GOP would like her to be. https://t.co/eBeum2G7MM",787.0
Redistrict,2022-08-03 14:49:23+00:00,"Trump-endorsed Kari Lake (R) has taken the lead over Gov. Ducey-backed Karrin Taylor Robson (R) by 11,324 votes (1.8 pts) in the #AZGOV GOP primary w/ more EDay ballots counted, and it doesn't look like she's giving it back.",788.0
Redistrict,2022-08-03 14:21:13+00:00,"New: Shri Thanedar (D) defeats state Sen. Adam Hollier (D) in the #MI13 Dem primary, meaning for the first time since 1954 there won’t be a Black member of Congress from Detroit.",789.0
Redistrict,2022-08-03 08:18:51+00:00,I’ve seen enough: Blake Masters (R) wins the #AZSEN GOP primary and will face Sen. Mark Kelly (D) in the fall. @CookPolitical November rating: Toss Up.,790.0
Redistrict,2022-08-03 07:58:18+00:00,"Reality check: Gibbs starts at a huge cash deficit to Hillary Scholten (D) and could have a tough time unifying the GOP, considering Rep. Peter Meijer is on track for 46% in the primary and those are far from automatic Gibbs votes in November. Plus, the new #MI03 is Biden +8.",791.0
rbeggin,2022-08-03 07:13:34+00:00,"Gibbs seen here talking to former President Donald Trump. 

""I'll see you soon. I'm very proud of you, John,"" Trump could be heard saying through the phone. (h/t John Barnes) https://t.co/LkIKqs98Io",792.0
Redistrict,2022-08-03 07:26:41+00:00,"Right now, the ""No"" vote in Kansas is on track to hit over 90% of Biden's 2020 vote total in the state. The ""Yes"" side is on track to hit just over 50% of Trump's vote total (to be clear, lots of Trump voters were ""No"" today, but just a huge Dem turnout).",793.0
Redistrict,2022-08-03 06:25:29+00:00,"Meijer is the second pro-impeachment Republican to lose a primary (four others opted to retire). With no realistic primary path for #WYAL Rep. Liz Cheney (R), there will be at most 3/10 pro-impeachment Rs remaining in the House in 2023.",794.0
Redistrict,2022-08-03 06:18:44+00:00,"I've seen enough: Trump-endorsed John Gibbs (R) defeats pro-impeachment Rep. Peter Meijer (R) in the #MI03 GOP primary and will face Hillary Scholten (D) in November. 

Rating change: @CookPolitical will be moving #MI03 from Toss Up to Lean D.",795.0
Redistrict,2022-08-03 05:56:04+00:00,"Breaking: John Gibbs (R) lead over Rep. Peter Meijer (R) now up to 1,195 votes (1.8 pts) w/ a big margin in Byron Twp. Gibbs is the strong favorite now. #MI03",796.0
Redistrict,2022-08-03 05:52:03+00:00,I've seen enough: pro-election conspiracy theory state Rep. Mark Finchem (R) wins the GOP primary for #AZSOS and will likely face Adrian Fontes (D) in the fall.,797.0
Redistrict,2022-08-03 05:44:50+00:00,"Shorter AZ GOP primary: Blake Masters' (R) 34% looks like it could be good enough to win the #AZSEN primary, while Kari Lake's (R) 40% doesn't look like it will cut it in #AZGOV.",798.0
Redistrict,2022-08-03 05:38:38+00:00,I've seen enough: Juan Ciscomani (R) wins the #AZ06 GOP primary and will face Kirsten Engel (D) in the fall. @CookPolitical November rating: Lean R.,799.0
Redistrict,2022-08-03 05:36:52+00:00,I've seen enough: Eli Crane (R) wins the #AZ02 GOP primary and will face Rep. Tom O'Halleran (D) in the fall. @CookPolitical November rating: Likely R.,800.0
Redistrict,2022-08-03 05:33:45+00:00,Breaking: Trump-endorsed John Gibbs (R) retakes the lead over GOP Rep. Peter Meijer (R) by 653 votes in the #MI03 GOP primary with a strong performance in Grandville. I'm not sure Meijer will make that up...,801.0
Redistrict,2022-08-03 05:28:26+00:00,"Based on initial returns, it's also a strong bet pro-impeachment Rep. Jaime Herrera Beutler (R) will advance in #WA03's top-two primary. As long as she does, she's safe in November (against either a D or R).

Both Newhouse and Herrera Beutler aided by split pro-Trump opposition.",802.0
Redistrict,2022-08-03 05:23:51+00:00,"Based on initial returns, it's a strong bet pro-impeachment Rep. Dan Newhouse (R) will advance in #WA04's top-two primary. As long as he does, he's safe in November (against either a D or R).",803.0
Redistrict,2022-08-03 05:18:21+00:00,I've seen enough: Rep. David Schweikert (R) survives the #AZ01 GOP primary and will face Jevin Hodge (D) in the fall. @CookPolitical November rating: Lean R.,804.0
Redistrict,2022-08-03 05:06:43+00:00,"We'll never know, but it's possible last-minute DCCC meddling in #MI03 actually backfired by making it clear to GOP primary voters which R Dems preferred to face in November (Gibbs would have been an underdog in this Biden +8 seat).",805.0
Redistrict,2022-11-11 17:25:00+00:00,"Disclaimer: as has always been the case, the personal judgments offered by this account regarding election results are not official race ""calls"" and do not necessarily reflect the views of the Cook Political Report, NBC News or any other entity.",806.0
Redistrict,2022-08-03 05:01:06+00:00,New: Eric Burlison (R) wins the #MO07 GOP primary. @CookPolitical November rating: Solid R.,807.0
Redistrict,2022-08-03 04:56:37+00:00,"As expected, Paul Junge (R) wins the #MI08 GOP primary and will face Rep. Dan Kildee (D) in the fall. @CookPolitical November rating: Toss Up.",808.0
Redistrict,2022-08-03 04:53:59+00:00,"New: pro-impeachment Rep. Peter Meijer (R) takes the lead over Trump-endorsed John Gibbs (R) w/ more Grand Rapids suburbs reporting, 50.5%-49.5%. 

Still a lot of votes left to count in #MI03, but Meijer looking like a slight favorite.",809.0
Redistrict,2022-08-03 04:42:10+00:00,"The city of Grand Rapids just reported, and pro-impeachment Rep. Peter Meijer (R) didn't do nearly as well there as he's doing in Kent Co.'s suburbs. It's going down to the wire between Meijer and Trump-endorsed John Gibbs (R) in #MI03.",810.0
Redistrict,2022-08-03 04:46:28+00:00,"City of Grand Rapids

Gibbs 4,657
Meijer 4,491

Suburban Kent Co.

Gibbs 4,333
Meijer 6,349

Meijer has many more GR suburbs to come, Gibbs has Muskegon Co. to come.",811.0
Redistrict,2022-08-03 04:14:20+00:00,"No House race is hinging on a GOP primary outcome quite like #MI03. If Rep. Peter Meijer (R) hangs on, it probably moves from Toss Up to Lean R. 

If John Gibbs (R) beats him, it probably moves from Toss Up to Lean D.",812.0
Redistrict,2022-08-03 04:05:48+00:00,"The biggest surprise of the night so far? Pro-impeachment Rep. Peter Meijer's (R) strength in the #MI03 GOP primary. If he maintains this pace in Kent Co., he's got a great chance to hang on.",813.0
Redistrict,2022-08-03 03:59:11+00:00,New: Mark Alford (R) wins the #MO04 GOP primary. @CookPolitical November rating: Solid R.,814.0
Redistrict,2022-08-03 03:51:22+00:00,"It's possible the margin for ""No"" in red Kansas will be a resounding double digits, a sign of just how unpopular overturning Roe v. Wade is nationally.",815.0
Redistrict,2022-08-03 03:26:29+00:00,"I've seen enough: in a huge victory for the pro-choice side, the Kansas constitutional amendment to remove protections of abortion rights fails.",816.0
Redistrict,2022-08-03 03:19:33+00:00,Trump-endorsed John Gibbs (R) leading Rep. Peter Meijer (R) 63%-37% in early going in #MI03 GOP primary. About as expected.,817.0
Redistrict,2022-08-03 03:13:38+00:00,"The best indicator in Kansas right now is Ellis Co. (Hays, KS), which voted 71%-27% for Trump in '20. Right now, ""Yes"" on removing abortion protections is up just 55%-45% w/ maybe 3/4 of the vote in. 

So far, the ""No"" side is hitting the numbers it needs.",818.0
Redistrict,2022-08-03 03:03:53+00:00,"Phillips Co. cast 2,736 votes in Nov. 2020 and is only counting 597 votes right now, so I think it's a long way from being done. Still, an encouraging showing for ""No"" thus far.",819.0
Redistrict,2022-08-03 02:52:05+00:00,"I've seen enough: Eric Schmitt (R) wins the #MOSEN GOP primary, defeating Vicky Hartzler (R), Eric Greitens (R) and others.",820.0
Redistrict,2022-08-03 02:48:52+00:00,"Early returns look favorable for the ""No"" side on amending the Kansas constitution to to remove protections of abortion rights. But we'll need to see much more EDay vote to draw real conclusions.",821.0
Redistrict,2022-08-03 02:34:53+00:00,"I've seen enough: Rep. Haley Stevens (D) wins the #MI11 Dem primary, defeating progressive Rep. Andy Levin (D). @CookPolitical November rating: Solid D.",822.0
Redistrict,2022-08-03 02:33:04+00:00,"Deleted a previous tweet, b/c as I suspected, the AP reversed the candidates' vote totals. As expected, Rep. Haley Stevens (D) now leads progressive Rep. Andy Levin (D) 59%-41% w/ more than a third of the expected vote in. #MI11",823.0
Redistrict,2022-08-03 02:28:13+00:00,"I've seen enough: Rep. Rashida Tlaib (D) wins the #MI12 Dem primary, defeating Detroit City Clerk Janice Winfrey (D) and others.",824.0
Redistrict,2022-08-03 02:23:36+00:00,I've seen enough: Tudor Dixon (R) wins the #MIGOV GOP primary and will face Gov. Gretchen Whitmer (D) in the fall. @CookPolitical November rating: Lean D.,825.0
Redistrict,2022-08-03 01:20:53+00:00,"RT @I hear a lot of folks talking about a “wave” election helping to put super long-shot races (think WA or VT) over the top, even as weaker candidates in winnable races (ie, GA/AZ) lose. That’s not really how it works. A ‘wave’ means weaker candidates win. 1/2",826.0
amyewalter,2022-08-02 20:07:19+00:00,"I hear a lot of folks talking about a “wave” election helping to put super long-shot races (think WA or VT) over the top, even as weaker candidates in winnable races (ie, GA/AZ) lose. That’s not really how it works. A ‘wave’ means weaker candidates win. 1/2",827.0
Redistrict,2022-11-11 17:25:00+00:00,"Disclaimer: as has always been the case, the personal judgments offered by this account regarding election results are not official race ""calls"" and do not necessarily reflect the views of the Cook Political Report, NBC News or any other entity.",828.0
Redistrict,2022-08-02 04:19:44+00:00,RT @Four incumbents are at risk of losing their primaries tomorrow night. Don't miss @Redistrict's preview of the House races to watch (🔒): https://t.co/i8K2CeuX6C,829.0
CookPolitical,2022-08-02 02:30:00+00:00,Four incumbents are at risk of losing their primaries tomorrow night. Don't miss @Redistrict's preview of the House races to watch (🔒): https://t.co/i8K2CeuX6C,830.0
Redistrict,2022-07-26 18:27:12+00:00,"If you’re wondering why there aren’t more Republicans in Congress willing to take a stand against Trump/Trumpism, a big reason is: Democrats have beaten them.",831.0
Redistrict,2022-07-26 04:15:36+00:00,"It’s now a Biden +9 seat after redistricting (and Grand Rapids is trending Dem), so Hillary Scholten (D) would be the slight favorite over Gibbs (R) in my view.",832.0
Redistrict,2022-07-26 03:46:08+00:00,"As many as six House incumbents are at genuine risk of losing primaries next week. And FWIW, #MI03 Rep. Peter Meijer (R) would be the underdog in his primary with or without DCCC meddling. Full analysis: https://t.co/MbwMfonrEl",833.0
Redistrict,2022-07-25 19:26:13+00:00,RT @The August 2nd primaries are just around the corner. Four incumbents are at risk of losing their primaries. Read @Redistrict's latest on the key House races to watch: https://t.co/i8K2Cedmf4,834.0
CookPolitical,2022-07-25 19:25:49+00:00,The August 2nd primaries are just around the corner. Four incumbents are at risk of losing their primaries. Read @Redistrict's latest on the key House races to watch: https://t.co/i8K2Cedmf4,835.0
Redistrict,2022-07-22 18:18:44+00:00,Peak DC is believing the #WYAL GOP primary is still competitive or that the current incumbent is a plausible presidential contender in 2024.,836.0
Redistrict,2022-07-22 18:02:20+00:00,"Is the ""red wave"" ebbing? Probably not much. But as Dems show more signs of life and Rs nominate several problematic candidates, we're downgrading our @CookPolitical House outlook from a GOP gain of 20-35 seats to 15-30 seats. Full analysis: https://t.co/LozihjYbQz",837.0
Redistrict,2022-07-22 18:05:04+00:00,"Exhibit A: in #MI03, Trump-endorsed former HUD official John Gibbs (R) is the favorite to defeat pro-impeachment Rep. Peter Meijer (R) on 8/2. 

Gibbs recently told the Detroit News, ""There are many great Americans all around the country who were actually conceived from rape.""",838.0
Redistrict,2022-07-22 18:11:44+00:00,"We haven't hesitated to move vulnerable House Dems into @CookPolitical's Toss Up column. Still, if the 34 seats in Toss Up were to split evenly between the parties, Republicans would net just 18 seats - at the lower end of our 15-30 seat range. https://t.co/mAdCOtLpRZ https://t.co/lcjGDX8lj6",839.0
Redistrict,2022-07-22 17:16:47+00:00,"RT @Republicans are enjoying a stronger Electoral College advantage than at any point in the 25-year history of the Cook PVI. In ‘04, Kerry lost by 3 pts., still got 251 EV. If current EV patterns hold in ‘24, a 3 pt loss by Dems would get just 218 EVs.",840.0
amyewalter,2022-07-22 16:59:26+00:00,"Republicans are enjoying a stronger Electoral College advantage than at any point in the 25-year history of the Cook PVI. In ‘04, Kerry lost by 3 pts., still got 251 EV. If current EV patterns hold in ‘24, a 3 pt loss by Dems would get just 218 EVs.",841.0
CookPolitical,2022-07-22 16:52:13+00:00,"New: @amyewalter uses the new 2022 Cook PVI to examine Republicans' Electoral College advantage.

https://t.co/HBUOHTTMqX",842.0
Redistrict,2022-07-22 15:58:25+00:00,RT @NEW ratings change at @CookPolitical this morning: #GAGov moves from Toss Up to Lean Republican https://t.co/Nb1qj0smxB ($),843.0
JessicaTaylor,2022-07-22 14:12:55+00:00,NEW ratings change at @CookPolitical this morning: #GAGov moves from Toss Up to Lean Republican https://t.co/Nb1qj0smxB ($),844.0
Redistrict,2022-07-20 02:38:47+00:00,"Notable Rs in competitive races who voted against codifying same-sex marriage:

#AZ01 David Schweikert (R) - Lean R
#CA45 Michelle Steel (R) - Lean R
#NM02 Yvette Herrell (R) - Toss Up
#OH01 Steve Chabot (R) - Toss Up
#TX34 Mayra Flores (R) - Lean D",845.0
rpyers,2022-07-20 01:08:38+00:00,"Full roll call vote on the Respect for Marriage Act
https://t.co/3qRngXSj9w https://t.co/O8sdWvo0WZ",846.0
Redistrict,2022-07-19 23:01:52+00:00,"Two @CookPolitical House rating changes today:

#IN01 Frank Mrvan (D) - Lean D to Toss Up
#MN01 VACANT (Hagedorn) (R) - Solid R to Likely R

https://t.co/pGssRoJtLq",847.0
Redistrict,2022-07-19 19:14:21+00:00,"As expected, OH Supreme Court throws out GOP map as an illegal gerrymander - but it’s too late to redraw in time for 2022. Expect Republicans to draw a slightly different gerrymander in time for 2024, when the court’s balance of power could shift right.",848.0
susantebben,2022-07-19 16:12:53+00:00,"BREAKING: The Ohio Supreme Court has declared the most recent congressional map invalid, ordering a new map within 30 days.",849.0
Redistrict,2022-07-19 19:17:46+00:00,"By a combination of running out the clock on lawsuits and diluting reform initiatives passed by voters, Republicans have now successfully thwarted redistricting reform measures in FL, OH and UT - accounting for their entire national gain from new maps.",850.0
Redistrict,2022-07-13 17:32:48+00:00,"RT @The 2022 Cook PVI is out. Under the new post-redistricting boundaries: 
#AL04 is the most Republican district  (R+33)
#CA12 is the most Democratic district (D+40)
#MI08 is the median district (R+1)

Explore the full 2022 Cook PVI map: https://t.co/hWYDp7JpS4 https://t.co/KRo1SbEp0o",851.0
CookPolitical,2022-07-13 17:28:40+00:00,"The 2022 Cook PVI is out. Under the new post-redistricting boundaries: 
#AL04 is the most Republican district  (R+33)
#CA12 is the most Democratic district (D+40)
#MI08 is the median district (R+1)

Explore the full 2022 Cook PVI map: https://t.co/hWYDp7JpS4 https://t.co/KRo1SbEp0o",852.0
Redistrict,2022-07-13 15:32:51+00:00,"NEW: the entire decline in competitive House seats from redistricting is attributable to GOP gerrymanders (esp. TX and GA), whereas swing seats *increased* in Dem-controlled states and held steady in court/commission-drawn states. Full report: https://t.co/AffIOzAvbV https://t.co/TnherK4HS2",853.0
Redistrict,2022-07-13 15:28:13+00:00,"NEW: by Cook PVI℠, four more districts shifted from R-leaning to D-leaning in redistricting than vice versa (17 to 13). But because Ds hold most seats in both categories, Rs have more pickup opportunities from revamped lines. https://t.co/AffIOzAvbV https://t.co/eo8W90Y0OJ",854.0
Redistrict,2022-07-13 15:20:49+00:00,"Left: the original, hard-copy Cook PVI devised by @CharlieCookDC, published in 1997. Right: our interactive 2022 Cook PVI℠ map (median district: Rep. Dan Kildee's (D) #MI08). Full report: https://t.co/AffIOzAvbV https://t.co/yxuDkcK5Qp",855.0
Redistrict,2022-07-13 14:47:57+00:00,"NEW: after redistricting, the number of hyper-competitive House seats (Cook PVI℠ between D+3 and R+3) has declined from 51 to 45, our lowest count ever. Full report: https://t.co/AffIOzAvbV https://t.co/9GiB63pcoO",856.0
Redistrict,2022-11-11 17:25:00+00:00,"Disclaimer: as has always been the case, the personal judgments offered by this account regarding election results are not official race ""calls"" and do not necessarily reflect the views of the Cook Political Report, NBC News or any other entity.",857.0
Redistrict,2022-07-13 14:07:28+00:00,"RT @We are excited to introduce the 25th Anniversary edition of the Cook Partisan Voting Index (Cook PVI℠) 

Not yet a subscriber? Join us today to read the report by @Redistrict. Use the code cpvi22 for 22% off your first year. 

https://t.co/JB12MT24PR",858.0
CookPolitical,2022-07-13 14:05:38+00:00,"We are excited to introduce the 25th Anniversary edition of the Cook Partisan Voting Index (Cook PVI℠) 

Not yet a subscriber? Join us today to read the report by @Redistrict. Use the code cpvi22 for 22% off your first year. 

https://t.co/JB12MT24PR",859.0
Redistrict,2022-07-12 15:17:48+00:00,"Exciting news: the 25th Anniversary edition of the Cook PVI℠ will be released tomorrow. Subscribers will get a sneak peek in their inbox this afternoon. 

Don't want to miss out? Use the code cpvi22 for 22% off your first year. https://t.co/fcpCfzVug7 https://t.co/zqzzjXMcac",860.0
Redistrict,2022-07-08 15:08:52+00:00,"RT @For R’s to pick up the 50-60 seats like they did in ‘94/‘10, they’ll have to win higher % of seats Biden won by 10+ pts than they did back then. With some cool charts by @alflinn &amp; research help by Matthew Klein &amp; Peter Jones. 

https://t.co/TVoLHhJHz3",861.0
amyewalter,2022-07-08 15:01:52+00:00,"For R’s to pick up the 50-60 seats like they did in ‘94/‘10, they’ll have to win higher % of seats Biden won by 10+ pts than they did back then. With some cool charts by @alflinn &amp; research help by Matthew Klein &amp; Peter Jones. 

https://t.co/TVoLHhJHz3",862.0
Redistrict,2022-07-08 02:59:28+00:00,"RT @How likely is it that the Supreme Court will embrace the ""independent state legislature"" theory, and how would it affect election law? @ameliatd and I investigate: https://t.co/vIRHIygrJd",863.0
baseballot,2022-07-07 16:44:19+00:00,"How likely is it that the Supreme Court will embrace the ""independent state legislature"" theory, and how would it affect election law? @ameliatd and I investigate: https://t.co/vIRHIygrJd",864.0
Redistrict,2022-06-30 20:52:22+00:00,"Hard to overstate what a radical step this would be, given that many swing-state legislatures are gerrymandered in ways that self-perpetuate GOP control. Would decimate checks and balances.",865.0
baseballot,2022-06-30 16:49:06+00:00,"The Supreme Court has granted cert to Moore v. Harper (the ""independent state legislature doctrine"" case), meaning it will decide next term whether state legislatures (and not courts) have sole jurisdiction over election law.",866.0
Redistrict,2022-06-29 16:48:07+00:00,"RT @It was a mixed night for MAGA and primary meddling.

📧 Subscribers: check your inboxes for our post-primary update by @amyewalter, @JessicaTaylor and @Redistrict: https://t.co/Yh1HogGj6Q",867.0
CookPolitical,2022-06-29 15:19:24+00:00,"It was a mixed night for MAGA and primary meddling.

📧 Subscribers: check your inboxes for our post-primary update by @amyewalter, @JessicaTaylor and @Redistrict: https://t.co/Yh1HogGj6Q",868.0
Redistrict,2022-06-29 05:41:58+00:00,"I've seen enough: Rep. Danny Davis (D) defeats Kina Collins (D) in the #IL07 Dem primary. But the result will be much, much closer than in 2020.",869.0
