username,orario,text,Unnamed: 0
Redistrict,2022-11-09 17:34:01+00:00,"RT @NEWS: Sean Patrick Maloney, the chairman of the DCCC, just called Republican Mike Lawler to concede his Lower Hudson Valley race. 

This is a stinging loss for Democrats, and Maloney in particular, on a night when the party otherwise faired better than expected.",444.0
npfandos,2022-11-09 17:29:50+00:00,"NEWS: Sean Patrick Maloney, the chairman of the DCCC, just called Republican Mike Lawler to concede his Lower Hudson Valley race. 

This is a stinging loss for Democrats, and Maloney in particular, on a night when the party otherwise faired better than expected.",445.0
Redistrict,2022-11-09 13:31:25+00:00,Key point for 2024 👇,446.0
kkondik,2022-11-09 09:48:22+00:00,Rs got their Supreme Court victories in OH and NC. Likely has consequences for redistricting next year -- Ds had a good night in each state for House but worse maps may be on horizon as Rs build defenses to protect what looks like a fairly small majority,447.0
Redistrict,2022-11-09 13:26:17+00:00,"In retrospect, I think this was key.",448.0
Redistrict,2022-11-08 04:21:03+00:00,"There's a tendency for forecasters to get caught up in the doom/momentum narrative that takes hold late in a cycle when one party is ahead, and turn predicting gains into an arms race. 

But @FiveThirtyEight's empirical model shows virtually no movement either way since 10/21.",449.0
Redistrict,2022-11-09 13:21:33+00:00,"That Dem turnout problem in FL? Yes, it was real - and massive. Luckily for Dems, it didn’t really materialize anywhere else.

Between Dems crushing competitive OH/MI/NH/PA/TX House races but dragging in FL/NY, this is the most uneven midterm I’ve ever seen.",450.0
Redistrict,2022-11-09 13:06:27+00:00,"Republicans wouldn’t be slight favorites to win House control right now if they hadn’t been able to gerrymander far more states than Dems.

And, Dems wouldn’t hold the slight majority today if courts hadn’t struck down GOP gerrymanders in FL, NC, PA and VA in the last 7 years.",451.0
Redistrict,2022-11-09 13:00:55+00:00,"Well, that was the craziest Election Night I’ve ever seen.",452.0
Redistrict,2022-11-09 00:34:30+00:00,"Biennial reminder: I'll be dark on Twitter from 6pm-6am tonight as I crunch data at the @NBCNews Decision Desk, as I've done every prez/midterm year since 2008.

BEWARE: anyone posting in my name on Twitter during that time period is impersonating me.

See you on the flip side.",453.0
Redistrict,2022-11-08 23:50:31+00:00,"If the bottom truly drops out for FL Dems, two House races to watch: #FL22 Rep. Lois Frankel (D), a Biden +18 seat, and #FL23 OPEN (Deutch) (D), a Biden +13 seat.",454.0
Redistrict,2022-11-08 22:53:43+00:00,"One thing to remember tonight: even though redistricting made lots of GOP-leaning House seats (@CookPolitical PVI Even to R+5) a lot safer, it increased the number of Dem-leaning seats (Even to D+5) from 46 to 48 - adding to Dems' exposure in the event of a big GOP wave.",455.0
Redistrict,2022-11-08 22:14:59+00:00,Big theme/vibe of 2022: split-ticket voting.,456.0
TimCalWMUR,2022-11-08 21:55:38+00:00,"Some early results coming in. @GovChrisSununu, @SenatorHassan and @RepAnnieKuster take the top spots in their races in Dixville. https://t.co/i1oqynKxVF",457.0
Redistrict,2022-11-08 21:23:46+00:00,"A good summary by @AmyeWalter on the three most likely scenarios tonight. FWIW, I'm leaning towards a different one today than I was yesterday. https://t.co/MJZsOkToqB",458.0
Redistrict,2022-11-08 20:04:04+00:00,It's pretty apparent from precinct-level data in VA and county-level data in FL that Democrats have a turnout problem today - one that's unlikely to be solved in the next six hours.,459.0
Redistrict,2022-11-08 20:14:24+00:00,"Noon turnout reports in VA Beach - a majority of Rep. Elaine Luria's (D) Toss Up #VA02 - show most heavily GOP precincts up to 55-60% of '21 votes cast, vs. 40-45% in most non-white precincts.

Total ballots cast skewing much more R than '20 in many FL counties, esp. Miami-Dade.",460.0
Redistrict,2022-11-08 20:23:23+00:00,"In recent years, R voters have generally enjoyed their largest turnout advantage in the first 2-3 hours of EDay voting. So, it's possible these gaps will narrow - and these are just two states.

But, these are just large differentials for Dems to overcome in the next few hours.",461.0
Redistrict,2022-11-11 17:25:00+00:00,"Disclaimer: as has always been the case, the personal judgments offered by this account regarding election results are not official race ""calls"" and do not necessarily reflect the views of the Cook Political Report, NBC News or any other entity.",462.0
Redistrict,2022-11-08 20:04:04+00:00,It's pretty apparent from precinct-level data in VA and county-level data in FL that Democrats have a turnout problem today - one that's unlikely to be solved in the next six hours.,463.0
Redistrict,2022-11-08 20:14:24+00:00,"Noon turnout reports in VA Beach - a majority of Rep. Elaine Luria's (D) Toss Up #VA02 - show most heavily GOP precincts up to 55-60% of '21 votes cast, vs. 40-45% in most non-white precincts.

Total ballots cast skewing much more R than '20 in many FL counties, esp. Miami-Dade.",464.0
Redistrict,2022-11-08 19:43:29+00:00,"IDK about bloodbath, but yeah, this isn't good for Dems in Miami.",465.0
PatrickRuffini,2022-11-08 19:24:51+00:00,"🚨 Miami-Dade is going to be an absolute bloodbath for Democrats.

In 2018, Dems outvoted Republicans by at least 70k votes. 

In the 22 point shift in 2020, Dems still outvoted Republicans by 90k. 

Republicans have a 10k vote lead in ballots cast as of right now. https://t.co/7S45VTqxt8",466.0
Redistrict,2022-11-08 15:31:43+00:00,"Reminder: a big reason Rs are favored to retake Congress today is that Ds didn't start out from a great place to begin with.

In 2020, Joe Biden faced a president w/ 53% disapproval and prevailed by just:

0.2% in GA
0.3% AZ
0.6% WI
1.2% PA
2.1% in the median House seat
2.4% NV",467.0
Redistrict,2022-11-08 15:31:44+00:00,"And if you're still puzzled why Dems have suffered significant erosion since then, @crampell's latest walk down memory lane is a good recap: https://t.co/kEJTXE2xmN",468.0
Redistrict,2022-11-08 07:15:05+00:00,"RT @Prepare for Philly’s vote count to take longer than we initially expected.

Elections officials are poised to reinstate the labor-intensive and time-consuming poll book reconciliation process that they voted last week to remove.

With @jeremyrroebuck:
https://t.co/0hZea8dUiL",469.0
Elaijuh,2022-11-08 07:07:27+00:00,"Prepare for Philly’s vote count to take longer than we initially expected.

Elections officials are poised to reinstate the labor-intensive and time-consuming poll book reconciliation process that they voted last week to remove.

With @jeremyrroebuck:
https://t.co/0hZea8dUiL",470.0
Redistrict,2022-11-08 06:55:48+00:00,"If you were tasked w/ correctly predicting the NV Senate race and could only know one of the following two stats, which would you rather know? (I know what I'd pick.)",471.0
Redistrict,2022-11-08 04:21:03+00:00,"Of note, @FiveThirtyEight's House forecast - which was closer to the result than most in 2020 - is a little more bearish on GOP gains (+17) than most prognosticators' midpoints. Why is that significant? (1/3) https://t.co/iroquHcBIm",472.0
Redistrict,2022-11-08 04:21:03+00:00,"There's a tendency for forecasters to get caught up in the doom/momentum narrative that takes hold late in a cycle when one party is ahead, and turn predicting gains into an arms race. 

But @FiveThirtyEight's empirical model shows virtually no movement either way since 10/21.",473.0
Redistrict,2022-11-08 04:21:03+00:00,"The point is, it's possible Rs will pick up 30+ House seats. But if they do, it's likelier to be b/c polls/models undershot House Rs all along, not because there was some kind of last-minute surge (and, I'm still taking the under).",474.0
Redistrict,2022-11-08 01:31:42+00:00,"FINAL @CookPolitical House ratings: 212 seats at least Lean R, 187 seats at least Lean D, 36 Toss Ups. Full analysis: https://t.co/nGRUaCMoef https://t.co/2Oyo2hdV1W",475.0
Redistrict,2022-11-08 00:37:30+00:00,"Final @CookPolitical House outlook: an unusually uneven landscape, with a 15-30 seat GOP gain the likeliest outcome but a wide range of possibilities. https://t.co/nGRUaCMoef",476.0
Redistrict,2022-11-07 16:09:23+00:00,"Personally, I’m not either. There are just a lot of really close races out there, and the lack of high quality public data relative to 2018 makes individual race predictions especially perilous.",477.0
baseballot,2022-11-07 15:24:29+00:00,"These guys do great work, but I’m not a fan of the “pushing your tossups” thing.* The goal isn’t to make picks; it’s to give people a sense of where each race stands and to have uncertainty accordingly.",478.0
Redistrict,2022-11-07 14:40:38+00:00,"New @CookPolitical: beware ""spoiler"" candidates in these five House races on Election Night. https://t.co/Ie4RNwEshX",479.0
Redistrict,2022-11-07 03:14:48+00:00,"I'll be honest: some of these are pure guesses. And, it's more likely than not the Toss Up column will break hard in one direction. The dozen races I'm most ""on the fence"" about: #CA49, #CT05, #ME02, #MI07, #MN02, #NV01, #NH01, #NY19, #OH13, #PA08, #RI02 and #TX34.",480.0
Redistrict,2022-11-07 01:09:39+00:00,"It’s possible Tuesday could be a big GOP wave in both chambers, but tbh there’s not much high-quality data to support narrative the “bottom has fallen out” for House Ds.

If anything, state fundamentals have moved the Senate outlook a notch closer to where the House already was.",481.0
Redistrict,2022-11-07 01:22:03+00:00,"Plenty of Dem incumbents in red/purple states (including #AKAL, #IN01, #KS03, #ME02, #MI07, #MI08, #NV04, #OH09, #PA07, #PA08, #TX28, #VA02) continue to hang tough in a difficult environment, defying Biden’s approval. 

Whether that holds will determine magnitude of GOP gains.",482.0
Redistrict,2022-11-06 20:29:27+00:00,"Encouraging news for Dems in final @NBCNews poll: voting enthusiasm gap closes from 78%-69% pro-R to 73%-73%.

But, biggest problem for Dems is still independents: just 28% approve of Biden and by 66%-28% say cost of living more important than abortion. https://t.co/tZpcBWgCf5",483.0
Redistrict,2022-11-04 18:33:11+00:00,"Here's my rough thinking early on Election Night:

- If #VA02 Luria (D) holds on, better night for Dems than expected
- If #IN01 Mrvan (D) or #VA07 Spanberger (D) lose, Rs likely winning 20+ seats
- If #NH02 Kuster (D) or #VA10 Wexton (D) lose, Rs likely winning 30+ seats",484.0
barrimus_prime,2022-11-04 18:24:09+00:00,@Redistrict @CookPolitical What races should we be looking at early election night? Are there some toss-ups that might give us a sneak peak into how things go?,485.0
Redistrict,2022-11-04 18:45:02+00:00,"A word of caution, though: at least in VA, the very first results reported are likely to favor Rs. Extra caution is warranted in #VA07, where Prince William Co.'s mail ballots are critical to Rep. Abigail Spanberger's (D) path to victory and could be the last to be counted.",486.0
Redistrict,2022-11-11 17:25:00+00:00,"Disclaimer: as has always been the case, the personal judgments offered by this account regarding election results are not official race ""calls"" and do not necessarily reflect the views of the Cook Political Report, NBC News or any other entity.",487.0
Redistrict,2022-11-04 18:33:11+00:00,"Here's my rough thinking early on Election Night:

- If #VA02 Luria (D) holds on, better night for Dems than expected
- If #IN01 Mrvan (D) or #VA07 Spanberger (D) lose, Rs likely winning 20+ seats
- If #NH02 Kuster (D) or #VA10 Wexton (D) lose, Rs likely winning 30+ seats",488.0
barrimus_prime,2022-11-04 18:24:09+00:00,@Redistrict @CookPolitical What races should we be looking at early election night? Are there some toss-ups that might give us a sneak peak into how things go?,489.0
Redistrict,2022-11-04 18:03:15+00:00,"I've fully expected criticism for having 35 House races in Toss Up at @CookPolitical, and empathize to some extent. But guess what? There are just a lot of really close races this year - with higher uncertainty than past cycles as the reliability of polling has declined.",490.0
Redistrict,2022-11-04 18:03:16+00:00,"I believe it's healthy to convey that uncertainty. That said, I also don't believe all our Toss Ups are alike. At some point before Tuesday I'll publish my best (semi-educated) guesses on where each of these Toss Ups will land, just as I did in 2018. So, stay tuned.",491.0
Redistrict,2022-11-04 17:06:11+00:00,"The inverse relationship between polling response rates/reliability and partisan wishcasting based on ""vibes"" isn't a perfect correlation, but feels especially strong this year. At least, that's the vibe I'm getting.",492.0
Redistrict,2022-11-04 16:43:25+00:00,"RT @I can't believe I had to write this piece yet again.  But seriously -- don't read the early voting tea leaves (unless you are Jon Ralston)!

https://t.co/i3SOomr9IU",493.0
SeanTrende,2022-11-04 13:46:41+00:00,"I can't believe I had to write this piece yet again.  But seriously -- don't read the early voting tea leaves (unless you are Jon Ralston)!

https://t.co/i3SOomr9IU",494.0
Redistrict,2022-11-04 15:04:38+00:00,"RT @Our final Senate overview is out. We are changing our range of most likely outcomes to D+0 to R+3.

Read @JessicaTaylor's analysis:   https://t.co/cC9J2GNEDp",495.0
CookPolitical,2022-11-04 14:42:46+00:00,"Our final Senate overview is out. We are changing our range of most likely outcomes to D+0 to R+3.

Read @JessicaTaylor's analysis:   https://t.co/cC9J2GNEDp",496.0
Redistrict,2022-11-04 14:22:14+00:00,"Phew, only four more days of crosstab truthing and early vote astrology until we have actual votes to analyze.",497.0
Redistrict,2022-11-04 14:20:52+00:00,"Some more welcome news for Upstate NY Dems in today’s @SienaResearch polls:

#NY19: Josh Riley (D) 48%, Marc Molinaro (R) 43%
#NY22: Fran Conole (D) 46%, Brandon Williams (R) 42%

Both are Toss Ups at @CookPolitical.",498.0
Redistrict,2022-11-03 03:05:14+00:00,Literally could be the margin of victory in #NY17.,499.0
jacobkornbluh,2022-11-02 21:54:51+00:00,"The Skver Hasidic sect in New Square — with some 3,000 votes — endorses @KathyHochul for governor and Rep. @spmaloney for #NY17 https://t.co/imeCs69MP8",500.0
Redistrict,2022-11-02 06:21:00+00:00,"RT @Conspiracy theories, records requests and lies: What running an election looks like right now https://t.co/JoaZGs9eea via @bcrodriguez @19thnews",501.0
grace_panetta,2022-11-01 20:02:31+00:00,"Conspiracy theories, records requests and lies: What running an election looks like right now https://t.co/JoaZGs9eea via @bcrodriguez @19thnews",502.0
Redistrict,2022-11-02 04:21:02+00:00,"Expect small election administration errors like this one to pop up more frequently this year, given the high number of counties/precincts split unnecessarily in redistricting and the complexity of reassigning voters to new districts.",503.0
kkruesi,2022-11-02 01:17:53+00:00,"Big --&gt; NASHVILLE, Tenn. (AP) — Election officials said Tuesday that some Tennessee voters have cast ballots in the wrong congressional district in Nashville — a city that Republican lawmakers carved three ways during redistricting in hopes of flipping a Democratic seat.",504.0
Redistrict,2022-11-02 04:29:03+00:00,"In this case, there’s no chance it’ll affect the outcome of a race since #TN06 and #TN07 are safe GOP seats. But given new maps &amp; lots of very close races, there’s a decent chance an election administration error somewhere could lead to post-11/8 litigation.",505.0
Redistrict,2022-11-02 02:12:26+00:00,"FWIW, there was only one way NV Dems could have ensured they'd win 3/4 House seats in the state, and that was to blatantly gerrymander a district from Las Vegas to Reno (hypothetical below). 

They opted against that, and all three Dem seats are at risk, esp. #NV01 and #NV03. https://t.co/FOy8rNnF71",506.0
Redistrict,2022-11-01 21:21:49+00:00,"In this kind of enviro, some Likely/Lean races inevitably become more competitive - it’s just tough to tell which ones until very late (or at all). If the 35 Toss Ups in our new ratings were to split evenly, Rs would pick up ~17 seats, right in the middle of our 12-25 range.",507.0
TomBevanRCP,2022-11-01 18:19:48+00:00,"Cook/Wasserman: We've moved 10 more blue districts, all in the GOP's direction.

Also Cook/Wasserman: We're sticking with our overall outlook of a GOP gain between 12 and 25 seats.

🤷‍♂️

https://t.co/FNqkhAa7V0",508.0
Redistrict,2022-11-01 20:00:04+00:00,“Let’s all focus on the early vote data because the polls are broken” is the analytical equivalent of jumping off a cliff in a wing suit because the stairs to the bottom of the canyon are old and rickety.,509.0
Redistrict,2022-11-01 20:08:14+00:00,"Those stairs aren’t always reliable. Sometimes a plank breaks and you fall through and land in the wrong place, as happened in 2020 when both parties’ polls misjudged the political environment. But it’s still preferable to jumping off the cliff.",510.0
Redistrict,2022-11-01 18:45:23+00:00,"NEW @CookPolitical House ratings: 212 seats at least Lean R, 188 seats at least Lean D, 35 Toss Ups. Our outlook remains a GOP gain of 12-25 seats. Full analysis: https://t.co/ldqos2Pi8J https://t.co/9HGhOabasA",511.0
Redistrict,2022-11-01 17:44:07+00:00,"NEW @CookPolitical House rating changes: 10 more blue state districts move in Republicans' direction, including #CA47 Rep. Katie Porter (D) from Lean D to Toss Up. Full analysis: https://t.co/ldqos2Pi8J https://t.co/rD40MW6vdw",512.0
Redistrict,2022-11-01 16:41:33+00:00,"A recurring theme this cycle: Dems drew maps in IL, NV, NM, OR, PA that spread out their voters to maximize their prospects of keeping the House - but by doing so they also increased the number of seats vulnerable to a strong GOP wave.",513.0
SeanTrende,2022-10-31 20:17:07+00:00,"On PA-12, it isn't just that the R challenger has the same name as the retiring D incumbent, though that is part of it.  The map that the Supreme Court of PA selected pushed the 12th district into heavily red precincts of Westmoreland Co. 1/ https://t.co/ijNZ4bgwWW",514.0
Redistrict,2022-10-31 14:31:31+00:00,"RT @Nate_Cohn: Our final* polls: the Senate is close, with some decent results for Democrats 
https://t.co/mEEUngwujY",515.0
Nate_Cohn,2022-10-31 13:35:36+00:00,"Our final* polls: the Senate is close, with some decent results for Democrats 
https://t.co/mEEUngwujY",516.0
Redistrict,2022-11-11 17:25:00+00:00,"Disclaimer: as has always been the case, the personal judgments offered by this account regarding election results are not official race ""calls"" and do not necessarily reflect the views of the Cook Political Report, NBC News or any other entity.",517.0
Redistrict,2022-10-31 05:27:23+00:00,"The highlight of my experience on here: a follow from my celebrity crush. Other than that, kinda looking forward to returning to obscurity when this site collapses.",518.0
Redistrict,2022-10-31 04:44:46+00:00,"RT @NEW: Perhaps no place in the nation offers a more symbolic and consequential test of whether Democrats can claw back some of the white working-class vote than northeastern PA in 2022.

So that's where I went, and this is what I wrote.
https://t.co/xTFT9y91yW",519.0
ShaneGoldmacher,2022-10-30 23:37:12+00:00,"NEW: Perhaps no place in the nation offers a more symbolic and consequential test of whether Democrats can claw back some of the white working-class vote than northeastern PA in 2022.

So that's where I went, and this is what I wrote.
https://t.co/xTFT9y91yW",520.0
Redistrict,2022-10-29 20:25:15+00:00,Biennial mental health tip.* https://t.co/dMnX7sIdtK,521.0
Redistrict,2022-10-29 20:26:27+00:00,"*Ok, I might check on Nevada's stats the weekend before 11/8, but that's like, it.",522.0
Redistrict,2022-10-28 21:59:16+00:00,"That's true - although I'd argue Dem incumbents are faring unevenly. Some (Davids, Peltola, Kildee, Golden) polling much stronger vs. '20 prez than others (Hayes, Titus, Maloney, Malinowski). I would've loved NYT/Siena to poll a vulnerable open seat like #OR05 or #PA17.",523.0
Nate_Cohn,2022-10-28 21:54:09+00:00,"An additional layer--which @Redistrict may disagree w, DK--is that it does seem like, in general, the incumbents are holding up better than I would have guessed after '20  A lot of the D weakness is open seat 
https://t.co/OIYM7yTmyK",524.0
Redistrict,2022-10-28 22:07:05+00:00,"P.S. Worth pointing out that @SienaResearch *did* poll the open #NY22 (Biden +7) a month ago and found the Republican up 5 pts. If every House outcome were 12 pts more pro-GOP than 2020 prez, Rs would end up +46 seats. 

So, House landscape unusually uneven.",525.0
Redistrict,2022-10-28 21:45:17+00:00,"FWIW, I see the four NYT/Siena polls as consistent with our House ratings and forecast of a 12-25 seat GOP gain. 

Yes, Ds have surprising strength in some red states/CDs (#KS03, #PA08). But they also have big problems in open seats &amp; blue state CDs (tied in Biden +8 #NV01, etc.)",526.0
Redistrict,2022-10-28 20:33:52+00:00,"RT @People, I have some thoughts on early voting + using it to predict election results 

They are not positive 

https://t.co/qt37xQ07ar https://t.co/dBqEdWi1Bo",527.0
databyler,2022-10-25 20:48:23+00:00,"People, I have some thoughts on early voting + using it to predict election results 

They are not positive 

https://t.co/qt37xQ07ar https://t.co/dBqEdWi1Bo",528.0
Redistrict,2022-10-28 19:43:21+00:00,"RT @Bc the House playing field is bifurcated in an unusual way this cycle. The ‘generic’ House CD isn’t telling full story. Like, how are Ds struggling in D-leaning CDs in NY/OR",529.0
amyewalter,2022-10-28 16:33:42+00:00,"Bc the House playing field is bifurcated in an unusual way this cycle. The ‘generic’ House CD isn’t telling full story. Like, how are Ds struggling in D-leaning CDs in NY/OR",530.0
joshtpm,2022-10-28 03:49:32+00:00,I’m not optimistic about Dems House chances but how do you get this headline when you poll 4 swing districts and one is tied and three have Dems ahead? https://t.co/Zb26pcnPzL,531.0
Redistrict,2022-10-28 14:58:54+00:00,The Dem best-positioned to win a Trump district: #OH09 Rep. Marcy Kaptur (D).,532.0
jake_zuckerman,2022-10-28 14:49:02+00:00,"Marcy Kaptur ad: ""....But the far left is wrong too. We should always stand for the national anthem. And defunding the police is ridiculous."" https://t.co/CGP00SLIQD",533.0
Redistrict,2022-10-28 04:12:37+00:00,"There’s a reason @CookPolitical moved #KS03 Rep. Sharice Davids (D) from Toss Up to Lean D this week: several red state Dems are holding up impressively well, and she’s at the top of the list.",534.0
Nate_Cohn,2022-10-28 02:25:16+00:00,"We have a few NYT/Siena polls in a handful of interesting House races for you this evening:
KS-3: D+14, 55-41
NV-1: Even, 47-47
NM-2: D+1, 48-47
PA-8: D+6, 50-44
https://t.co/R2RpVKttgg",535.0
Redistrict,2022-10-28 04:13:34+00:00,Blue state Dems on the other hand…,536.0
Redistrict,2022-10-28 04:33:36+00:00,"Also of note, #PA08 Rep. Matt Cartwright’s (D) numbers are better than you’d expect given what we’re seeing nationally. But given it’s a Trump +3 seat, his lead’s not enough to move him out of Toss Up.",537.0
Redistrict,2022-10-28 00:58:09+00:00,"Trying to set a new personal record for on-topic callers, so be sure to chime in w/ your favorite state and district.",538.0
cspanwj,2022-10-27 23:44:00+00:00,"FRI| Cook Political Report House Editor David Wasserman (@Redistrict) will discuss Campaign 2022 and key House races to watch.

Watch live at 9:00am ET! https://t.co/Sy8qTTRw24",539.0
Redistrict,2022-10-27 19:02:26+00:00,RT @kirk_bado: Real question: who does a Cheney endorsement persuade that wasn’t going to vote for Slotkin already?,540.0
kirk_bado,2022-10-27 17:30:56+00:00,Real question: who does a Cheney endorsement persuade that wasn’t going to vote for Slotkin already?,541.0
TomBeaumont,2022-10-27 17:05:23+00:00,"Republican Rep. Liz Cheney is expected to endorse and campaign for Rep. Elissa Slotkin of Michigan, the first time that the critic of former President Donald Trump who lost her GOP primary in Wyoming has crossed party lines to formally support a Democrat. https://t.co/q406DOPHiq",542.0
Redistrict,2022-10-26 16:41:56+00:00,"NEW @CookPolitical House ratings: 211 seats at least Lean R, 191 seats at least Lean D, 33 Toss Ups. Our new outlook is a GOP gain of 12-25 seats. Full analysis: https://t.co/fSRaeBY2JM https://t.co/RsyN70KZl0",543.0
Redistrict,2022-10-26 07:23:31+00:00,"RT @One downside for Katie Porter of having banked $15 million as of early October is the DCCC and Dem super PACs have sat on the sidelines, making her unload her own money 

She's running broadcast TV now in pricey LA in a district Biden carried by 11. https://t.co/skL1A8DBJW",544.0
ShaneGoldmacher,2022-10-26 01:24:27+00:00,"One downside for Katie Porter of having banked $15 million as of early October is the DCCC and Dem super PACs have sat on the sidelines, making her unload her own money 

She's running broadcast TV now in pricey LA in a district Biden carried by 11. https://t.co/skL1A8DBJW",545.0
Redistrict,2022-10-25 21:51:06+00:00,"NEW @CookPolitical: 10 House rating changes this week, including four Dem incumbents from Lean D to Toss Up and two - #AKAL Mary Peltola (D) and #KS03 Sharice Davids (D) - from Toss Up to Lean D. Full analysis: https://t.co/QxOmHybgEl https://t.co/tFYim1sNT6",546.0
Redistrict,2022-10-25 21:59:45+00:00,"Fascinatingly, all six of the races that have moved in Republicans' direction this week are in states Biden carried in 2020, whereas all four races moving towards Democrats are located in states Donald Trump carried in both 2016 and 2020.",547.0
