username,orario,text
RepSpanberger,2023-10-20 14:25:13+00:00,"Congress has a long to-do list.

But the U.S. House needs a Speaker to avoid a shutdown, support our allies in Israel and Ukraine, secure our borders, and so much more.

Democrats remain focused on governing — and I urge the GOP majority to work with us to get things done. https://t.co/73sojPHzvf"
RepSpanberger,2023-10-20 01:17:11+00:00,"RT @""The House has so much work to do,"" says Virginia Representative Abigail Spanberger. 

The speaker’s office has been vacant for more than two weeks, leaving the House paralyzed https://t.co/5WA7y3ir3P https://t.co/6SdjJENaOD"
BloombergTV,2023-10-20 00:50:19+00:00,"""The House has so much work to do,"" says Virginia Representative Abigail Spanberger. 

The speaker’s office has been vacant for more than two weeks, leaving the House paralyzed https://t.co/5WA7y3ir3P https://t.co/6SdjJENaOD"
RepSpanberger,2023-10-20 00:00:01+00:00,"More than 4,200 Virginians joined last night’s telephone town hall!

We discussed a range of issues — including broadband internet access, the crisis at our southern border, and the ongoing wars in Ukraine and Israel.

Watch a full recording below!👇

https://t.co/c5lEft50r2 https://t.co/kjaPRUwpah"
RepSpanberger,2023-10-19 23:00:01+00:00,"While the House Republican majority struggles, our shared priorities — like passing the Farm Bill, stopping a shutdown, and supporting Israel — have been forced on the backburner.

We need to get back to work for the American people in a bipartisan way.

More w/ @NewsRadioWINA: https://t.co/z0RVkG2EHd"
RepSpanberger,2023-10-19 21:55:40+00:00,"Thank you to @SecBlinken for taking this necessary step.

Thwarting these Iranian programs is vital to stopping further destabilization in the region and assuring the security of Israel."
SecBlinken,2023-10-19 01:45:00+00:00,"Today, the United States is imposing new sanctions to counter Iran’s ballistic missile and UAV programs."
RepSpanberger,2023-10-19 20:40:05+00:00,"The U.S. State Department has advised all Americans traveling or living abroad to exercise increased caution.

✅ Stay alert in locations frequented by tourists

✅ Enroll in the Smart Traveler Enrollment Program (STEP) at https://t.co/0Ji9sF1yze to receive information and alerts"
RepSpanberger,2023-10-19 19:35:08+00:00,RT @Kerry Crowley &amp; Jeanie Barbrow joined Jason Tickle of @CarolineHabitat &amp; Congresswoman Spanberger in Fredericksburg on Tues. for the region's first housing summit to explore solutions for addressing this critical issue in our communities. Learn more:  https://t.co/X04MsmCi5W https://t.co/oi80GVTGFp
RDVirginia_,2023-10-19 17:30:00+00:00,Kerry Crowley &amp; Jeanie Barbrow joined Jason Tickle of @CarolineHabitat &amp; Congresswoman Spanberger in Fredericksburg on Tues. for the region's first housing summit to explore solutions for addressing this critical issue in our communities. Learn more:  https://t.co/X04MsmCi5W https://t.co/oi80GVTGFp
RepSpanberger,2023-10-19 18:25:24+00:00,"October is #HeadStartAwarenessMonth!

Virginia’s Head Start programs support the education of thousands of children, invest in families, and help parents and caretakers navigate learning in the early years.

I’ll always work to make sure families are set up for success. https://t.co/4dIf8jnI89"
RepSpanberger,2023-10-19 14:25:32+00:00,"We have pressing matters to address — like keeping the government open and passing a bipartisan Farm Bill.

I am committed to working with my colleagues on both sides of the aisle to get things done. The House GOP must be willing to do the same.

More w/ @JulieMason: https://t.co/tYzJJZVYMR"
RepSpanberger,2023-10-19 01:10:16+00:00,"STARTING SOON! 👇

I look forward to hearing from you!"
RepSpanberger,2023-10-18 16:25:20+00:00,"TONIGHT at 7:30pm — our next telephone town hall!

I hope you will bring your questions, feedback, and ideas. https://t.co/FzsUEtvUkm"
RepSpanberger,2023-10-18 23:55:23+00:00,Thank you to the local members and leadership of the Virginia Hospital &amp; Healthcare Association who stopped by my office this afternoon — and for all you do to keep Virginians healthy! https://t.co/JPkHlCm0oh
RepSpanberger,2023-10-18 22:45:28+00:00,"Congress has a long to-do list:

◻️ Avoid a government shutdown
◻️ Pass a bipartisan Farm Bill
◻️ Strengthen our border security and combat fentanyl
◻️ Support our Israeli and Ukrainian allies

The House GOP majority needs to work with Democrats to get serious about governing."
RepSpanberger,2023-10-18 14:04:30+00:00,"41 million Americans rely on Adderall.

For over a year, I've heard from many Virginians who have struggled to fill their prescriptions due to the shortage.

That's why I'm urging the FDA &amp; DEA to address this health crisis and make sure Americans get the medication they need. https://t.co/KQ34zS4ccP"
TIME,2023-10-18 06:23:00+00:00,It's been one year since the FDA announced that pharmaceutical companies were unable to produce enough Adderall https://t.co/4NlzRjNtEo
RepSpanberger,2023-10-18 05:59:42+00:00,"The United States has a moral responsibility to determine how this explosion occurred and who is responsible for the deaths of innocent civilians — children, families, hospital workers, and volunteers. 

Their families — and the world — deserve accountability."
POTUS,2023-10-18 01:40:05+00:00,"I am outraged and deeply saddened by the explosion at the Al Ahli Arab hospital in Gaza, and the terrible loss of life that resulted. Immediately upon hearing this news, I spoke with King Abdullah II of Jordan, and Prime Minister Netanyahu of Israel and have directed my national security team to continue gathering information about what exactly happened.

The United States stands unequivocally for the protection of civilian life during conflict and we mourn the patients, medical staff and other innocents killed or wounded in this tragedy."
RepSpanberger,2023-10-18 00:01:45+00:00,"As a former CIA case officer, I am well aware that America’s current classification system needs reform.

I'm proud to lead bipartisan, bicameral legislation — with @RepBradWenstrup — to increase accountability, protect classified information, and prevent overclassification."
RepSpanberger,2023-10-05 23:15:12+00:00,"Are you having trouble getting your passport renewed?

While we cannot guarantee your passport by a certain date, my team may be able to help you — like we were able to assist Afua.

Contact my office at https://t.co/IzQ4Fv0K5z or (703) 987-2180. https://t.co/EbeWOp0xaE"
RepSpanberger,2023-10-05 21:16:20+00:00,"1 in 8 women will be diagnosed with breast cancer in their lifetime.

This Breast Cancer Awareness Month, join me in honoring all breast cancer survivors, fighters, caregivers, &amp; those who have lost their lives. 💕"
RepSpanberger,2023-10-05 20:12:18+00:00,"RT @Ukraine’s fate and America’s credibility with our allies are on the line if far-right Republicans block funding to Ukraine.

Watch New Dem @RepSpanberger explain why maintaining strong bipartisan support and funding for Ukraine is critical ⬇️ 
https://t.co/a6oZpANqna"
NewDemCoalition,2023-10-05 19:18:20+00:00,"Ukraine’s fate and America’s credibility with our allies are on the line if far-right Republicans block funding to Ukraine.

Watch New Dem @RepSpanberger explain why maintaining strong bipartisan support and funding for Ukraine is critical ⬇️ 
https://t.co/a6oZpANqna"
RepSpanberger,2023-10-05 19:41:02+00:00,"Nearly 30 million people in the United States are living with a rare disease.

I am proud to join the Rare Disease Caucus — a bicameral, bipartisan caucus dedicated to raising awareness of uncommon diseases &amp; promoting policy solutions benefitting the rare disease community."
RepSpanberger,2023-10-05 17:26:41+00:00,"If the United States abandons our Ukrainian allies in their fight, the world will be watching. 

Vladimir Putin will be watching.

It is in our national interest to continue supporting Ukraine in their fight for sovereignty.

More w/ @WTOP: https://t.co/FQ9f3pZe98"
RepSpanberger,2023-10-05 16:00:13+00:00,"I’m proud to represent all of our neighbors across Virginia’s Seventh District in Congress.

Do you want to stay up-to-date with my work on Capitol Hill on behalf of Virginians?

Subscribe to my weekly newsletter!
📧 https://t.co/ekZBWfeTHl"
RepSpanberger,2023-09-29 14:45:25+00:00,"This morning, I directed the U.S. House to withhold my pay in the event of a government shutdown.

Because NOT ONE lawmaker should be rewarded if Congress (really, the House GOP majority) causes federal workers, contractors, servicemembers, and small business owners to suffer. https://t.co/mAP8k7qsvT"
RepSpanberger,2023-09-29 01:30:00+00:00,"Our vibrant African diaspora population makes our Commonwealth and our country stronger.

I’m proud to lead this effort — alongside @RepMcClellan and @RepMariaSalazar — to shine a spotlight on the extraordinary contributions of the African diaspora.

https://t.co/EBZQuFy4BJ"
RepSpanberger,2023-09-28 20:17:21+00:00,"I enjoyed meeting with the Virginia School Board Association and discussing their work to promote excellence in public education.

Thank you for all you do for Virginia schools! https://t.co/8i6beF8OqG"
RepSpanberger,2023-09-28 18:40:14+00:00,"I often hear my Republican colleagues downplay the threat of a government shutdown on American families — “they’ll get paid back.”

But far too many Americans — including federal employees — live paycheck to paycheck.

Read what Liz, a federal employee, shared with me: https://t.co/Jor0OUoEys"
RepSpanberger,2023-09-28 17:22:54+00:00,"We are just three days away from a government shutdown — and the House GOP majority has shown that they would rather play political games than work in a bipartisan way to do our duty and keep the government open.

That is completely unacceptable. https://t.co/JtYPOcp6Pu"
RepSpanberger,2023-09-28 15:51:19+00:00,"I asked Virginians how a government shutdown would impact them, their families, or their businesses.

So far, I've received nearly 1,000 stories from federal workers, contractors, business owners, and families who would pay the price.

Take my survey⬇️
https://t.co/8VCtYjJoEe"
RepSpanberger,2023-01-12 14:34:07+00:00,"🚨 TODAY, I’m reintroducing my bipartisan legislation to ban Members of Congress, their spouses, and their dependent children from trading individual stocks while serving the American people."
RepSpanberger,2023-09-27 18:00:00+00:00,"I've heard directly from Virginians — a government shutdown would be catastrophic for Virginia workers, families, and businesses.

House Republicans must stop playing games and keep the government open to ensure working families get the paychecks they've earned.

w/ @ryanobles: https://t.co/VNN46x2IQr"
RepSpanberger,2023-09-27 16:55:20+00:00,"🚨 NEW: After hearing personal stories from nearly 1,000 Virginians who would feel the consequences of a reckless shutdown, I’m calling on Speaker McCarthy to immediately bring bipartisan legislation to fund the government to the floor of the U.S. House for a vote. https://t.co/egUBN5cEe7"
RepSpanberger,2023-09-27 16:55:23+00:00,"Virginia’s Seventh District is home to the fourth most federal civilian employees in the country.

These Virginians, contractors, servicemembers, and other working Americans are sick of being used as political pawns by the House GOP majority."
RepSpanberger,2023-09-27 16:55:25+00:00,The Virginians I represent and Americans across our country are asking us to work together to do our jobs and keep the government open.
RepSpanberger,2023-09-27 15:15:20+00:00,"It’s not only federal employees, contractors, and servicemembers who suffer in a shutdown — it’s small business and restaurant owners who lose customers.

These Americans never get paid back the revenue lost if the House GOP lets the government shut down.

More w/ @nbcwashington: https://t.co/jotSkYRfZf"
RepSpanberger,2023-09-27 14:27:15+00:00,"Virginia is home to the second most active duty servicemembers of any state in the United States. 

If the House GOP forces a government shutdown, these brave Americans would be forced to work without pay, potentially making it harder to meet basic needs and pay the bills."
RepSpanberger,2023-09-27 14:27:15+00:00,"Let me be clear — the heroes who serve our country should never worry about when they will get their next paycheck. 

It is utterly shameful that some of my colleagues are using the livelihoods of American servicemembers as political bargaining chips."
RepSpanberger,2023-09-27 14:27:15+00:00,"We need a commonsense, bipartisan solution to keep the government open and fulfill our duty to the heroes who keep our country safe."
RepSpanberger,2023-09-27 00:15:17+00:00,"UPDATE: House Republicans are barreling toward a shutdown with no regard for the working Americans, servicemembers, families, and small businesses who will suffer.

The consequences of a government shutdown are not hypothetical — Virginians know the damage.

🚫 NO SHUTDOWN! https://t.co/AzJWOJD899"
RepSpanberger,2023-09-26 23:20:15+00:00,"RT @WATCH: @RepSpanberger (D-Va.) says McCarthy is unwilling to bring forth a bill to prevent a shutdown because “he’s obsessed” with keeping his speakership.

“Any conversations he wants to have with Democrats ... need to be predicated with a real desire to actually govern.” https://t.co/pYRYm72ilU"
MeetThePress,2023-09-26 22:49:20+00:00,"WATCH: @RepSpanberger (D-Va.) says McCarthy is unwilling to bring forth a bill to prevent a shutdown because “he’s obsessed” with keeping his speakership.

“Any conversations he wants to have with Democrats ... need to be predicated with a real desire to actually govern.” https://t.co/pYRYm72ilU"
RepSpanberger,2023-09-26 22:00:36+00:00,"The House GOP majority is playing politics with Virginians’ paychecks.

If Speaker McCarthy allows the government to shut down, thousands of Virginia’s federal employees, contractors, and families will pay the price.

Catherine, a government contractor, is right. NO excuse. https://t.co/BCHi9w0StX"
RepSpanberger,2023-09-26 20:15:32+00:00,"🚨 DEADLINE: Veterans who deployed to a combat zone, never enrolled in VA healthcare, and left active duty from 9/11/2001 - 10/1/2013 now have until this Saturday, September 30 at 11:59pm to enroll thanks to the bipartisan Honoring Our PACT Act!

Visit https://t.co/V6bOO7oqwW."
RepSpanberger,2023-09-26 16:43:24+00:00,"Looking to stock up on at-home COVID tests?

With COVID-19 cases on the rise, every Virginia household is eligible for four FREE tests to be delivered to your home, courtesy of @HHSGov.

Visit https://t.co/GwjFOCf7rd to get yours."
RepSpanberger,2023-09-26 14:20:40+00:00,"I launched a survey asking Virginians, “Would you, your family, or your business be impacted by a government shutdown?”

🚨 I've already heard personal stories from nearly 1,000 Virginians who would be affected.

Claudia, a federal employee, knows a shutdown would be devastating: https://t.co/dTH4Tiq6r7"
RepSpanberger,2023-09-25 23:35:25+00:00,"The House GOP majority must not allow the government to shut down.

Our military servicemembers — more than 150,000 servicemembers who call Virginia home — would not get paid.

Congress must prevent a shutdown, sustain U.S. military readiness, and support military families."
RepSpanberger,2023-09-25 23:06:41+00:00,"If you're planning international travel:

🔍: Check the expiration date on your U.S. passport.
📎: If you need a passport, apply early!
🖥️: Monitor your passport application at https://t.co/8RRiISImbC.
☎️: If all else fails, contact my office. We will do our best to assist you! https://t.co/bCyDPS3wGl"
RepSpanberger,2023-09-25 21:06:04+00:00,"Every year, I'm honored to recommend outstanding students from Virginia’s Seventh District seeking to attend our service academies.

The application to be considered for a nomination from my office is due October 16!

For details, visit https://t.co/qylBTW7mwp. https://t.co/kcUGw354Lg"
RepSpanberger,2023-09-25 20:03:09+00:00,"In Congress, I represent thousands of members of the Patawomeck Indian Tribe.

Their long history, rich traditions, &amp; centuries of contributions to Virginia deserve respect.

I'm proud to lead the effort to provide them with the recognition they deserve.
https://t.co/FQ8DOOuGG1"
RepSpanberger,2023-09-25 19:53:03+00:00,"RT @elwasson: *US GOV SHUTDOWN WOULD BE `NEGATIVE' FOR RATING, MOODY’S SAYS  @TheTerminal"
elwasson,2023-09-25 19:31:41+00:00,"*US GOV SHUTDOWN WOULD BE `NEGATIVE' FOR RATING, MOODY’S SAYS  @TheTerminal"
RepSpanberger,2023-09-25 00:45:09+00:00,"To all who are observing across Virginia's Seventh District, I wish you a blessed Yom Kippur and a meaningful period of reflection.

G'mar chatima tova."
RepSpanberger,2023-01-12 14:34:07+00:00,"🚨 TODAY, I’m reintroducing my bipartisan legislation to ban Members of Congress, their spouses, and their dependent children from trading individual stocks while serving the American people."
RepSpanberger,2023-09-24 23:00:15+00:00,"I’m proud to represent Virginia’s Seventh District in the U.S. House.

Want to stay up-to-date with my continued work to prevent a government shutdown, support Virginia workers, and keep our communities strong?

Sign up for my weekly newsletter! ⬇️
https://t.co/ekZBWfelRN https://t.co/aLuCkO8aJD"
RepSpanberger,2023-09-24 19:05:27+00:00,"Today, on Gold Star Families Day, we honor all Americans who have lost loved ones in the defense of our great nation.

Gold Star families make incredible sacrifices for our country, and we must always work to deliver the support they deserve."
RepSpanberger,2023-09-23 17:25:29+00:00,"Would you, your family, or your business be impacted by a government shutdown?

The stories I receive from Virginia federal employees, servicemembers, contractors, and business owners will continue to fuel my efforts to stop a reckless shutdown.

Tell me 👉https://t.co/Z0Y4zbbAzQ https://t.co/X4iBSpmsYs"
RepSpanberger,2023-09-23 14:52:19+00:00,"Ukraine remains unwavering in its fight for sovereignty.

And lawmakers on both sides of the aisle remain committed to supporting our Ukrainian allies in their fight and giving them the chance at victory they deserve.

As I told @wolfblitzer — it must stay that way. https://t.co/9hZ63I87YI"
RepSpanberger,2023-09-23 01:02:53+00:00,"My team is at Culpeper Fiesta!

Stop by, celebrate Hispanic Heritage Month, and chat with our office if you are having an issue with a federal agency, program, or benefit. https://t.co/SEfz6xfJSX"
RepSpanberger,2023-09-22 22:19:52+00:00,"RT @*State of Emergency Declared for Virginia*
Devices charged? Stocked emergency kit? Know the forecast for your area? TROPICAL STORM OPHELIA is right on our doorstep, and the storm is expected to have impacts statewide. #MakeAPlan #BuildAKit #BeInformed #TropicalStormOphelia https://t.co/aJIWjIHfu2"
VDEM,2023-09-22 21:20:25+00:00,"*State of Emergency Declared for Virginia*
Devices charged? Stocked emergency kit? Know the forecast for your area? TROPICAL STORM OPHELIA is right on our doorstep, and the storm is expected to have impacts statewide. #MakeAPlan #BuildAKit #BeInformed #TropicalStormOphelia https://t.co/aJIWjIHfu2"
RepSpanberger,2023-09-22 21:55:01+00:00,"Earlier today, I met with local elected officials to discuss the top concerns and priorities of Virginians across the Seventh District — including the looming government shutdown and support for local community projects.

Thank you all for joining me this morning! https://t.co/PWxiY9siO7"
RepSpanberger,2023-09-22 18:30:15+00:00,"TODAY is the first day of early voting in Virginia!

Not sure where your early voting office is located or want to double check that it has not changed?

Visit https://t.co/IYA4cbWO1Y 🗳️"
vaELECT,2023-09-22 15:01:27+00:00,Why wait for Election Day? Early voting has begun. Visit https://t.co/ChkBeJD1mt to learn more. #VAElection2023 https://t.co/yPT0Qd0ufV
RepSpanberger,2023-09-22 17:28:56+00:00,"To avoid a senseless government shutdown, the House GOP and @SpeakerMcCarthy need to stop the games and start working with Democrats to get a solution across the finish line.

Virginia's economy cannot afford a shutdown.

From @NBC12: https://t.co/uuASomu2kp"
RepSpanberger,2023-09-22 16:05:22+00:00,"During #SuicidePrevention Month, I’m leading a bipartisan bill to combat high rates of suicide by Veterans.

The VA needs a full grasp of the problem at hand to contend with an epidemic of Veteran suicide.

Veterans — dial 📞 9-8-8 and press 1 to reach the Veterans Crisis Line."
RepSpanberger,2023-09-22 15:45:04+00:00,"RT @Mark your calendar:

Sep 22 1st day of early voting
Oct 16 Last day to register to vote a regular ballot
Oct 27 Last day to request absentee ballot
Nov 4 Last day to vote early, in person
Nov 7 Election Day - Polls open 6am-7pm

https://t.co/ChkBeJD1mt 

#VaisForVoters https://t.co/Xz8bOVTIV4"
vaELECT,2023-09-21 15:01:43+00:00,"Mark your calendar:

Sep 22 1st day of early voting
Oct 16 Last day to register to vote a regular ballot
Oct 27 Last day to request absentee ballot
Nov 4 Last day to vote early, in person
Nov 7 Election Day - Polls open 6am-7pm

https://t.co/ChkBeJD1mt 

#VaisForVoters https://t.co/Xz8bOVTIV4"
RepSpanberger,2023-09-22 13:45:00+00:00,"We are just 9 days away from a government shutdown — and yet Speaker McCarthy refuses to work in a bipartisan way to get us out of this crisis.

This week during our town hall, I heard from Virginians who know the dangers of government shutdowns all too well.

🚫 SHUTDOWN! https://t.co/pkVnuQ1GZd"
RepSpanberger,2023-09-22 01:00:01+00:00,"During last night's town hall, I heard from concerned constituents who know that a government shutdown would hurt thousands of Virginians.

I assured them that I will not stand idly by while a fringe wing of the House GOP uses American workers as political pawns. https://t.co/okuAnlg911"
RepSpanberger,2023-09-22 01:17:41+00:00,"You can watch the full recorded event below:

https://t.co/eCi6q4sBVd"
RepSpanberger,2023-09-21 23:55:55+00:00,"Members of Congress should not get paid if the government shuts down.

It’s unacceptable that we do.

In the past 24 hours, @RepDeluzio and @RepGregLandsman have signed on to my bipartisan bill to block pay for lawmakers in the event of a government shutdown."
RepSpanberger,2023-09-21 21:45:26+00:00,"🚨 BREAKING: The House GOP is calling it quits for the week with no clear plan to fund the government.

It’s shameful that Speaker McCarthy is sending Congress home without making any progress toward averting a disastrous, totally avoidable shutdown.

Here’s where things stand: https://t.co/xMJvI0Rkhp"
RepSpanberger,2023-09-21 19:04:40+00:00,"🚜NEW: Agriculture Right to Repair Act!

Farmers and producers deserve the tools necessary to repair their equipment and do their jobs — without having to work through cumbersome hurdles.

Producers in Virginia — like William — and across our country support our effort. https://t.co/XJaCbSdNgW"
RepSpanberger,2023-09-21 17:55:09+00:00,"Members of Congress should NOT be rewarded for shutting down the government.

I’m leading a bill to BLOCK lawmaker pay in a shutdown — because maybe my House GOP colleagues wouldn't play with Virginians' paychecks if their antics threatened their own.

https://t.co/oLJlWHhrSb https://t.co/jbuiO4bh6l"
RepSpanberger,2023-09-21 15:10:09+00:00,"RT @Celebrating Workforce Development Month, @Gar_Field_HS showcased their CTE programs for @RepSpanberger. She visited the MCJROTC cadets, the plumbing classroom, and the new Culinary Arts facility, learning about the opportunities that CTE provides PWCS students. https://t.co/6z6oqj9TG5"
PWCSNews,2023-09-21 01:00:00+00:00,"Celebrating Workforce Development Month, @Gar_Field_HS showcased their CTE programs for @RepSpanberger. She visited the MCJROTC cadets, the plumbing classroom, and the new Culinary Arts facility, learning about the opportunities that CTE provides PWCS students. https://t.co/6z6oqj9TG5"
RepSpanberger,2023-09-21 13:16:51+00:00,"The Commonwealth of Virginia officially recognized the Patawomeck Indian Tribe more than a decade ago.

But the federal government has yet to do so.

I'm honored to lead the effort to provide them with the respect they deserve.

NEW in the @washingtonpost —https://t.co/4j60cxuqPw"
RepSpanberger,2023-01-12 14:34:07+00:00,"🚨 TODAY, I’m reintroducing my bipartisan legislation to ban Members of Congress, their spouses, and their dependent children from trading individual stocks while serving the American people."
RepSpanberger,2023-09-21 01:21:39+00:00,STARTING SOON👇
RepSpanberger,2023-09-20 23:35:21+00:00,"TONIGHT — our next telephone town hall!

Dial in to ask questions, share feedback, voice your concerns, and hear updates on my work for Virginia in the U.S. House.

I hope to hear from you! https://t.co/kj00nPqxdu"
RepSpanberger,2023-09-21 00:25:55+00:00,"At 32 years old, Summer Barrow died of a fentanyl overdose.

Her addiction began after an Oxycodone prescription from a car accident.

Last year, @POTUS signed into law my bipartisan addiction recovery bill in her name.

Because everyone deserves to recover. #RecoveryMonth https://t.co/nyPZVGBTom"
RepSpanberger,2023-09-20 20:56:24+00:00,"Always a pleasure to welcome the next generation of leaders to the U.S. Capitol — and this morning I had the opportunity to speak with students from the Commonwealth Governor’s School.

Thank you for bringing your questions! I am continually impressed by Virginia students. https://t.co/XwOyMbcYGZ"
