username,orario,text
VaDOT,2023-08-17 17:05:24+00:00,"Are you ready for it? 
The new @VAExpressLanes 10-mile extension of the 95 Express Lanes to Fredericksburg opens to traffic tonight, 8/17, in the southbound direction before its full day on Friday, 8/18.
Learn more: https://t.co/NGtYWKB45Z
@GovernorVA @SenTimKaine @RepSpanberger https://t.co/c8OXu25bsH"
RepSpanberger,2023-08-17 14:28:00+00:00,"I'm proud to once again be recognized as the most bipartisan Member of Congress from Virginia. 

That's why I will continue to work across the aisle to get things done for Virginia.
https://t.co/JDQhXFENS9"
RepSpanberger,2023-08-16 22:07:21+00:00,"One year ago, the Inflation Reduction Act became law, delivering for Virginia seniors by offering free vaccines, capping insulin copays, and allowing Medicare to negotiate drug prices.

I visited Celebrate by Del Webb to discuss these efforts to lower costs for Virginians. https://t.co/54MlyEBPXT"
RepSpanberger,2023-08-16 20:31:16+00:00,"NEW: Extended I-95 Express Lanes!

The new 10-mile Fredericksburg Extension means shorter commute times, less congestion, and more enjoyable travel up and down our beautiful Commonwealth.

I always say — if the Express Lanes are headed in the direction you want to go, take them! https://t.co/KCPNNx0vZQ"
RepSpanberger,2023-08-16 19:03:28+00:00,"RT @3, 2, 1! The ribbon has been cut for the new I-95 southbound @VAExpressLanes Fredericksburg Extension! #FredEx @GovernorVA @SenTimKaine @RepSpanberger https://t.co/QYkDkXDYCg"
VaDOT,2023-08-16 18:50:02+00:00,"3, 2, 1! The ribbon has been cut for the new I-95 southbound @VAExpressLanes Fredericksburg Extension! #FredEx @GovernorVA @SenTimKaine @RepSpanberger https://t.co/QYkDkXDYCg"
RepSpanberger,2023-08-16 18:24:05+00:00,"RT @Ribbon cut @GovernorVA for the 10-mile extension @VAExpressLanes in #Stafford, opening southbound late tomorrow as part of multiple projects to improve your drive on I-95. @SenTimKaine @RepSpanberger @TaraDurantVA @staffordvagov @FxbgGov @SpotsyGov https://t.co/o77GOh9ITj"
VaDOTFRED,2023-08-16 18:16:31+00:00,"Ribbon cut @GovernorVA for the 10-mile extension @VAExpressLanes in #Stafford, opening southbound late tomorrow as part of multiple projects to improve your drive on I-95. @SenTimKaine @RepSpanberger @TaraDurantVA @staffordvagov @FxbgGov @SpotsyGov https://t.co/o77GOh9ITj"
RepSpanberger,2023-08-16 17:52:54+00:00,A beautiful day to celebrate the new 10-mile Fredericksburg Extension Express Lanes on I-95! https://t.co/lMMuWSqUlL
RepSpanberger,2023-08-16 14:22:28+00:00,"One year ago, the Inflation Reduction Act was signed into law to:

✅ Lower drug prices for seniors
✅ Prevent premium hikes for families
✅ Penalize pharma companies that raise drug prices faster than the rate of inflation

Today, this law is delivering for Virginians."
RepSpanberger,2023-08-16 00:11:44+00:00,"I’m backing the Freedom to Vote Act to:

✅ End partisan gerrymandering
✅ Expand online voter registration
✅ Expand voting by mail
✅ Protect early voting
✅ Enact same-day voter registration

Because it should be easier for every citizen to exercise their right to vote."
RepSpanberger,2023-08-16 00:11:45+00:00,"In recent years, Virginia has taken major steps to make it easier for every voter to make their voice heard.

I’m supporting the Freedom to Vote Act to protect Virginia’s progress and bring these long overdue reforms to every corner of America — no matter the zip code."
RepSpanberger,2023-08-16 00:11:46+00:00,"At a time when many state legislatures across the country want to go backwards, we need to protect our democracy from these partisan attacks, improve voter access, and promote confidence in our elections.

This bill answers that call."
RepSpanberger,2023-08-15 22:31:40+00:00,"RT @Our new #drone experimentation range will foster collaboration among government, industry &amp; academia to help advance #UAS technologies for “the future defense of our homeland, our communities, and our people,” said U.S. Rep. Abigail Spanberger. https://t.co/tadOgCpppQ"
MITREcorp,2023-08-15 22:30:58+00:00,"Our new #drone experimentation range will foster collaboration among government, industry &amp; academia to help advance #UAS technologies for “the future defense of our homeland, our communities, and our people,” said U.S. Rep. Abigail Spanberger. https://t.co/tadOgCpppQ"
RepSpanberger,2023-08-15 14:16:44+00:00,"Senator Tuberville has now left the Army, Navy, and Marines without confirmed leaders — for the first time in history.

He has upended the lives of more than 300 servicemembers and families in Virginia and across our country.

A truly shocking lack of respect for our military. https://t.co/CVuKuOegID"
RepSpanberger,2023-08-15 03:20:11+00:00,"RT @Veterans and survivors — While there’s no deadline to apply for Honoring Our PACT Act benefits, TODAY is the deadline to be eligible for benefits backdated to August 10, 2022!

File your claim or submit an intent to file by tonight at 11:59pm ET!
👉 https://t.co/V6bOO7nSHo https://t.co/tYTThtBbEh"
RepSpanberger,2023-08-14 15:02:46+00:00,"Veterans and survivors — While there’s no deadline to apply for Honoring Our PACT Act benefits, TODAY is the deadline to be eligible for benefits backdated to August 10, 2022!

File your claim or submit an intent to file by tonight at 11:59pm ET!
👉 https://t.co/V6bOO7nSHo https://t.co/tYTThtBbEh"
RepSpanberger,2023-08-15 00:45:59+00:00,"It was great to visit the @NATCA at Potomac TRACON!

This facility supports our region’s air traffic controllers — many of whom live in the Seventh District — at Dulles, DCA, RIC, and many other local airports.

Thank you for having me! https://t.co/PLgYcOzVhE"
RepSpanberger,2023-08-14 23:32:59+00:00,"Celebrated the grand opening of @MITREcorp’s new drone range in Orange County this afternoon!

This expansion will help strengthen Virginia’s standing as a leader in drone research, provide unique capabilities to keep our nation safe, and support new jobs. https://t.co/9H6nWUFud3"
RepSpanberger,2023-01-12 14:34:07+00:00,"🚨 TODAY, I’m reintroducing my bipartisan legislation to ban Members of Congress, their spouses, and their dependent children from trading individual stocks while serving the American people."
RepSpanberger,2023-08-14 19:15:37+00:00,"Business is booming in Orange County!

Macmillan Publishing Services — which has operated in Orange since 1997 — is expanding its facility in the county.

Today, I had the chance to tour their facility and learn more about the continued investment MPS is making in the community. https://t.co/47GSp7zylY"
RepSpanberger,2023-08-14 16:05:47+00:00,"On August 14, 1935, the Social Security Act was signed into law.

But today, retired federal employees, police officers, educators, and other public servants are being denied the benefits they paid into.

My bipartisan #SocialSecurityFairnessAct would END this unfair penalty."
RepSpanberger,2023-08-14 15:02:46+00:00,"Veterans and survivors — While there’s no deadline to apply for Honoring Our PACT Act benefits, TODAY is the deadline to be eligible for benefits backdated to August 10, 2022!

File your claim or submit an intent to file by tonight at 11:59pm ET!
👉 https://t.co/V6bOO7nSHo https://t.co/tYTThtBbEh"
RepSpanberger,2023-08-13 21:20:15+00:00,"Thank you to the Stafford NAACP for having me at the 2023 Freedom Fund Banquet!

I was glad to join to honor Virginia’s Veterans and first responders — and recognize 67 years of service from the Stafford NAACP! https://t.co/H5zvkp2M9c"
RepSpanberger,2023-08-13 20:38:33+00:00,"RT @According to Representative Abigail Spanberger, the voices of Virginians are helping to shape the forthcoming U.S. Farm Bill, or at least the contribution that she’s making to it. https://t.co/PZZw5OPCZi"
TheWN,2023-08-13 18:32:15+00:00,"According to Representative Abigail Spanberger, the voices of Virginians are helping to shape the forthcoming U.S. Farm Bill, or at least the contribution that she’s making to it. https://t.co/PZZw5OPCZi"
RepSpanberger,2023-08-13 02:44:41+00:00,"I spent part of this afternoon shopping the more than 100 Black-owned businesses represented at the 4th Annual Virginia Black Business Expo in Fredericksburg!

It was great to meet some of the Virginians who run the small businesses that help keep our Commonwealth strong. https://t.co/WahRzMQNop"
RepSpanberger,2023-08-12 19:14:37+00:00,"Six years ago, Virginia State Police Lt. H. Jay Cullen and Trooper-Pilot Berke Bates died working to protect innocent Virginians on the ground as white supremacists marched through Charlottesville.

May Virginians always remember their commitment to service."
RepSpanberger,2023-08-12 15:05:14+00:00,"It has been six years since a white supremacist drove his car into a crowd of Virginians denouncing the hate that had infiltrated Charlottesville.

He killed Heather Heyer.

Today, we honor her life by rejecting the hatred and antisemitism that led to her death."
RepSpanberger,2023-08-11 23:30:43+00:00,"On August 11, 2017, white supremacists descended on Charlottesville and marched on the University of Virginia chanting Nazi slogans, carrying torches, and spewing racism and antisemitism.

Six years since that evening, we cannot forget the forces of hate that flooded our streets."
RepSpanberger,2023-08-11 20:46:10+00:00,"My team is always ready to assist residents of Virginia’s Seventh District — just like we were able to help Jay.

Having an issue with a federal agency, program, or benefit? Contact my office at https://t.co/IzQ4Fv0K5z. https://t.co/5DuW5bccg2"
RepSpanberger,2023-08-11 18:40:07+00:00,"No matter where I go, I hear from Virginians who are tired of Members of Congress profiting off suspiciously timed stock trades.

My bipartisan bill would ban lawmakers from trading individual stocks — because Americans deserve to trust in their officials.

More w/ @juliemason: https://t.co/LWgFE1i7Qq"
RepSpanberger,2023-08-11 16:30:38+00:00,"I asked Virginians, “Should parents be seated with their young kids on flights for no extra fees?”

80% said YES.

I’m proud the House passed my bipartisan bill to make this a reality — and I'm glad to hear from parents, pilots, and passengers who support it.

Some responses 👇"
RepSpanberger,2023-08-11 16:30:59+00:00,"“It appears like a no-brainer. It’s beneficial for the parents/family as well as any other passengers.” — Joseph Keady, Prince William"
RepSpanberger,2023-08-11 16:31:01+00:00,"“It is just the right thing to do!” — Daniel Cummins, Stafford"
RepSpanberger,2023-08-11 14:05:00+00:00,"As the only Virginian on the U.S. House Agriculture Committee, I take serving Virginia’s farmers and producers seriously.

And as 2023 Farm Bill negotiations continue, hearing directly from folks on the ground is as important as ever. https://t.co/0nIn4twFKE"
RepSpanberger,2023-01-12 14:34:07+00:00,"🚨 TODAY, I’m reintroducing my bipartisan legislation to ban Members of Congress, their spouses, and their dependent children from trading individual stocks while serving the American people."
RepSpanberger,2023-08-10 22:19:40+00:00,RT @Reducing mother-to-child HIV transmission is a critical part of combatting HIV globally – that’s why I joined @repspanberger and over 70 of my House colleagues in calling for maternal care that incorporates HIV testing and treatment. ➡️ https://t.co/QLTh9FrjvI
RepScholten,2023-08-10 21:01:24+00:00,Reducing mother-to-child HIV transmission is a critical part of combatting HIV globally – that’s why I joined @repspanberger and over 70 of my House colleagues in calling for maternal care that incorporates HIV testing and treatment. ➡️ https://t.co/QLTh9FrjvI
RepSpanberger,2023-08-10 18:45:29+00:00,"Today marks one year since the Honoring Our PACT Act was signed into law!

This law finally extends VA benefits to millions of Veterans exposed to burn pits and other toxins during their service.

Not sure if you or a loved one are eligible? 👉 https://t.co/V6bOO7nSHo"
RepSpanberger,2023-08-10 17:18:46+00:00,"Virginia’s small businesses are the cornerstone of our economy.

But the data is clear — Black-owned businesses have a harder time accessing capital.

I was glad to have the chance to discuss how I can help our Black business owners get a fair shot.
https://t.co/JJ1wA55Zsk"
RepSpanberger,2023-08-10 15:58:51+00:00,"EXTENDED DEADLINE: Veterans and survivors now have until 11:59pm ET on Monday, August 14 to receive backdated PACT Act benefits!

If you file a claim or submit an intent to file by then, your claim can be eligible for one year of retroactive benefits.

👉 https://t.co/V6bOO7oqwW https://t.co/zGI0DaXpvo"
RepSpanberger,2023-08-10 14:15:00+00:00,"Members of Congress must be banned from trading individual stocks while in office.

And according to a new survey, that’s a belief I share with 86% of Americans.

More on my bipartisan bill to make sure lawmakers are focused on the people they serve, not their stock portfolios — https://t.co/WpQ1YARs9n"
RepSpanberger,2023-08-10 00:05:24+00:00,"I first read Frank M. White’s extraordinary poem while I was celebrating Juneteenth in Stafford County.

His words deserve to be remembered — and I was proud to preserve his beautiful words about the long overdue emancipation of enslaved people.
https://t.co/qDYxkbXt7c"
RepSpanberger,2023-08-09 22:25:19+00:00,Celebrated new jobs and booming business in Caroline County with a whole lot of selfies! 🤳 https://t.co/cF9mwmQNlS
RepSpanberger,2023-08-09 21:30:32+00:00,"M.C. Dean, Inc. is expanding operations in Caroline County!

I was proud to celebrate the new Modular Mission Critical manufacturing campus that is bringing hundreds of jobs, helping to grow our local economy, and making sure Virginia stays the best place for business. https://t.co/15HuQCcDBK"
RepSpanberger,2023-08-09 20:18:17+00:00,"Today marks one year since the bipartisan CHIPS and Science Act was signed into law.

I was proud to vote to boost domestic manufacturing, spur private investment, and help America dominate the 21st century.

Virginia is ready for more semiconductor jobs."
RepSpanberger,2023-08-09 18:50:58+00:00,"It was great to join @JulieMason to chat about supporting Virginia's farmers, combating threats posed by the Chinese Communist Party, and banning lawmakers from trading stocks.
 
🎧 Listen to our full conversation: https://t.co/BcPik0opiA"
RepSpanberger,2023-08-09 17:30:15+00:00,"TODAY is the last day for Veterans and survivors to file claims under the Honoring Our PACT Act — or quickly submit an intent to file — to receive benefits backdated to August 10, 2022.

Not sure if you’re eligible? Visit https://t.co/V6bOO7nSHo today!

More information👇 https://t.co/99v2gL2Bbf"
RepSpanberger,2023-08-09 16:43:54+00:00,"RT @Due to high volume, some Veterans and survivors are receiving error messages when submitting their intent to file PACT Act claims.

If you received one of these messages, don’t worry! We have logged your intent to file and saved your effective date for benefits."
SecVetAffairs,2023-08-09 05:28:47+00:00,"Due to high volume, some Veterans and survivors are receiving error messages when submitting their intent to file PACT Act claims.

If you received one of these messages, don’t worry! We have logged your intent to file and saved your effective date for benefits."
RepSpanberger,2023-08-09 16:32:23+00:00,"97% of illicit fentanyl in the United States is manufactured using precursor chemicals from China.

I’m urging the Biden Administration to combat the Chinese Communist Party’s role in fentanyl trafficking — because we must stop the flow of deadly fentanyl into our communities."
RepSpanberger,2023-08-09 03:50:06+00:00,"Thank you to Celebrate by Del Webb in Stafford County for welcoming me tonight for a town hall!

I appreciate every Virginian who joined to share with me the issues that are top of mind — you make me a better representative for every Virginian I serve! https://t.co/6XgcGmIWlH"
RepSpanberger,2023-08-08 22:50:51+00:00,"TOMORROW, August 9 is the last day to submit an intent to file for Veterans benefits from the Honoring Our PACT Act and receive benefits backdated to last year!

If you are or know a Veteran who was exposed to toxic substances in service, visit https://t.co/V6bOO7nSHo TODAY! https://t.co/33WduUy6OV"
RepSpanberger,2023-08-08 20:08:49+00:00,"RT @Congrats to @RepSpanberger (D-VA) for being ranked as the most bipartisan elected official from VA and as the second-highest bipartisan lawmaker in the country! 🎉 Congresswoman, we're proud to have you as a Common Ground Champion! 🏆
https://t.co/0FBWMDVZmZ"
commongroundcom,2023-08-08 20:01:00+00:00,"Congrats to @RepSpanberger (D-VA) for being ranked as the most bipartisan elected official from VA and as the second-highest bipartisan lawmaker in the country! 🎉 Congresswoman, we're proud to have you as a Common Ground Champion! 🏆
https://t.co/0FBWMDVZmZ"
RepSpanberger,2023-08-08 19:50:33+00:00,"RT @Thank you, @RepSpanberger, for joining the Assisting Caregivers Today (ACT) Caucus!
 
We look forward to working together to support family caregivers, including the 980,000 individuals helping loved ones here in VA!"
AARPVa,2023-08-08 19:50:10+00:00,"Thank you, @RepSpanberger, for joining the Assisting Caregivers Today (ACT) Caucus!
 
We look forward to working together to support family caregivers, including the 980,000 individuals helping loved ones here in VA!"
RepSpanberger,2023-08-08 18:23:41+00:00,"I'm honored to once again be ranked as the most bipartisan lawmaker from Virginia and tied for second place for most bipartisan elected official in the country.

Virginians expect me to get things done — and that means working across the aisle to deliver for our Commonwealth. https://t.co/mZSd8aLsLb"
RepSpanberger,2023-08-08 18:23:41+00:00,"I want to thank @CommonGroundCom for their continued work for the good of our communities and country. We must keep encouraging lawmakers to find common ground.

Click here for the full ranking: https://t.co/gzqG1fokLo."
RepSpanberger,2023-08-08 14:15:14+00:00,"Serving hundreds of thousands of Virginians is a job I take seriously — and hearing from our neighbors helps me do it well.

Friday’s discussion with so many of our region’s Black business owners was invaluable to helping me bring their voices to the table.https://t.co/I4iJDCQCb7"
RepSpanberger,2023-01-12 14:34:07+00:00,"🚨 TODAY, I’m reintroducing my bipartisan legislation to ban Members of Congress, their spouses, and their dependent children from trading individual stocks while serving the American people."
RepSpanberger,2023-08-07 23:45:20+00:00,"DEADLINE: Virginia Veterans have TWO DAYS left to submit an intent to file to receive Honoring Our PACT Act benefits backdated to August 10, 2022!

Submit your intent to file by this Wednesday, August 9 at https://t.co/V6bOO7nSHo. https://t.co/3VNseP1KqE"
RepSpanberger,2023-08-07 23:06:25+00:00,"On National Purple Heart Day, we honor the servicemembers who were injured or killed protecting the freedoms we hold dear. 

Today and every day, we thank recipients and their families for their service and sacrifice in defense of our great nation. 💜"
RepSpanberger,2023-08-07 22:42:04+00:00,RT @Are you charging your phones and other needed devices in case of power outages this evening due to the expected severe weather? #VaWx https://t.co/43mMIeKNSt
VDEM,2023-08-07 22:18:32+00:00,Are you charging your phones and other needed devices in case of power outages this evening due to the expected severe weather? #VaWx https://t.co/43mMIeKNSt
RepSpanberger,2023-08-07 22:12:09+00:00,"Last Congress, I helped negotiate and pass the Bipartisan Infrastructure Law to invest in our Commonwealth’s physical infrastructure.

From expanding broadband internet access to repairing our roads and bridges, this law invests in Virginia’s future.

More with @NewsRadioWINA: https://t.co/E6CKlv7TOj"
RepSpanberger,2023-08-07 20:15:04+00:00,"August is National Black Business Month.

During Friday’s roundtable discussion, Black small business owners from our Commonwealth shared some of the challenges they face and helped me better understand how I can advocate for them.

Hear from some of these Virginians on @wusa9 — https://t.co/IFn84U0t62"
RepSpanberger,2023-08-07 15:08:33+00:00,"Team Spanberger logging on to wish Abigail a very happy birthday! 🥳

Happy birthday to the best boss and an even better advocate for the people of Virginia. https://t.co/vD3hKnEzBq"
RepSpanberger,2023-08-06 23:30:52+00:00,Thank you to St. John Baptist Church in Caroline County and Reverend Craddock for having me this morning! https://t.co/GOcLWABgCW
RepSpanberger,2023-08-06 00:30:40+00:00,I had a great time at the African American Heritage Festival today in Prince William County — and checking out the classic car show! https://t.co/OfB9Xdtvjv
RepSpanberger,2023-08-06 00:28:05+00:00,RT @Black business owners made clear they want a more prominent seat at the table to address the unique challenges they face. https://t.co/Lxd1jySd2j
InsideNoVA,2023-08-05 20:22:06+00:00,Black business owners made clear they want a more prominent seat at the table to address the unique challenges they face. https://t.co/Lxd1jySd2j
RepSpanberger,2023-08-05 16:55:34+00:00,"Virginia Veterans — WEDNESDAY is the deadline to submit your intent to file to receive new benefits from the bipartisan Honoring Our PACT Act backdated a year!

Not sure if you’re eligible? Check at https://t.co/YIfBttG9B1!"
RepSpanberger,2023-08-05 03:23:18+00:00,"RT @HAPPENING NOW — Roundtable of black business owners in #PrinceWilliamCounty talking about challenges and ways government can help. 

Hosted by @RepSpanberger and county supervisors for Black Business Month. 

@wusa9 https://t.co/M9Gz2tcgi5"
ekoslof,2023-08-05 02:56:02+00:00,"HAPPENING NOW — Roundtable of black business owners in #PrinceWilliamCounty talking about challenges and ways government can help. 

Hosted by @RepSpanberger and county supervisors for Black Business Month. 

@wusa9 https://t.co/M9Gz2tcgi5"
RepSpanberger,2023-08-05 00:43:05+00:00,"No lawmaker should use their access to privileged information for their own personal profit.

That's why I'm leading the bipartisan TRUST in Congress Act to ban Members of Congress — and their spouses — from trading individual stocks while in office.

More with @NewsRadioWINA: https://t.co/yvXDRBWt3z"
RepSpanberger,2023-08-04 22:11:30+00:00,Thank you to the community at Dar Alnoor Islamic Community Center for welcoming me today! https://t.co/miES1oDVMI
RepSpanberger,2023-08-04 20:40:20+00:00,"To celebrate National Black Business Month, I sat down in Prince William County today to hear from local Black business owners, consultants, restaurant owners, lawyers, coaches, and more entrepreneurs.

Thank you to @VABlackBusiness and @NVBCC for hosting our discussion! https://t.co/ONWGvd24xq"
RepSpanberger,2023-08-04 18:15:18+00:00,"A government shutdown would be crushing for millions of federal employees — like so many I represent in Virginia.

Congress must work together to avoid a catastrophe.

From @8NEWS — https://t.co/6hsLZuCinS"
RepSpanberger,2023-08-04 15:30:42+00:00,"NEW: I’m leading a bipartisan bill to reduce pollution in the Chesapeake Bay.

The Bay is one of Virginia’s treasures — from its natural beauty to the economic opportunities it creates.

I’m proud to work to improve conservation efforts and cut red tape for the region’s farmers. https://t.co/BrHUSL7wNp"
RepSpanberger,2023-08-04 15:30:43+00:00,"Thank you to my colleagues in both parties — @timkaine, @SenatorCardin, @SenBobCasey, @ChrisVanHollen, @MarkWarner, @RobWittman, @RepSarbanes, and @BobbyScott — for working together to protect this watershed for generations to come."
RepSpanberger,2023-08-04 14:24:32+00:00,"RT @Since she first arrived in Congress in 2019, Congresswoman @repspanberger focused on the impact of the high cost of prescription drug prices. Please listen and watch what she has done to lower the costs of drugs for her constituents, and EVERY American! #HealthCareAwarenessMonth https://t.co/S2nNsJgewo"
morethanmySLE,2023-08-04 13:27:07+00:00,"Since she first arrived in Congress in 2019, Congresswoman @repspanberger focused on the impact of the high cost of prescription drug prices. Please listen and watch what she has done to lower the costs of drugs for her constituents, and EVERY American! #HealthCareAwarenessMonth https://t.co/S2nNsJgewo"
RepSpanberger,2023-08-03 21:00:09+00:00,"Thank you to the nearly 5,000 Virginians who tuned into last night’s town hall!

We covered much of what’s on the minds of our neighbors — like Social Security, long overdue ethics reforms, broadband internet, and the Child Tax Credit.

Missed our conversation?👇"
RepSpanberger,2023-08-03 21:00:09+00:00,"You can watch the full event at the link below — and I hope you can join us next time!
https://t.co/j2k09DZ89c"
RepSpanberger,2023-01-12 14:34:07+00:00,"🚨 TODAY, I’m reintroducing my bipartisan legislation to ban Members of Congress, their spouses, and their dependent children from trading individual stocks while serving the American people."
RepSpanberger,2023-08-03 21:00:09+00:00,"Thank you to the nearly 5,000 Virginians who tuned into last night’s town hall!

We covered much of what’s on the minds of our neighbors — like Social Security, long overdue ethics reforms, broadband internet, and the Child Tax Credit.

Missed our conversation?👇"
