username,orario,text
RepSpanberger,2023-05-15 20:25:44+00:00,"I’m horrified by this attack on @GerryConnolly’s staff at their office in Fairfax.

I’m thinking of their team, and I’m glad to hear that neither team member sustained life-threatening injuries."
GerryConnolly,2023-05-15 19:48:50+00:00,https://t.co/PkVuYI4KHs
RepSpanberger,2023-05-15 17:55:06+00:00,"Every day, law enforcement officers put their own lives at risk to protect those of their neighbors.

Many never return from their patrol.

Today is Peace Officers Memorial Day — a time to honor the lives of those brave men and women who were lost in the line of duty. #PoliceWeek"
RepSpanberger,2023-05-14 20:10:10+00:00,"One year ago today, ten people were gunned down at a grocery store in Buffalo, New York.

365 days later, more communities have faced horror, loss, and gun violence.

We can — and must — do more."
RepSpanberger,2023-05-14 16:30:16+00:00,"Happy Mother’s Day!

To every mom and grandmother, I hope today is filled with joy and love."
RepSpanberger,2023-05-13 15:45:18+00:00,"From @WTOP:

Members of Congress should not be rewarded for causing the American people and the American economy to suffer.

One of the most fundamental responsibilities of Congress is to pay our country’s bills.

Get it done, or don’t get paid. https://t.co/719fnTCY1h"
RepSpanberger,2023-05-12 21:00:14+00:00,"#TeacherAppreciationWeek is a time to celebrate the Virginia educators — like Fabiana Parker, 2023 Virginia Teacher of the Year from @spotsyschools — who go above and beyond every day for our kids.

We’ve all had a teacher who shaped our lives. This week is about them! 🍎 https://t.co/1lmVEW7TDY"
RepSpanberger,2023-05-12 19:30:15+00:00,"RT @.@RepSpanberger is pushing for an additional incentive for Congress to resolve the fight over the debt ceiling, writing a letter to the CAO requesting that she ""withhold US Member of Congress pay until Congress has lifted the debt ceiling.""

https://t.co/FAJqCogWbf"
dcexaminer,2023-05-12 19:28:23+00:00,".@RepSpanberger is pushing for an additional incentive for Congress to resolve the fight over the debt ceiling, writing a letter to the CAO requesting that she ""withhold US Member of Congress pay until Congress has lifted the debt ceiling.""

https://t.co/FAJqCogWbf"
RepSpanberger,2023-05-12 18:18:28+00:00,"The job of Congress right now is to pay our nation’s bills and protect Americans’ financial security.

Working families get it — if you don’t do your job, you don’t get paid.

I’m moving to block lawmaker pay until Congress fixes the debt ceiling crisis.
https://t.co/Z5tiThLGPz"
RepSpanberger,2023-05-12 17:35:40+00:00,"NEW — Our bipartisan bill to stock up on naloxone in schools to protect kids from overdose deaths.

Tackling the overdose crisis means stopping the flow of illicit drugs, supporting treatment and recovery programs, and making sure Virginians can respond in emergency situations."
RepSpanberger,2023-05-12 17:35:40+00:00,"As a parent, I’m deeply concerned about the opioid crisis — particularly fentanyl — making its way into our classrooms, school cafeterias, and hallways.

And right now, we are grappling with the reality that more children and teenagers are losing their lives to overdose."
RepSpanberger,2023-05-12 17:35:41+00:00,Providing schools with the means necessary to revive a child or teenager who has suffered an overdose is an inexpensive and proven way to protect Virginia students.
RepSpanberger,2023-05-12 16:02:02+00:00,"🚨 NEW: I’m leading the charge to block Members of Congress from getting paid until Congress fixes the debt ceiling crisis.

Hyper-partisanship is jeopardizing our economic strength and the economic security of the American people — and lawmakers should not be rewarded. https://t.co/ylBHsDUJPk"
RepSpanberger,2023-05-12 15:46:33+00:00,RT @ChadPergram: Dem VA Rep Spanberger writes to Hse CAO asking Hse to block pay to mbrs unless the debt ceiling is resolved
ChadPergram,2023-05-12 15:39:20+00:00,Dem VA Rep Spanberger writes to Hse CAO asking Hse to block pay to mbrs unless the debt ceiling is resolved
RepSpanberger,2023-05-12 00:15:00+00:00,"The American people deserve to know that Members of Congress are working for them — not their own stock portfolios.

It’s that simple.

We must ban Members of Congress from trading individual stocks and remove even the opportunity for impropriety. https://t.co/CBUBKcBwmf"
RepSpanberger,2023-05-11 23:20:24+00:00,"🚨 I JUST voted with a bipartisan majority of the U.S. House to PASS a bill to help federal, state, and local law enforcement crack down on ‘Tranq.’

This mix of xylazine, a veterinary tranquilizer, and fentanyl is killing Americans.

We must do more to protect Virginians. https://t.co/RvtEv3hZq0"
RepSpanberger,2023-05-11 22:41:22+00:00,"We must BAN Members of Congress from trading individual stocks.

Both Democrats and Republicans in Congress — and the vast majority of Americans — support this ban.

It’s time for U.S. House leadership to bring a bill to the floor to get it done. https://t.co/1bjojucpEi"
RepSpanberger,2023-05-11 21:23:10+00:00,RT @Virginia @RepSpanberger is one of the lawmakers who signed the bipartisan letter calling on Congress to act to ban lawmakers from trading stocks. Here’s part of what she had to say #virginia #stocktrading https://t.co/gdgGVmVpBx
JamieReports,2023-05-11 21:22:37+00:00,Virginia @RepSpanberger is one of the lawmakers who signed the bipartisan letter calling on Congress to act to ban lawmakers from trading stocks. Here’s part of what she had to say #virginia #stocktrading https://t.co/gdgGVmVpBx
RepSpanberger,2023-05-11 19:08:47+00:00,"As a former law enforcement officer and CIA officer who worked narcotics cases, I understand the threat of fentanyl flowing into our communities.

I’m proud to help lead a bipartisan, bicameral bill to provide local law enforcement with new technology to detect deadly fentanyl. https://t.co/MuqZdgm7ri"
RepSpanberger,2023-05-11 18:13:01+00:00,"RT @Thank you, @RepSpanberger, @RepDaveJoyce, @SenSherrodBrown, and @SenTomCotton for introducing the POWER Act to provide resources to speed up investigations related to fentanyl. MCSA is proud to endorse this bill. 

https://t.co/ersNlRQIi1"
MCSheriffs,2023-05-11 18:02:13+00:00,"Thank you, @RepSpanberger, @RepDaveJoyce, @SenSherrodBrown, and @SenTomCotton for introducing the POWER Act to provide resources to speed up investigations related to fentanyl. MCSA is proud to endorse this bill. 

https://t.co/ersNlRQIi1"
RepSpanberger,2023-05-11 16:09:54+00:00,"RT @U.S. Rep. Abigail Spanberger, D–7th, has launched a new survey to gather ""Stories of Service' from Virginians with loved ones who are active-duty service members or veterans. https://t.co/hiTUTwilVP"
NewsInTheBurg,2023-05-11 16:01:03+00:00,"U.S. Rep. Abigail Spanberger, D–7th, has launched a new survey to gather ""Stories of Service' from Virginians with loved ones who are active-duty service members or veterans. https://t.co/hiTUTwilVP"
RepSpanberger,2023-01-12 14:34:07+00:00,"🚨 TODAY, I’m reintroducing my bipartisan legislation to ban Members of Congress, their spouses, and their dependent children from trading individual stocks while serving the American people."
RepSpanberger,2023-05-11 14:46:03+00:00,"Members of Congress cannot raise eyebrows with suspiciously well-timed stock trades if they cannot trade, period.

We must pass my bipartisan bill to BAN Members of Congress AND their spouses AND dependent children from trading individual stocks."
RepSpanberger,2023-05-11 03:13:32+00:00,"Throughout Asian American, Native Hawaiian, and Pacific Islander Heritage Month, we recognize the rich history, culture, and community AANHPI Americans contribute to our country — and celebrate our #AANHPI neighbors across Virginia!"
RepSpanberger,2023-05-10 22:15:37+00:00,"May is #MilitaryAppreciationMonth.

To celebrate our Veterans, support those on active duty, and remember those who made the ultimate sacrifice, I want to share their Stories of Service.

Please share the sacrifice of a friend, relative, or loved one.
🇺🇸 https://t.co/PaPZy6WZ16 https://t.co/rQ3L2NE6cU"
RepSpanberger,2023-05-10 17:15:26+00:00,"HAPPENING NOW: My team is holding in-person office hours at the Greene County Library!

Stop by and chat with my team if you are having an issue with your Social Security checks, tax refund, VA benefits, or any other federal benefit."
RepSpanberger,2023-05-09 16:25:26+00:00,"TOMORROW: My team is headed to Greene County for in-person office hours!

If you are having an issue with any federal agency, program, or benefit, please stop by the Greene County Library to discuss with my team. https://t.co/cbAE53M1Uc"
RepSpanberger,2023-05-10 16:15:11+00:00,"Fentanyl is killing Americans.

As a former federal law enforcement officer and CIA case officer, I know how the right resources and technology can save lines.

Our new bipartisan bill would help local law enforcement officers detect dangerous drugs — like fentanyl. https://t.co/UREuSktkwA"
RepSpanberger,2023-05-09 19:36:25+00:00,"🚨 NEW: Our bipartisan, bicameral bill to connect state and local law enforcement with new high-tech, portable screening devices to detect and identify dangerous drugs — including fentanyl.

I’m proud to lead this legislation with @RepDaveJoyce, @SenSherrodBrown, &amp; @SenTomCotton."
RepSpanberger,2023-05-09 19:36:26+00:00,"As a former federal agent and CIA case officer who worked narcotics cases and tracked cartels, I recognize the severity of the fentanyl crisis in our communities.

And I’ve heard from police departments in Virginia that are increasingly encountering this substance on the job."
RepSpanberger,2023-05-09 19:36:26+00:00,"By making sure law enforcement officers have the resources and training they need, we can quickly identify when fentanyl enters an area, warn our neighbors, and build a response plan.

And we can protect the lives of the men and women who keep our communities safe every day."
RepSpanberger,2023-05-09 14:36:32+00:00,"I just returned from a bipartisan congressional delegation visit with colleagues on the House Intelligence Committee where we met with senior officials in Israel, Jordan, and Egypt and the Americans serving on the front lines of our diplomatic and security efforts abroad. 🇺🇸 https://t.co/PqLPXUXX2q"
RepSpanberger,2023-05-08 21:25:35+00:00,"May is #MentalHealthAwarenessMonth.

If you are struggling, you are not alone. And support is available.

Virginians and Americans across our country can visit https://t.co/cNpn0pZEmB for help with mental health, drugs, and alcohol."
samhsagov,2023-05-07 17:00:37+00:00,"3 out of 10 people in the United States have issues with mental health, drugs, or alcohol. 

Support is out there. Get started at https://t.co/b8YyNtIaAR.
#FindSupport #MentalHealthMonth #RecoveryIsPossible https://t.co/uRAPiZGkrQ"
RepSpanberger,2023-05-08 17:40:19+00:00,"Federal employees, police officers, and other public sector workers are being DENIED their hard-earned retirement benefits.

My bipartisan #SocialSecurityFairnessAct would protect the benefits these Americans paid into just like others.

More @InsideNoVA —
https://t.co/ccqwC2GTZb https://t.co/AyZz6GRlYY"
RepSpanberger,2023-05-07 15:03:51+00:00,"Eight people murdered in Allen, Texas.

I’m praying for the victims, those wounded, and the families torn apart. I’m grateful for the police officers who risked their lives to prevent further carnage.

But Congress MUST act if we want to break this cycle of horrific gun violence."
RepSpanberger,2023-05-06 18:15:22+00:00,"NOW OPEN: Applications to receive a congressional nomination to the U.S. Military, Naval, Air Force, and Merchant Marine Academies! 🇺🇸

Interested Virginians can visit my website.
👉 https://t.co/qylBTW7mwp https://t.co/3dueNLwF71"
RepSpanberger,2023-05-05 18:30:58+00:00,"I know that many Virginians — like Roberta from Prince William County — have faced challenges with the IRS.

If you are one of them, my team may be able to help get the answers you deserve.

Please contact our team at https://t.co/IzQ4Fv0K5z or (703) 987-2180. https://t.co/kiivFcr3Dl"
RepSpanberger,2023-05-05 16:00:43+00:00,"I’m proud to help introduce legislation — alongside both Democrats and Republicans — to connect Virginia Veterans to other Veterans with similar conditions and circumstances.

I’ve spoken directly with many of our neighbors who are working to overcome the mental wounds of war. 1/"
RepSpanberger,2023-05-05 16:00:44+00:00,"Often, I’m told how they find immense strength in sharing their stories, their experiences, and their triumphs with their fellow Veterans.

These programs are often critical in building pathways to hope, preventing Veteran suicide, and achieving personal health and wellness. 2/"
RepSpanberger,2023-05-04 21:00:52+00:00,"May is Jewish American Heritage Month — a time to acknowledge and celebrate the achievements of Jewish Americans throughout our nation’s history.

We also recommit ourselves to standing up for our neighbors and speaking out against antisemitism everywhere."
RepSpanberger,2023-05-04 19:54:15+00:00,"RT @Thanks for the shoutout and your leadership, @RepSpanberger! There are currently 18.2 million veterans in the U.S. 🇺🇸 and 1 in 10 are truck 🛻 drivers. 

Working together, we can help address the driver shortage while creating exciting new opportunities for these brave heroes."
VaTruckingAssn,2023-05-04 17:20:18+00:00,"Thanks for the shoutout and your leadership, @RepSpanberger! There are currently 18.2 million veterans in the U.S. 🇺🇸 and 1 in 10 are truck 🛻 drivers. 

Working together, we can help address the driver shortage while creating exciting new opportunities for these brave heroes."
RepSpanberger,2023-05-04 16:35:47+00:00,🚨 NEW: The Virginia Trucking Association endorsed my bipartisan bill to help more Veterans join the trucking workforce! #MilitaryAppreciationMonth https://t.co/dPuxv10OJ0
RepSpanberger,2023-05-04 18:16:44+00:00,"Are you having trouble getting your tax refund?

After waiting more than a year, our team was able to get Richard from Spotsylvania the refund he was long owed. And we may be able to help you too!

Visit https://t.co/IzQ4Fv0K5z or call (703) 987-2180 to open a case. https://t.co/F30PpKPH1j"
RepSpanberger,2023-01-12 14:34:07+00:00,"🚨 TODAY, I’m reintroducing my bipartisan legislation to ban Members of Congress, their spouses, and their dependent children from trading individual stocks while serving the American people."
RepSpanberger,2023-05-04 16:35:47+00:00,🚨 NEW: The Virginia Trucking Association endorsed my bipartisan bill to help more Veterans join the trucking workforce! #MilitaryAppreciationMonth https://t.co/dPuxv10OJ0
RepSpanberger,2023-05-03 23:32:30+00:00,"On World Press Freedom Day, we honor journalists around the world who bravely pursue the truth in the face of rising threats and those who wish to silence them.

#IStandWithEvan"
RepSpanberger,2023-04-19 19:32:15+00:00,Russia must release Wall Street Journal reporter Evan Gershkovich — and every American unjustly held behind bars — NOW. #IStandWithEvan https://t.co/jXBd6PtluO
RepSpanberger,2023-05-03 22:42:30+00:00,"At my 2023 Farm Bill Summit, I heard from many crop and livestock producers about challenges with USDA staff shortages.

That’s why I’m proud to help lead a bipartisan bill to cut red tape and help farmers take advantage of voluntary conservation programs.
https://t.co/6yG42nFGie https://t.co/U0gpYY6LvK"
RepSpanberger,2023-05-03 22:42:31+00:00,"Thank you to @RepJimBaird for your partnership in the U.S. House and thank you to @SenatorBraun, @SenatorBennet, and @RogerMarshallMD for your commitment to supporting America’s farmers."
RepSpanberger,2023-05-03 18:46:20+00:00,"We as Americans owe a great debt of gratitude to every servicemember — past and present — who put on the uniform and defended our nation.

Thank you to all those who continue to answer the call. #MilitaryAppreciationMonth"
DeptofDefense,2023-05-01 15:00:00+00:00,"May is #MilitaryAppreciationMonth, a time to honor the brave men and women who have served and continue to serve our country. Thank you for your selfless sacrifice and unwavering commitment to defending our freedom. We are forever grateful for your service. https://t.co/SOj0b5yG8F"
RepSpanberger,2023-05-03 18:24:16+00:00,RT @Thank you to @RepSpanberger for working to advance the rights of people with disabilities when they use air travel! https://t.co/Gas5DHW6JL
ESealsDCMDVA,2023-05-03 18:05:06+00:00,Thank you to @RepSpanberger for working to advance the rights of people with disabilities when they use air travel! https://t.co/Gas5DHW6JL
RepSpanberger,2023-05-03 17:05:42+00:00,"I’ve heard horror stories from Virginians with disabilities about airlines dropping them from their wheelchairs and damaging/losing wheelchairs.

Unacceptable.

That's why today, I urged @SecretaryPete to review how DOT enforces these violations and better protect Americans. https://t.co/D92nuhMhKq"
RepSpanberger,2023-05-03 01:11:00+00:00,"I’m proud to represent Virginia’s Seventh District in the U.S. House of Representatives.

And I always appreciate meeting and hearing directly from our neighbors.

Want to hear directly from me? You can sign up for my weekly email newsletter!
📧 https://t.co/ekZBWfelRN https://t.co/ATFB71GPRG"
RepSpanberger,2023-05-02 23:37:00+00:00,"Congratulations to @SBAgov’s 2023 Small Business Person of the Year for the Virginia District Office, Obsidian Solutions Group Co-Founder &amp; CEO Tyrone Logan!

OSG is one of the fastest growing companies in the DMV.

Today, my team was proud to celebrate his success. https://t.co/adpGBTIiKS"
RepSpanberger,2023-05-02 17:06:25+00:00,"Reports of lawmakers dumping bank stocks in the lead up to the SVB and First Republic Bank collapses make clear the need to BAN Members of Congress from trading individual stocks.

My bipartisan TRUST in Congress Act would do just that.

More @YahooFinance:https://t.co/8S9xsCRPGo"
RepSpanberger,2023-05-02 15:14:56+00:00,"As a former federal law enforcement officer who carried a gun every day, I get the threat of criminals modifying firearms to inflict as much damage as possible.

That’s why I’m leading a bill with @SenAmyKlobuchar, @RepCasten, &amp; @SenGaryPeters to crack down on glock switches."
RepSpanberger,2023-05-02 15:14:56+00:00,"These illegal devices turn a handgun into a machine gun.

Our bill would give law enforcement the tools they need to stop criminals and gun traffickers.

As a legislator and parent, I’m focused on keeping our communities, first responders, and children safe from gun violence."
RepSpanberger,2023-05-02 00:40:38+00:00,"I’ve been hearing from Virginians impacted by the Adderall shortage for months.

And I’ve been pressing DEA &amp; FDA to initiate a strategy to make sure that everyone who relies on Adderall can fill their prescriptions.

Americans deserve peace of mind.
https://t.co/siJDGzttC8"
RepSpanberger,2023-05-01 21:15:10+00:00,"As the only Virginian on the U.S. House Agriculture Committee, it's my responsibility to make sure that the voices of our Commonwealth’s farmers are heard.

2023 Farm Bill negotiations are ongoing — as is my work on behalf of Virginians in the ag industry.
https://t.co/D8eApsn0K0"
RepSpanberger,2023-05-01 16:30:12+00:00,"My office is here — by definition — to serve our neighbors across Virginia’s Seventh District.

I’m proud to share that we have now returned more than $29 MILLION in Social Security checks, VA benefits, Medicare appeals, tax refunds, and more to Virginians! https://t.co/wjBC95W9iB"
RepSpanberger,2023-05-01 05:36:54+00:00,"Today marked the final day of Arab American Heritage Month.

The Arab American community’s history, culture, and achievements strengthen our country.

This month — and every month — we celebrate our neighbors in Virginia and across the country."
RepSpanberger,2023-05-01 00:35:25+00:00,"My fourth and final stop of the day yesterday was to Hidden Pines Meat Processing in Madison County.

Thank you for showing me around and giving me more insight into your operations and how I can work to support you at the federal level. https://t.co/iImMjBwyif"
RepSpanberger,2023-04-30 23:01:02+00:00,"I also visited Heavenly Acres Farm in Greene County yesterday!

In 2021, the farm received the Clean Water Farm Award from @VirginiaDCR for its commitment to practices that protect Virginia’s soil and water health.

As I always say — farmers are the original conservationists. https://t.co/la0W8mSMTA"
RepSpanberger,2023-04-30 22:15:27+00:00,"My second stop yesterday was to Senterfitt Cattle Company and Virginia Cattle Company in Madison County. 

As 2023 Farm Bill negotiations continue, I’ll continue to bring the voices of Virginia producers to the table. https://t.co/mjkSjV31mv"
RepSpanberger,2023-04-30 21:40:41+00:00,"Yesterday, I toured several Virginia farms and cattle operations — starting with Muddy Flats Farm in Culpeper County.

Fun fact: In 2020, Muddy Flats received the Culpeper Chamber of Commerce’s “Agribusiness of the Year” award!

Thank you for having me! https://t.co/ihoqZpxlDX"
RepSpanberger,2023-01-12 14:34:07+00:00,"🚨 TODAY, I’m reintroducing my bipartisan legislation to ban Members of Congress, their spouses, and their dependent children from trading individual stocks while serving the American people."
RepSpanberger,2023-04-30 17:01:32+00:00,"RT @.@RepSpanberger⁩ joins ⁦@Timodc⁩ to talk appealing to the middle, the battle of the debt ceiling, her career in the CIA (as much as she's allowed to say), what it's like being a mom while in Congress, and more! https://t.co/6wPFXREOat"
BillKristol,2023-04-30 16:39:16+00:00,".@RepSpanberger⁩ joins ⁦@Timodc⁩ to talk appealing to the middle, the battle of the debt ceiling, her career in the CIA (as much as she's allowed to say), what it's like being a mom while in Congress, and more! https://t.co/6wPFXREOat"
RepSpanberger,2023-04-29 17:38:59+00:00,"RT @ICYMI: we were joined by @JeremyMcPike @ssurovell @DelegateTorian @KennyBoddye @VAExpressLanes &amp; rep for @RepSpanberger to celebrate a new 1.5 mi long auxiliary lane on SB I-95 from Rt 123 to PW Pkwy this week to relieve #congestion 🥳 Public opening date TBA! 

@pwcgov @OCQ1734 https://t.co/eEghtkfp0D"
VaDOTNOVA,2023-04-29 16:40:17+00:00,"ICYMI: we were joined by @JeremyMcPike @ssurovell @DelegateTorian @KennyBoddye @VAExpressLanes &amp; rep for @RepSpanberger to celebrate a new 1.5 mi long auxiliary lane on SB I-95 from Rt 123 to PW Pkwy this week to relieve #congestion 🥳 Public opening date TBA! 

@pwcgov @OCQ1734 https://t.co/eEghtkfp0D"
RepSpanberger,2023-04-29 01:25:28+00:00,"RT @In the wake of the Silicon Valley Bank collapse, we're seeing *story after story* about lawmakers making suspicious stock trades.

These reports demonstrate the CLEAR need to pass my bipartisan bill to ban Members of Congress from trading individual stocks.

More w/ @LokayFOX5 — https://t.co/5skLhFzceP"
RepSpanberger,2023-04-28 15:54:26+00:00,"In the wake of the Silicon Valley Bank collapse, we're seeing *story after story* about lawmakers making suspicious stock trades.

These reports demonstrate the CLEAR need to pass my bipartisan bill to ban Members of Congress from trading individual stocks.

More w/ @LokayFOX5 — https://t.co/5skLhFzceP"
RepSpanberger,2023-04-29 01:23:23+00:00,"I’m proud to say, “I told you so.” #GiveItAChance 

https://t.co/QWp33P7MMO"
nytimes,2023-04-28 18:00:25+00:00,Give it a chance. https://t.co/vh54nPFlhv
RepSpanberger,2023-04-28 22:32:44+00:00,"RT @Filing taxes is confusing enough already. Americans shouldn’t be punished for IRS backlogs that are out of their control.

@RepSpanberger &amp; I introduced the Cutting Paperwork for Taxpayers Act to make life easier for taxpayers.
https://t.co/VfAEiPgduU"
RepYoungKim,2023-04-28 05:00:02+00:00,"Filing taxes is confusing enough already. Americans shouldn’t be punished for IRS backlogs that are out of their control.

@RepSpanberger &amp; I introduced the Cutting Paperwork for Taxpayers Act to make life easier for taxpayers.
https://t.co/VfAEiPgduU"
RepSpanberger,2023-04-28 19:28:39+00:00,"RT @LWX issues Flood Warning for Albemarle, City of Charlottesville, Culpeper, Greene, Madison, Orange, Page, Rockingham [VA] till Apr 28, 5:30 PM EDT https://t.co/L4gcVdKBUu https://t.co/TRwH2pFj2c"
hbwx,2023-04-28 19:28:24+00:00,"LWX issues Flood Warning for Albemarle, City of Charlottesville, Culpeper, Greene, Madison, Orange, Page, Rockingham [VA] till Apr 28, 5:30 PM EDT https://t.co/L4gcVdKBUu https://t.co/TRwH2pFj2c"
RepSpanberger,2023-04-28 18:53:18+00:00,"My team may be able to help if you are having an issue with a federal agency — like Janet had been — or with any other benefit or program. 

Can’t get a response in a timely manner? 

Contact our office at https://t.co/IzQ4Fv0K5z or (703) 987-2180. https://t.co/WxkrqsEZeF"
RepSpanberger,2023-04-27 22:55:59+00:00,"Great to meet 2023 Virginia Teacher of the Year, Fabiana Parker, who is an ESL teacher at Thornburg Middle School @ThornburgJags in Spotsylvania County! https://t.co/ZAvaFf24xZ"
RepSpanberger,2023-04-27 21:20:20+00:00,"An airman posting extreme statements online should not be able to access and leak classified documents.

As a former CIA officer and a Member of the U.S. House Intelligence Committee, I want to know what went wrong — and why no alarm bells went off.

More w/ @brikeilarcnn: https://t.co/vnBRaPOREy"
RepSpanberger,2023-04-27 20:02:14+00:00,About to join @CNN @brikeilarcnn to discuss the need to protect our classified information and protect America’s national security. Tune in! https://t.co/Dk3bIHI9VD
