username,orario,text,Unnamed: 0
RonDeSantis,2023-07-04 18:31:19+00:00,"Happy Independence Day!

We are blessed to have a country founded on principles of freedom, and it is our duty to preserve and defend the sacred fire of liberty as these principles are constantly under attack.

We do not run from this responsibility; we welcome it. We will hold the line, keep the faith, and never, ever back down.",168.0
RonDeSantis,2023-06-30 18:02:32+00:00,"Florida served as the birthplace of the parents’ revolution — the grassroots uprising of moms and dads all across the country, led by @Moms4Liberty, who are beating back the enemies of the American family.

While other states were working to grind parents down, we lifted them up. It’s time we had a president — and a federal government — who supported parents rather than attacking them.

This election is a referendum on the failures of the ideology that is driving the woke agenda in school districts across the country.

Moms are motivated like never before. 2024 will be the year that parents fought back.",169.0
RonDeSantis,2023-06-30 15:00:13+00:00,"The idea that politicians in New York are focused on going after coal-fired pizza is insane.

The Left is obsessed with controlling your behavior. It’s time to restore sanity. https://t.co/y8pvaXY2GF",170.0
RonDeSantis,2023-06-29 23:21:10+00:00,"Great to stop in at Grimaldi's in New York City for a slice of their coal-fired pizza. Why do the bureaucrats want to mess with coal-fired ovens?

Tune in to @JesseBWatters tonight for an in-depth pizza review of Frank and Anthony's famous stop. https://t.co/3ORxztM7FN",171.0
RonDeSantis,2023-06-29 17:40:09+00:00,"College admissions should be based on merit and applicants should not be judged on their race or ethnicity.

The Supreme Court has correctly upheld the Constitution and ended discrimination by colleges and universities.",172.0
RonDeSantis,2023-06-29 16:17:31+00:00,"While the Biden-Garland DOJ sides with Communist China, I side with the American people.

As governor, I prohibited CCP-tied entities from buying land in Florida. 

As president, I'll do the same.

https://t.co/TetevJzAOM",173.0
RonDeSantis,2023-06-28 22:44:15+00:00,"Bidenomics means working Americans pay more for the necessities of life while people in and around Washington, DC live high on the hog. Biden’s insistence on kneecapping domestic energy production will increasingly pinch individuals and families while making America more dependent on China.

Bidenomics: No thank you!",174.0
RonDeSantis,2023-06-28 00:07:01+00:00,"China is hosting a World Economic Forum meeting this week, which is fitting because both the Chinese Communist Party and the WEF are in lockstep seeking to control people who never elected them.

https://t.co/WvleUfa4lX",175.0
RonDeSantis,2023-06-27 22:46:24+00:00,"Joe Biden’s gross dereliction of duty has left the southern border in shambles. 

Millions of illegal aliens have entered the United States under the Biden administration, including criminal aliens and individuals suspected by the U.S. government of terrorism. This is unacceptable.

We’ve heard empty promises for years on securing our border. As president, I will bring the issue of our southern border to a conclusion.

Stop the invasion. No excuses.",176.0
RonDeSantis,2023-06-27 18:31:04+00:00,"Great to be back in New Hampshire where people are ready to defeat Joe Biden and get the country going in the right direction.

This election is a referendum on the failures of the Biden administration – especially the reckless open border policies that have endangered the lives of millions of Americans. 

We must win in 2024 to restore America. No excuses.",177.0
RonDeSantis,2023-06-27 15:58:01+00:00,"Governor DeSantis Hosts Campaign Event in Hollis, New Hampshire https://t.co/dHIoxvtnzD",178.0
RonDeSantis,2023-06-26 22:30:41+00:00,"While in Eagle Pass, Texas, I have seen firsthand the crisis at our southern border. 

Millions of illegal aliens are flooding across the border and tens of thousands of Americans are dying from fentanyl that is being smuggled into our country. This is a massive dereliction of duty from Joe Biden. And this ends under the DeSantis administration.

Stop the invasion. Fight the cartels. Build the wall. Restore our sovereignty. No excuses.",179.0
RonDeSantis,2023-06-26 18:12:18+00:00,"Governor DeSantis Holds a Press Conference in Eagle Pass, Texas https://t.co/dnA6iCUcdw",180.0
RonDeSantis,2023-06-26 16:10:35+00:00,"Governor DeSantis Speaks in Eagle Pass, Texas https://t.co/MTqoU53tyL",181.0
RonDeSantis,2023-06-23 20:21:04+00:00,"Thank you @FaithandFreedom for having me.

The left is waging a war on sanity, common sense and our basic values.  We need a leader with the courage to fight back.

We are ready to fight. We will answer the challenge. We won’t get a mulligan in 2024 — we need to win. No excuses! https://t.co/qigngRR8Ix",182.0
RonDeSantis,2023-06-22 23:25:36+00:00,"Great to be in North Augusta in the GREAT state of South Carolina.

Voters here are fired up to send Joe Biden back to his basement and to restore sanity in America.

We must win in 2024. No excuses. https://t.co/Hjh4mPplbB",183.0
RonDeSantis,2023-06-22 20:32:21+00:00,"Governor DeSantis Engages with Voters in North Augusta, South Carolina https://t.co/ZPcr40IUik",184.0
RonDeSantis,2023-06-22 14:30:28+00:00,"What I witnessed in San Francisco was shocking and saddening, yet unsurprising.

The failures of states like California are the direct result of a failed progressive, and woke, agenda.

I’m running for president because decline is a choice, success is attainable, and freedom is worth fighting for.  We cannot allow our country to descend into a woketopia where freedoms are infringed and the truth is discarded.

Florida is proof that America can do better.",185.0
RonDeSantis,2023-09-13 18:06:11+00:00,"When I’m president, the days of the DC Establishment spending this country into oblivion are over.

I’ve had enough of the elites imposing their will on us.

Now is the time for We the People to impose OUR will on them. https://t.co/8abcHAUOB6",186.0
RonDeSantis,2023-06-21 01:34:14+00:00,Leadership matters. Cities like San Francisco that have embraced leftist policies have destroyed the quality of life of their citizens and sparked an exodus of productive people to greener pastures. We need to restore sanity across this country. https://t.co/LF86omZ1e6,187.0
RonDeSantis,2023-06-20 17:41:55+00:00,Looks like Hunter received a sweetheart deal and is not facing any charges on the massive corruption allegations. If Hunter was not connected to the elite DC class he would have been put in jail a long time ago. https://t.co/tZcZOY1uST,188.0
RonDeSantis,2023-06-18 00:45:31+00:00,"It’s great to be at the Corley Ranch for the 8th Annual Basque Fry!

We need to get the job done in Nevada and across the country in 2024. No more excuses! https://t.co/TFbpbiMBIw",189.0
RonDeSantis,2023-06-17 21:45:00+00:00,Great to be at a staple of Northern Nevada: The Reno Rodeo! https://t.co/ni47GdOMw0,190.0
RonDeSantis,2023-06-17 20:44:33+00:00,"Good on the thousands who showed up at Dodger Stadium to protest this anti-Catholic hate group.

The virtually empty stadium for the game itself was a powerful image – Americans are fed up with the nonsense and are fighting back.

https://t.co/Caabq9rNlO",191.0
RonDeSantis,2023-06-16 21:09:06+00:00,"We must repeal the jailbreak bill that allowed this to happen.

https://t.co/7uQqTVKBhg",192.0
RonDeSantis,2023-06-16 18:57:33+00:00,"My administration will never promote military leaders who abuse their power to push a woke ideology.

Our nation needs to focus on military readiness, not an ideological agenda. https://t.co/ZxFd0XHncn",193.0
RonDeSantis,2023-06-11 17:00:32+00:00,Great night at the Ponca City Rodeo! https://t.co/kzHx88EZwD,194.0
RonDeSantis,2023-06-11 16:36:22+00:00,"RT @Thank you @GovStitt for your endorsement of @RonDeSantis!

Lots of excitement and support in the Sooner state — We were thrilled to join you Oklahoma, thank you! https://t.co/uZ4CQBC6UE",195.0
CaseyDeSantis,2023-06-11 16:36:02+00:00,"Thank you @GovStitt for your endorsement of @RonDeSantis!

Lots of excitement and support in the Sooner state — We were thrilled to join you Oklahoma, thank you! https://t.co/uZ4CQBC6UE",196.0
RonDeSantis,2023-06-11 03:32:13+00:00,"RT @Quick Pit Stop for some chips and a catch….⚾️

Beautiful Saturday night with our friends in Oklahoma. 🇺🇸 https://t.co/udOjulwTQl",197.0
CaseyDeSantis,2023-06-11 02:49:42+00:00,"Quick Pit Stop for some chips and a catch….⚾️

Beautiful Saturday night with our friends in Oklahoma. 🇺🇸 https://t.co/udOjulwTQl",198.0
RonDeSantis,2023-06-11 01:30:45+00:00,"In Florida and Oklahoma, we stand up for freedom — freedom to raise your family without radical ideology being crammed down your throat; freedom to worship and live your faith as you see fit; freedom to run your business and control your finances without corporate activists injecting a woke ideology into the marketplace.

We are on a mission to ensure that freedom prevails across the land.

Thank you, @GovStitt and @RepJBridenstine!",199.0
RonDeSantis,2023-06-10 03:34:01+00:00,"Now more than ever, it is imperative that Americans hold the line and keep the faith.

As Republicans in North Carolina know, we must have the discipline and the conviction to stand together when it counts — especially when it comes to school choice and keeping the woke agenda out of the classroom.

The future of our nation is worth fighting for, and we will not give up the fight until we win again in 2024.",200.0
RonDeSantis,2023-06-09 03:53:39+00:00,"The weaponization of federal law enforcement represents a mortal threat to a free society.

We have for years witnessed an uneven application of the law depending upon political affiliation.

Why so zealous in pursuing Trump yet so passive about Hillary or Hunter?

The DeSantis administration will bring accountability to the DOJ, excise political bias and end weaponization once and for all.",201.0
RonDeSantis,2023-06-08 18:10:47+00:00,".@CaseyDeSantis and I are saddened by the loss of Pat Robertson and we join many in lifting his family up in our prayers.

https://t.co/vI5DDqr3PS",202.0
RonDeSantis,2023-06-06 00:21:03+00:00,"Democrats are boasting about the $4 trillion debt ceiling scheme that locks in inflationary COVID-era spending levels and keeps 98% of Biden's IRS expansion to target the middle class. While this ""deal"" benefits the DC political class, the American people are yet again getting stuck with the bill.",203.0
RonDeSantis,2023-06-04 00:57:01+00:00,"RT @Thank you @joniernst for hosting us at your Roast and Ride!

The kids had a great time on their first trip to Iowa, we’ll see you again soon! https://t.co/NikyFjYY5S",204.0
CaseyDeSantis,2023-06-04 00:56:12+00:00,"Thank you @joniernst for hosting us at your Roast and Ride!

The kids had a great time on their first trip to Iowa, we’ll see you again soon! https://t.co/NikyFjYY5S",205.0
RonDeSantis,2023-06-04 00:41:02+00:00,"It's great to be back in Iowa.

Thank you @joniernst for inviting @CaseyDeSantis and I to join so many veterans and hard-working patriots at the annual Roast and Ride.

Madison, Mason, and Mamie had a great time in Des Moines — they can't wait to come back to Iowa! https://t.co/qguA8WRkg9",206.0
RonDeSantis,2023-06-03 21:32:08+00:00,"RT @The people of South Carolina are committed to our fight to revitalize America.

They support @RonDeSantis because they are ready for a leader who unapologetically believes in the promise of America.

Our Great American Comeback will reaffirm these fundamental truths. https://t.co/rLyF27XxXW",207.0
CaseyDeSantis,2023-06-03 21:26:00+00:00,"The people of South Carolina are committed to our fight to revitalize America.

They support @RonDeSantis because they are ready for a leader who unapologetically believes in the promise of America.

Our Great American Comeback will reaffirm these fundamental truths. https://t.co/rLyF27XxXW",208.0
RonDeSantis,2023-06-03 03:11:23+00:00,"We must have the courage to lead and the strength to win because the stakes could not be higher.

This election is a referendum on the failures of Joe Biden - an open border, inflation, and a woke ideology infecting our society.

But the people of Greenville, South Carolina are ready to fight back and restore America.

Together, we will fight the good fight and defeat Joe Biden. And when we do...we will usher in our Great American Comeback.",209.0
RonDeSantis,2023-06-03 00:02:36+00:00,"Governor DeSantis Delivers Remarks Live From Greenville, South Carolina https://t.co/MqsxyJsSbS",210.0
RonDeSantis,2023-09-13 18:06:11+00:00,"When I’m president, the days of the DC Establishment spending this country into oblivion are over.

I’ve had enough of the elites imposing their will on us.

Now is the time for We the People to impose OUR will on them. https://t.co/8abcHAUOB6",211.0
RonDeSantis,2023-06-02 23:00:06+00:00,"RT @Gilbert, South Carolina loves America's Governor!

The people of South Carolina have come out in full force today to send a message: they are ready for a president with the courage to lead and the strength to win!

They are ready for @RonDeSantis to lead our Great American Comeback!",212.0
CaseyDeSantis,2023-06-02 22:57:45+00:00,"Gilbert, South Carolina loves America's Governor!

The people of South Carolina have come out in full force today to send a message: they are ready for a president with the courage to lead and the strength to win!

They are ready for @RonDeSantis to lead our Great American Comeback!",213.0
RonDeSantis,2023-06-02 17:45:42+00:00,"The energy the Lowcountry showed this morning is the same energy I plan to bring to the executive. 

We have it in our power to reverse our nation's decline, but we must fight to restore America together. 

We have an economy to fix, and a border to secure, and neither will get done until we beat Joe Biden.

The people of South Carolina are ready.",214.0
RonDeSantis,2023-06-02 15:14:27+00:00,"RT @New Hampshire is finding out what Florida already knows: @RonDeSantis never backs down. He never takes the path of least resistance. He does what he says he's going to do. He gets it done--and he wins. 

The people of New Hampshire are ready to win again. https://t.co/pCMCahdQPu",215.0
CaseyDeSantis,2023-06-02 15:12:29+00:00,"New Hampshire is finding out what Florida already knows: @RonDeSantis never backs down. He never takes the path of least resistance. He does what he says he's going to do. He gets it done--and he wins. 

The people of New Hampshire are ready to win again. https://t.co/pCMCahdQPu",216.0
RonDeSantis,2023-06-02 00:07:02+00:00,"Governor DeSantis Delivers Remarks Live from Manchester, New Hampshire https://t.co/0UICzxOy2X",217.0
RonDeSantis,2023-06-01 22:52:29+00:00,"RT @The state motto of New Hampshire doesn't mince words: ""Live Free or Die""

We know ""freedom is never more than one generation away from extinction” - so it must fall upon our generation to protect and defend it. 

New Hampshire, thank you for the warm welcome and support...on to our fourth stop of the day...here we come!",218.0
CaseyDeSantis,2023-06-01 22:51:49+00:00,"The state motto of New Hampshire doesn't mince words: ""Live Free or Die""

We know ""freedom is never more than one generation away from extinction” - so it must fall upon our generation to protect and defend it. 

New Hampshire, thank you for the warm welcome and support...on to our fourth stop of the day...here we come!",219.0
RonDeSantis,2023-06-01 21:31:08+00:00,"We cannot allow the Left to continue to hijack our institutions and push their ideological agenda. 

The people of Rochester know that the fight to preserve and defend our founding principles is just beginning.

And fight we must. https://t.co/aqMVLWONSA",220.0
RonDeSantis,2023-06-01 19:33:00+00:00,"Thank you for the warm welcome, New Hampshire!

Our nation under Joe Biden is upside down, and I know the people of Laconia are ready to take our country back.

We MUST fight to restore America. The future of our nation hangs in the balance. https://t.co/PbXxjYQee1",221.0
RonDeSantis,2023-06-01 14:01:09+00:00,"As we traveled Iowa these last two days we met thousands of Americans who know the same truth we know in Florida: Our country is going in the wrong direction. We can see it and we can feel it.

We have it within our power to reverse our nation's decline. Together we will fight the good fight. We will finish the race. We will keep the faith... and when we do, we will bring about our Great American Comeback.

I can confidently say after yesterday: the people of Sioux City, Council Bluffs, Pella, and Cedar Rapids are standing strong in a long line of dedicated patriots ready to restore America and defeat Joe Biden.",222.0
RonDeSantis,2023-06-01 02:17:08+00:00,"Governor DeSantis Delivers Remarks Live from Cedar Rapids, Iowa https://t.co/opkAZYRR9s",223.0
RonDeSantis,2023-05-31 18:04:13+00:00,"Kicking off our Great American Comeback Tour in the GREAT state of Iowa!

Florida and Iowa have led the way in the fight for our way of life — and I’m running for president to take that fight to the White House.

We are building a movement to restore America. This is what it looks like:",224.0
RonDeSantis,2023-05-31 18:04:51+00:00,"It is our responsibility to revitalize America, and we must return the government to its rightful owners… the American people.

I will not rest until we do. Join our fight ⬇️

https://t.co/VqogxdnG83",225.0
RonDeSantis,2023-05-31 04:46:24+00:00,"Our Great American Comeback begins in the Hawkeye State.

We will send Joe Biden back to his basement in Delaware.

Casey and I are grateful for the support! https://t.co/dddW3Juj0a",226.0
RonDeSantis,2023-05-31 04:46:24+00:00,"If you're ready to join the movement, text FREEDOM to 512345.",227.0
RonDeSantis,2023-05-29 21:58:56+00:00,"Our country is careening toward bankruptcy, and after this debt ceiling ""deal"" it will still be careening toward bankruptcy. The deal green lights $4 trillion in new debt over the next year and a half, locks in inflated levels of spending from COVID, and keeps 98% of the Biden IRS expansion.",228.0
RonDeSantis,2023-05-24 23:58:08+00:00,I’m running for president to lead our Great American Comeback. https://t.co/YmkWkLaVDg,229.0
RonDeSantis,2023-05-24 00:06:48+00:00,RT @CaseyDeSantis: America is worth the fight... Every. Single. Time. https://t.co/lWNQ3DIXgp,230.0
CaseyDeSantis,2023-05-24 00:06:20+00:00,America is worth the fight... Every. Single. Time. https://t.co/lWNQ3DIXgp,231.0
RonDeSantis,2023-05-23 14:33:53+00:00,"RT @Had a great discussion at the National Religious Broadcasters Convention on the importance of supporting families, protecting children and defending religious liberty. https://t.co/4yWnU5MrNS",232.0
GovRonDeSantis,2023-05-23 14:10:11+00:00,"Had a great discussion at the National Religious Broadcasters Convention on the importance of supporting families, protecting children and defending religious liberty. https://t.co/4yWnU5MrNS",233.0
RonDeSantis,2023-05-23 14:33:50+00:00,"RT @Proud to sign Curtis’ Law, which will assist families during criminal investigations into the death of a minor. The rights of victims matter and grieving family members have a right to be informed about the status of relevant investigations. 

I am grateful for the hard work that Curtis’ family put into making this reform a reality.",234.0
GovRonDeSantis,2023-05-23 00:31:39+00:00,"Proud to sign Curtis’ Law, which will assist families during criminal investigations into the death of a minor. The rights of victims matter and grieving family members have a right to be informed about the status of relevant investigations. 

I am grateful for the hard work that Curtis’ family put into making this reform a reality.",235.0
RonDeSantis,2023-05-23 14:33:48+00:00,"RT @This past weekend, I was able to speak at the Florida Family Policy Council about what we are doing to keep Florida the freest state in the nation. 

Thanks to the FFPC for giving me the Wilberforce Award! https://t.co/ERwBcYgy20",236.0
GovRonDeSantis,2023-05-22 18:00:03+00:00,"This past weekend, I was able to speak at the Florida Family Policy Council about what we are doing to keep Florida the freest state in the nation. 

Thanks to the FFPC for giving me the Wilberforce Award! https://t.co/ERwBcYgy20",237.0
RonDeSantis,2023-05-20 18:55:00+00:00,"RT @This Police Week, Florida says thank you to the men and women in law enforcement who put their lives on the line every day to keep our communities safe and ensure that Florida is a law &amp; order state. https://t.co/X9LBmONRSC",238.0
GovRonDeSantis,2023-05-20 15:18:55+00:00,"This Police Week, Florida says thank you to the men and women in law enforcement who put their lives on the line every day to keep our communities safe and ensure that Florida is a law &amp; order state. https://t.co/X9LBmONRSC",239.0
RonDeSantis,2023-09-13 18:06:11+00:00,"When I’m president, the days of the DC Establishment spending this country into oblivion are over.

I’ve had enough of the elites imposing their will on us.

Now is the time for We the People to impose OUR will on them. https://t.co/8abcHAUOB6",240.0
RonDeSantis,2023-05-20 14:08:57+00:00,"RT @Operation Lone Star is underway with Florida deploying law enforcement officers and special agents to protect the Southern Border in Texas.

When the federal government refuses to step up — Florida stands ready to serve. https://t.co/TxstjUWEOV",241.0
GovRonDeSantis,2023-05-20 01:44:03+00:00,"Operation Lone Star is underway with Florida deploying law enforcement officers and special agents to protect the Southern Border in Texas.

When the federal government refuses to step up — Florida stands ready to serve. https://t.co/TxstjUWEOV",242.0
RonDeSantis,2023-05-20 14:08:54+00:00,RT @Florida’s tourism industry is thriving with a single quarter record of 37.9 million visitors to the Sunshine State. https://t.co/JpitV6fFCC,243.0
GovRonDeSantis,2023-05-19 22:48:50+00:00,Florida’s tourism industry is thriving with a single quarter record of 37.9 million visitors to the Sunshine State. https://t.co/JpitV6fFCC,244.0
RonDeSantis,2023-05-19 16:11:07+00:00,"RT @Public bathrooms, changing rooms, and locker rooms in Florida will have separate facilities based on biological sex.

Our wives and daughters deserve protections from woke ideology run amok. https://t.co/PHKPCVORRl",245.0
GovRonDeSantis,2023-05-18 18:33:22+00:00,"Public bathrooms, changing rooms, and locker rooms in Florida will have separate facilities based on biological sex.

Our wives and daughters deserve protections from woke ideology run amok. https://t.co/PHKPCVORRl",246.0
RonDeSantis,2023-05-17 19:20:27+00:00,"RT @Florida is expanding Parents’ Rights in Education to cover grades pre-K to 8.

Teachers of young children and tweens should be focused on reading comprehension — not gender fluidity and pronouns. https://t.co/PWos2qesmQ",247.0
GovRonDeSantis,2023-05-17 18:31:11+00:00,"Florida is expanding Parents’ Rights in Education to cover grades pre-K to 8.

Teachers of young children and tweens should be focused on reading comprehension — not gender fluidity and pronouns. https://t.co/PWos2qesmQ",248.0
RonDeSantis,2023-05-17 19:20:24+00:00,"RT @Florida students and teachers will no longer have to “declare” their pronouns in school or be forced to use pronouns not based on biological sex.

Our teachers will focus on what matters — reading, writing, and arithmetic. https://t.co/XviQB23lLF",249.0
GovRonDeSantis,2023-05-17 18:00:32+00:00,"Florida students and teachers will no longer have to “declare” their pronouns in school or be forced to use pronouns not based on biological sex.

Our teachers will focus on what matters — reading, writing, and arithmetic. https://t.co/XviQB23lLF",250.0
RonDeSantis,2023-05-17 19:20:22+00:00,"RT @With my signature, Florida permanently prohibits genital mutilating surgical procedures and experimental puberty blockers for minors.

Minors given these procedures without their consent will now be able to recover damages for permanent injury or death caused by these medical experiments.",251.0
GovRonDeSantis,2023-05-17 17:20:45+00:00,"With my signature, Florida permanently prohibits genital mutilating surgical procedures and experimental puberty blockers for minors.

Minors given these procedures without their consent will now be able to recover damages for permanent injury or death caused by these medical experiments.",252.0
RonDeSantis,2023-05-17 15:06:27+00:00,"RT @To combat human trafficking, Florida hotels will be required to follow current human trafficking awareness laws and to enhance our protection for the likeliest targets — young children.

Hotels will be required to maintain strict compliance, and non-compliance will result in daily fines in the thousands of dollars.",253.0
GovRonDeSantis,2023-05-17 00:45:26+00:00,"To combat human trafficking, Florida hotels will be required to follow current human trafficking awareness laws and to enhance our protection for the likeliest targets — young children.

Hotels will be required to maintain strict compliance, and non-compliance will result in daily fines in the thousands of dollars.",254.0
RonDeSantis,2023-05-16 19:49:02+00:00,"RT @Today I signed legislation to combat human trafficking and support victims of these terrible crimes.

Victims will now be able to:
Recover damages from adult entertainment establishments;
Receive restitution from the sale of their trafficker’s seized property; and
Participate in educational programs offering alternatives to prostitution and adult entertainment.",255.0
