username,orario,text,Unnamed: 0
RonDeSantis,2023-08-18 22:58:15+00:00,"Faith and family are the building blocks of our society — and that is why the Left is waging a full-on assault against them.

We must stand strong for religious liberty. https://t.co/DueCSWltQt",86.0
RonDeSantis,2023-08-18 20:53:00+00:00,"The Mexican drug cartels are killing tens of thousands of Americans every single year.

This cannot go on.

As President, I will build the wall, stop the invasion, and authorize use of force against drug smugglers breaking into our country.

Cartels who seek to harm Americans will end up stone cold dead.",87.0
RonDeSantis,2023-08-16 02:36:03+00:00,"This month marks the second anniversary of Biden's disastrous withdrawal from Afghanistan.

Americans and our Afghan allies were left behind. Thirteen brave servicemembers were killed. Intelligence warnings that the Taliban would quickly take over were ignored. Billions of dollars in U.S. military equipment were gifted to the Taliban.

Since one of the worst foreign policy failures in U.S. history, our enemies including China, Russia, and Iran have become more emboldened. Afghanistan has once again become a terror safe haven as the Taliban eliminates rights for women under its tyranny.

It is a disgrace no one has been held accountable.",88.0
RonDeSantis,2023-08-15 22:02:15+00:00,"Since 2019, spending for federal agencies has increased by 50 percent.

Do you feel better off as a result of this expansion of government?

As President, I will reduce spending and the footprint of these agencies by at least 50 percent.

Here’s how: https://t.co/1ZtiHuzGRh",89.0
RonDeSantis,2023-09-13 18:06:11+00:00,"When I’m president, the days of the DC Establishment spending this country into oblivion are over.

I’ve had enough of the elites imposing their will on us.

Now is the time for We the People to impose OUR will on them. https://t.co/8abcHAUOB6",90.0
RonDeSantis,2023-08-15 02:43:01+00:00,"Would I renominate Jerome Powell as chair of the Federal Reserve?

No. https://t.co/vCaLzcJZiN",91.0
RonDeSantis,2023-08-13 17:53:42+00:00,"Had a great day at the Iowa State Fair with @CaseyDeSantis, Madison, Mason &amp; Mamie. Grateful to all of the Iowa leadership and legislators who spent the day with us, and the many Iowans who stopped me to express their support. https://t.co/cOBCCYlcQv",92.0
RonDeSantis,2023-08-12 02:54:45+00:00,"Great to hear from voters in Guthrie County about the issues that matter most to their families and communities.  

Together, we will help our country get back on the right track – and that starts with sending Joe Biden back to his basement! https://t.co/0gPZBKsuY4",93.0
RonDeSantis,2023-08-12 00:23:55+00:00,"Honored to have the support of this American hero: Bob Van Horn, the last living World War II veteran in Carroll County, Iowa. https://t.co/2j8ij14DVl",94.0
RonDeSantis,2023-08-11 22:29:03+00:00,Great to visit the Harlan American Legion today in Shelby County. https://t.co/7TQcWj3x4x,95.0
RonDeSantis,2023-08-11 20:52:36+00:00,"Our family enjoyed visiting with local elected officials and members of the community at Downtowner Family Restaurant in Atlantic today. 

Thank you for your hospitality, Cass County! https://t.co/q4WKkFDZqL",96.0
RonDeSantis,2023-08-11 19:30:08+00:00,"I’m honored to receive the endorsement from the great @SteveDeaceShow 

Like so many Iowans, Steve knows the time for excuses is over. We will get the job done in 2024! https://t.co/RCIURzKbK4",97.0
RonDeSantis,2023-08-11 17:44:37+00:00,"Every year since 1999, Bubba Sorensen has painted the Menlo Freedom Rock to honor America’s veterans. Bubba’s dedication inspired a movement: Today, all 99 counties in Iowa have their own Freedom Rocks.

Check out https://t.co/eLBMHKutNO to learn more about this patriotic project!",98.0
RonDeSantis,2023-08-11 01:38:53+00:00,"Biden is shamefully caving to Iran’s blackmail and extortion. Rewarding Iran for taking Americans hostage incentivizes more hostage-taking.

The $6 billion ransom payment will help Iran build nuclear weapons, support terrorism, oppress the Iranian people, and assist Russia. Biden's appeasement and weakness emboldens Iran to attack us and our allies, and facilitates Iran becoming closer than ever to nuclear weapons.

Biden must stop obsessively pursuing disastrous deals that endanger our security. It is time to stand up to Iran with maximum pressure and roll back Iran's malign influence.",99.0
RonDeSantis,2023-08-10 23:02:33+00:00,"We appreciated the chance to meet so many freedom loving Iowans in Johnson County and to share our vision for America’s comeback.

Thank you for the warm welcome! https://t.co/8LSIkXAFMt",100.0
RonDeSantis,2023-08-10 21:12:39+00:00,".@CaseyDeSantis and I enjoyed visiting the Tipton Family Restaurant &amp; Cedar County's finest this morning. 

We will always stand with the men and women of law enforcement, who put so much on the line to keep their communities safe. https://t.co/X0JoWn5cYP",101.0
RonDeSantis,2023-08-10 18:09:56+00:00,"Bidenomics means middle class Americans pay more for life’s necessities while DC insiders benefit.

As president, I'll declare our economic independence from the elites and Communist China, unleash domestic energy production, reduce inflationary spending, and revive our stagnant economy.",102.0
dcexaminer,2023-08-10 14:42:30+00:00,"#BREAKING: Inflation rose slightly to a 3.2% rate for the year ending in July, the first increase after a full year of declines, the Bureau of Labor Statistics reported on Thursday in an update to the consumer price index. https://t.co/5n5lV3XE4f",103.0
RonDeSantis,2023-08-10 16:53:32+00:00,"It’s disgraceful for the FBI to target Catholics as “extremists” — and for Christopher Wray to allow it.

As President, I will defend religious liberty, stop the weaponization of our federal government once and for all, and I will fire Wray.
https://t.co/QaBFFAWeAh",104.0
RonDeSantis,2023-08-09 22:06:19+00:00,"RT @When our country was under attack, Ron DeSantis fought back.

He joined the Navy JAG and deployed to Iraq with SEAL Team 1.

He embodies service over self.

As the father of our three young children, he understands the importance of the fights ahead.

Ron DeSantis is the fighter we need as President.",105.0
CaseyDeSantis,2023-08-09 22:05:31+00:00,"When our country was under attack, Ron DeSantis fought back.

He joined the Navy JAG and deployed to Iraq with SEAL Team 1.

He embodies service over self.

As the father of our three young children, he understands the importance of the fights ahead.

Ron DeSantis is the fighter we need as President.",106.0
RonDeSantis,2023-08-08 20:20:30+00:00,"Another example of why I will authorize use of deadly force at the border.

Are we supposed to just let these dangerous criminals invade our country?",107.0
BillMelugin_,2023-08-08 16:04:06+00:00,"NEW: Per law enforcement source, a group of suspected cartel gunmen armed with rifles &amp; body armor were seen on cameras crossing illegally into the Fronton, TX area in the RGV Saturday night. Elite Border Patrol BORTAC agents were called out &amp; searched area, but found nobody. https://t.co/9GuhQngPKj",108.0
RonDeSantis,2023-08-08 18:51:19+00:00,"Today, drug cartels are responsible for killing more Americans than any other group or country. Yet we just sit back and do nothing?

As President, I will authorize use of deadly force against drug smugglers cutting through the border wall.

We have to take the fight to the cartels.",109.0
RonDeSantis,2023-08-07 22:04:11+00:00,"America's middle class is struggling — with the American dream slipping away from millions of our fellow citizens.

As president, I have a plan to rebuild the economy and restore the middle class.

Read more in my @USATODAY op-ed:
https://t.co/ip7QE06544",110.0
RonDeSantis,2023-08-06 20:16:56+00:00,"Casey and I enjoyed spending time with our friends @bobvanderplaats and Darla at Soteria Des Moines.

Thank you for the wonderful prayer and for welcoming us to worship.",111.0
bobvanderplaats,2023-08-06 19:55:42+00:00,Blessed to have Governor @RonDeSantis and First Lady @CaseyDeSantis join Darla and me for Church this morning! I Timothy 2:1-4 #ChooseWell2024 https://t.co/9YLkJbmKRw,112.0
RonDeSantis,2023-08-05 18:50:33+00:00,"Driving through Benton County and noticed Peggy’s signs, so we stopped by to thank her for her support. https://t.co/RRJXQsPAqx",113.0
RonDeSantis,2023-08-05 18:15:38+00:00,Great to be in Black Hawk County this morning to meet with community leaders and supporters. https://t.co/jLCf1wyHVJ,114.0
RonDeSantis,2023-09-13 18:06:11+00:00,"When I’m president, the days of the DC Establishment spending this country into oblivion are over.

I’ve had enough of the elites imposing their will on us.

Now is the time for We the People to impose OUR will on them. https://t.co/8abcHAUOB6",115.0
RonDeSantis,2023-08-05 15:58:23+00:00,"Washington's spending binges have fueled inflation and enriched the ruling class at the expense of American families.

We haven’t had a president since Ronald Reagan who took a stand against Congress overspending.

I will be that president. https://t.co/W8gK589DPQ",116.0
RonDeSantis,2023-08-04 23:12:17+00:00,"How many of America's decisions are being made in consultation with the CCP? This is a gross violation of our national security and a recipe for disaster.

The DeSantis Administration will not be consulting the Chinese Communist Party on ANY national decisions.

When I'm president, I will fully unleash American energy production and will never ask permission from our adversaries to put America's interests first.",117.0
FoxNews,2023-08-04 15:05:04+00:00,Energy Sec Granholm secretly consulted top CCP energy official before SPR releases https://t.co/30vdjjW9eA,118.0
RonDeSantis,2023-08-04 21:23:03+00:00,"Happy birthday to my friend, @KimReynoldsIA! 

The great state of Iowa is lucky to have you. https://t.co/0xvk9kzqgj",119.0
RonDeSantis,2023-08-04 19:58:46+00:00,"We enjoyed serving ice cream this morning at WW Homestead Dairy, a third-generation family farm in Allamakee County.

Our Declaration of Economic Independence means downsizing the federal government and standing up for family farms and other small businesses.

Check them out if you’re in the area — they’re famous for their grilled cheese: https://t.co/4DlkI2J9UF",120.0
RonDeSantis,2023-08-04 17:20:11+00:00,It appears the NBA took a break from protesting our anthem and bending the knee to Communist China to chirp about my policies.,121.0
TheNBPA,2023-08-03 19:21:06+00:00,"A statement from the NBPA on the Orlando Magic’s recent political donations.

Official statement: https://t.co/6fmRZCxVzG https://t.co/JQEk0V4Ztl",122.0
RonDeSantis,2023-08-04 13:50:08+00:00,"For decades, the D.C. political establishment — in both parties — has pushed for mass illegal immigration.

The Beltway elites' immigration agenda has driven down wages, divided our nation, and made it harder for American citizens to achieve the American Dream.

We need a secure border and an immigration policy that benefits Americans. As President, I will deliver. #NoExcuses",123.0
RonDeSantis,2023-08-03 15:49:08+00:00,"We must achieve energy independence.

To restore our industrial base.

To stop inflation and make life more affordable.

And for the sake of our national security.

As President, I will immediately reverse every Biden Administration mandate, regulation, and rule kneecapping American energy production.",124.0
RonDeSantis,2023-08-03 03:47:00+00:00,"The debate between California and Florida is already over. People have been voting with their feet for years.

But the debate about the future of our country is one we need to have.

I'm game to talk about my plans to reverse the decline in this country anytime, anywhere, because I have the best vision for the future of our country.",125.0
RonDeSantis,2023-08-02 20:09:15+00:00,"The naysayers have been attacking me for years.

They wrote me off during COVID because I stood against Faucism.

They attacked when I stood up for children against Disney.

But we continue to lead and deliver results. https://t.co/pysvC9YAxO",126.0
RonDeSantis,2023-08-01 23:51:45+00:00,"As President, I will end the weaponization of government, replace the FBI Director, and ensure a single standard of justice for all Americans.

While I’ve seen reports, I have not read the indictment. I do, though, believe we need to enact reforms so that Americans have the right to remove cases from Washington, DC to their home districts.

Washington, DC is a “swamp” and it is unfair to have to stand trial before a jury that is reflective of the swamp mentality. 

One of the reasons our country is in decline is the politicization of the rule of law. No more excuses—I will end the weaponization of the federal government.",127.0
RonDeSantis,2023-08-01 18:10:54+00:00,"This is an unacceptable revelation about a dangerous China-linked biolab in our own backyard.

Our country does not not have the serious leadership needed to confront this threat.

In Florida, we ejected the CCP. As President, I will ensure there will be NO China-backed bioexperimentation happening on American soil.",128.0
NRO,2023-07-31 21:25:26+00:00,"Prestige Biotech, a Chinese medical company, operated an illegal lab in California where they bioengineered and infected mice with HIV, E. Coli, malaria, and Covid. | @ariblaff 

https://t.co/xzkWQh5CkW",129.0
RonDeSantis,2023-08-01 14:10:58+00:00,"We’ve had a generation of kids go to college and end up deep into debt with little to show for it.

The Left’s solution is to force taxpayers to pay off this debt.

Here’s a better solution: Make the colleges and universities foot the bill. And let student loans be dischargeable in bankruptcy.",130.0
RonDeSantis,2023-08-01 01:14:15+00:00,"I don’t bend the knee to lies manufactured by corporate media and the Left.

When the Left lies and creates phony narratives — as Kamala Harris is doing — I push back. https://t.co/EhLtMNuIeD",131.0
RonDeSantis,2023-07-31 23:50:31+00:00,"The question is: what kind of country do we want to have?

I want a country where Americans that work hard are able to get ahead, raise a family, and lead fulfilling, productive lives.

If we can’t get that right, we will not succeed as a country. https://t.co/Ao2mjo9GT4",132.0
RonDeSantis,2023-07-31 21:26:49+00:00,"As President, I won’t sit there like a wallflower.

I will fight for working people.

I will fight for our families.

I will fight for our way of life.

I will never back down, and we will finally take back control of our economy from the ruling class. https://t.co/gixnPlVFms",133.0
RonDeSantis,2023-07-31 17:33:32+00:00,RT @TeamDeSantis: Ron DeSantis Unveils Declaration of Economic Independence https://t.co/jE7ZO7BdzU,134.0
TeamDeSantis,2023-07-31 17:23:40+00:00,Ron DeSantis Unveils Declaration of Economic Independence https://t.co/jE7ZO7BdzU,135.0
RonDeSantis,2023-07-30 20:18:01+00:00,"To the Left, citizenship is meaningless. Illinois is now letting illegal aliens become police officers.

In Florida, we took action to combat the harms of Biden’s border crisis. We also value our citizen officers who serve and protect our communities.

As President, I will restore American sovereignty.

No illegal alien should have authority over any American citizen. It is a sad commentary on the state of America that this is even a debate.",136.0
RonDeSantis,2023-07-29 17:02:39+00:00,"This is just the latest — and absurd — example of the weaponization of the federal government.

Standing up the lies of people like Kamala Harris is the right thing to do. We will defend Florida and stand firm against false, politically-driven narratives.

As President I will end the weaponization of government and hold partisan bureaucrats accountable for abusing their power.
https://t.co/D2EDajQ3OW",137.0
RonDeSantis,2023-07-29 00:59:37+00:00,"I am not going to let Joe Biden get away with sitting in his basement this election.

We are going to run him ragged and hold him accountable.

Thank you to Mahaska County, Iowa for the warm welcome! https://t.co/hQiGWzAUUs",138.0
RonDeSantis,2023-07-28 21:14:22+00:00,"Government cannot be allowed to collude with big corporations to censor information from the public. The more we learn about examples like this, the more we know just how bad it has gotten.

As president, I will end the censorship regime once and for all.
https://t.co/e1U23k4Pqn",139.0
RonDeSantis,2023-09-13 18:06:11+00:00,"When I’m president, the days of the DC Establishment spending this country into oblivion are over.

I’ve had enough of the elites imposing their will on us.

Now is the time for We the People to impose OUR will on them. https://t.co/8abcHAUOB6",140.0
RonDeSantis,2023-07-28 19:05:03+00:00,"Really enjoyed speaking to and meeting with a great group of Iowans at the Freedom Rock in Appanoose County. 

I appreciate the support from our veterans! https://t.co/BQqzQNqazb",141.0
RonDeSantis,2023-07-28 16:49:11+00:00,"In Florida, we fought back against elites who wanted to plunge society into lockdown dystopia.

Federal COVID policies sparked a massive transfer of wealth from working people to Google, Amazon, and other big corporations. https://t.co/OsLtDkX8yt",142.0
RonDeSantis,2023-07-28 03:36:04+00:00,"Thank you to the McBee Meat Company in Lamoni, Iowa for the tour this afternoon. 

Check them out if you are interested in high-quality Midwest beef: https://t.co/uj6Zmn90JU https://t.co/EIYPAF1GHD",143.0
RonDeSantis,2023-07-28 00:49:32+00:00,"Met some great Iowans at the Wayne County Fair with Senator Amy Sinclair &amp; Sheriff Keith Davis this afternoon. 

I was happy to thank Ralph Alshouse for his heroic service during WWII! https://t.co/i6piwMu4yV",144.0
RonDeSantis,2023-07-27 21:53:45+00:00,"RT @The Harris-Biden Administration and corporate media continue to lie about Florida’s education standards. 

Watch Governor @RonDeSantis fight back with the truth… and win. https://t.co/PWwveQXbHA",145.0
CaseyDeSantis,2023-07-27 21:10:19+00:00,"The Harris-Biden Administration and corporate media continue to lie about Florida’s education standards. 

Watch Governor @RonDeSantis fight back with the truth… and win. https://t.co/PWwveQXbHA",146.0
RonDeSantis,2023-07-26 22:15:12+00:00,"With the latest rate hike, Americans are now facing the highest interest rates in over 20 years. The pain Americans are feeling is the direct result of the federal government borrowing and spending trillions of dollars since March 2020.

Politicians stroke checks they will never have to pay while buying a home or a car has become out-of-reach for many Americans.",147.0
RonDeSantis,2023-07-21 18:56:19+00:00,"Democrats like Kamala Harris have to lie about Florida's educational standards to cover for their agenda of indoctrinating students and pushing sexual topics onto children.

Florida stands in their way and we will continue to expose their agenda and their lies.",148.0
RonDeSantis,2023-07-21 18:56:19+00:00,"The Harris-Biden administration is obsessed with Florida...yet they ignore the chaos at the border, crime-infested cities, economic malaise, and the military recruitment crisis.

Maybe if Biden’s granddaughter moved to Florida he’d actually visit her.",149.0
RonDeSantis,2023-07-20 00:50:18+00:00,"When the media attacks you, you’re doing something right. @Jason_Aldean has nothing to apologize for.",150.0
Jason_Aldean,2023-07-18 21:17:28+00:00,"In the past 24 hours I have been accused of releasing a pro-lynching song (a song that has been out since May) and was subject to the comparison that I (direct quote) was not too pleased with the nationwide BLM protests. These references are not only meritless, but dangerous. There is not a single lyric in the song that references race or points to it- and there isn’t a single video clip that isn’t real news footage -and while I can try and respect others to have their own interpretation of a song with music- this one goes too far. 

As so many pointed out, I was present at Route 91-where so many lost their lives- and our community recently suffered another heartbreaking tragedy. NO ONE, including me, wants to continue to see senseless headlines or families ripped apart.

Try That In A Small Town, for me, refers to the feeling of a community that I had growing up, where we took care of our neighbors, regardless of differences of background or belief. Because they were our neighbors, and that was above any differences. My political views have never been something I’ve hidden from, and I know that a lot of us in this Country don’t agree on how we get back to a sense of normalcy where we go at least a day without a headline that keeps us up at night. But the desire for it to- that’s what this song is about.",151.0
RonDeSantis,2023-07-18 21:08:16+00:00,I sat down with pastors in South Carolina today to talk about how we can address issues such as religious liberty and promoting family. https://t.co/HhRvJjeYt2,152.0
RonDeSantis,2023-07-18 20:00:10+00:00,"Our military needs to focus on lethality, capability, and readiness — not a woke agenda or social experimentation.   

Today, I was in South Carolina to unveil my plan to refocus the military on the mission, not the political agenda of some civilians. https://t.co/tqrnJUf0sd",153.0
RonDeSantis,2023-07-18 18:20:25+00:00,"Today I officially filed the paperwork to be on the ballot in the Republican Presidential primary in South Carolina. 

American revival runs through the Palmetto State! 🇺🇸 https://t.co/xrqNXLVLP3",154.0
RonDeSantis,2023-07-18 01:51:18+00:00,"Chatting with voters in South Carolina today about breaking the swamp, reviving our economy, and protecting parents' rights. https://t.co/bB5n59NbGm",155.0
RonDeSantis,2023-07-17 21:30:14+00:00,"Today, I'm proud to announce that Florida has officially opened an investigation into Morningstar for potential violations of our anti-BDS law. 

We won't let them target Israel and get away with it. https://t.co/DNGg5ZgZwp",156.0
RonDeSantis,2023-07-13 21:25:30+00:00,https://t.co/tAzDQHzo4V,157.0
CNBC,2023-07-13 14:54:24+00:00,"Bob Iger responds to FL Gov. DeSantis’ Disney accusations: “The notion that Disney is in any way sexualizing children, quite frankly, is preposterous and inaccurate.” https://t.co/6gLqWDbQFn https://t.co/c3NtvfAW5l",158.0
RonDeSantis,2023-07-12 03:41:55+00:00,"How disrespectful for the U.S. Ambassador to Israel to falsely claim “most Israelis want the United States to be in their business.""

Biden meets with dictators of countries such as Venezuela but snubs the democratically elected Israeli Prime Minister Benjamin Netanyahu. This is not how you should treat an ally.

https://t.co/LeSqBi6Dlw",159.0
RonDeSantis,2023-07-11 00:25:15+00:00,".@KimReynoldsIA is a strong leader who knows how to ignore the chirping and get it done. She earned a landslide re-election because she delivered big results, and she is poised to deliver even more for Iowans in the special session.",160.0
RonDeSantis,2023-07-10 23:08:00+00:00,"Bidenomics means you pay more at the grocery store.

As president, I will rip up Joe Biden’s failed liberal economic agenda. We cannot settle for a declining standard of living.

https://t.co/uI4JB5xwjC",161.0
RonDeSantis,2023-07-10 20:19:30+00:00,"“The president's admonitions include: ‘God dammit, how the f**k don't you know this?!,’ ‘Don't f**king bullsh*t me!’ and ‘Get the f**k out of here!’""

This is how most Americans feel when the president tells them Bidenomics is working.

https://t.co/fPAMYVskjF",162.0
RonDeSantis,2023-07-09 03:03:11+00:00,"Miami-Dade County was historically a Democratic machine city. But last year, we broke that machine — for good. 

Our success in 2022 proves that Republicans can win again. Miami's present can be America's future. 

Our party — and our country — cannot afford to lose anymore. Our country is suffering under the Left’s stranglehold on power. We can’t leave our fellow citizens behind. That's why I'm running for president. 

We must take the victories we delivered in Miami and across the state of Florida and bring them to every corner of the nation. 

Thank you for having me, @MiamiDadeGOP. Let's continue winning — there's no alternative.",163.0
RonDeSantis,2023-09-13 18:06:11+00:00,"When I’m president, the days of the DC Establishment spending this country into oblivion are over.

I’ve had enough of the elites imposing their will on us.

Now is the time for We the People to impose OUR will on them. https://t.co/8abcHAUOB6",164.0
RonDeSantis,2023-07-08 22:45:31+00:00,"Under Biden, the military has been more concerned with woke ideology than fighting America's enemies.  
 
My administration will rip the political agenda out of the military and restore it to its proper glory.

https://t.co/lc8b9cveeV",165.0
RonDeSantis,2023-07-06 23:08:33+00:00,"RT @We will not allow you to exploit the innocence of our children to advance your agenda.

When you come after our kids, we fight back.

We are no longer silent.

We are united.

We are Mamas for DeSantis.

...and we will elect @RonDeSantis President of the United States.

Join our historic movement today: https://t.co/u5zx6bwdIt",166.0
CaseyDeSantis,2023-07-06 23:08:09+00:00,"We will not allow you to exploit the innocence of our children to advance your agenda.

When you come after our kids, we fight back.

We are no longer silent.

We are united.

We are Mamas for DeSantis.

...and we will elect @RonDeSantis President of the United States.

Join our historic movement today: https://t.co/u5zx6bwdIt",167.0
