username,orario,text
SenatorTimScott,2023-10-19 23:00:00+00:00,"Iran policy is Israel policy.
 
How we treat Israel’s greatest enemy—the largest state sponsor of terrorism in the world—directly impacts its ability to threaten our greatest ally in the region.
 
We cannot say we support Israel while we release billions to their enemies. https://t.co/n6R6m2MlRB"
SenatorTimScott,2023-10-19 20:45:00+00:00,"First, President Biden bypassed Congress by keeping Acting Labor Secretary Julie Su in office without Senate confirmation. Now, he's trying to put her into the presidential line of succession. I joined @SenKatieBritt in demanding answers.

Read more here⬇️
https://t.co/jlhhhEkWvv"
SenatorTimScott,2023-10-19 19:30:00+00:00,"Charter schools provide a quality education for kids across America, no matter their zip code. That's why I'm making it easier to open them in the communities that need them most and set every child up for a brighter future.

Learn more below⬇️
https://t.co/0Ey3mDSyIB"
SenatorTimScott,2023-10-19 18:02:22+00:00,Enjoyed meeting with the Carolinas Credit Union League! https://t.co/WNbXuttyTY
SenatorTimScott,2023-10-19 16:07:29+00:00,"From Harvard to Columbia, Americans have watched our institutions of higher learning turn into hotbeds of antisemitism. I'm fighting to cut federal funding to any university that enables, excuses or provides cover for blatant and outrageous antisemitism.
https://t.co/uFaUhyHlxj"
SenatorTimScott,2023-10-19 15:00:02+00:00,"If you take out a loan, you pay it back. 

The Biden administration’s efforts to circumvent Congress and, effectively, secretly forgive even more COVID loans is not only unacceptable, but unconstitutional.
https://t.co/iU82PMX7eK"
SenatorTimScott,2023-10-19 00:48:52+00:00,"This afternoon, I stood on the Senate floor to condemn the antisemitism sweeping our world and stand up for the Jewish people's right to exist. 

America's heart is too big for bigotry. https://t.co/vfpW2Hcgd4"
SenatorTimScott,2023-10-19 00:00:00+00:00,"Israel isn’t just fighting Hamas-it's facing a war of misinformation. False narratives, like Hamas' Gaza hospital bombing, threaten the Jewish community.

At today’s @SenateForeign hearing, I encouraged the media to wait for the facts instead of promoting terrorists' messaging. https://t.co/tgCSbC7xFX"
SenatorTimScott,2023-10-18 22:52:51+00:00,"My bill, the Revoke Iranian Funding Act, requires the Treasury Secretary to report all of Iran’s assets so we can hit them where it hurts the most – their wallet.
 
They must pay for what they have done – period. https://t.co/NNpvLh65tg"
SenatorTimScott,2023-10-18 17:13:03+00:00,"RT @Hamas couldn’t have planned or carried out its attack against Israel without support from Iran, the world’s number one state sponsor of terrorism. This week, I joined @SenatorTimScott to introduce the Revoke Iranian Funding Act."
SenatorFischer,2023-10-18 01:12:44+00:00,"Hamas couldn’t have planned or carried out its attack against Israel without support from Iran, the world’s number one state sponsor of terrorism. This week, I joined @SenatorTimScott to introduce the Revoke Iranian Funding Act."
SenatorTimScott,2023-10-18 17:13:01+00:00,"RT @Our bill will halt efforts to provide billions of dollars to Iran. It will also increase transparency by providing Congress with more information about Iran’s high-value assets around the world that are currently subject to U.S. sanctions.
https://t.co/sgXEgQXg5K"
SenatorFischer,2023-10-18 01:12:44+00:00,"Our bill will halt efforts to provide billions of dollars to Iran. It will also increase transparency by providing Congress with more information about Iran’s high-value assets around the world that are currently subject to U.S. sanctions.
https://t.co/sgXEgQXg5K"
SenatorTimScott,2023-10-18 00:38:15+00:00,"RT @Congress needs to act to:

1) Permanently freeze the $6 billion of Iranian assets
2) Take further steps to ensure the regime is denied its sanctioned assets

@SenatorTimScott’s bill does exactly that.

WATCH on @FoxBusiness: https://t.co/T7qAuw1aCx"
BankingGOP,2023-10-18 00:14:50+00:00,"Congress needs to act to:

1) Permanently freeze the $6 billion of Iranian assets
2) Take further steps to ensure the regime is denied its sanctioned assets

@SenatorTimScott’s bill does exactly that.

WATCH on @FoxBusiness: https://t.co/T7qAuw1aCx"
WhiteHouse,2023-10-05 18:30:00+00:00,Guess what? It also grows the economy. Benefits everybody. Hurts nobody.
SenatorTimScott,2023-10-05 20:35:07+00:00,Praying for the family and friends of 23-year-old Deputy Jacob Salrin who died on duty in a fatal crash. This is an incredible loss for the @RCSD and the Salrin family. Grieving with them as they navigate this heartbreaking time.
CurtisWilson275,2023-10-05 18:15:06+00:00,Saying farewell to Deputy Jacob Salrin affectionately known as Jake 🙏🏽 #RichlandCountySheriff @RCSD #fallenangel #lawenforcement #policeofficers #deputysheriff #OPLive #onpatrollive https://t.co/Jgl7u5LCsq
SenatorTimScott,2023-10-05 17:30:00+00:00,"I still remember two teachers, Mrs. Lynch and Mrs. Greenberg, who changed my life. On World Teachers Day, I’m thankful for teachers like them whose dedication unlocks a world of endless possibility for kids. https://t.co/U9M8S0oVNP"
SenatorTimScott,2023-10-05 15:03:53+00:00,"Restricting oil production makes gas prices go up. The President’s failure to grasp this simple reality is hurting the American people.
https://t.co/ZYuKJb61qp"
SenatorTimScott,2023-10-06 00:34:30+00:00,"If by “nobody” President Biden means the 87% of Americans without student debt who are now forced to pay off loans they didn't take out...
 
Middle-class Americans are already struggling to fill up their tanks and keep the lights on.

If you take out a loan, you pay it back."
SenatorTimScott,2023-09-29 15:09:19+00:00,"Saddened to learn of Senator Feinstein’s passing. A true trailblazer, she leaves behind a lasting legacy of service in the Senate. My prayers are with her family during this time of loss."
SenatorTimScott,2023-09-29 01:53:04+00:00,RT @The Fed’s IG report on the Silicon Valley Bank failure confirms what @SenatorTimScott has continuously stated: the repeated supervisory failures of regulators contributed to the bank’s collapse. https://t.co/RBBg17UwTr
BankingGOP,2023-09-29 01:35:52+00:00,The Fed’s IG report on the Silicon Valley Bank failure confirms what @SenatorTimScott has continuously stated: the repeated supervisory failures of regulators contributed to the bank’s collapse. https://t.co/RBBg17UwTr
SenatorTimScott,2023-09-28 18:00:01+00:00,"While the President refuses to visit the border:
  📈 Illegal border crossings have soared;
  📈Nearly 70,000 lives have been lost to fentanyl per year;
  📈 85,000 children are lost.

Republicans have passed border security bills. President Biden needs to wake up and do his job."
SenatorTimScott,2023-09-28 16:00:01+00:00,"Whether they're Republican or Democrat, most Americans agree President Biden needs to do more to stop the flow of fentanyl across his open border.
https://t.co/47QDxm4YGt"
SenatorTimScott,2023-09-27 17:00:02+00:00,"I couldn’t agree more with school choice champion @BetsyDeVos that empowering parents with education freedom is key to solving America’s learning crisis.
https://t.co/IK0QuBYEX9"
SenatorTimScott,2023-09-27 15:15:00+00:00,"Because of President Biden's open border, 85,000 kids are lost, fentanyl claims nearly 70,000 lives a year, and over 7 million illegal immigrants have poured over our border.

President Biden’s dereliction of duty will affect our nation for years to come."
SenatorTimScott,2023-09-27 00:00:00+00:00,It’s great to see Fairfax keeping the Gullah tradition alive and strong in South Carolina! https://t.co/qLktU3o5km
SenatorTimScott,2023-09-26 22:01:18+00:00,"Over 8,000 migrants overwhelmed Eagle Pass, Texas in the past week.
 
Its population is only 30,000.
 
I’m fighting to end this crisis by championing the Secure the Border Act. It’s time for Congress to come together and pass it. https://t.co/sSy0JTHq2I"
SenatorTimScott,2023-09-26 19:30:00+00:00,Congratulations to @SchoolClassical for being selected as a quarterfinalist for the prestigious @YassPrize! I’m proud to celebrate schools like Charleston Classical Academy for transforming students’ lives through innovation and choice.
SenatorTimScott,2023-09-26 18:15:41+00:00,"With a historic 11,000 encounters at the southern border in just 24 hours, Border Patrol Chief Jason Owens has it right when he says “this is not sustainable.” 

It's time for President Biden to do his job and secure our border.
https://t.co/ZoultWMILS"
SenatorTimScott,2023-09-25 14:34:58+00:00,Wishing those who celebrate a blessed Yom Kippur. G’mar Hatimah Tovah!
SenatorTimScott,2023-09-23 15:00:01+00:00,"League Academy is a nationally recognized magnet middle school propelling students to success through a well-rounded, liberal arts education. I’m thankful @leagueacademysc is empowering kids to achieve excellence in South Carolina! #SCSweetTea https://t.co/shvj6k5YeC"
SenatorTimScott,2023-09-22 21:00:00+00:00,"This Girl Scout is making South Carolina proud with her efforts to honor our fallen heroes. Keep up the good work!
https://t.co/OAw3SjpEkN"
SenatorTimScott,2023-09-22 18:00:01+00:00,"Whether they're Democrat or Republican, the overwhelming majority of Americans believe the White House has failed them on inflation. It's time to put American families first.
 https://t.co/2uyKdJkbX8"
SenatorTimScott,2023-09-22 15:00:02+00:00,"It’s a tragedy that the Biden administration’s open border continues to fuel the fentanyl crisis. I’m calling on Congress to pass my FEND Off Fentanyl Act and rid our communities of this poison.
https://t.co/6JOxXPZJLH"
SenatorTimScott,2023-09-21 23:00:01+00:00,"I'm so proud that 5 South Carolina schools have been selected as National Blue Ribbon Schools based on their record of academic excellence. They have gone above and beyond to provide a quality education, the closest thing to magic in America.
 https://t.co/iqz71Byq8m"
SenatorTimScott,2023-09-21 21:00:00+00:00,"This is great news! Learning the financial basics empowered me to build a better life, and now, it’s going to afford students across South Carolina the opportunity to do the same.
https://t.co/5YHQ1MM1Kk"
SenatorTimScott,2023-09-21 18:00:00+00:00,"When open borders become a green light for child trafficking, it’s evil—not compassionate.
https://t.co/gtx3Vkfi1K"
SenatorTimScott,2023-09-21 16:04:45+00:00,"Instead of working with Congress to prevent a government shutdown, President Biden is focused on appeasing Green New Deal activists with billions of taxpayer dollars. 

He needs to get his priorities straight.
https://t.co/acI7ls0wpS"
SenatorTimScott,2023-09-21 01:00:01+00:00,"The @ChasRiverDogs only play to win!
https://t.co/45hzljAbSx"
SenatorTimScott,2023-09-20 22:59:20+00:00,"The Biden administration wants you to believe what it’s saying over what you’re seeing with your own eyes!

The facts don't lie.

There is a crisis at our southern border, and it's because of President Biden's dereliction of duty.
 https://t.co/z6J6P9hlYb"
SenatorTimScott,2023-09-20 20:30:00+00:00,"With record numbers of terrorists pouring into our country, we are less safe because this President refuses to recognize border security is national security.
https://t.co/pb0S6KcmC2"
SenatorTimScott,2023-09-20 17:45:00+00:00,"Last night, I was honored to receive the Distinguished Christian Statesman Award. This honor is a reminder that my life would not be possible without God's hope of redemption. https://t.co/ap0o5AeCLS"
SenatorTimScott,2023-09-20 16:45:27+00:00,"The White House is missing 85,000 migrant children who have crossed its open border.

This is a humanitarian crisis."
SenatorTimScott,2023-09-20 00:00:00+00:00,"I’m glad these POW’s are finally getting some of the recognition they deserve. They embody what it means to live a life of duty and sacrifice.
https://t.co/vUYDMu0gC5"
SenatorTimScott,2023-09-19 22:31:12+00:00,"RT @Burdensome regulations &amp; inflation are making homes unaffordable under President Biden. @SenatorTimScott's solution, the ROAD to Housing Act, aims to make homeownership more attainable by increasing the nation’s housing supply and improving affordability.
https://t.co/D0HePgKr0f"
BankingGOP,2023-09-19 20:51:57+00:00,"Burdensome regulations &amp; inflation are making homes unaffordable under President Biden. @SenatorTimScott's solution, the ROAD to Housing Act, aims to make homeownership more attainable by increasing the nation’s housing supply and improving affordability.
https://t.co/D0HePgKr0f"
FoxBusiness,2023-09-17 08:35:28+00:00,Millennials feel they missed 'golden opportunity' to buy a home https://t.co/Ndu4HK0Ti7
SenatorTimScott,2023-09-19 20:50:24+00:00,"The Biden administration's open border policy has fueled the humanitarian, fentanyl and national security crises at our southern border. We must end this tragedy and secure the border.
https://t.co/2ulYTe6DrO"
SenatorTimScott,2023-09-19 19:00:01+00:00,"Under President Biden's open border policy, up to 200 illegal immigrants are being released into this Arizona town each day.

This is not sustainable.
https://t.co/PJLCJn6nrh"
SenatorTimScott,2023-09-19 17:54:25+00:00,Thanks to my amazing team for their birthday wishes today! https://t.co/Bz049FSjux
SenatorTimScott,2023-09-18 23:00:00+00:00,"Head on over to the Upstate this Thanksgiving!
https://t.co/I9uZWkhbHz"
SenatorTimScott,2023-09-18 19:00:02+00:00,"Each year, over 15,000 children are diagnosed with cancer across the country. During National Childhood Cancer Awareness Month, we honor the precious lives lost, survivors, and all families affected by childhood cancer."
SenatorTimScott,2023-09-18 15:00:01+00:00,"Thank you @portergaud for supporting HBCUs! For generations, these institutions have rooted students in a rich tradition of excellence.
https://t.co/A1GWCkk89A"
SenatorTimScott,2023-09-17 15:00:02+00:00,"Since its signing in 1787, the Constitution has grounded our nation in liberty—shining bright as a beacon of light to the world. https://t.co/TWR6VdgDv3"
SenatorTimScott,2023-09-16 17:00:00+00:00,"Growing up mired in poverty, learning financial basics was key to unlocking a better life. Greer High's mission to teach students financial literacy is unleashing their boundless potential and equipping South Carolina's next generation of leaders to succeed. #SCSweetTea https://t.co/GupiIEjQg5"
SenatorTimScott,2023-09-16 13:30:00+00:00,Wishing all who celebrate a blessed Rosh Hashanah. https://t.co/1EayrMptkk
SenatorTimScott,2023-09-15 22:00:19+00:00,"While the Biden administration attacks energy production in the face of record high gas prices, I will always stand by my belief that Americans deserve affordable and reliable energy. https://t.co/VwfhlQ8A3z"
SenatorTimScott,2023-09-15 18:00:02+00:00,"Do to others what you would have them do to you. When an Upstate police officer followed the Golden Rule, his generosity changed a life and serves as a shining example of how to serve others.
https://t.co/ufysb1k8iC"
SenatorTimScott,2023-09-15 15:45:00+00:00,"During #NationalHispanicHeritageMonth, we celebrate the millions of Hispanic Americans who are woven into the very fabric of our nation. I'm thankful for the special part they share in our American story. https://t.co/ddO2l4w21g"
SenatorTimScott,2023-09-14 22:00:00+00:00,"During Team Scott’s recent tour of Bosch’s Anderson facility, we loved learning about the wealth of jobs and opportunities @BoschUSA is creating in South Carolina! https://t.co/hg9VuNZvZJ"
SenatorTimScott,2023-09-14 19:00:02+00:00,"Americans are watching their cost of living go up, while their standard of living goes down. We need new leadership to reverse this economic decline.
 https://t.co/1NzQ9Ynvd1"
SenatorTimScott,2023-09-14 17:09:59+00:00,"RT @NEW VIDEO🎥: For the first time in a year, @BankingGOP Republicans had the opportunity to press @GaryGensler directly and hold him accountable for his burdensome regulatory agenda. https://t.co/7g1bkSyH0f"
BankingGOP,2023-09-14 14:24:17+00:00,"NEW VIDEO🎥: For the first time in a year, @BankingGOP Republicans had the opportunity to press @GaryGensler directly and hold him accountable for his burdensome regulatory agenda. https://t.co/7g1bkSyH0f"
SenatorTimScott,2023-09-14 15:00:03+00:00,"President Biden’s economy has made it harder for families to save, businesses to grow, and people to flourish. Saving the American Dream starts with unleashing the free market, cutting red tape, and reigning in spending.
https://t.co/pKwXdfoPnu"
SenatorTimScott,2023-09-13 23:00:01+00:00,Everyone deserves the opportunity to unlock their full potential. It’s great to see a new Spartanburg family center helping folks do just that. https://t.co/EAIAMIGgRy
SenatorTimScott,2023-09-13 21:35:48+00:00,"RT @Instead of upholding @SECGov’s mission to protect investors, Chair Gensler has pushed for a radical and unnecessary rewrite of well-functioning securities rules at the expense of hardworking American investors and retirement savers. https://t.co/s6HZdLBTwq"
BankingGOP,2023-09-13 18:48:03+00:00,"Instead of upholding @SECGov’s mission to protect investors, Chair Gensler has pushed for a radical and unnecessary rewrite of well-functioning securities rules at the expense of hardworking American investors and retirement savers. https://t.co/s6HZdLBTwq"
SenatorTimScott,2023-09-13 20:00:00+00:00,"Once again, President Biden has been hoodwinked by Iran, risking American lives and our national security.
 
The administration has repeatedly claimed this ransom payment will only be used for humanitarian needs.

They're either lying or dangerously naive. https://t.co/505qgaSAnc"
SenatorTimScott,2023-09-13 18:00:01+00:00,"With SEC regulations impacting the savings and investments of hardworking Americans, it's critical the SEC is transparent in its rulemaking process.
 
I called out Chair @GaryGensler for evading congressional oversight and demanded accountability on behalf of the American people. https://t.co/go6kFIDIUy"
SenatorTimScott,2023-09-13 16:01:49+00:00,"Americans are facing a new economic reality: they’re spending more and getting less. This is wrong.
https://t.co/mZ2I7WzqPq"
SenatorTimScott,2023-09-13 00:00:01+00:00,"American families continue to grapple with sky high prices. The good news is, we can turn the tide by cutting the inflationary government spending and burdensome regulations currently crushing Americans. https://t.co/rbI0oESdYE"
SenatorTimScott,2023-09-12 22:00:00+00:00,"China wants to rewrite the ""rules of the game."" If the United States won’t push back, who will? 

The Biden administration must check the CCP’s aggression if we are going to remain the leader of the free world. https://t.co/QzoFVVpa7s"
SenatorTimScott,2023-09-12 19:36:32+00:00,"Instead of imposing more burdensome regulations, the SEC should facilitate fair, efficient, and innovative markets so Americans from all backgrounds can grow their savings, attain financial security and live out their version of the American Dream. https://t.co/Htc2TkmUJK"
SenatorTimScott,2023-09-12 16:22:41+00:00,"President Biden can’t seem to cut his habit of sending money to terrorists. First, it was $400 million to Iran in 2016 when he was VP. Now, it’s $6 billion to Iran on 22nd anniversary of 9/11. This President is putting a price on American lives. Enough is enough."
AP,2023-09-11 21:57:56+00:00,BREAKING: Biden administration clears the way for the release of five American citizens detained in Iran by issuing a blanket waiver for international banks to transfer $6 billion in frozen Iranian money and agreeing to release five Iranian citizens. https://t.co/Py4LuWy9a7
SenatorTimScott,2023-09-11 22:00:01+00:00,"The Biden administration’s failure to lead has emboldened our adversaries and enabled the CCP to undermine our military. We need strength, not weakness, if we're going to keep the American Dream alive for the next generation.
https://t.co/keopns43Vj"
SenatorTimScott,2023-09-11 17:30:00+00:00,"South Carolina native Major Norwood has built his life on hard work and faithful service. I’m proud his commitment to our country is being recognized!
 https://t.co/Os7fdL4vef"
SenatorTimScott,2023-09-11 14:54:27+00:00,"May we #NeverForget the innocent lives lost 22 years ago today, the sacrifice of our first responders and the ordinary Americans who became heroes. Amidst the pain, let us remember the unity and resolve that mended a heartbroken nation and strive to better her each and every day. https://t.co/uONrkjucMR"
SenatorTimScott,2023-09-10 16:20:22+00:00,"On #NationalGrandparentsDay, I remember mine defined by quiet dignity and stubborn optimism, believing in the goodness of America and its future despite their present. My grandparents have passed to glory, but they planted the seeds of everything I need - faith, hope and love."
SenatorTimScott,2023-09-09 15:00:00+00:00,"When the Rhodes family called my office to assist them with passport delays, we were able to help their daughter make it to Sweden and play in the world’s largest youth soccer tournament. I'm blessed to serve South Carolinians like this every single day! #SCSweetTea https://t.co/8eUMEYxuXu"
SenatorTimScott,2023-09-08 22:00:01+00:00,South Carolinians shouldn’t be struggling just to afford a tank of gas. This is what failed leadership looks like. https://t.co/EFknXs5ROG
SenatorTimScott,2023-09-08 18:00:00+00:00,"Migrants illegally trafficked through our open border are abused, raped, and even killed on their way to the U.S.  President Biden’s open border policies are anything but humane. https://t.co/KweE9DE6yi"
SenatorTimScott,2023-09-08 16:00:03+00:00,"Whether it's at the pump, or the grocery store, the Biden administration's actions are keeping prices high for Americans.

Americans deserve affordable and reliable energy, not broken promises.
 https://t.co/B8xifozrDP"
SenatorTimScott,2023-09-07 23:31:37+00:00,"During Team Scott’s recent tour of the Michelin facility in Anderson, they got a glimpse of the great work Michelin is doing in South Carolina. We’re blessed with vibrant businesses that bring opportunities to folks across the state! https://t.co/bBgPFVCxzN"
SenatorTimScott,2023-09-07 23:20:01+00:00,"RT @Our state-regulated insurance system results in highly competitive, affordable markets across the country. Federal government intervention is not the solution. https://t.co/3gcKlGilXd"
BankingGOP,2023-09-07 22:30:00+00:00,"Our state-regulated insurance system results in highly competitive, affordable markets across the country. Federal government intervention is not the solution. https://t.co/3gcKlGilXd"
SenatorTimScott,2023-09-07 19:22:19+00:00,"As a member of @SenateForeign, I was honored to meet with Australia's Ambassador to the U.S. @AmboRudd. Strengthening our alliance is critical as we face shared challenges and strive to foster an open and secure Indo-Pacific, free from CCP aggression. https://t.co/eJR1tpfZ6m"
SenatorTimScott,2023-09-07 18:00:00+00:00,"The numbers don’t lie: the border crisis is not going away. 

It’s time we recognize that border security is national security and secure our country.
https://t.co/DbMACSkDYK"
SenatorTimScott,2023-09-07 17:37:51+00:00,"RT @America's state-based insurance system is the gold standard, but poor regulations in some states raise costs & reduce coverage availability for homeowners.

By prioritizing competition & cutting red-tape, more affordable coverage can provide families the peace of mind they deserve."
BankingGOP,2023-09-07 17:20:22+00:00,"America's state-based insurance system is the gold standard, but poor regulations in some states raise costs & reduce coverage availability for homeowners.

By prioritizing competition & cutting red-tape, more affordable coverage can provide families the peace of mind they deserve."
SenatorTimScott,2023-09-07 15:30:01+00:00,"High gas prices hit hardest for those who can least afford it.

Ramping up domestic energy production is a key step towards fixing this affordability crisis.
https://t.co/oI6RRB8A3K"
SenatorTimScott,2023-09-06 22:00:00+00:00,"School choice is a win for every child!
​​https://t.co/Nqfo4UQ9cI"
SenatorTimScott,2023-09-06 20:00:01+00:00,"The fentanyl crisis is taking a toll on communities across America. Thank you, @MarshaBlackburn, for your support of the FEND Off Fentanyl Act. With your help, we can finally curb the flow of fentanyl into the U.S. https://t.co/vMhmc8BHAD"
SenatorTimScott,2023-09-06 18:00:02+00:00,President Biden’s latest student loan scheme forces hardworking Americans to pay for billions in loans they never signed up for. I joined my Senate colleagues to stop this reckless and unfair action.  https://t.co/bePoLNtvnP
SenatorTimScott,2023-09-05 20:30:00+00:00,"Families across our country are facing a crisis at the kitchen table. This administration needs to look in the mirror and take responsibility for devastating our economy.
https://t.co/BGAYuMnLto"
SenatorTimScott,2023-09-05 17:36:35+00:00,RT @The Chinese Communist Party wants to influence &amp; undermine American schools. @SenatorTimScott is leading the charge in protecting America’s future. https://t.co/oNYCPCTnTj
BankingGOP,2023-09-05 17:25:32+00:00,The Chinese Communist Party wants to influence &amp; undermine American schools. @SenatorTimScott is leading the charge in protecting America’s future. https://t.co/oNYCPCTnTj
SenatorTimScott,2023-09-05 16:00:01+00:00,Celebrating the incredible opportunity this South Carolina pastor had to share his faith! https://t.co/M7p4AQwaR6
SenatorTimScott,2023-09-04 15:00:02+00:00,Happy #LaborDay to every hardworking American—you're the backbone of our nation!
