username,orario,text
SenatorTimScott,2023-05-29 16:00:02+00:00,"Freedom isn't free. From the 1776 revolutionaries to the heroes at Normandy, millions of our soldiers have paid the ultimate price to protect our God-given rights. This Memorial Day, I am recognizing the debt we owe to every brave service member. They gave their life for liberty. https://t.co/qlZP1mW6OD"
SenatorTimScott,2023-05-27 15:01:08+00:00,"Brushy Creek Elementary School wouldn’t be the same without Mrs. Finch. For 50 years, she has been the epitome of a servant leader and generations of students love her for it. What an incredible impact she has had on her community! #SCSweetTea
https://t.co/haxAsYpv1e"
SenatorTimScott,2023-05-26 23:00:00+00:00,"President Biden's EPA has overstepped its' authority yet again. These absurd regulations would make it even harder for Americans to afford a car. I'm standing with my Senate colleagues to protect working families from this latest unconstitutional mandate. 
https://t.co/PUKWwRsaQC"
SenatorTimScott,2023-05-26 19:00:02+00:00,"Democrats shut down our country to protect us from a virus, yet they refuse to secure our border to protect us from the deadly fentanyl epidemic.

Americans have had enough of this double standard. We must give Border Patrol the tools they need to safeguard our country."
SenatorTimScott,2023-05-26 17:00:00+00:00,"America must take the threat posed by the Chinese Communist Party seriously, and it is imperative that we take additional steps to secure our critical infrastructure.
https://t.co/MOAS3ApGJB"
SenatorTimScott,2023-05-26 16:00:00+00:00,"Working 16 hours a day as a nurse’s aide, my mama taught me there is dignity in all work. While President Biden has incentivized millions to drop out of the workforce, I’ll always fight to empower Americans with jobs, the true key to opportunity."
SenatorTimScott,2023-05-26 00:00:02+00:00,"Americans have the right to work and live as they see fit. That’s why I’ve always fought to keep the power in their hands, not the federal government’s. This is a big victory for freedom-loving Americans!
https://t.co/EYtqrjedjK"
SenatorTimScott,2023-05-25 22:30:13+00:00,"More and more evidence shows that Chinese suppliers are fueling the devastating fentanyl crisis. We must hold them accountable for their part in spreading this poison and killing hundreds of thousands of Americans. My FEND Off Fentanyl Act does just that.
https://t.co/kHSQqzUsBh"
SenatorTimScott,2023-05-25 19:00:03+00:00,Inflation is a punishing tax we are all being forced to pay. South Carolinians deserve a leader who will lower the cost of living. https://t.co/RebwnuuMhf
SenatorTimScott,2023-05-25 17:02:25+00:00,"Americans’ energy bills have surged as President Biden has shut down domestic energy production. With new leadership, we can tap into our abundant natural resources, lower energy costs, and create thousands of blue-collar jobs."
SenatorTimScott,2023-05-25 15:01:21+00:00,"I love to see what these brothers are doing for South Carolina! They are a wonderful example of how to use your talents to grow community and jobs.
https://t.co/OjPd8B8EFy"
SenatorTimScott,2023-05-24 22:00:00+00:00,"In the 5 years since I championed the creation of Opportunity Zones, OZ's have sparked change in thousands of low-income communities. Lifting Americans out of poverty and onto the economic ladder is something we can always celebrate. 
https://t.co/pOSKbN9MkR"
SenatorTimScott,2023-05-24 19:00:03+00:00,"In just 2 short years, the Biden economy has crushed economic opportunity. I believe our best days are still ahead of us, but we need a leader who will reign in excessive spending, cut burdensome regulations, and invest in our innovative private-sector.
https://t.co/K5U2YmEor7"
SenatorTimScott,2023-05-24 17:00:03+00:00,President Biden’s open border policy is an attack on every county in America. A nation without borders is a nation devoid of law and liberty. Restoring hope in the future of America starts with securing our border.
SenatorTimScott,2023-05-24 15:00:01+00:00,"The IRS is out of control. Every American should be alarmed when the government wants total control over the tax filing process. Taxpayers have the right to an independent and transparent system, and I refuse to accept this blatant conflict of interest.
https://t.co/6vquhsGzzB"
SenatorTimScott,2023-05-24 00:00:01+00:00,"In just 2 years, the Biden administration has made everything worse for Americans. Our country deserves better than this. https://t.co/g2lZsa7tGu"
SenatorTimScott,2023-05-23 22:00:01+00:00,"The Biden administration wants to pretend there is no border crisis. The truth is, thousands of illegal immigrants are being released into our country. Americans deserve a leader who treats this problem with the urgency it deserves.
https://t.co/fs80Bd3QpF"
SenatorTimScott,2023-05-23 19:48:13+00:00,"On this day in 1788, South Carolina entered into the union. Our state has enjoyed a rich journey of growth and opportunity, and it is truly an honor to serve her people."
SenatorTimScott,2023-05-23 18:01:51+00:00,"As Ranking Member of @BankingGOP, I am calling on our regulators to stop pointing fingers and accept responsibility for failing to do their job. https://t.co/XmOxpD6OJm"
SenatorTimScott,2023-05-23 15:23:49+00:00,"Heartbroken to learn of the passing of my friend Chief Luther Reynolds. An unwavering servant and family man, I pray his family and loved ones feel God's comfort during this difficult time. He will be sorely missed."
SenatorTimScott,2023-05-22 22:00:00+00:00,"Americans can’t even afford to keep their lights on. We have to get back to commonsense economic policies that safe-guard America’s celebrated standard of living.
https://t.co/vdC70VP0by"
SenatorTimScott,2023-05-22 21:00:01+00:00,"Democrats have fought to keep our borders open. What they don’t tell Americans is that their policies have caused human trafficking rates to skyrocket,  destroying countless lives.

We can end this humanitarian crisis by securing our border."
SenatorTimScott,2023-05-22 15:00:01+00:00,President Biden is on track to become the first President in American history to default on the debt limit. We need a leader who is able to step up to the plate and negotiate a responsible budget.
SenatorTimScott,2023-05-20 18:01:43+00:00,"America’s armed forces are real-life heroes to me. This Armed Forces Day, I want to thank the brave men and women who have served our nation. It’s because of their sacrifice, that we can live freely.  #ArmedForcesDay https://t.co/BjPBuFhsnY"
SenatorTimScott,2023-05-20 15:01:10+00:00,Congratulations to the South Carolina students who won a statewide writing contest! Watching the next generation develop their talents gives me hope for the future and makes me proud of the Palmetto State. #SCSweetTea https://t.co/zbFeLeOH3D
SenatorTimScott,2023-05-20 00:21:04+00:00,"Heartbroken to learn of the passing of a dear friend and spiritual mentor, Tim Keller. I've known Tim since I was first elected to Congress and he helped me to live a faith-filled life. His life reminds us to keep the main thing the main thing as we pursue our purpose."
SenatorTimScott,2023-05-19 21:00:02+00:00,"As hardworking Americans continue to grapple with higher costs, it's clear we need to cut spending, balance the budget, and rein in our debt.

President Biden has shown us we need new leadership for that to happen."
SenatorTimScott,2023-05-19 19:30:00+00:00,"President Biden’s inflationary policies are crippling job growth. Building opportunity for every American starts with cutting his reckless spending.
https://t.co/XYixDhzN1J"
SenatorTimScott,2023-05-19 15:00:02+00:00,"Dorothy’s secret to a beautiful life is simple: love others. I’m a firm believer if we all followed her example, our nation would be a better place. Thank you, Dorothy, for your faithful service to South Carolina’s veterans.
https://t.co/gXLNcsBcxi"
SenatorTimScott,2023-05-19 00:00:01+00:00,"When financial regulators fail to do their jobs and then demand more power, everyday Americans pay the price.
 
Increasing regulations will only restrict access to credit and make it harder to start businesses and own homes. https://t.co/XoQXgv0gVY"
SenatorTimScott,2023-05-18 22:27:57+00:00,I’m leading @BankingGOP’s opposition to growth-killing regulations that hurt small businesses and everyday Americans. https://t.co/db5AI0ADXy
SenatorTimScott,2023-05-18 21:00:02+00:00,"Jewish Americans’ extraordinary accomplishments have pushed America forward as a beacon of hope, faith, and freedom. I am proud to stand with the Jewish community, and against the increasing tide of despicable, antisemitic hate.
https://t.co/AAUyvv55Dq"
SenatorTimScott,2023-05-18 20:00:02+00:00,"Time after time, this President has failed to keep Americans safe. I‘m taking a stand for commonsense solutions to end this border crisis and protect our communities. https://t.co/jgWIih6J2O"
SenatorTimScott,2023-05-18 18:00:00+00:00,"Under the Biden administration, the cost of living has skyrocketed. Americans can't take this much longer.

I’m doing everything in my power to restore commonsense economic solutions before it's too late.
https://t.co/g2fnXny6cf"
SenatorTimScott,2023-05-18 16:34:58+00:00,"I was proud to join my colleagues in standing with our police officers. Our men and women in blue put their lives on the line every day and deserve all the support they can get.
https://t.co/i2r7rBAxEs"
SenatorTimScott,2023-05-18 00:00:00+00:00,"I know Luther to be a servant, friend, and family man. I am saddened by this terrible news. I am praying that God would give Luther and his family peace and comfort in this difficult time."
Live5News,2023-05-17 20:38:02+00:00,Charleston Police chief announces he will enter hospice care  #chsnews https://t.co/KLNxnWV790
SenatorTimScott,2023-05-17 22:00:00+00:00,"In the 69 years since Brown v. Board of Education, our nation has made tremendous strides towards a more perfect union. We owe the freedom and opportunity we enjoy today to yesterday's heroes and their fearless stand for our God-given rights."
SenatorTimScott,2023-05-17 21:00:00+00:00,"Workforce challenges combined with increasing demand is making traveling a burden for Americans. I am working to strengthen the pipeline into the aviation sector to ensure we have reliable and efficient air travel.
https://t.co/hYkXXgTypa"
SenatorTimScott,2023-05-17 19:00:01+00:00,"The Democrats are trying to downplay the crisis at the border. The reality is, we have terrorists coming across our southern border. I’m fighting to keep this from becoming our new normal.
https://t.co/9tbkzHgQBd"
SenatorTimScott,2023-05-17 18:00:03+00:00,It’s always a pleasure to have South Carolinians in the office! #PalmettoWednesdays https://t.co/ZMauip8sCy
SenatorTimScott,2023-05-17 17:00:00+00:00,"As Ranking Member of the @SenateForeign Africa Subcommittee, I strongly condemn the attack against US embassy personnel in Nigeria. My heart goes out to our embassy staff &amp; their families in Lagos &amp; Abuja. We must ensure the safety of our diplomatic &amp; locally employed staff."
SenatorTimScott,2023-05-17 01:30:27+00:00,"Iran continues its push for a nuclear weapon and its support for proxy militias that target Americans. We must show Tehran that until its behavior changes, the US remains committed to maximum economic pressure. I introduced a bill to do just that.
https://t.co/bujyYX5BDd"
SenatorTimScott,2023-05-17 00:01:13+00:00,"It’s easy to take our teachers for granted, but Renee Atkinson deserves a special shoutout for going above and beyond for her students. Thank you for serving South Carolina!
https://t.co/YR2EUVwm8h"
SenatorTimScott,2023-05-16 23:00:02+00:00,Risk management is critical in our banking sector. SVB’s executives missed all the signs and failed to take mitigating action. https://t.co/ny7cOAAbHh
SenatorTimScott,2023-05-16 22:00:00+00:00,"Julie Su's anti-worker policies were a disaster in California. Now President Biden wants her to head the Department of Labor.

While they attack every rung of the ladder that helped me climb in life, I'm fighting to expand opportunities for EVERY American.
https://t.co/ELl9ZD51iY"
SenatorTimScott,2023-05-16 20:00:34+00:00,Americans deserve to understand why the executives of SVB and Signature Bank so terribly mismanaged their risk. I set out to get some answers at today’s @BankingGOP hearing. https://t.co/VmaQRISWIg
SenatorTimScott,2023-05-16 19:00:13+00:00,"Biden’s radical climate agenda hurts low-income Americans the most. The worst part? He doesn’t even seem to care.

I’m working to reign in high energy costs and keep the American dream alive for all.
https://t.co/C5X1hEZ94n"
SenatorTimScott,2023-05-16 18:01:19+00:00,"RT @.@SenatorTimScott to former CEO of Silicon Valley Bank: “I ran a business for a while. And I’ll tell you, honestly, I’m shocked at the complete negligence and disregard for the economic realities that this country was facing. Under your leadership, SVB made significant bets on interest rates falling when everything indicated exactly the opposite.”"
BankingGOP,2023-05-16 17:47:22+00:00,".@SenatorTimScott to former CEO of Silicon Valley Bank: “I ran a business for a while. And I’ll tell you, honestly, I’m shocked at the complete negligence and disregard for the economic realities that this country was facing. Under your leadership, SVB made significant bets on interest rates falling when everything indicated exactly the opposite.”"
SenatorTimScott,2023-05-16 16:06:00+00:00,President Biden letting Title 42 expire has only spurred more chaos at the border. I’m stepping up with solutions to stop the devastation and restore order. https://t.co/lTLH7CQ9C4
SenatorTimScott,2023-05-16 01:00:41+00:00,"President Biden’s incoherent border policies are enabling drug traffickers to bring fentanyl into our communities. 

My FEND Off Fentanyl Act aims to curb the flow of fentanyl into the U.S. by targeting the money that funds the cartels’ illegal activities. https://t.co/6xNOoaq5rU"
SenatorTimScott,2023-05-15 23:18:36+00:00,"Our police officers bravely answer the call of duty to protect our families each and every day. By ensuring the safety of our communities, we’re planting the seeds of hope for a better future for all Americans. I'll never waver in my commitment to support our police. #BacktheBlue"
SenatorTimScott,2023-05-15 21:37:25+00:00,"An Afghan terrorist was arrested at the border. Our enemies know our southern border is a vulnerability.

While Biden gives terrorists an open invite, I'm fighting to bolster border security, crack down on cartels, and keep our streets safe.
https://t.co/hUEAGGVmNq"
SenatorTimScott,2023-05-15 21:00:00+00:00,It was great to spend time with students at Palmetto Christian Academy today. I’m proud to support faith-based schools and the quality education they provide to thousands of kids across our great state. https://t.co/tp5wtFjy8w
SenatorTimScott,2023-05-15 19:45:00+00:00,"Pilot shortages have reached record highs, making routine trips a hassle for working Americans. I’m introducing legislation to grow the aviation workforce and make flight cancellations and delays the exception, not the norm.
https://t.co/JlvBQrlM4t"
SenatorTimScott,2023-05-15 17:00:00+00:00,"In President Biden’s America, every county is a border county. The solution is clear: secure our southern border. https://t.co/XkluBcmOxl"
SenatorTimScott,2023-05-14 19:00:01+00:00,"Apart from my faith in God, my mama is the single greatest reason I have made it this far in life. Happy Mother's Day, Mama."
SenatorTimScott,2023-05-13 19:04:40+00:00,"It’s wonderful to see nearly 200 students compete in the Charleston County School District Special Olympics and showcase their hard work. Nothing can stop these kids, and their can-do spirit is an inspiration to the Palmetto state.#SCSweetTea
https://t.co/qbSlhzN2vj"
SenatorTimScott,2023-05-13 01:00:01+00:00,"I say it all the time because it’s true - education is the closest thing to magic in America. It’s wonderful to see many in the Orangeburg community come together to expand that magic for their students.
https://t.co/eNDGvCfQpw"
SenatorTimScott,2023-05-12 22:13:11+00:00,I can’t think of any way to make America safer than to secure our southern border. My Title 42 legislation gives law enforcement the tools they need to crack down on crime and protect our people. https://t.co/2LfiUx0ULW
SenatorTimScott,2023-05-12 20:01:56+00:00,"The radical left wants you to believe their open borders policy is compassionate.

Nothing could be further from the truth. We’ve got to end this humanitarian crisis before more lives are destroyed by human trafficking. https://t.co/PqfXZUPrtk"
SenatorTimScott,2023-05-12 19:53:58+00:00,"RT @JUST IN: @SenatorTimScott &amp; @PatrickMcHenry urge President Biden to implement TikTok national security finding.
https://t.co/rq0O3jPITN"
BankingGOP,2023-05-12 19:42:49+00:00,"JUST IN: @SenatorTimScott &amp; @PatrickMcHenry urge President Biden to implement TikTok national security finding.
https://t.co/rq0O3jPITN"
SenatorTimScott,2023-05-12 15:00:38+00:00,"As a new wave of the Biden border crisis boils over with the expiration of Title 42, this administration is showing little interest in actually solving it. One thing is clear: America needs new leadership.

Acting now will ensure America’s best days are still ahead of her."
SenatorTimScott,2023-05-12 01:30:00+00:00,To our nurses: the work you do is more than a job - it’s a calling. I watched my mama spend 50 years as a nurse’s aide serving people during their darkest moments. Millions like her deserve our thanks for all they do to care for us. #NursesWeek
SenatorTimScott,2023-05-12 00:00:00+00:00,"Americans are being forced to settle for less in President Biden’s economy. I’m working to bring the basic cost of living down and restore opportunity in America.
https://t.co/cm06wV0Aw4"
SenatorTimScott,2023-05-11 22:42:28+00:00,"RT @Almost 2yrs after the Biden Admin’s disastrous withdrawal from #Afghanistan, State still refuses to provide us w/ a copy of the dissent cable warning of the rapidly deteriorating situation. @SenJohnThune &amp; I want answers for the American people. https://t.co/O7IgtDncJY"
SenateForeign,2023-05-11 22:34:46+00:00,"Almost 2yrs after the Biden Admin’s disastrous withdrawal from #Afghanistan, State still refuses to provide us w/ a copy of the dissent cable warning of the rapidly deteriorating situation. @SenJohnThune &amp; I want answers for the American people. https://t.co/O7IgtDncJY"
SenatorTimScott,2023-05-11 22:34:02+00:00,"The decision to end Title 42 will bring more fentanyl across our border and make it more accessible to every child and young adult in America.

Not on my watch. My legislation takes the fentanyl crisis seriously and gives Homeland Security the tools they need to end it."
SenatorTimScott,2023-05-11 21:00:30+00:00,Public charter schools have provided educational opportunity to millions of kids across America. Let’s keep giving families the freedom to choose and empower kids. #CharterSchoolsWeek https://t.co/6GqJ7SLUZ0
SenatorTimScott,2023-05-11 18:03:16+00:00,"Solutions to our border crisis are clear and simple: extend Title 42 authorities to stop illegal entries and trafficking, invest in border security, and financially cripple the drug cartels smuggling children and fentanyl into our country.
https://t.co/zTBO09UnPB"
SenatorTimScott,2023-05-11 16:00:02+00:00,"Other countries evacuated their citizens from Sudan before the State Department even began to assist Americans trying to leave. This is unacceptable. We must have proper contingency plans at US embassies to protect personnel and citizens in crises.
https://t.co/x6PwsT1V3w"
SenatorTimScott,2023-05-11 15:03:12+00:00,"Americans are tired of being controlled by big labor’s top-down policies. My Employee Rights Act puts workers first, freeing them to take part in the American economy.
https://t.co/R0a8yXir9M"
SenatorTimScott,2023-05-11 01:00:02+00:00,It was a pleasure spending time with students from @portergaud at the Capitol. These bright students make me optimistic for the future! https://t.co/esd2C6VGrZ
SenatorTimScott,2023-05-10 23:24:33+00:00,RT @It was great connecting with @SenatorTimScott for a meaningful conversation around critical issues such as security and economic prosperity in the Indo-Pacific region. I look forward to forging deeper bonds with the amazing people of South Carolina. -Ambassador Tomita https://t.co/4E5bKhFiOi
JapanEmbDC,2023-05-10 23:00:20+00:00,It was great connecting with @SenatorTimScott for a meaningful conversation around critical issues such as security and economic prosperity in the Indo-Pacific region. I look forward to forging deeper bonds with the amazing people of South Carolina. -Ambassador Tomita https://t.co/4E5bKhFiOi
SenatorTimScott,2023-05-10 22:45:34+00:00,"President Biden's decision to let Title 42 expire is a disaster.

Let’s codify the powers of Title 42 and apply them in response to the fentanyl epidemic.

My legislation does exactly that.
https://t.co/Q76MIsBAvo"
SenatorTimScott,2023-05-10 22:00:01+00:00,We need new leadership to secure our borders and dismantle the criminal cartels trafficking children and fentanyl across our border.
SenatorTimScott,2023-05-10 20:22:14+00:00,🌴🌙 #PalmettoWednesdays https://t.co/plVAwZyp6L
SenatorTimScott,2023-05-10 20:22:10+00:00,"RT @BankingGOP: FHFA should seek info BEFORE imposing a widely criticized change, not after.
https://t.co/EUn6kD8noA https://t.co/X9xGHbFlUG"
BankingGOP,2023-05-10 19:13:19+00:00,"FHFA should seek info BEFORE imposing a widely criticized change, not after.
https://t.co/EUn6kD8noA https://t.co/X9xGHbFlUG"
SenatorTimScott,2023-05-10 20:22:08+00:00,"RT @This week @SenatorTimScott asked @FHFA to justify its recent actions, including a new upfront fee for borrowers &amp; an unfair mortgage pricing change. FHFA announced it’s repealing the fee &amp; issuing a ‘request for information’ on the mortgage pricing change.
https://t.co/CawQ9HikeK"
BankingGOP,2023-05-10 19:13:17+00:00,"This week @SenatorTimScott asked @FHFA to justify its recent actions, including a new upfront fee for borrowers &amp; an unfair mortgage pricing change. FHFA announced it’s repealing the fee &amp; issuing a ‘request for information’ on the mortgage pricing change.
https://t.co/CawQ9HikeK"
SenatorTimScott,2023-05-10 17:09:46+00:00,"Every day, our brave men and women in uniform put their lives on the line so we can enjoy the freedoms that make the United States the greatest country on earth. Thank you for your selfless service. #MilitaryAppreciationMonth https://t.co/AEpIKYfCbZ"
SenatorTimScott,2023-05-10 15:20:52+00:00,"As member of the Senate Committee on Foreign Relations, I was honored to meet with Japanese Ambassador Tomita. Japan is a key ally for the US and deepening our countries’ relationship is critical as we pursue a free, open, and secure Asia-Pacific. https://t.co/DZqPGcpkdQ"
SenatorTimScott,2023-05-10 00:00:00+00:00,"Democrats’ reckless spending spree has made the American Dream harder and harder to achieve. Cutting back on inflationary spending will put more money into Americans’ pockets and put our families back on the path to a better life.
https://t.co/4cnZRHQ6KF"
SenatorTimScott,2023-05-09 23:09:12+00:00,RT @.@SenatorTimScott is translating awareness into action with the FEND Off Fentanyl Act. This bipartisan bill aims to curb the flow of fentanyl into the U.S. by targeting the illicit fentanyl supply chain &amp; choking off the funds of criminal cartels. #NationalFentanylAwarenessDay https://t.co/cUQYCJuwxF
BankingGOP,2023-05-09 22:14:10+00:00,.@SenatorTimScott is translating awareness into action with the FEND Off Fentanyl Act. This bipartisan bill aims to curb the flow of fentanyl into the U.S. by targeting the illicit fentanyl supply chain &amp; choking off the funds of criminal cartels. #NationalFentanylAwarenessDay https://t.co/cUQYCJuwxF
SenatorTimScott,2023-05-09 23:09:09+00:00,RT @Fentanyl is fueling the deadliest drug epidemic in U.S. history. Transnational criminal organizations from Mexico &amp; China traffic fentanyl across the border and sell it for massive sums—enabling them to fund the production of even more deadly drugs. #NationalFentanylAwarenessDay https://t.co/HdJarIlWzx
BankingGOP,2023-05-09 21:20:13+00:00,Fentanyl is fueling the deadliest drug epidemic in U.S. history. Transnational criminal organizations from Mexico &amp; China traffic fentanyl across the border and sell it for massive sums—enabling them to fund the production of even more deadly drugs. #NationalFentanylAwarenessDay https://t.co/HdJarIlWzx
SenatorTimScott,2023-05-09 23:01:02+00:00,Jewish Americans are a vibrant part of our nation’s history. We must reaffirm our commitment to not only calling out antisemitic hate but crushing it wherever it rears its ugly head. #JAHM2023
SenatorTimScott,2023-05-09 20:02:10+00:00,"While President Biden refuses to rise to his duty, I'm rising to mine. Under his failed leadership, fentanyl-related deaths, child trafficking, and cartel profits are up. My border plan puts an end to all of it."
SenatorTimScott,2023-05-09 19:00:08+00:00,"We can end this state of emergency with one simple solution: securing our border.
https://t.co/IZgI57O2zi"
SenatorTimScott,2023-05-09 18:06:22+00:00,"Charter schools provide a quality education – no matter a student’s zip code. I am proud to recognize the transforming impact they have made on millions of students. #CharterSchoolsWeek 
https://t.co/euiXFIBVsG"
