username,orario,text,Unnamed: 0
TheDemocrats,2023-09-25 18:30:05+00:00,"BIG NEWS: Starting today, you can order FREE COVID-19 tests delivered to your home. Get yours today by visiting https://t.co/VyVLw8YIEx.",
TheDemocrats,2023-09-25 17:45:29+00:00,WATCH: Trump takes CREDIT for the overturning of Roe v. Wade and paving the way for abortion bans across the country. https://t.co/BOto7kJHox,
TheDemocrats,2023-09-25 15:45:07+00:00,"The economy has created about 13.5 million jobs since President Biden took office, including over 800,000 manufacturing jobs. https://t.co/FMMrpMvUuu",
TheDemocrats,2023-09-25 00:06:21+00:00,President Biden is delivering for Gen Z 😎 https://t.co/bXVunxU6ii,
TheDemocrats,2023-09-24 03:15:15+00:00,The Biden-Harris administration is listening to young people 💙 https://t.co/60VwNfScEY,0.0
TheDemocrats,2023-09-24 01:34:11+00:00,He said it. https://t.co/1EDMfH9F1K,1.0
TheDemocrats,2023-09-23 23:39:00+00:00,"No one can be denied coverage for a preexisting condition thanks to the Affordable Care Act.

MAGA Republicans want to repeal the Affordable Care Act, which could strip away these protections.",2.0
TheDemocrats,2023-09-23 21:30:23+00:00,"It's National Public Lands Day! 

Explore the beauty of our natural landscapes today. Whether visiting a local park or hiking in the forest, nature has endless wonders to offer. https://t.co/6yHQOQFIit",3.0
TheDemocrats,2023-09-23 19:00:07+00:00,"This week, the Biden-Harris administration announced plans to remove medical debt from Americans' credit reports. 

It’s a big deal. 
https://t.co/hfIOhbZYwa",4.0
TheDemocrats,2023-09-23 16:15:09+00:00,🍂 Happy first day of fall! 🍂 https://t.co/qcefXJ2J2M,5.0
TheDemocrats,2023-09-23 02:04:05+00:00,Getting things done for the American people. https://t.co/U7qGaQ8vF3,6.0
TheDemocrats,2023-09-23 00:16:00+00:00,"“I felt like she actually gave us a voice and wants us to be heard and even gave us some strength,” O’Riordan, who is majoring in forensic psychology, said. “I just love her.” 💙
https://t.co/ryG3XzQc4l",7.0
TheDemocrats,2023-09-22 23:00:01+00:00,"RT @Tuesday, I’ll go to Michigan to join the picket line and stand in solidarity with the men and women of UAW as they fight for a fair share of the value they helped create.

It’s time for a win-win agreement that keeps American auto manufacturing thriving with well-paid UAW jobs.",8.0
POTUS,2023-09-22 22:56:21+00:00,"Tuesday, I’ll go to Michigan to join the picket line and stand in solidarity with the men and women of UAW as they fight for a fair share of the value they helped create.

It’s time for a win-win agreement that keeps American auto manufacturing thriving with well-paid UAW jobs.",9.0
TheDemocrats,2023-09-22 22:48:06+00:00,Another week delivering for the American people. https://t.co/QetbDRzKyn,10.0
TheDemocrats,2023-09-22 21:39:16+00:00,"Time to unpin that tweet, Kevin McCarthy. https://t.co/TZQYEEESeJ",11.0
TheDemocrats,2023-09-22 19:55:06+00:00,"President Biden's new Office of Gun Violence Prevention builds on historic actions he has taken to end gun violence in our country, including signing the Bipartisan Safer Communities Act and taking more executive actions than any other president to make our communities safer. https://t.co/MRrf43COK2",12.0
TheDemocrats,2023-09-22 18:58:47+00:00,RT @The new Office of Gun Violence Prevention will play a critical role in implementing @JoeBiden’s and my efforts to reduce gun violence while encouraging elected leaders and advocates to come together to save lives. https://t.co/YRZzDuNuyS,13.0
KamalaHarris,2023-09-22 18:12:08+00:00,The new Office of Gun Violence Prevention will play a critical role in implementing @JoeBiden’s and my efforts to reduce gun violence while encouraging elected leaders and advocates to come together to save lives. https://t.co/YRZzDuNuyS,14.0
TheDemocrats,2023-09-22 18:58:39+00:00,RT @JoeBiden: Yes. https://t.co/xgKhfKXBKa,15.0
JoeBiden,2023-09-22 15:56:31+00:00,Yes. https://t.co/xgKhfKXBKa,16.0
TheDemocrats,2023-09-22 17:52:04+00:00,"Trump on women who get an abortion: “There has to be some form of punishment.”

Trump on appointing the Supreme Court justices who overturned Roe v. Wade: “Nobody has ever done more [than me].”

Trump on signing a national abortion ban: “We’ll get it done.”",17.0
TheDemocrats,2023-09-22 14:45:06+00:00,"This is a significant step forward in helping to end gun violence. 

Thank you, President Biden. https://t.co/GtCqXGdT3A",18.0
TheDemocrats,2023-09-22 04:31:30+00:00,"RT @It was an honor to see President Zelenskyy again. The people of Ukraine are fighting bravely to defend their homes, their families, and for the principles of independence, sovereignty, and territorial integrity.

We will not waver in our support. https://t.co/s0VchusU2g",19.0
VP,2023-09-22 04:25:21+00:00,"It was an honor to see President Zelenskyy again. The people of Ukraine are fighting bravely to defend their homes, their families, and for the principles of independence, sovereignty, and territorial integrity.

We will not waver in our support. https://t.co/s0VchusU2g",20.0
TheDemocrats,2023-09-22 03:15:17+00:00,"RT @POTUS: Last time there was a government shutdown, 800,000 Americans were furloughed or worked without pay.

But enjoy your weekend.",21.0
POTUS,2023-09-22 00:51:26+00:00,"Last time there was a government shutdown, 800,000 Americans were furloughed or worked without pay.

But enjoy your weekend.",22.0
axios,2023-09-21 20:47:42+00:00,NEW: Congress is officially heading home for the weekend after House GOP hardliners once again tanked plans to fund the government by the Oct. 1 deadline. https://t.co/LPVm1w2XP2,23.0
TheDemocrats,2023-09-22 01:45:06+00:00,"President Biden’s revived Cancer Moonshot program aims to end cancer as we know it by:

🔵Preventing 4 million cancer deaths by 2047
🔵Investing in cancer research
🔵Improving early cancer detection
🔵Facilitating over 240 research projects https://t.co/dQosI5d5Jh",24.0
TheDemocrats,2023-09-22 00:17:05+00:00,President Biden will never stop fighting to deliver student loan relief. https://t.co/3Spqjef6O8,25.0
TheDemocrats,2023-09-22 00:15:52+00:00,"RT @Two nations. One clear, firm, and unwavering message: We stand together.

Дві країни. Один чіткий, твердий і непохитний сигнал: ми разом. https://t.co/d5VGFt8nJk",26.0
POTUS,2023-09-22 00:10:19+00:00,"Two nations. One clear, firm, and unwavering message: We stand together.

Дві країни. Один чіткий, твердий і непохитний сигнал: ми разом. https://t.co/d5VGFt8nJk",27.0
TheDemocrats,2023-09-21 23:13:26+00:00,Trump: “I was able to do something that nobody thought was possible. … We ended Roe v. Wade.” https://t.co/oB3PS2iwr6,28.0
TheDemocrats,2023-09-21 22:03:00+00:00,"As we approach this fall and winter, our defenses against major seasonal viruses are stronger than ever.

Learn about RSV and where to get updated COVID and flu vaccines near you at https://t.co/iJ6ny5xzua.",29.0
TheDemocrats,2023-09-21 21:26:01+00:00,"This week, House Democrats introduced the John R. Lewis Voting Rights Advancement Act to protect and expand the right to vote.

It’s time to #ProtectOurVotingRights.",30.0
TheDemocrats,2023-09-21 20:15:29+00:00,https://t.co/jvxAlkboHq,31.0
JakeSherman,2023-09-21 17:41:49+00:00,"Just to put this in context, republicans cannot even agree to debate the pentagon spending bill. This bill usually passes by big margins. 

It failed twice this week. 

Kevin mccarthys House Republicans are in a state of crisis.",32.0
TheDemocrats,2023-09-21 18:25:01+00:00,"Biden-Harris wins this week:

✅ Approved another $37 million of student loan cancellation
✅ Established the American Climate Corps
✅ Announced free at-home COVID tests
✅ Moving to restore benefits for LGBTQ+ veterans
✅ Announced the Partnership for Workers’ Rights",33.0
TheDemocrats,2023-09-21 16:00:22+00:00,"Too many in our communities, including our children, have been drinking contaminated water from lead pipes for years. 

Because Americans voted for @JoeBiden and @KamalaHarris, we’re working to remove all lead pipes in our nation.",34.0
TheDemocrats,2023-09-21 01:44:05+00:00,"NEWS: The Biden-Harris administration announced the creation of the American Climate Corps, which will help conserve our lands and waters and protect communities from floods and wildfires.

This is what taking action on climate looks like. https://t.co/0KvnKiQbzV",35.0
TheDemocrats,2023-09-21 00:50:00+00:00,"Yesterday, @HouseDemocrats introduced the John R. Lewis Voting Rights Advancement Act to protect and expand the right to vote.

Let’s get it done.",36.0
TheDemocrats,2023-09-21 00:15:22+00:00,Republicans with a slim House majority vs. Democrats with a slim House majority. https://t.co/Uh63N1rCQH,37.0
TheDemocrats,2023-09-20 22:30:08+00:00,"Under the Biden-Harris administration, we’ve seen the best two years for new business applications on record and we’re on track for a third. https://t.co/LvHHn4IUiz",38.0
TheDemocrats,2023-09-20 21:24:05+00:00,"RT @While Donald Trump takes credit for killing Roe v. Wade and would sign a national abortion ban, we will always fight to protect a woman’s freedom to choose.",39.0
JoeBiden,2023-09-20 20:30:03+00:00,"While Donald Trump takes credit for killing Roe v. Wade and would sign a national abortion ban, we will always fight to protect a woman’s freedom to choose.",40.0
TheDemocrats,2023-09-20 20:39:16+00:00,Here is Donald Trump saying “there has to be some form of punishment” for women who get an abortion. https://t.co/BtJdbOKsbG,41.0
TheDemocrats,2023-09-20 19:15:19+00:00,"Last week, Vice President @KamalaHarris kicked off her college tour at @_HamptonU! 🙌 https://t.co/tMoYAC2sNJ",42.0
TheDemocrats,2023-09-20 17:00:24+00:00,Congratulations to Lindsay Powell on winning the PA District 21 special election—retaining Democratic control of the Pennsylvania House! https://t.co/IyBFLf9JVB,43.0
TheDemocrats,2023-09-20 15:45:03+00:00,"President @JoeBiden's SAVE plan is a significant milestone in higher education affordability. 

By capping monthly payments based on income, it will help ease the financial strain on borrowers. Visit https://t.co/r61mfRoLFO to learn more.",44.0
TheDemocrats,2023-09-20 02:22:15+00:00,The difference. https://t.co/7IQ5BdPp0S,45.0
TheDemocrats,2023-09-20 01:28:05+00:00,"And there you have it. 

Trump wants you to remember he paved the way for abortion bans across the country. https://t.co/382qGSnYWp",46.0
TheDemocrats,2023-09-20 00:12:31+00:00,Your vote is your power. Make sure you’re registered to vote at https://t.co/ZKn8fJEh9z. https://t.co/0Motzp5oIk,47.0
TheDemocrats,2023-09-19 22:22:36+00:00,"RT @We are witnessing a full-on attack on our freedoms. Everything from making decisions about your own body to living free from gun violence is at stake.

Register to vote and then get 3 friends to do the same. 

Your vote is your voice→ https://t.co/VbrfuqVy9P. https://t.co/PuJHxJ9cDu",48.0
KamalaHarris,2023-09-19 21:50:06+00:00,"We are witnessing a full-on attack on our freedoms. Everything from making decisions about your own body to living free from gun violence is at stake.

Register to vote and then get 3 friends to do the same. 

Your vote is your voice→ https://t.co/VbrfuqVy9P. https://t.co/PuJHxJ9cDu",49.0
TheDemocrats,2023-09-19 21:41:12+00:00,"Taking on Big Pharma to lower prescription drug costs and cap insulin at $35 a month.
Investing in clean energy to lower energy bills.
Strengthening supply chains to help lower goods prices.

Bidenomics is lowering costs for hardworking families. https://t.co/K6GARWhpO7",50.0
TheDemocrats,2023-09-19 20:58:35+00:00,"RT @Donald Trump skipping the debate to rally with striking autoworkers is like a wolf showing up at a sheep convention promising ""better wool.""",51.0
stabenow,2023-09-19 19:56:50+00:00,"Donald Trump skipping the debate to rally with striking autoworkers is like a wolf showing up at a sheep convention promising ""better wool.""",52.0
TheDemocrats,2023-09-19 19:22:05+00:00,Vice President @KamalaHarris receives a warm welcome at @ncatsuaggies during her nationwide college tour. https://t.co/Ye2BkZhpKN,53.0
TheDemocrats,2023-09-19 19:06:35+00:00,"RT @As the late Representative John Lewis would say, “Democracy is not a state; it is an act.”

I will do everything in my power to protect the right to vote and ensure that every American has a free and fair opportunity to exercise this fundamental liberty.",54.0
JoeBiden,2023-09-19 19:00:14+00:00,"As the late Representative John Lewis would say, “Democracy is not a state; it is an act.”

I will do everything in my power to protect the right to vote and ensure that every American has a free and fair opportunity to exercise this fundamental liberty.",55.0
TheDemocrats,2023-09-19 18:58:36+00:00,"RT @If you want your representatives to support the issues you care about, it’s important to show up to vote in every election.

This National Voter Registration Day, register or update your voter registration at https://t.co/q00n5Woojf. Then ask your family and friends to do the same.",56.0
BarackObama,2023-09-19 18:50:43+00:00,"If you want your representatives to support the issues you care about, it’s important to show up to vote in every election.

This National Voter Registration Day, register or update your voter registration at https://t.co/q00n5Woojf. Then ask your family and friends to do the same.",57.0
TheDemocrats,2023-09-19 18:58:00+00:00,"RT @.@TheDemocrats published our Q3 social media scorecard update today to reflect changes social media companies have made to their approaches to misinformation.
https://t.co/o5OywtTcei https://t.co/lCWFAZxC1R",58.0
timothydurigan,2023-09-19 14:13:50+00:00,".@TheDemocrats published our Q3 social media scorecard update today to reflect changes social media companies have made to their approaches to misinformation.
https://t.co/o5OywtTcei https://t.co/lCWFAZxC1R",59.0
TheDemocrats,2023-09-19 18:00:17+00:00,"National Voter Registration Day is today! Here are ways you can take action: 
  
Register to vote 🗳️  
📝 Confirm your registration is up to date at https://t.co/ZKn8fJEh9z 
Tag 3️⃣ friends and make sure they’re registered",60.0
TheDemocrats,2023-09-19 17:00:16+00:00,"President @JoeBiden and Vice President @KamalaHarris are committed to delivering for young Americans by:

✅Investing in our schools and colleges
✅Supporting student borrowers
✅Standing up for reproductive rights
✅Taking action to end gun violence
✅Tackling the climate crisis",61.0
TheDemocrats,2023-09-19 15:00:21+00:00,"It’s National Voter Registration Day!

There is so much at stake: reproductive freedom, gun safety, LGBTQ+ rights, climate action, and much more. To ensure your voice is heard, check your voter registration: https://t.co/ZKn8fJEh9z https://t.co/y7EG0btwqh",62.0
TheDemocrats,2023-09-19 01:45:05+00:00,MAGAnomics is more extreme than anything many Americans have ever seen before. https://t.co/K3YH2PLqnC,63.0
TheDemocrats,2023-09-19 00:58:21+00:00,"Donald Trump owns every abortion ban across the country. 

Pass it on. https://t.co/Pj138nocfj",64.0
TheDemocrats,2023-09-18 23:01:16+00:00,"Trump lied.

President Biden delivers. https://t.co/sXUs9NUwbJ",65.0
TheDemocrats,2023-09-18 21:30:20+00:00,☕️💯 https://t.co/66t27Yhpzi https://t.co/UyUkWj6WtQ,66.0
TheDemocrats,2023-09-18 19:20:06+00:00,"Unemployment has been under 4% for 19 months in a row—the longest stretch in over 50 years. 

Thanks, President @JoeBiden. https://t.co/vn5sYSkzjd",67.0
TheDemocrats,2023-09-18 18:30:07+00:00,RT @KamalaHarris: Seeing our young leaders invested in the future of our country fills me with optimism. https://t.co/7pvN1qhgT9,68.0
KamalaHarris,2023-09-16 23:57:31+00:00,Seeing our young leaders invested in the future of our country fills me with optimism. https://t.co/7pvN1qhgT9,69.0
TheDemocrats,2023-09-18 18:09:16+00:00,“I’m the one that got rid of Roe v. Wade” —Donald Trump https://t.co/xdvKS7EcGK,70.0
TheDemocrats,2023-09-18 16:15:02+00:00,RT @JoeBiden: This is MAGAnomics. https://t.co/mokUDqX0un,71.0
JoeBiden,2023-09-17 17:23:21+00:00,This is MAGAnomics. https://t.co/mokUDqX0un,72.0
TheDemocrats,2023-09-18 01:57:15+00:00,"Trump broke his promises, manufacturing plants closed. https://t.co/DYicbBilZy",73.0
TheDemocrats,2023-09-17 22:35:51+00:00,Get yours today → https://t.co/66t27Yhpzi https://t.co/D4VQPrIYB3,74.0
TheDemocrats,2023-09-17 21:17:28+00:00,"RT @Autoworkers helped build the middle class, and strong unions grow the economy. 

@POTUS and I respect workers’ right to strike under the collective bargaining system, and agree a new contract should promote good middle class jobs — and ensure the UAW remains at the heart of our auto economy.",75.0
VP,2023-09-17 21:02:18+00:00,"Autoworkers helped build the middle class, and strong unions grow the economy. 

@POTUS and I respect workers’ right to strike under the collective bargaining system, and agree a new contract should promote good middle class jobs — and ensure the UAW remains at the heart of our auto economy.",76.0
TheDemocrats,2023-09-17 20:39:16+00:00,"There it is.

Trump was asked if he would sign a national abortion ban if elected in 2024: “I think we’ll get it done … We will get that taken care of.” https://t.co/Dzbwu8ixTw",77.0
TheDemocrats,2023-09-17 17:52:05+00:00,"—A higher share of prime-age Americans are working now than at any time in the last 20 years
—Unemployment has remained under 4% for 19 months in a row
—Annual core inflation continues to fall

Bidenomics is creating millions of jobs and fueling an economic boom. https://t.co/mclD75UpZq",78.0
TheDemocrats,2023-09-17 16:47:01+00:00,"Reminder: Democrats delivered the largest investment to combat climate change in American history. The Inflation Reduction Act will help reduce carbon emissions and build clean energy infrastructure.

Every Republican in Congress voted against it.",79.0
TheDemocrats,2023-09-17 01:48:21+00:00,Donald Trump: “I got rid of Roe v. Wade.” https://t.co/lQ0HCMMv7b,80.0
TheDemocrats,2023-09-17 00:35:05+00:00,Our vice president. 💙 https://t.co/bmgzkHeexZ,81.0
TheDemocrats,2023-09-16 22:41:00+00:00,"RT @KamalaHarris: When I look at our young leaders, I know our future is bright. https://t.co/Rax5LM7bbA",82.0
KamalaHarris,2023-09-15 22:15:12+00:00,"When I look at our young leaders, I know our future is bright. https://t.co/Rax5LM7bbA",83.0
TheDemocrats,2023-09-16 19:43:05+00:00,The Biden-Harris administration is using every resource possible to help end cancer as we know it. https://t.co/kUkM7zN8ey,84.0
TheDemocrats,2023-09-16 18:15:01+00:00,"RT @JoeBiden: The contrast is clear, folks. https://t.co/ZtTkS9GAvP",85.0
JoeBiden,2023-09-15 19:06:18+00:00,"The contrast is clear, folks. https://t.co/ZtTkS9GAvP",86.0
TheDemocrats,2023-09-16 16:56:26+00:00,Trump failed auto workers and attacked unions. https://t.co/FkdvKpkQxR,87.0
TheDemocrats,2023-09-16 02:00:17+00:00,"Once again, Kevin McCarthy didn’t have the votes. https://t.co/rMjWXIJeo2",88.0
TheDemocrats,2023-09-16 00:22:15+00:00,"The expanded Child Tax Credit eased the financial burden of raising a child for millions of American families and helped cut the child poverty rate in half.

Republicans refused to extend it.",89.0
TheDemocrats,2023-09-15 23:26:16+00:00,"Addie Mae Collins.
Denise McNair.
Carole Robertson.
Cynthia Wesley.

60 years ago today. We remember the four Black girls murdered by the KKK in the bombing of Birmingham's 16th Street Baptist Church. We continue to stand against the white supremacy that killed them.",90.0
TheDemocrats,2023-09-15 23:19:51+00:00,"RT @After negotiations broke down, the UAW announced a targeted strike at a few Big 3 auto plants.

No one wants a strike, but I respect workers' right to collective action.

Workers deserve to share in the benefits they helped create for an enterprise. https://t.co/zlnvnYVvao",91.0
POTUS,2023-09-15 22:59:33+00:00,"After negotiations broke down, the UAW announced a targeted strike at a few Big 3 auto plants.

No one wants a strike, but I respect workers' right to collective action.

Workers deserve to share in the benefits they helped create for an enterprise. https://t.co/zlnvnYVvao",92.0
TheDemocrats,2023-09-15 22:41:15+00:00,Donald Trump: “There has to be some form of punishment” for women who get an abortion. https://t.co/jGVL8hC8xs,93.0
TheDemocrats,2023-09-15 21:30:23+00:00,"L’Shanah Tovah to all who are celebrating Rosh Hashanah. May your new year be filled with peace, prosperity, and happiness. https://t.co/D7tEG6ZmSR",94.0
TheDemocrats,2023-09-15 20:25:01+00:00,RT @I’m no stranger to baseless attacks—attacks are lodged against us because they’re scared of what we’ve been able to accomplish. https://t.co/5GFI3984r2,95.0
KamalaHarris,2023-09-15 01:31:34+00:00,I’m no stranger to baseless attacks—attacks are lodged against us because they’re scared of what we’ve been able to accomplish. https://t.co/5GFI3984r2,96.0
TheDemocrats,2023-09-15 19:33:05+00:00,"Trump failed auto workers. 

Pass it on. https://t.co/0DCxVCKUuf",97.0
TheDemocrats,2023-09-15 18:15:06+00:00,"At a pre-Rosh Hashanah celebration at the vice president's residence this week, @DouglasEmhoff spoke about the fight to combat antisemitism.
https://t.co/yhOVy2pN3A",98.0
TheDemocrats,2023-09-15 17:05:02+00:00,"RT @Right now, 81,000 brave service members remain missing and unaccounted for.
 
But they are not – and will never be – forgotten.
 
On National POW/MIA Recognition Day, I honor their courage and devotion, and promise to never stop fighting to bring them home. https://t.co/K8Hn3kP5dM",99.0
POTUS,2023-09-15 15:35:01+00:00,"Right now, 81,000 brave service members remain missing and unaccounted for.
 
But they are not – and will never be – forgotten.
 
On National POW/MIA Recognition Day, I honor their courage and devotion, and promise to never stop fighting to bring them home. https://t.co/K8Hn3kP5dM",100.0
TheDemocrats,2023-09-15 17:00:24+00:00,RT @JoeBiden: The difference between Bidenomics and MAGAnomics. https://t.co/rl3DJOCqpR,101.0
JoeBiden,2023-09-15 01:42:05+00:00,The difference between Bidenomics and MAGAnomics. https://t.co/rl3DJOCqpR,102.0
TheDemocrats,2023-09-15 16:00:28+00:00,Don't make him ask twice. https://t.co/zRRj4p33gI,103.0
TheDemocrats,2023-09-15 15:08:05+00:00,"This Hispanic Heritage Month, we celebrate the Latino community's rich diversity, culture, and contributions to our country. Latinos continue to leave an indelible mark on this nation's cultural fabric and history—Hispanic history is American history. https://t.co/k0FQeNJLkN",104.0
TheDemocrats,2023-09-15 01:55:05+00:00,Wins for America. https://t.co/MoFJFIRE4G,105.0
TheDemocrats,2023-09-15 00:18:11+00:00,"Thank you, President Biden 🙌 https://t.co/gZCLkIvoSH",106.0
TheDemocrats,2023-09-14 22:35:21+00:00,"WATCH: @GOPChairwoman admits the impeachment inquiry is about revenge against Democrats: 

“Our voters are sick and tired of Republicans getting attacked … it's time to go after Biden.” https://t.co/sfj9ryjdnB",107.0
TheDemocrats,2023-09-14 22:11:06+00:00,Trump wants to double down on his failed trickle-down tax scam. #MAGATaxScam https://t.co/o7zvfKxQOs,108.0
TheDemocrats,2023-09-14 21:52:31+00:00,"RT @MAGAnomics:
—Tax cuts for the wealthy and big corporations
—Cuts Social Security and Medicare
—Raises costs for the middle class

Bidenomics:
—Making the wealthy and big corporations begin to pay their fair share
—Protecting Social Security and Medicare
—Lowering costs",109.0
JoeBiden,2023-09-14 21:46:00+00:00,"MAGAnomics:
—Tax cuts for the wealthy and big corporations
—Cuts Social Security and Medicare
—Raises costs for the middle class

Bidenomics:
—Making the wealthy and big corporations begin to pay their fair share
—Protecting Social Security and Medicare
—Lowering costs",110.0
TheDemocrats,2023-09-14 20:07:45+00:00,RT @JoeBiden: Every single one. https://t.co/DVsSPgMLHX,111.0
JoeBiden,2023-09-14 20:00:19+00:00,Every single one. https://t.co/DVsSPgMLHX,112.0
TheDemocrats,2023-09-14 20:07:36+00:00,"RT @The expanded Child Tax Credit is a tax cut for working families that helped cut the child poverty rate nearly in half during our first year in office.  

Republicans in Congress refused to extend it.  

President @JoeBiden and I will continue fighting to restore the expanded Child Tax Credit, because our children deserve every opportunity to thrive.",113.0
KamalaHarris,2023-09-14 18:22:40+00:00,"The expanded Child Tax Credit is a tax cut for working families that helped cut the child poverty rate nearly in half during our first year in office.  

Republicans in Congress refused to extend it.  

President @JoeBiden and I will continue fighting to restore the expanded Child Tax Credit, because our children deserve every opportunity to thrive.",114.0
TheDemocrats,2023-09-14 20:04:01+00:00,"Under the Biden-Harris administration's SAVE plan, millions of Americans are eligible to save money on student loan repayments.

To lower your monthly plan before payments resume later this fall, visit https://t.co/r61mfRoLFO.",115.0
TheDemocrats,2023-09-14 18:20:17+00:00,We see right through Kevin McCarthy. https://t.co/rI84Gi2E3a,116.0
TheDemocrats,2023-09-14 16:00:28+00:00,"BIG NEWS: Vice President Harris is hitting the road to speak directly with young voters about reproductive freedom, gun safety, climate action, and more. https://t.co/raM2rdQrmo",117.0
TheDemocrats,2023-09-14 13:39:45+00:00,"RT @JoeBiden: Unlike the last guy, I won’t stop fighting to end gun violence. https://t.co/DJClxJBZxz",118.0
JoeBiden,2023-09-14 00:34:05+00:00,"Unlike the last guy, I won’t stop fighting to end gun violence. https://t.co/DJClxJBZxz",119.0
