username,date,first_topic,first_topic_name,first_topic_prob,sentiment,sentiment_prob,emotion,emotion_prob,second_topic,second_topic_name,second_topic_prob,text,lemmatized_text,per_word_topics,per_word_topics_name
RyanBinkley,2023-06-14 01:14:10+00:00,2,War,0.40861344,positive,0.8661130666732788,optimism,0.801288902759552,8.0,Infrastructure/job/energy,0.24974805,"I encouraged Republicans to look to the future and broaden our tent at the GOP Convention in Georgia. Our youth, our urban communities, and our entire great nation needs unity. United we stand. #Believe https://t.co/30JuTqtlrG",encouraged republican look future broaden tent gop convention georgia youth urban community entire great nation need unity united stand,"[('united', [2, 8]), ('republican', [6, 2]), ('need', [2, 8]), ('entire', [2, 8]), ('gop', [6, 2]), ('future', [8, 6]), ('look', [6, 2]), ('great', [6, 8]), ('community', [8, 6]), ('stand', [2, 8]), ('nation', [8, 2]), ('georgia', [6, 4]), ('tent', [2, 6]), ('youth', [2, 6]), ('urban', [8, 4]), ('convention', [2, 4]), ('unity', [2, 6]), ('encouraged', [4]), ('broaden', [2])]","[('united', ['War', 'Infrastructure/job/energy']), ('republican', ['Election/debate', 'War']), ('need', ['War', 'Infrastructure/job/energy']), ('entire', ['War', 'Infrastructure/job/energy']), ('gop', ['Election/debate', 'War']), ('future', ['Infrastructure/job/energy', 'Election/debate']), ('look', ['Election/debate', 'War']), ('great', ['Election/debate', 'Infrastructure/job/energy']), ('community', ['Infrastructure/job/energy', 'Election/debate']), ('stand', ['War', 'Infrastructure/job/energy']), ('nation', ['Infrastructure/job/energy', 'War']), ('georgia', ['Election/debate', 'Republicans vs democrats']), ('tent', ['War', 'Election/debate']), ('youth', ['War', 'Election/debate']), ('urban', ['Infrastructure/job/energy', 'Republicans vs democrats']), ('convention', ['War', 'Republicans vs democrats']), ('unity', ['War', 'Election/debate']), ('encouraged', ['Republicans vs democrats']), ('broaden', ['War'])]"
WillHurd,2023-06-14 02:22:35+00:00,2,War,0.48871943,positive,0.9414339661598206,optimism,0.7229782938957214,1.0,American/economics/health,0.2696761,"It was great to meet with Sen. Carrie Gendreau, Hon. Brad Bailey, and Bruce Perlo in Littleton, NH today. Folks in New Hampshire are patriots who take their #FITN responsibility seriously. They care about kitchen table issues like inflation and the growing threat of China, not all the noise from the media. #NHpolitics",great meet sen carrie gendreau hon brad bailey bruce perlo littleton  today folk hampshire patriot responsibility seriously care kitchen table issue like inflation growing threat china noise medium,"[('today', [6, 1]), ('medium', [2, 6]), ('like', [2, 6]), ('threat', [2, 1]), ('china', [2, 1]), ('responsibility', [1, 2]), ('care', [1, 2]), ('seriously', [2, 6]), ('issue', [6, 1]), ('great', [6, 2]), ('growing', [1, 6]), ('folk', [6, 1]), ('patriot', [2, 6]), ('brad', [2, 6]), ('table', [1]), ('hampshire', [6, 1]), ('meet', [6, 1]), ('inflation', [1]), ('sen', [2, 6]), ('kitchen', [1]), ('bruce', [2]), ('littleton', [6]), ('bailey', [2]), ('carrie', [2]), ('gendreau', [2]), ('hon', [2]), ('noise', [2]), ('perlo', [2])]","[('today', ['Election/debate', 'American/economics/health']), ('medium', ['War', 'Election/debate']), ('like', ['War', 'Election/debate']), ('threat', ['War', 'American/economics/health']), ('china', ['War', 'American/economics/health']), ('responsibility', ['American/economics/health', 'War']), ('care', ['American/economics/health', 'War']), ('seriously', ['War', 'Election/debate']), ('issue', ['Election/debate', 'American/economics/health']), ('great', ['Election/debate', 'War']), ('growing', ['American/economics/health', 'Election/debate']), ('folk', ['Election/debate', 'American/economics/health']), ('patriot', ['War', 'Election/debate']), ('brad', ['War', 'Election/debate']), ('table', ['American/economics/health']), ('hampshire', ['Election/debate', 'American/economics/health']), ('meet', ['Election/debate', 'American/economics/health']), ('inflation', ['American/economics/health']), ('sen', ['War', 'Election/debate']), ('kitchen', ['American/economics/health']), ('bruce', ['War']), ('littleton', ['Election/debate']), ('bailey', ['War']), ('carrie', ['War']), ('gendreau', ['War']), ('hon', ['War']), ('noise', ['War']), ('perlo', ['War'])]"
RepSpanberger,2023-06-14 16:40:21+00:00,2,War,0.37697265,negative,0.8510643839836121,fear,0.6923303604125977,5.0,Border/community/family,0.2683712,"On June 17, 2015, nine congregants were shot and killed at Mother Emanuel AME Church by an 18-year-old who was prohibited by law from owning a gun. But this murderer was able to purchase a gun because of a dangerous loophole — now known as the “Charleston Loophole.” (1/3)",june congregant shot killed mother emanuel ame church year old prohibited law owning gun murderer able purchase gun dangerous loophole known charleston loophole,"[('old', [5, 2]), ('year', [5, 8]), ('shot', [2, 5]), ('law', [8, 5]), ('killed', [5, 2]), ('able', [8, 5]), ('purchase', [2, 1]), ('gun', [5, 1]), ('owning', [8, 1]), ('charleston', [5, 8]), ('known', [2, 5]), ('loophole', [8]), ('church', [2, 5]), ('mother', [5, 2]), ('june', [5, 1]), ('murderer', [2]), ('dangerous', [2, 5]), ('ame', [8]), ('emanuel', [2]), ('prohibited', [2]), ('congregant', [2])]","[('old', ['Border/community/family', 'War']), ('year', ['Border/community/family', 'Infrastructure/job/energy']), ('shot', ['War', 'Border/community/family']), ('law', ['Infrastructure/job/energy', 'Border/community/family']), ('killed', ['Border/community/family', 'War']), ('able', ['Infrastructure/job/energy', 'Border/community/family']), ('purchase', ['War', 'American/economics/health']), ('gun', ['Border/community/family', 'American/economics/health']), ('owning', ['Infrastructure/job/energy', 'American/economics/health']), ('charleston', ['Border/community/family', 'Infrastructure/job/energy']), ('known', ['War', 'Border/community/family']), ('loophole', ['Infrastructure/job/energy']), ('church', ['War', 'Border/community/family']), ('mother', ['Border/community/family', 'War']), ('june', ['Border/community/family', 'American/economics/health']), ('murderer', ['War']), ('dangerous', ['War', 'Border/community/family']), ('ame', ['Infrastructure/job/energy']), ('emanuel', ['War']), ('prohibited', ['War']), ('congregant', ['War'])]"
CollinRugg,2023-06-14 19:16:32+00:00,2,War,0.7081906,negative,0.8217007517814636,sadness,0.9346755146980286,1.0,American/economics/health,0.04171622,It's all falling apart. https://t.co/e05bJMgeEK,falling apart,"[('apart', [2]), ('falling', [2])]","[('apart', ['War']), ('falling', ['War'])]"
amyewalter,2023-06-14 22:33:52+00:00,2,War,0.6741029,neutral,0.8274439573287964,anticipation,0.5286417007446289,7.0,Abortion/rights/guns,0.21824607,Remember to stay to the left on the Metro escalators Mr/Ms Moose…,remember stay left metro escalator   moose,"[('stay', [2, 7]), ('left', [2, 7]), ('remember', [2, 7]), ('metro', [7]), ('escalator', [2]), ('moose', [2])]","[('stay', ['War', 'Abortion/rights/guns']), ('left', ['War', 'Abortion/rights/guns']), ('remember', ['War', 'Abortion/rights/guns']), ('metro', ['Abortion/rights/guns']), ('escalator', ['War']), ('moose', ['War'])]"
SenatorTimScott,2023-06-14 23:37:27+00:00,2,War,0.49948254,neutral,0.7971224188804626,anticipation,0.4999702572822571,1.0,American/economics/health,0.3234558,RT @BankingGOP: Jared Bernstein orchestrated historic inflation. Now Democrats are giving him a promotion. https://t.co/6mtzJyswmZ,jared bernstein orchestrated historic inflation democrat giving promotion,"[('giving', [2, 1]), ('democrat', [2, 1]), ('jared', [2, 7]), ('inflation', [1]), ('historic', [1, 7]), ('promotion', [7, 2]), ('bernstein', [2]), ('orchestrated', [2])]","[('giving', ['War', 'American/economics/health']), ('democrat', ['War', 'American/economics/health']), ('jared', ['War', 'Abortion/rights/guns']), ('inflation', ['American/economics/health']), ('historic', ['American/economics/health', 'Abortion/rights/guns']), ('promotion', ['Abortion/rights/guns', 'War']), ('bernstein', ['War']), ('orchestrated', ['War'])]"
DavidABergstein,2023-06-15 13:36:04+00:00,2,War,0.42266342,neutral,0.552004337310791,anger,0.5589151382446289,6.0,Election/debate,0.3179656,“Rich people love running for office. But campaigns can expose these candidates to embarrassing disclosures and personal attacks” #wvsen #mtsen #pasen #wisen https://t.co/FqVVz3GA7S,rich people love running office campaign expose candidate embarrassing disclosure personal attack,"[('attack', [7, 2]), ('office', [6, 2]), ('people', [2, 6]), ('personal', [7, 2]), ('candidate', [6, 7]), ('love', [2, 6]), ('running', [6, 2]), ('campaign', [6, 2]), ('rich', [2, 6]), ('disclosure', [7]), ('expose', [2]), ('embarrassing', [2])]","[('attack', ['Abortion/rights/guns', 'War']), ('office', ['Election/debate', 'War']), ('people', ['War', 'Election/debate']), ('personal', ['Abortion/rights/guns', 'War']), ('candidate', ['Election/debate', 'Abortion/rights/guns']), ('love', ['War', 'Election/debate']), ('running', ['Election/debate', 'War']), ('campaign', ['Election/debate', 'War']), ('rich', ['War', 'Election/debate']), ('disclosure', ['Abortion/rights/guns']), ('expose', ['War']), ('embarrassing', ['War'])]"
WillHurd,2023-06-15 17:26:00+00:00,2,War,0.714172,negative,0.7732106447219849,fear,0.9243765473365784,1.0,American/economics/health,0.11292084,"Xi Jinping is preparing his people for armed conflict and war. The CCP has been playing up the tensions between the US and its Asian allies. While the CCP decries so-called “Western Aggression” internationally, it internally stokes the fears of its people in preparation for war.", jinping preparing people armed conflict war ccp playing tension asian ally ccp decries called western aggression internationally internally stokes fear people preparation war,"[('war', [2, 1]), ('tension', [2]), ('fear', [2, 1]), ('people', [2, 1]), ('called', [2, 7]), ('armed', [2, 1]), ('preparing', [2]), ('playing', [2, 1]), ('aggression', [2]), ('ally', [2, 7]), ('asian', [7, 3]), ('conflict', [2]), ('ccp', [2]), ('internally', [2]), ('western', [2, 1]), ('jinping', [2]), ('decries', [7]), ('internationally', [1]), ('preparation', [1]), ('stokes', [3])]","[('war', ['War', 'American/economics/health']), ('tension', ['War']), ('fear', ['War', 'American/economics/health']), ('people', ['War', 'American/economics/health']), ('called', ['War', 'Abortion/rights/guns']), ('armed', ['War', 'American/economics/health']), ('preparing', ['War']), ('playing', ['War', 'American/economics/health']), ('aggression', ['War']), ('ally', ['War', 'Abortion/rights/guns']), ('asian', ['Abortion/rights/guns', 'News/radio/livestream']), ('conflict', ['War']), ('ccp', ['War']), ('internally', ['War']), ('western', ['War', 'American/economics/health']), ('jinping', ['War']), ('decries', ['Abortion/rights/guns']), ('internationally', ['American/economics/health']), ('preparation', ['American/economics/health']), ('stokes', ['News/radio/livestream'])]"
KamalaHarris,2023-06-15 20:23:00+00:00,2,War,0.5848769,negative,0.4808513820171356,anger,0.6730143427848816,7.0,Abortion/rights/guns,0.365045,Weapons of war have no place on the streets of a civil society. Congress must pass an assault weapons ban. President Biden will sign it.,weapon war place street civil society congress pas assault weapon ban president biden sign,"[('ban', [7, 2]), ('weapon', [2]), ('biden', [2, 7]), ('street', [2]), ('war', [2]), ('congress', [7, 2]), ('president', [2, 7]), ('place', [2, 7]), ('civil', [7, 2]), ('pas', [7, 2]), ('sign', [7]), ('society', [2, 7]), ('assault', [2, 7])]","[('ban', ['Abortion/rights/guns', 'War']), ('weapon', ['War']), ('biden', ['War', 'Abortion/rights/guns']), ('street', ['War']), ('war', ['War']), ('congress', ['Abortion/rights/guns', 'War']), ('president', ['War', 'Abortion/rights/guns']), ('place', ['War', 'Abortion/rights/guns']), ('civil', ['Abortion/rights/guns', 'War']), ('pas', ['Abortion/rights/guns', 'War']), ('sign', ['Abortion/rights/guns']), ('society', ['War', 'Abortion/rights/guns']), ('assault', ['War', 'Abortion/rights/guns'])]"
CollinRugg,2023-06-16 00:19:43+00:00,2,War,0.5623111,neutral,0.7913742065429688,anticipation,0.5265315771102905,4.0,Republicans vs democrats,0.06257635,I wonder what this could have been? https://t.co/rvhm9hw97Z,wonder,"[('wonder', [2])]","[('wonder', ['War'])]"
CollinRugg,2023-06-16 01:33:30+00:00,2,War,0.6880303,neutral,0.5010056495666504,anger,0.4646728038787842,6.0,Election/debate,0.22852334,The media is TOTALLY fair and definitely NOT a propaganda tool for the Democrat party. https://t.co/6Mw9CTPLgO,medium totally fair definitely propaganda tool democrat party,"[('medium', [2, 6]), ('totally', [2]), ('party', [2, 6]), ('democrat', [2, 6]), ('propaganda', [2]), ('tool', [2]), ('fair', [6]), ('definitely', [2, 6])]","[('medium', ['War', 'Election/debate']), ('totally', ['War']), ('party', ['War', 'Election/debate']), ('democrat', ['War', 'Election/debate']), ('propaganda', ['War']), ('tool', ['War']), ('fair', ['Election/debate']), ('definitely', ['War', 'Election/debate'])]"
RobertKennedyJr,2023-06-16 07:05:00+00:00,2,War,0.30882496,negative,0.6337530016899109,optimism,0.4700402319431305,1.0,American/economics/health,0.15163161,"To ensure the security of Israel and, indeed, the Iranian people, Iran must not be allowed to develop nuclear weapons. This is non-negotiable. It will require constant vigilance and stringent verification. The JCPOA is based on outdated assumptions and conditions, and is not appropriate to our time. But I will set my sights on real peace in the Mideast, including between Israel and Iran. When I am President, we will set a new standard for international behavior. The US bears historical culpability for much of the tension in the region, which is partly the result of our regrettable history of regime change operations, coups, and support for despotic regimes in Iran and elsewhere. #Kennedy24",ensure security israel iranian people iran allowed develop nuclear weapon non negotiable require constant vigilance stringent verification jcpoa based outdated assumption condition appropriate time set sight real peace mideast including israel iran president set standard international behavior bear historical culpability tension region partly result regrettable history regime change operation coup support despotic regime iran,"[('nuclear', [2, 4]), ('security', [1, 5]), ('weapon', [2, 1]), ('support', [2, 1]), ('iranian', [2]), ('tension', [4, 6]), ('israel', [2, 5]), ('people', [2, 1]), ('allowed', [2, 4]), ('president', [1, 4]), ('iran', [2, 5]), ('peace', [2, 5]), ('time', [2, 1]), ('history', [5, 1]), ('require', [1, 8]), ('real', [1, 2]), ('regime', [2, 4]), ('including', [1, 5]), ('non', [2, 6]), ('change', [2, 1]), ('historical', [6]), ('standard', [1, 4]), ('set', [6, 4]), ('international', [5, 8]), ('based', [7, 4]), ('operation', [8, 4]), ('constant', [2, 5]), ('ensure', [1, 8]), ('result', [1, 6]), ('sight', [5]), ('region', [8, 5]), ('behavior', [2, 4]), ('condition', [1, 8]), ('verification', [6]), ('develop', [8, 1]), ('bear', [2, 6]), ('appropriate', [4, 1]), ('outdated', [5]), ('coup', [7, 5]), ('jcpoa', [1]), ('mideast', [1]), ('vigilance', [7]), ('assumption', [3]), ('stringent', [6]), ('negotiable', [7]), ('partly', [4, 6]), ('culpability', [4]), ('despotic', [2]), ('regrettable', [2])]","[('nuclear', ['War', 'Republicans vs democrats']), ('security', ['American/economics/health', 'Border/community/family']), ('weapon', ['War', 'American/economics/health']), ('support', ['War', 'American/economics/health']), ('iranian', ['War']), ('tension', ['Republicans vs democrats', 'Election/debate']), ('israel', ['War', 'Border/community/family']), ('people', ['War', 'American/economics/health']), ('allowed', ['War', 'Republicans vs democrats']), ('president', ['American/economics/health', 'Republicans vs democrats']), ('iran', ['War', 'Border/community/family']), ('peace', ['War', 'Border/community/family']), ('time', ['War', 'American/economics/health']), ('history', ['Border/community/family', 'American/economics/health']), ('require', ['American/economics/health', 'Infrastructure/job/energy']), ('real', ['American/economics/health', 'War']), ('regime', ['War', 'Republicans vs democrats']), ('including', ['American/economics/health', 'Border/community/family']), ('non', ['War', 'Election/debate']), ('change', ['War', 'American/economics/health']), ('historical', ['Election/debate']), ('standard', ['American/economics/health', 'Republicans vs democrats']), ('set', ['Election/debate', 'Republicans vs democrats']), ('international', ['Border/community/family', 'Infrastructure/job/energy']), ('based', ['Abortion/rights/guns', 'Republicans vs democrats']), ('operation', ['Infrastructure/job/energy', 'Republicans vs democrats']), ('constant', ['War', 'Border/community/family']), ('ensure', ['American/economics/health', 'Infrastructure/job/energy']), ('result', ['American/economics/health', 'Election/debate']), ('sight', ['Border/community/family']), ('region', ['Infrastructure/job/energy', 'Border/community/family']), ('behavior', ['War', 'Republicans vs democrats']), ('condition', ['American/economics/health', 'Infrastructure/job/energy']), ('verification', ['Election/debate']), ('develop', ['Infrastructure/job/energy', 'American/economics/health']), ('bear', ['War', 'Election/debate']), ('appropriate', ['Republicans vs democrats', 'American/economics/health']), ('outdated', ['Border/community/family']), ('coup', ['Abortion/rights/guns', 'Border/community/family']), ('jcpoa', ['American/economics/health']), ('mideast', ['American/economics/health']), ('vigilance', ['Abortion/rights/guns']), ('assumption', ['News/radio/livestream']), ('stringent', ['Election/debate']), ('negotiable', ['Abortion/rights/guns']), ('partly', ['Republicans vs democrats', 'Election/debate']), ('culpability', ['Republicans vs democrats']), ('despotic', ['War']), ('regrettable', ['War'])]"
marwilliamson,2023-06-16 17:25:42+00:00,2,War,0.4668928,negative,0.5598875880241394,disgust,0.2842495441436767,7.0,Abortion/rights/guns,0.35651746,RFK Jr. says he’s “a free market capitalism guy.” I’m “a hypercapitalism has gone off the rails and lost any semblance of moral center and has to be regulated more strictly before it kills us all” kind of gal.,rfk  say  free market capitalism guy hypercapitalism gone rail lost semblance moral center regulated strictly kill kind gal,"[('kill', [2]), ('say', [2, 7]), ('lost', [2, 7]), ('guy', [2]), ('free', [2, 7]), ('center', [8, 7]), ('gone', [2, 7]), ('market', [8, 2]), ('kind', [2, 8]), ('rfk', [2]), ('moral', [2]), ('gal', [7]), ('rail', [8]), ('capitalism', [7, 8]), ('strictly', [7]), ('regulated', [7]), ('hypercapitalism', [7, 2]), ('semblance', [7])]","[('kill', ['War']), ('say', ['War', 'Abortion/rights/guns']), ('lost', ['War', 'Abortion/rights/guns']), ('guy', ['War']), ('free', ['War', 'Abortion/rights/guns']), ('center', ['Infrastructure/job/energy', 'Abortion/rights/guns']), ('gone', ['War', 'Abortion/rights/guns']), ('market', ['Infrastructure/job/energy', 'War']), ('kind', ['War', 'Infrastructure/job/energy']), ('rfk', ['War']), ('moral', ['War']), ('gal', ['Abortion/rights/guns']), ('rail', ['Infrastructure/job/energy']), ('capitalism', ['Abortion/rights/guns', 'Infrastructure/job/energy']), ('strictly', ['Abortion/rights/guns']), ('regulated', ['Abortion/rights/guns']), ('hypercapitalism', ['Abortion/rights/guns', 'War']), ('semblance', ['Abortion/rights/guns'])]"
CollinRugg,2023-06-16 18:32:52+00:00,2,War,0.43666157,neutral,0.5372588634490967,anger,0.7974818348884583,4.0,Republicans vs democrats,0.29461297,"NEW: Elon Musk expresses his support for free speech at the Viva Technology event in Paris, France. It's crazy that this is a controversial take in 2023. ""We should have free speech as much as possible... We want to allow the people to express themselves."" ""Free speech matters and is only relevant if people are allowed to say things that you don't like. Because otherwise it’s not free speech."" Your government hates this.",elon musk express support free speech viva technology event paris france crazy controversial free speech possible want allow people express free speech matter relevant people allowed thing like free speech government hate,"[('hate', [2, 4]), ('speech', [2, 4]), ('support', [2, 4]), ('people', [2, 4]), ('allowed', [2, 4]), ('like', [2, 4]), ('technology', [8, 5]), ('elon', [4]), ('musk', [4]), ('thing', [2, 4]), ('crazy', [2, 4]), ('government', [2, 4]), ('event', [6, 4]), ('want', [2, 4]), ('possible', [4, 2]), ('allow', [2, 7]), ('free', [2, 4]), ('matter', [4, 2]), ('controversial', [7, 6]), ('express', [2, 5]), ('france', [5]), ('paris', [7]), ('relevant', [4, 6]), ('viva', [2])]","[('hate', ['War', 'Republicans vs democrats']), ('speech', ['War', 'Republicans vs democrats']), ('support', ['War', 'Republicans vs democrats']), ('people', ['War', 'Republicans vs democrats']), ('allowed', ['War', 'Republicans vs democrats']), ('like', ['War', 'Republicans vs democrats']), ('technology', ['Infrastructure/job/energy', 'Border/community/family']), ('elon', ['Republicans vs democrats']), ('musk', ['Republicans vs democrats']), ('thing', ['War', 'Republicans vs democrats']), ('crazy', ['War', 'Republicans vs democrats']), ('government', ['War', 'Republicans vs democrats']), ('event', ['Election/debate', 'Republicans vs democrats']), ('want', ['War', 'Republicans vs democrats']), ('possible', ['Republicans vs democrats', 'War']), ('allow', ['War', 'Abortion/rights/guns']), ('free', ['War', 'Republicans vs democrats']), ('matter', ['Republicans vs democrats', 'War']), ('controversial', ['Abortion/rights/guns', 'Election/debate']), ('express', ['War', 'Border/community/family']), ('france', ['Border/community/family']), ('paris', ['Abortion/rights/guns']), ('relevant', ['Republicans vs democrats', 'Election/debate']), ('viva', ['War'])]"
WillHurd,2023-06-16 20:52:50+00:00,2,War,0.6340669,neutral,0.5780484080314636,anger,0.714648425579071,1.0,American/economics/health,0.17623246,The U.S. became a global superpower by standing with our allies against despots and tyrants. Something to remember as Vladimir Putin wages war on a sovereign Ukraine., global superpower standing ally despot tyrant remember vladimir putin wage war sovereign ukraine,"[('putin', [2, 5]), ('war', [2, 5]), ('ukraine', [2, 5]), ('vladimir', [2, 5]), ('standing', [2, 1]), ('remember', [2, 5]), ('global', [2, 5]), ('ally', [2, 5]), ('wage', [1]), ('tyrant', [2]), ('superpower', [2]), ('despot', [1]), ('sovereign', [5])]","[('putin', ['War', 'Border/community/family']), ('war', ['War', 'Border/community/family']), ('ukraine', ['War', 'Border/community/family']), ('vladimir', ['War', 'Border/community/family']), ('standing', ['War', 'American/economics/health']), ('remember', ['War', 'Border/community/family']), ('global', ['War', 'Border/community/family']), ('ally', ['War', 'Border/community/family']), ('wage', ['American/economics/health']), ('tyrant', ['War']), ('superpower', ['War']), ('despot', ['American/economics/health']), ('sovereign', ['Border/community/family'])]"
EvBerryhill,2023-06-16 22:38:01+00:00,2,War,0.5761667,negative,0.832533061504364,sadness,0.376307338476181,1.0,American/economics/health,0.32509834,I have seen countless - and I mean countless - drunk people say something totally obscure like “God save the Queen” and then jaunt around like a Joe Biden just did in an effort to play it off as if they were sober. He’s truly incapacitated. https://t.co/XhNfFwyTwK,seen countless mean countless drunk people totally obscure like god save queen jaunt like joe biden effort play sober  truly incapacitated,"[('seen', [2, 1]), ('biden', [2, 1]), ('people', [2, 1]), ('god', [2]), ('joe', [2, 1]), ('like', [2, 1]), ('totally', [2, 1]), ('truly', [2, 1]), ('effort', [1, 8]), ('mean', [2, 1]), ('save', [1, 2]), ('queen', [2]), ('play', [2, 1]), ('drunk', [8]), ('countless', [1]), ('obscure', [1]), ('sober', [2]), ('incapacitated', [2]), ('jaunt', [2])]","[('seen', ['War', 'American/economics/health']), ('biden', ['War', 'American/economics/health']), ('people', ['War', 'American/economics/health']), ('god', ['War']), ('joe', ['War', 'American/economics/health']), ('like', ['War', 'American/economics/health']), ('totally', ['War', 'American/economics/health']), ('truly', ['War', 'American/economics/health']), ('effort', ['American/economics/health', 'Infrastructure/job/energy']), ('mean', ['War', 'American/economics/health']), ('save', ['American/economics/health', 'War']), ('queen', ['War']), ('play', ['War', 'American/economics/health']), ('drunk', ['Infrastructure/job/energy']), ('countless', ['American/economics/health']), ('obscure', ['American/economics/health']), ('sober', ['War']), ('incapacitated', ['War']), ('jaunt', ['War'])]"
