username,date,first_topic,first_topic_name,first_topic_prob,sentiment,sentiment_prob,emotion,emotion_prob,second_topic,second_topic_name,second_topic_prob,text,lemmatized_text,per_word_topics,per_word_topics_name
CurtisWilson275,2023-10-05 18:15:06+00:00,2,War,0.641638,neutral,0.8013978600502014,joy,0.7304291129112244,5.0,Border/community/family,0.27444395,Saying farewell to Deputy Jacob Salrin affectionately known as Jake 🙏🏽 #RichlandCountySheriff @RCSD #fallenangel #lawenforcement #policeofficers #deputysheriff #OPLive #onpatrollive https://t.co/Jgl7u5LCsq,saying farewell deputy jacob salrin affectionately known jake,"[('deputy', [5]), ('saying', [2, 5]), ('known', [2, 5]), ('jake', [2]), ('jacob', [5]), ('salrin', [2]), ('affectionately', [2]), ('farewell', [2])]","[('deputy', ['Border/community/family']), ('saying', ['War', 'Border/community/family']), ('known', ['War', 'Border/community/family']), ('jake', ['War']), ('jacob', ['Border/community/family']), ('salrin', ['War']), ('affectionately', ['War']), ('farewell', ['War'])]"
TheRedPill333,2023-10-05 18:15:11+00:00,2,War,0.6329633,negative,0.932118833065033,anger,0.6392353177070618,4.0,Republicans vs democrats,0.31695408,"I don't think people understand the reason why #Republicans let this happen in #Texas. You have to be really ""stupid"" to think that Biden administration left the door open for this to happen.",think people understand reason let happen stupid think biden administration left door open happen,"[('biden', [4, 2]), ('administration', [2, 4]), ('let', [2, 4]), ('people', [2, 4]), ('happen', [2, 4]), ('reason', [2, 4]), ('think', [2, 4]), ('open', [4, 2]), ('door', [4]), ('left', [2, 4]), ('understand', [2, 4]), ('stupid', [2, 4])]","[('biden', ['Republicans vs democrats', 'War']), ('administration', ['War', 'Republicans vs democrats']), ('let', ['War', 'Republicans vs democrats']), ('people', ['War', 'Republicans vs democrats']), ('happen', ['War', 'Republicans vs democrats']), ('reason', ['War', 'Republicans vs democrats']), ('think', ['War', 'Republicans vs democrats']), ('open', ['Republicans vs democrats', 'War']), ('door', ['Republicans vs democrats']), ('left', ['War', 'Republicans vs democrats']), ('understand', ['War', 'Republicans vs democrats']), ('stupid', ['War', 'Republicans vs democrats'])]"
truth_campaign,2023-10-05 18:15:16+00:00,2,War,0.72212386,negative,0.777521550655365,anger,0.7771272659301758,4.0,Republicans vs democrats,0.17063163,All the anti-Joe Manchin bots are DNC bots. #manchin #joe #democrats,anti joe manchin bot dnc bot,"[('joe', [2, 4]), ('dnc', [4, 2]), ('anti', [2, 4]), ('manchin', [2]), ('bot', [2])]","[('joe', ['War', 'Republicans vs democrats']), ('dnc', ['Republicans vs democrats', 'War']), ('anti', ['War', 'Republicans vs democrats']), ('manchin', ['War']), ('bot', ['War'])]"
foolm1ns,2023-10-05 18:23:53+00:00,2,War,0.4942639,negative,0.8540501594543457,anger,0.7371705174446106,4.0,Republicans vs democrats,0.31083766,"It’s pretty clear Markwayne mullin has had this information for a while, but wasn’t compelled to share it until now! Markwayne Mullin is NO BETTER than Matt Gaetz! #Republicans are dirtbags! Cawthorned",pretty clear markwayne mullin information compelled share markwayne mullin better matt gaetz dirtbags cawthorned,"[('clear', [2, 4]), ('better', [8, 4]), ('information', [4, 8]), ('gaetz', [4]), ('matt', [4, 2]), ('share', [8, 4]), ('pretty', [2, 4]), ('compelled', [8]), ('cawthorned', [2]), ('dirtbags', [2]), ('markwayne', [2]), ('mullin', [2, 4])]","[('clear', ['War', 'Republicans vs democrats']), ('better', ['Infrastructure/job/energy', 'Republicans vs democrats']), ('information', ['Republicans vs democrats', 'Infrastructure/job/energy']), ('gaetz', ['Republicans vs democrats']), ('matt', ['Republicans vs democrats', 'War']), ('share', ['Infrastructure/job/energy', 'Republicans vs democrats']), ('pretty', ['War', 'Republicans vs democrats']), ('compelled', ['Infrastructure/job/energy']), ('cawthorned', ['War']), ('dirtbags', ['War']), ('markwayne', ['War']), ('mullin', ['War', 'Republicans vs democrats'])]"
FROcoffeeSOUL,2023-10-05 18:31:43+00:00,2,War,0.40422532,negative,0.5486134886741638,anger,0.3676302134990692,5.0,Border/community/family,0.34540272,Just another day. The two sides are not the same #Biden2024 #MAGA https://t.co/aedm6Jcxud,day side,"[('side', [2]), ('day', [5, 2])]","[('side', ['War']), ('day', ['Border/community/family', 'War'])]"
StCyrlyMe2,2023-10-05 18:38:39+00:00,2,War,0.32724893,negative,0.9218947291374208,anger,0.7187562584877014,4.0,Republicans vs democrats,0.29017243,"How many more days do we have before we go back to #MAGA #Republicans holding our Government HOSTAGE 2 their BullShit Again they are on another VACATION and can't be bothered? What a job they have Any wonder why so many UNSKILLED, UNQUALIFIED, STUPID ASSES want a job like this?",day holding government hostage bullshit vacation bothered job wonder unskilled unqualified stupid ass want job like,"[('wonder', [2, 4]), ('job', [1, 4]), ('day', [6, 4]), ('like', [2, 4]), ('government', [2, 4]), ('holding', [4, 1]), ('want', [2, 4]), ('stupid', [2, 4]), ('vacation', [4]), ('hostage', [2, 1]), ('unqualified', [4]), ('ass', [6]), ('bothered', [6]), ('bullshit', [2, 4]), ('unskilled', [2])]","[('wonder', ['War', 'Republicans vs democrats']), ('job', ['American/economics/health', 'Republicans vs democrats']), ('day', ['Election/debate', 'Republicans vs democrats']), ('like', ['War', 'Republicans vs democrats']), ('government', ['War', 'Republicans vs democrats']), ('holding', ['Republicans vs democrats', 'American/economics/health']), ('want', ['War', 'Republicans vs democrats']), ('stupid', ['War', 'Republicans vs democrats']), ('vacation', ['Republicans vs democrats']), ('hostage', ['War', 'American/economics/health']), ('unqualified', ['Republicans vs democrats']), ('ass', ['Election/debate']), ('bothered', ['Election/debate']), ('bullshit', ['War', 'Republicans vs democrats']), ('unskilled', ['War'])]"
MaupinRobin,2023-10-05 18:39:47+00:00,2,War,0.56243867,negative,0.9024868607521056,disgust,0.5259156823158264,6.0,Election/debate,0.06251875,@mattgaetz #republicans can’t govern. https://t.co/691nMxyfH6,govern,"[('govern', [2])]","[('govern', ['War'])]"
miksu2006,2023-10-05 18:41:34+00:00,2,War,0.47028846,negative,0.5206418633460999,anticipation,0.5112227201461792,1.0,American/economics/health,0.3548153,"@laurencetotoole We shall see....just wondering if you've given this any thought...when/if #donaldtrump's properties are sold, will you be happy when China ends up buying them since I have no doubt the #democRATS will allow that to happen...?",shall wondering given thought  property sold happy china end buying doubt allow happen,"[('thought', [2, 5]), ('china', [2, 1]), ('happen', [2, 1]), ('property', [1, 5]), ('sold', [2, 1]), ('end', [1, 2]), ('wondering', [1]), ('allow', [2, 1]), ('given', [2, 5]), ('doubt', [2, 1]), ('buying', [1, 2]), ('shall', [2]), ('happy', [5, 1])]","[('thought', ['War', 'Border/community/family']), ('china', ['War', 'American/economics/health']), ('happen', ['War', 'American/economics/health']), ('property', ['American/economics/health', 'Border/community/family']), ('sold', ['War', 'American/economics/health']), ('end', ['American/economics/health', 'War']), ('wondering', ['American/economics/health']), ('allow', ['War', 'American/economics/health']), ('given', ['War', 'Border/community/family']), ('doubt', ['War', 'American/economics/health']), ('buying', ['American/economics/health', 'War']), ('shall', ['War']), ('happy', ['Border/community/family', 'American/economics/health'])]"
AlexBasedXx2,2023-10-05 18:42:08+00:00,2,War,0.38079748,negative,0.8787426948547363,anger,0.7303631901741028,7.0,Abortion/rights/guns,0.36194462,Be it in Wisconsin or any other state... - We're not going to allow you to permanently sterilize and mutilate CHILDREN. - We're not going to allow misogynistic men destroy women's sports. Best get used to this. #TransWomenAreConMen https://t.co/uRkyEoUkhu,wisconsin state going allow permanently sterilize mutilate child going allow misogynistic men destroy woman  sport best,"[('state', [7, 5]), ('going', [2, 7]), ('child', [5, 2]), ('men', [5, 7]), ('sport', [7, 5]), ('woman', [7, 5]), ('best', [5, 2]), ('allow', [2, 7]), ('wisconsin', [7, 5]), ('misogynistic', [2]), ('destroy', [2, 7]), ('permanently', [7]), ('mutilate', [5]), ('sterilize', [2])]","[('state', ['Abortion/rights/guns', 'Border/community/family']), ('going', ['War', 'Abortion/rights/guns']), ('child', ['Border/community/family', 'War']), ('men', ['Border/community/family', 'Abortion/rights/guns']), ('sport', ['Abortion/rights/guns', 'Border/community/family']), ('woman', ['Abortion/rights/guns', 'Border/community/family']), ('best', ['Border/community/family', 'War']), ('allow', ['War', 'Abortion/rights/guns']), ('wisconsin', ['Abortion/rights/guns', 'Border/community/family']), ('misogynistic', ['War']), ('destroy', ['War', 'Abortion/rights/guns']), ('permanently', ['Abortion/rights/guns']), ('mutilate', ['Border/community/family']), ('sterilize', ['War'])]"
JohnnyMorris99,2023-10-05 18:43:12+00:00,2,War,0.7811305,negative,0.9359273314476012,anger,0.5423282980918884,1.0,American/economics/health,0.031289343,@KamalaHarris They are only for mass murder by the government. #DemocratsAreDestroyingAmerica #Democrats #Communists #dictatorship #democide #democide #genocide,mass murder government,"[('murder', [2]), ('government', [2]), ('mass', [2])]","[('murder', ['War']), ('government', ['War']), ('mass', ['War'])]"
abstractmediums,2023-10-05 18:43:33+00:00,2,War,0.5623578,negative,0.8862180709838867,anger,0.5875369310379028,6.0,Election/debate,0.062603265,@nicksortor Probably because of this. #democratscheating #cheating #electionfraud #democrats #communists #socialists #soros #leftists #commie #BidenCrimeFamilly https://t.co/JSyzk2Nv4C,probably,"[('probably', [2])]","[('probably', ['War'])]"
livecut,2023-10-05 18:43:42+00:00,2,War,0.7082298,negative,0.9361838698387146,disgust,0.4965448677539825,5.0,Border/community/family,0.041700605,"#Republicans @GOP are killing themselves, and many of those they govern. https://t.co/RkCGTB2F97",killing govern,"[('killing', [2]), ('govern', [2])]","[('killing', ['War']), ('govern', ['War'])]"
Bearwhale,2023-10-05 18:47:57+00:00,2,War,0.5534732,negative,0.9498512148857116,anger,0.6353598833084106,4.0,Republicans vs democrats,0.4047607,"I just watched one of the most disgusting videos ever where @briebriejoy was attempting to argue against sending aid to Ukraine. We could be sending them air defenses, but instead, she would rather they die. #Republicans have turned into Vladimir Putin's lackeys.",watched disgusting video attempting argue sending aid ukraine sending air defense instead die turned vladimir putin  lackey,"[('putin', [2, 4]), ('aid', [2, 4]), ('ukraine', [2, 4]), ('instead', [2, 4]), ('vladimir', [2]), ('defense', [4, 2]), ('air', [4]), ('turned', [4, 2]), ('sending', [2, 4]), ('video', [4, 2]), ('attempting', [4]), ('die', [2]), ('watched', [4]), ('disgusting', [2]), ('argue', [2, 4]), ('lackey', [4])]","[('putin', ['War', 'Republicans vs democrats']), ('aid', ['War', 'Republicans vs democrats']), ('ukraine', ['War', 'Republicans vs democrats']), ('instead', ['War', 'Republicans vs democrats']), ('vladimir', ['War']), ('defense', ['Republicans vs democrats', 'War']), ('air', ['Republicans vs democrats']), ('turned', ['Republicans vs democrats', 'War']), ('sending', ['War', 'Republicans vs democrats']), ('video', ['Republicans vs democrats', 'War']), ('attempting', ['Republicans vs democrats']), ('die', ['War']), ('watched', ['Republicans vs democrats']), ('disgusting', ['War']), ('argue', ['War', 'Republicans vs democrats']), ('lackey', ['Republicans vs democrats'])]"
limestoneroof,2023-10-05 18:51:03+00:00,2,War,0.7811019,negative,0.8851637244224548,anger,0.7109951376914978,4.0,Republicans vs democrats,0.03130499,This is WHAT the #democrats are trying to destroy and what the @GOP used to believe. https://t.co/sDrG0yoUAC https://t.co/BKsb9c59J3,trying destroy believe,"[('believe', [2]), ('trying', [2]), ('destroy', [2])]","[('believe', ['War']), ('trying', ['War']), ('destroy', ['War'])]"
FOEhio,2023-10-05 18:52:10+00:00,2,War,0.6754447,negative,0.6267310976982117,anger,0.5549433827400208,4.0,Republicans vs democrats,0.24109523,Why the #Democrats leak Sexy Redd sex tape after she said she likes Trump.,leak sexy redd sex tape said like trump,"[('said', [2, 4]), ('like', [2, 4]), ('trump', [4, 2]), ('sex', [2, 4]), ('tape', [2]), ('leak', [4, 2]), ('sexy', [2]), ('redd', [2])]","[('said', ['War', 'Republicans vs democrats']), ('like', ['War', 'Republicans vs democrats']), ('trump', ['Republicans vs democrats', 'War']), ('sex', ['War', 'Republicans vs democrats']), ('tape', ['War']), ('leak', ['Republicans vs democrats', 'War']), ('sexy', ['War']), ('redd', ['War'])]"
GoodGrief18,2023-10-05 18:53:19+00:00,2,War,0.7808524,negative,0.8148776292800903,anger,0.6252980828285217,5.0,Border/community/family,0.03130955,@BobGood What's with the TAN suit? #Republicans hate #tan #suits! What's with #sleeping on the #job #republican behind you? https://t.co/YxIR48eZyM,tan suit hate,"[('hate', [2]), ('suit', [2]), ('tan', [2])]","[('hate', ['War']), ('suit', ['War']), ('tan', ['War'])]"
Schaumburgur,2023-10-05 18:56:44+00:00,2,War,0.51262486,neutral,0.5299546718597412,disgust,0.2421089112758636,1.0,American/economics/health,0.26810172,"I see the downtrodden economy has not stopped ""Chess King"" from making a comeback... #fashionable #Democrats #ThatAintNoHalston",downtrodden economy stopped chess king making comeback,"[('making', [1, 2]), ('stopped', [2, 1]), ('economy', [1, 2]), ('king', [2]), ('chess', [2]), ('comeback', [3]), ('downtrodden', [2])]","[('making', ['American/economics/health', 'War']), ('stopped', ['War', 'American/economics/health']), ('economy', ['American/economics/health', 'War']), ('king', ['War']), ('chess', ['War']), ('comeback', ['News/radio/livestream']), ('downtrodden', ['War'])]"
Hasilkilt1,2023-10-05 18:59:20+00:00,2,War,0.6827401,negative,0.6462408304214478,joy,0.4541437029838562,5.0,Border/community/family,0.19204873,@JoaquinCastrotx HAHAHA. It is Sweet to see Democrats so upset over this. HAHA. #democrats,hahaha sweet democrat upset haha,"[('upset', [2]), ('democrat', [2, 5]), ('haha', [2]), ('sweet', [5]), ('hahaha', [2])]","[('upset', ['War']), ('democrat', ['War', 'Border/community/family']), ('haha', ['War']), ('sweet', ['Border/community/family']), ('hahaha', ['War'])]"
Trumpgirl_45_,2023-10-05 19:00:00+00:00,2,War,0.7080741,negative,0.6034057140350342,anger,0.693847119808197,7.0,Abortion/rights/guns,0.041723642,@Victoria176d @Trumpgirl_45_ 🇺🇸IFB 🇺🇸 It’s never stops with these #Democrats https://t.co/4JV0fddcsQ,ifb stop,"[('stop', [2]), ('ifb', [2])]","[('stop', ['War']), ('ifb', ['War'])]"
StCyrlyMe2,2023-10-05 19:01:19+00:00,2,War,0.2997848,positive,0.5000537037849426,joy,0.6509448885917664,8.0,Infrastructure/job/energy,0.2779092,I am so loving this show not even all the billions #Trump collects from his millionaire pimps will get #NewYork AG #LetitiaJames out of his big ass She's beyond his match She gives him nightmares &amp; he can't even digest his Big Macs LOL #Democrats #MSNBC #CNN,loving billion collect millionaire pimp  big  match give nightmare digest big mac,"[('billion', [1, 8]), ('big', [1, 8]), ('nightmare', [5]), ('loving', [2, 5]), ('give', [1, 5]), ('pimp', [2]), ('match', [2]), ('mac', [8, 1]), ('collect', [1, 8]), ('millionaire', [8]), ('digest', [2])]","[('billion', ['American/economics/health', 'Infrastructure/job/energy']), ('big', ['American/economics/health', 'Infrastructure/job/energy']), ('nightmare', ['Border/community/family']), ('loving', ['War', 'Border/community/family']), ('give', ['American/economics/health', 'Border/community/family']), ('pimp', ['War']), ('match', ['War']), ('mac', ['Infrastructure/job/energy', 'American/economics/health']), ('collect', ['American/economics/health', 'Infrastructure/job/energy']), ('millionaire', ['Infrastructure/job/energy']), ('digest', ['War'])]"
KrauseForIowa,2023-10-05 19:04:17+00:00,2,War,0.47004142,negative,0.9240031838417052,disgust,0.5046314001083374,1.0,American/economics/health,0.38795173,"Orcs hit a cafe &amp; grocery, timing it for lunch hour. 49 civilians dead, including a 6 y.o. child. Is there any doubt in anyone's mind about the Russian war crimes going on? Why give them encouragement by defunding Ukraine? #IaCaucus #IaPolitics",orcs hit cafe grocery timing lunch hour civilian dead including   child doubt  mind russian war crime going encouragement defunding ukraine,"[('hour', [1, 6]), ('war', [2, 1]), ('ukraine', [2, 1]), ('crime', [2, 1]), ('russian', [2]), ('hit', [1, 2]), ('going', [2, 1]), ('mind', [2, 1]), ('child', [1, 2]), ('including', [1, 6]), ('grocery', [1, 2]), ('doubt', [2, 1]), ('dead', [2]), ('timing', [2]), ('lunch', [1, 6]), ('civilian', [2, 1]), ('cafe', [6]), ('defunding', [1]), ('encouragement', [1]), ('orcs', [2, 1])]","[('hour', ['American/economics/health', 'Election/debate']), ('war', ['War', 'American/economics/health']), ('ukraine', ['War', 'American/economics/health']), ('crime', ['War', 'American/economics/health']), ('russian', ['War']), ('hit', ['American/economics/health', 'War']), ('going', ['War', 'American/economics/health']), ('mind', ['War', 'American/economics/health']), ('child', ['American/economics/health', 'War']), ('including', ['American/economics/health', 'Election/debate']), ('grocery', ['American/economics/health', 'War']), ('doubt', ['War', 'American/economics/health']), ('dead', ['War']), ('timing', ['War']), ('lunch', ['American/economics/health', 'Election/debate']), ('civilian', ['War', 'American/economics/health']), ('cafe', ['Election/debate']), ('defunding', ['American/economics/health']), ('encouragement', ['American/economics/health']), ('orcs', ['War', 'American/economics/health'])]"
marklevinshow,2023-10-05 19:13:14+00:00,2,War,0.6245774,negative,0.9399086833000184,anger,0.7367677092552185,7.0,Abortion/rights/guns,0.31266794,"This liar should have been disbarred. She’s also a NeverTrumper, Democrat Party hack, and a bigot. Next thing you know she’ll become a DC federal judge. https://t.co/OJKymGc8Yb",liar disbarred nevertrumper democrat party hack bigot thing know  federal judge,"[('know', [2, 7]), ('thing', [2, 7]), ('federal', [7]), ('party', [2, 7]), ('hack', [2, 7]), ('democrat', [2, 7]), ('liar', [2]), ('judge', [7]), ('bigot', [7]), ('disbarred', [2]), ('nevertrumper', [2])]","[('know', ['War', 'Abortion/rights/guns']), ('thing', ['War', 'Abortion/rights/guns']), ('federal', ['Abortion/rights/guns']), ('party', ['War', 'Abortion/rights/guns']), ('hack', ['War', 'Abortion/rights/guns']), ('democrat', ['War', 'Abortion/rights/guns']), ('liar', ['War']), ('judge', ['Abortion/rights/guns']), ('bigot', ['Abortion/rights/guns']), ('disbarred', ['War']), ('nevertrumper', ['War'])]"
Shaughn_A2,2023-10-05 19:15:06+00:00,2,War,0.56796455,negative,0.6819813847541809,disgust,0.518046498298645,7.0,Abortion/rights/guns,0.34852234,"Why are #Conservatives/#Republican Party so divided right now? Like for instance with this #SpeakerOfTheHouse ordeal? How after we’ve seen everything that #Democrats are doing to #America, are we not even more unified than ever? 🤷🏾‍♂️",party divided right like instance ordeal seen unified,"[('seen', [2, 7]), ('like', [2, 7]), ('right', [7, 2]), ('party', [2, 7]), ('instance', [2]), ('divided', [2]), ('ordeal', [7]), ('unified', [7])]","[('seen', ['War', 'Abortion/rights/guns']), ('like', ['War', 'Abortion/rights/guns']), ('right', ['Abortion/rights/guns', 'War']), ('party', ['War', 'Abortion/rights/guns']), ('instance', ['War']), ('divided', ['War']), ('ordeal', ['Abortion/rights/guns']), ('unified', ['Abortion/rights/guns'])]"
tortiegertie,2023-10-05 19:15:20+00:00,2,War,0.4799681,negative,0.9423856139183044,anger,0.6713229417800903,1.0,American/economics/health,0.28759575,"#Republicans are vile,destructive, and hellbent on destroying this country and they not without outside help. They have no #principles #TyrannyOfMinority @SenateDems @HouseDemocrats @WhiteHouse",vile destructive hellbent destroying country outside help,"[('destructive', [2]), ('outside', [2, 1]), ('country', [2, 1]), ('help', [1, 2]), ('destroying', [2, 1]), ('hellbent', [1]), ('vile', [7])]","[('destructive', ['War']), ('outside', ['War', 'American/economics/health']), ('country', ['War', 'American/economics/health']), ('help', ['American/economics/health', 'War']), ('destroying', ['War', 'American/economics/health']), ('hellbent', ['American/economics/health']), ('vile', ['Abortion/rights/guns'])]"
RedSector1144,2023-10-05 19:16:43+00:00,2,War,0.622748,neutral,0.587568461894989,anger,0.272783100605011,7.0,Abortion/rights/guns,0.17159721,"“The #Democrats are the party that says government will make you smarter, taller, richer, and remove the crabgrass on your lawn. The #Republicans are the party that says government doesn't work and then they get elected and prove it.” ― P.J. O'Rourke",party say government smarter taller richer remove crabgrass lawn party say government work elected prove    rourke,"[('say', [2, 4]), ('work', [2, 7]), ('government', [2, 4]), ('party', [2, 4]), ('prove', [2, 4]), ('elected', [2, 4]), ('rourke', [2]), ('remove', [4, 2]), ('lawn', [7]), ('smarter', [2]), ('richer', [7]), ('crabgrass', [2]), ('taller', [2])]","[('say', ['War', 'Republicans vs democrats']), ('work', ['War', 'Abortion/rights/guns']), ('government', ['War', 'Republicans vs democrats']), ('party', ['War', 'Republicans vs democrats']), ('prove', ['War', 'Republicans vs democrats']), ('elected', ['War', 'Republicans vs democrats']), ('rourke', ['War']), ('remove', ['Republicans vs democrats', 'War']), ('lawn', ['Abortion/rights/guns']), ('smarter', ['War']), ('richer', ['Abortion/rights/guns']), ('crabgrass', ['War']), ('taller', ['War'])]"
TiknisArts,2023-10-05 19:18:27+00:00,2,War,0.45655975,negative,0.5271738767623901,anticipation,0.3789779245853424,7.0,Abortion/rights/guns,0.37379757,"""If they were to decide that, there would no longer be any possible way to argue that a group of elected #Republicans could be counted on to defend the Constitution.""",decide longer possible way argue group elected counted defend constitution,"[('way', [2, 7]), ('group', [2, 7]), ('longer', [2, 7]), ('constitution', [7, 2]), ('possible', [2, 6]), ('elected', [7, 2]), ('defend', [7, 2]), ('counted', [2, 6]), ('decide', [7, 6]), ('argue', [2])]","[('way', ['War', 'Abortion/rights/guns']), ('group', ['War', 'Abortion/rights/guns']), ('longer', ['War', 'Abortion/rights/guns']), ('constitution', ['Abortion/rights/guns', 'War']), ('possible', ['War', 'Election/debate']), ('elected', ['Abortion/rights/guns', 'War']), ('defend', ['Abortion/rights/guns', 'War']), ('counted', ['War', 'Election/debate']), ('decide', ['Abortion/rights/guns', 'Election/debate']), ('argue', ['War'])]"
catturd2,2023-10-05 19:20:37+00:00,2,War,0.44258088,negative,0.6652613878250122,fear,0.9475641250610352,7.0,Abortion/rights/guns,0.3696196,Breaking - Democrats in a full blown panic 😂,democrat blown panic,"[('democrat', [2, 7]), ('panic', [2]), ('blown', [7])]","[('democrat', ['War', 'Abortion/rights/guns']), ('panic', ['War']), ('blown', ['Abortion/rights/guns'])]"
NSYPlantTrees,2023-10-05 19:21:00+00:00,2,War,0.26052514,negative,0.8330183625221252,anger,0.7465597987174988,5.0,Border/community/family,0.21926485,@bobcesca_go WTH #CommanderBitPeople ??? I had a biter dog and loved him to death - Commander is obviously not going after folks and biting them - if they reach for him? Get him out of there before someone really gets hurt. He's a trained GUARD DOG!!! Maybe he just bites #Republicans?,wth biter dog loved death commander obviously going folk biting reach hurt trained guard dog maybe bite,"[('going', [2, 6]), ('maybe', [6, 2]), ('dog', [2]), ('hurt', [1, 2]), ('trained', [1, 6]), ('death', [5, 1]), ('folk', [6, 5]), ('reach', [1, 6]), ('bite', [1]), ('guard', [5, 8]), ('obviously', [2, 6]), ('loved', [5, 1]), ('commander', [5]), ('biting', [8]), ('wth', [6]), ('biter', [2, 5])]","[('going', ['War', 'Election/debate']), ('maybe', ['Election/debate', 'War']), ('dog', ['War']), ('hurt', ['American/economics/health', 'War']), ('trained', ['American/economics/health', 'Election/debate']), ('death', ['Border/community/family', 'American/economics/health']), ('folk', ['Election/debate', 'Border/community/family']), ('reach', ['American/economics/health', 'Election/debate']), ('bite', ['American/economics/health']), ('guard', ['Border/community/family', 'Infrastructure/job/energy']), ('obviously', ['War', 'Election/debate']), ('loved', ['Border/community/family', 'American/economics/health']), ('commander', ['Border/community/family']), ('biting', ['Infrastructure/job/energy']), ('wth', ['Election/debate']), ('biter', ['War', 'Border/community/family'])]"
lots_mama,2023-10-05 19:24:27+00:00,2,War,0.93738407,negative,0.9335015416145324,anger,0.6881253719329834,,,,"JOE BIDEN IS ACTUALLY STEELING TRUMPS IDEAS FOR AMERICA Hahaha! #Democrats and #JoeBiden are so pathetic. They stopped something that was good for America, just to get back at Trump!",joe biden actually steeling trump idea america hahaha pathetic stopped good america trump,"[('biden', [2]), ('america', [2]), ('joe', [2]), ('trump', [2]), ('good', [2]), ('idea', [2]), ('actually', [2]), ('pathetic', [2]), ('stopped', [2]), ('hahaha', [2]), ('steeling', [2])]","[('biden', ['War']), ('america', ['War']), ('joe', ['War']), ('trump', ['War']), ('good', ['War']), ('idea', ['War']), ('actually', ['War']), ('pathetic', ['War']), ('stopped', ['War']), ('hahaha', ['War']), ('steeling', ['War'])]"
