username,date,first_topic,first_topic_name,first_topic_prob,sentiment,sentiment_prob,emotion,emotion_prob,second_topic,second_topic_name,second_topic_prob,text,lemmatized_text,per_word_topics,per_word_topics_name
NateSilver538,2023-03-16 17:51:58+00:00,2,War,0.4805124,negative,0.5209435820579529,anticipation,0.4958679974079132,1.0,American/economics/health,0.25716,"Should experts assign some credit to ""common sense""? Complicated question, but sometimes the answer is yes, especially in cases where the evidence is pretty weak either way. There's a whole literature on the wisdom of crowds &amp; how experts are often bad at probabilistic reasoning.",expert assign credit common sense complicated question answer yes especially case evidence pretty weak way literature wisdom crowd expert bad probabilistic reasoning,"[('way', [2, 1]), ('evidence', [4, 2]), ('crowd', [2, 4]), ('question', [4, 2]), ('expert', [2, 1]), ('common', [1, 2]), ('sense', [1, 4]), ('yes', [2, 4]), ('especially', [2, 1]), ('case', [4, 1]), ('bad', [2, 4]), ('answer', [4, 2]), ('credit', [1, 2]), ('pretty', [2, 4]), ('weak', [2, 4]), ('reasoning', [1]), ('assign', [1]), ('complicated', [2, 4]), ('wisdom', [2, 4]), ('literature', [2]), ('probabilistic', [2])]","[('way', ['War', 'American/economics/health']), ('evidence', ['Republicans vs democrats', 'War']), ('crowd', ['War', 'Republicans vs democrats']), ('question', ['Republicans vs democrats', 'War']), ('expert', ['War', 'American/economics/health']), ('common', ['American/economics/health', 'War']), ('sense', ['American/economics/health', 'Republicans vs democrats']), ('yes', ['War', 'Republicans vs democrats']), ('especially', ['War', 'American/economics/health']), ('case', ['Republicans vs democrats', 'American/economics/health']), ('bad', ['War', 'Republicans vs democrats']), ('answer', ['Republicans vs democrats', 'War']), ('credit', ['American/economics/health', 'War']), ('pretty', ['War', 'Republicans vs democrats']), ('weak', ['War', 'Republicans vs democrats']), ('reasoning', ['American/economics/health']), ('assign', ['American/economics/health']), ('complicated', ['War', 'Republicans vs democrats']), ('wisdom', ['War', 'Republicans vs democrats']), ('literature', ['War']), ('probabilistic', ['War'])]"
laurenboebert,2023-03-16 20:30:27+00:00,2,War,0.3566754,neutral,0.6930398941040039,optimism,0.4146549105644226,7.0,Abortion/rights/guns,0.24014619,"RT @It is to @SpeakerMcCarthy’s great credit that he lets War Powers votes come to the floor and he doesn’t play the games Pelosi did to hijack the legislative calendar from lawmakers. Speaker and I disagree strongly on whether America should be a global police force, but he doesn’t fear the debate or the vote.",great credit let war power vote come floor play game pelosi hijack legislative calendar lawmaker speaker disagree strongly america global police force fear debate vote,"[('come', [2, 6]), ('war', [2, 4]), ('force', [2, 7]), ('fear', [2, 7]), ('let', [2, 7]), ('strongly', [2, 4]), ('america', [2, 7]), ('police', [2, 4]), ('vote', [7, 6]), ('power', [2, 4]), ('speaker', [4, 7]), ('debate', [6, 4]), ('great', [6, 2]), ('legislative', [7, 6]), ('floor', [7, 4]), ('pelosi', [4, 2]), ('lawmaker', [7, 4]), ('global', [2, 6]), ('game', [6, 7]), ('credit', [2, 1]), ('play', [6, 2]), ('disagree', [4, 2]), ('calendar', [7]), ('hijack', [2])]","[('come', ['War', 'Election/debate']), ('war', ['War', 'Republicans vs democrats']), ('force', ['War', 'Abortion/rights/guns']), ('fear', ['War', 'Abortion/rights/guns']), ('let', ['War', 'Abortion/rights/guns']), ('strongly', ['War', 'Republicans vs democrats']), ('america', ['War', 'Abortion/rights/guns']), ('police', ['War', 'Republicans vs democrats']), ('vote', ['Abortion/rights/guns', 'Election/debate']), ('power', ['War', 'Republicans vs democrats']), ('speaker', ['Republicans vs democrats', 'Abortion/rights/guns']), ('debate', ['Election/debate', 'Republicans vs democrats']), ('great', ['Election/debate', 'War']), ('legislative', ['Abortion/rights/guns', 'Election/debate']), ('floor', ['Abortion/rights/guns', 'Republicans vs democrats']), ('pelosi', ['Republicans vs democrats', 'War']), ('lawmaker', ['Abortion/rights/guns', 'Republicans vs democrats']), ('global', ['War', 'Election/debate']), ('game', ['Election/debate', 'Abortion/rights/guns']), ('credit', ['War', 'American/economics/health']), ('play', ['Election/debate', 'War']), ('disagree', ['Republicans vs democrats', 'War']), ('calendar', ['Abortion/rights/guns']), ('hijack', ['War'])]"
GovRonDeSantis,2023-03-16 21:21:32+00:00,2,War,0.4917681,neutral,0.5059996247291565,anger,0.5246436595916748,5.0,Border/community/family,0.36962137,Remember when so-called public health experts said it was ok to have mass gatherings if you join the BLM protests but that it was not ok to protest lockdowns? https://t.co/o4t0OgN1lM,remember called public health expert said  mass gathering join blm protest  protest lockdown,"[('said', [2, 5]), ('called', [2, 5]), ('protest', [2]), ('expert', [2, 5]), ('health', [1, 5]), ('mass', [2, 5]), ('public', [5, 1]), ('remember', [5, 2]), ('join', [5, 1]), ('gathering', [5, 2]), ('lockdown', [2, 5]), ('blm', [5])]","[('said', ['War', 'Border/community/family']), ('called', ['War', 'Border/community/family']), ('protest', ['War']), ('expert', ['War', 'Border/community/family']), ('health', ['American/economics/health', 'Border/community/family']), ('mass', ['War', 'Border/community/family']), ('public', ['Border/community/family', 'American/economics/health']), ('remember', ['Border/community/family', 'War']), ('join', ['Border/community/family', 'American/economics/health']), ('gathering', ['Border/community/family', 'War']), ('lockdown', ['War', 'Border/community/family']), ('blm', ['Border/community/family'])]"
RonDeSantis,2023-03-17 01:08:26+00:00,2,War,0.5162204,neutral,0.5929833054542542,anger,0.546022891998291,5.0,Border/community/family,0.32448268,RT @Remember when so-called public health experts said it was ok to have mass gatherings if you join the BLM protests but that it was not ok to protest lockdowns? https://t.co/o4t0OgN1lM,called public health expert said  mass gathering join blm protest  protest lockdown,"[('said', [2, 5]), ('called', [2, 5]), ('protest', [2]), ('expert', [2, 5]), ('health', [1, 5]), ('mass', [2, 5]), ('public', [5, 1]), ('join', [5, 1]), ('gathering', [5, 2]), ('lockdown', [2, 5]), ('blm', [5])]","[('said', ['War', 'Border/community/family']), ('called', ['War', 'Border/community/family']), ('protest', ['War']), ('expert', ['War', 'Border/community/family']), ('health', ['American/economics/health', 'Border/community/family']), ('mass', ['War', 'Border/community/family']), ('public', ['Border/community/family', 'American/economics/health']), ('join', ['Border/community/family', 'American/economics/health']), ('gathering', ['Border/community/family', 'War']), ('lockdown', ['War', 'Border/community/family']), ('blm', ['Border/community/family'])]"
RonDeSantis,2023-03-17 01:08:28+00:00,2,War,0.49792564,positive,0.9850077629089355,joy,0.955670177936554,5.0,Border/community/family,0.23400417,RT @GovRonDeSantis: Mason and I enjoyed our time at the World Baseball Classic. Congrats Puerto Rico on your win! https://t.co/1Cof6pSYcx,mason enjoyed time world baseball classic congrats puerto rico win,"[('world', [2, 5]), ('time', [2, 5]), ('win', [6, 2]), ('enjoyed', [6, 5]), ('baseball', [2, 6]), ('congrats', [5, 6]), ('classic', [2]), ('rico', [2]), ('puerto', [2]), ('mason', [5])]","[('world', ['War', 'Border/community/family']), ('time', ['War', 'Border/community/family']), ('win', ['Election/debate', 'War']), ('enjoyed', ['Election/debate', 'Border/community/family']), ('baseball', ['War', 'Election/debate']), ('congrats', ['Border/community/family', 'Election/debate']), ('classic', ['War']), ('rico', ['War']), ('puerto', ['War']), ('mason', ['Border/community/family'])]"
TulsiGabbard,2023-03-17 13:11:02+00:00,2,War,0.4025322,negative,0.7787767052650452,fear,0.953583598136902,5.0,Border/community/family,0.37612805,"As Lincoln warned: the biggest danger to the United States doesn't come from abroad, but from within. Our freedoms are being threatened not by a foreign enemy, but by those who have supposedly sworn to support and defend our Constitution.",lincoln warned biggest danger united state come abroad freedom threatened foreign enemy supposedly sworn support defend constitution,"[('come', [5, 2]), ('freedom', [7, 5]), ('state', [5, 7]), ('united', [5, 2]), ('support', [5, 2]), ('abroad', [5, 2]), ('threatened', [2, 7]), ('constitution', [7, 2]), ('biggest', [2, 5]), ('enemy', [2, 5]), ('warned', [2]), ('lincoln', [5]), ('foreign', [2, 5]), ('defend', [5, 7]), ('supposedly', [5]), ('sworn', [7]), ('danger', [2, 5])]","[('come', ['Border/community/family', 'War']), ('freedom', ['Abortion/rights/guns', 'Border/community/family']), ('state', ['Border/community/family', 'Abortion/rights/guns']), ('united', ['Border/community/family', 'War']), ('support', ['Border/community/family', 'War']), ('abroad', ['Border/community/family', 'War']), ('threatened', ['War', 'Abortion/rights/guns']), ('constitution', ['Abortion/rights/guns', 'War']), ('biggest', ['War', 'Border/community/family']), ('enemy', ['War', 'Border/community/family']), ('warned', ['War']), ('lincoln', ['Border/community/family']), ('foreign', ['War', 'Border/community/family']), ('defend', ['Border/community/family', 'Abortion/rights/guns']), ('supposedly', ['Border/community/family']), ('sworn', ['Abortion/rights/guns']), ('danger', ['War', 'Border/community/family'])]"
amyewalter,2023-03-17 13:48:54+00:00,2,War,0.39982882,neutral,0.8188877701759338,anticipation,0.3781162202358246,1.0,American/economics/health,0.34993452,Care to respond @JessicaTaylor ?,care respond,"[('care', [1, 2]), ('respond', [2, 1])]","[('care', ['American/economics/health', 'War']), ('respond', ['War', 'American/economics/health'])]"
NateSilver538,2023-03-17 14:15:15+00:00,2,War,0.27622208,neutral,0.7479566335678101,anticipation,0.3726062476634979,1.0,American/economics/health,0.26542875,"But also, educational polarization is particularly important in how institutions that rely heavily on a workforce with substantial educational qualifications behave, such as media, academia and some parts of politics. And those institutions have a lot of downstream influence.",educational polarization particularly important institution rely heavily workforce substantial educational qualification behave medium academia part politics institution lot downstream influence,"[('medium', [2, 4]), ('lot', [2, 4]), ('part', [8, 1]), ('important', [8, 1]), ('influence', [4, 8]), ('politics', [2, 4]), ('substantial', [1]), ('particularly', [4, 1]), ('qualification', [6, 2]), ('polarization', [2, 6]), ('institution', [2, 8]), ('workforce', [8, 1]), ('heavily', [2]), ('educational', [1, 8]), ('rely', [8, 1]), ('behave', [2]), ('academia', [1]), ('downstream', [8, 6])]","[('medium', ['War', 'Republicans vs democrats']), ('lot', ['War', 'Republicans vs democrats']), ('part', ['Infrastructure/job/energy', 'American/economics/health']), ('important', ['Infrastructure/job/energy', 'American/economics/health']), ('influence', ['Republicans vs democrats', 'Infrastructure/job/energy']), ('politics', ['War', 'Republicans vs democrats']), ('substantial', ['American/economics/health']), ('particularly', ['Republicans vs democrats', 'American/economics/health']), ('qualification', ['Election/debate', 'War']), ('polarization', ['War', 'Election/debate']), ('institution', ['War', 'Infrastructure/job/energy']), ('workforce', ['Infrastructure/job/energy', 'American/economics/health']), ('heavily', ['War']), ('educational', ['American/economics/health', 'Infrastructure/job/energy']), ('rely', ['Infrastructure/job/energy', 'American/economics/health']), ('behave', ['War']), ('academia', ['American/economics/health']), ('downstream', ['Infrastructure/job/energy', 'Election/debate'])]"
laurenboebert,2023-03-17 17:57:38+00:00,2,War,0.39577857,negative,0.8995089530944824,anger,0.5896583199501038,1.0,American/economics/health,0.30316406,There is basically no member of the Biden family that isn’t in on the corrupt family grift. Disgusting. https://t.co/UL86lAU4K6,basically member biden family corrupt family grift disgusting,"[('biden', [2, 1]), ('member', [8, 1]), ('family', [1, 8]), ('corrupt', [2, 1]), ('basically', [2]), ('disgusting', [2]), ('grift', [8])]","[('biden', ['War', 'American/economics/health']), ('member', ['Infrastructure/job/energy', 'American/economics/health']), ('family', ['American/economics/health', 'Infrastructure/job/energy']), ('corrupt', ['War', 'American/economics/health']), ('basically', ['War']), ('disgusting', ['War']), ('grift', ['Infrastructure/job/energy'])]"
NateSilver538,2023-03-20 02:48:01+00:00,2,War,0.7007703,negative,0.82553631067276,anger,0.2857158184051513,4.0,Republicans vs democrats,0.19162771,Never going to be part of any movement or clique where skepticism is negatively coded.,going movement clique skepticism negatively coded,"[('going', [2, 4]), ('movement', [2, 4]), ('skepticism', [4]), ('coded', [2]), ('negatively', [2]), ('clique', [2])]","[('going', ['War', 'Republicans vs democrats']), ('movement', ['War', 'Republicans vs democrats']), ('skepticism', ['Republicans vs democrats']), ('coded', ['War']), ('negatively', ['War']), ('clique', ['War'])]"
RonDeSantis,2023-03-21 15:08:28+00:00,2,War,0.56312215,negative,0.6436701416969299,anger,0.5702099204063416,7.0,Abortion/rights/guns,0.37906432,RT @The Cuban government tried to use the World Baseball Championship for propaganda. They still lost 14-2 to the USA. Freedom wins again.,cuban government tried use world baseball championship propaganda lost usa freedom win,"[('freedom', [7, 2]), ('world', [2, 7]), ('government', [2, 7]), ('lost', [2, 7]), ('tried', [7, 2]), ('use', [2, 7]), ('propaganda', [2]), ('win', [2, 7]), ('cuban', [2]), ('usa', [7]), ('baseball', [2]), ('championship', [7])]","[('freedom', ['Abortion/rights/guns', 'War']), ('world', ['War', 'Abortion/rights/guns']), ('government', ['War', 'Abortion/rights/guns']), ('lost', ['War', 'Abortion/rights/guns']), ('tried', ['Abortion/rights/guns', 'War']), ('use', ['War', 'Abortion/rights/guns']), ('propaganda', ['War']), ('win', ['War', 'Abortion/rights/guns']), ('cuban', ['War']), ('usa', ['Abortion/rights/guns']), ('baseball', ['War']), ('championship', ['Abortion/rights/guns'])]"
NateSilver538,2023-03-22 11:17:35+00:00,2,War,0.64238787,negative,0.8514553308486938,disgust,0.3745835721492767,5.0,Border/community/family,0.25574386,"RT @Cannot tell you what a bummer it is to discover that the Editor-in-Chief of Science thinks it’s not “acceptable”, and that people shouldn’t be given “permission”, to disagree with him on policy even if they accept 100% of the science.",tell bummer discover editor chief science think acceptable people given permission disagree policy accept science,"[('people', [2, 5]), ('chief', [5, 2]), ('editor', [3, 5]), ('think', [2, 5]), ('tell', [2, 5]), ('science', [2]), ('accept', [2, 5]), ('given', [2, 5]), ('policy', [2, 5]), ('disagree', [2]), ('discover', [5]), ('permission', [5]), ('acceptable', [2]), ('bummer', [2])]","[('people', ['War', 'Border/community/family']), ('chief', ['Border/community/family', 'War']), ('editor', ['News/radio/livestream', 'Border/community/family']), ('think', ['War', 'Border/community/family']), ('tell', ['War', 'Border/community/family']), ('science', ['War']), ('accept', ['War', 'Border/community/family']), ('given', ['War', 'Border/community/family']), ('policy', ['War', 'Border/community/family']), ('disagree', ['War']), ('discover', ['Border/community/family']), ('permission', ['Border/community/family']), ('acceptable', ['War']), ('bummer', ['War'])]"
jonathanvswan,2023-03-22 14:16:36+00:00,2,War,0.72500277,neutral,0.9053637385368348,anticipation,0.4986451268196106,4.0,Republicans vs democrats,0.21720566,"“A conservative foreign policy should accept that the United States exists in a world of limits and must behave accordingly,” ⁦@dandcaldwell⁩ writes. https://t.co/esIL1ychZa",conservative foreign policy accept united state exists world limit behave accordingly writes,"[('state', [2, 4]), ('united', [2, 4]), ('world', [2, 4]), ('limit', [4, 2]), ('accept', [2, 4]), ('policy', [2, 4]), ('conservative', [2, 4]), ('foreign', [2, 4]), ('exists', [2, 4]), ('writes', [2, 4]), ('accordingly', [2]), ('behave', [2])]","[('state', ['War', 'Republicans vs democrats']), ('united', ['War', 'Republicans vs democrats']), ('world', ['War', 'Republicans vs democrats']), ('limit', ['Republicans vs democrats', 'War']), ('accept', ['War', 'Republicans vs democrats']), ('policy', ['War', 'Republicans vs democrats']), ('conservative', ['War', 'Republicans vs democrats']), ('foreign', ['War', 'Republicans vs democrats']), ('exists', ['War', 'Republicans vs democrats']), ('writes', ['War', 'Republicans vs democrats']), ('accordingly', ['War']), ('behave', ['War'])]"
WLNS,2023-03-22 19:33:13+00:00,2,War,0.40995356,neutral,0.9448611736297609,anticipation,0.365882933139801,8.0,Infrastructure/job/energy,0.26443097,UPDATE: MSU police says a suspect was found in downtown East Lansing and was taken into custody https://t.co/IX8UiX83O1,update msu police say suspect found downtown east lansing taken custody,"[('east', [2, 8]), ('update', [8, 4]), ('taken', [2, 4]), ('police', [2, 4]), ('say', [2, 4]), ('custody', [2]), ('found', [4, 2]), ('downtown', [8]), ('suspect', [2, 7]), ('lansing', [8, 7]), ('msu', [7])]","[('east', ['War', 'Infrastructure/job/energy']), ('update', ['Infrastructure/job/energy', 'Republicans vs democrats']), ('taken', ['War', 'Republicans vs democrats']), ('police', ['War', 'Republicans vs democrats']), ('say', ['War', 'Republicans vs democrats']), ('custody', ['War']), ('found', ['Republicans vs democrats', 'War']), ('downtown', ['Infrastructure/job/energy']), ('suspect', ['War', 'Abortion/rights/guns']), ('lansing', ['Infrastructure/job/energy', 'Abortion/rights/guns']), ('msu', ['Abortion/rights/guns'])]"
NateSilver538,2023-03-22 22:35:57+00:00,2,War,0.4003847,neutral,0.6423404812812805,anger,0.5800544023513794,4.0,Republicans vs democrats,0.36488935,"In polling, a plurality of voters actually support a TikTok ban. That isn't necessarily dispositive to what the political reaction would be. But I'd trust it before some hand-waving notion that OMG GEN Z WILL BE SO MAD AND WE HAVE TO APPEAL TO THE YOUTHS. https://t.co/89c5LIsQNC",polling plurality voter actually support tiktok ban necessarily dispositive political reaction trust hand waving notion gen  mad appeal youth,"[('ban', [7, 2]), ('support', [2, 4]), ('political', [4, 2]), ('reaction', [2, 4]), ('hand', [2, 4]), ('actually', [2, 4]), ('polling', [4, 6]), ('voter', [4, 6]), ('trust', [4, 2]), ('appeal', [4, 6]), ('mad', [2, 4]), ('tiktok', [4]), ('youth', [2, 6]), ('necessarily', [2]), ('plurality', [4, 7]), ('notion', [2, 6]), ('waving', [7]), ('gen', [2, 6]), ('dispositive', [2, 4])]","[('ban', ['Abortion/rights/guns', 'War']), ('support', ['War', 'Republicans vs democrats']), ('political', ['Republicans vs democrats', 'War']), ('reaction', ['War', 'Republicans vs democrats']), ('hand', ['War', 'Republicans vs democrats']), ('actually', ['War', 'Republicans vs democrats']), ('polling', ['Republicans vs democrats', 'Election/debate']), ('voter', ['Republicans vs democrats', 'Election/debate']), ('trust', ['Republicans vs democrats', 'War']), ('appeal', ['Republicans vs democrats', 'Election/debate']), ('mad', ['War', 'Republicans vs democrats']), ('tiktok', ['Republicans vs democrats']), ('youth', ['War', 'Election/debate']), ('necessarily', ['War']), ('plurality', ['Republicans vs democrats', 'Abortion/rights/guns']), ('notion', ['War', 'Election/debate']), ('waving', ['Abortion/rights/guns']), ('gen', ['War', 'Election/debate']), ('dispositive', ['War', 'Republicans vs democrats'])]"
AP_Politics,2023-03-23 13:28:03+00:00,2,War,0.49719462,negative,0.767985999584198,fear,0.6795331835746765,3.0,News/radio/livestream,0.2061017,Russia is threatening to escalate attacks in Ukraine after the British government announced it would provide to Ukraine a type of munition that Moscow falsely claims has nuclear components. Just what is depleted uranium? https://t.co/YvHGnfOpry,russia threatening escalate attack ukraine british government announced provide ukraine type munition moscow falsely claim nuclear component depleted uranium,"[('nuclear', [2, 8]), ('russia', [2]), ('attack', [2, 7]), ('ukraine', [2]), ('claim', [2]), ('british', [3]), ('announced', [8]), ('government', [2, 8]), ('moscow', [8, 7]), ('threatening', [8, 2]), ('falsely', [3]), ('provide', [8]), ('munition', [2]), ('component', [7]), ('type', [2, 8]), ('uranium', [3]), ('escalate', [2]), ('depleted', [3])]","[('nuclear', ['War', 'Infrastructure/job/energy']), ('russia', ['War']), ('attack', ['War', 'Abortion/rights/guns']), ('ukraine', ['War']), ('claim', ['War']), ('british', ['News/radio/livestream']), ('announced', ['Infrastructure/job/energy']), ('government', ['War', 'Infrastructure/job/energy']), ('moscow', ['Infrastructure/job/energy', 'Abortion/rights/guns']), ('threatening', ['Infrastructure/job/energy', 'War']), ('falsely', ['News/radio/livestream']), ('provide', ['Infrastructure/job/energy']), ('munition', ['War']), ('component', ['Abortion/rights/guns']), ('type', ['War', 'Infrastructure/job/energy']), ('uranium', ['News/radio/livestream']), ('escalate', ['War']), ('depleted', ['News/radio/livestream'])]"
FischerKing64,2023-03-23 23:34:39+00:00,2,War,0.40738988,negative,0.8254386186599731,disgust,0.5008045434951782,6.0,Election/debate,0.4063424,"1/Straight talk on DeSantis. Why did he completely flip his position in a day on Ukraine? MONEY. He doesn’t have any himself. To run for POTUS he will need many large donors, some of which come from military-industrial complex, connected to neo-cons. His flip is bad sign…",straight talk desantis completely flip position day ukraine money run potus need large donor come military industrial complex connected neo con flip bad sign,"[('come', [6, 2]), ('military', [7, 2]), ('money', [2, 6]), ('position', [2, 6]), ('ukraine', [2, 6]), ('day', [6, 2]), ('completely', [2]), ('need', [6, 2]), ('desantis', [6, 2]), ('run', [6, 2]), ('bad', [2, 6]), ('talk', [6, 2]), ('sign', [6, 7]), ('large', [6, 2]), ('donor', [6, 2]), ('flip', [6]), ('connected', [7]), ('industrial', [7]), ('complex', [7, 6]), ('straight', [2, 6]), ('potus', [2]), ('neo', [2]), ('con', [2])]","[('come', ['Election/debate', 'War']), ('military', ['Abortion/rights/guns', 'War']), ('money', ['War', 'Election/debate']), ('position', ['War', 'Election/debate']), ('ukraine', ['War', 'Election/debate']), ('day', ['Election/debate', 'War']), ('completely', ['War']), ('need', ['Election/debate', 'War']), ('desantis', ['Election/debate', 'War']), ('run', ['Election/debate', 'War']), ('bad', ['War', 'Election/debate']), ('talk', ['Election/debate', 'War']), ('sign', ['Election/debate', 'Abortion/rights/guns']), ('large', ['Election/debate', 'War']), ('donor', ['Election/debate', 'War']), ('flip', ['Election/debate']), ('connected', ['Abortion/rights/guns']), ('industrial', ['Abortion/rights/guns']), ('complex', ['Abortion/rights/guns', 'Election/debate']), ('straight', ['War', 'Election/debate']), ('potus', ['War']), ('neo', ['War']), ('con', ['War'])]"
jonathanvswan,2023-03-24 18:19:10+00:00,2,War,0.44259444,negative,0.7382537126541138,anger,0.4041073620319366,5.0,Border/community/family,0.39193764,"RT @Few people like to talk about it, but the US has been in a proxy war with Iran in Iraq and Syria for years. So has Israel. Every now and then, the violence comes into public view. In this instance, a US contractor was killed &amp; others wounded — maybe fighters paid by a firm.",people like talk proxy war iran iraq syria year israel violence come public view instance contractor killed wounded maybe fighter paid firm,"[('come', [5, 2]), ('war', [2, 5]), ('year', [5, 2]), ('iraq', [2, 5]), ('syria', [5]), ('israel', [2, 5]), ('people', [2, 5]), ('like', [2, 5]), ('killed', [5, 2]), ('fighter', [5]), ('contractor', [2]), ('iran', [2, 5]), ('view', [4, 2]), ('maybe', [2, 4]), ('violence', [2, 5]), ('paid', [5, 4]), ('public', [5, 4]), ('talk', [2, 5]), ('firm', [4, 2]), ('instance', [2, 4]), ('proxy', [2, 4]), ('wounded', [5])]","[('come', ['Border/community/family', 'War']), ('war', ['War', 'Border/community/family']), ('year', ['Border/community/family', 'War']), ('iraq', ['War', 'Border/community/family']), ('syria', ['Border/community/family']), ('israel', ['War', 'Border/community/family']), ('people', ['War', 'Border/community/family']), ('like', ['War', 'Border/community/family']), ('killed', ['Border/community/family', 'War']), ('fighter', ['Border/community/family']), ('contractor', ['War']), ('iran', ['War', 'Border/community/family']), ('view', ['Republicans vs democrats', 'War']), ('maybe', ['War', 'Republicans vs democrats']), ('violence', ['War', 'Border/community/family']), ('paid', ['Border/community/family', 'Republicans vs democrats']), ('public', ['Border/community/family', 'Republicans vs democrats']), ('talk', ['War', 'Border/community/family']), ('firm', ['Republicans vs democrats', 'War']), ('instance', ['War', 'Republicans vs democrats']), ('proxy', ['War', 'Republicans vs democrats']), ('wounded', ['Border/community/family'])]"
