username,date,first_topic,first_topic_name,first_topic_prob,sentiment,sentiment_prob,emotion,emotion_prob,second_topic,second_topic_name,second_topic_prob,text,lemmatized_text,per_word_topics,per_word_topics_name
politico,2023-10-05 22:09:52+00:00,2,War,0.43635276,neutral,0.6620913743972778,fear,0.8647094964981079,5.0,Border/community/family,0.34405658,Josh Shapiro’s star is rising. But trouble may be brewing back at home. https://t.co/IZ4Y7z6fNT,josh shapiros star rising trouble brewing home,"[('josh', [2]), ('home', [5, 2]), ('rising', [5, 2]), ('star', [5]), ('brewing', [3]), ('trouble', [2]), ('shapiros', [2])]","[('josh', ['War']), ('home', ['Border/community/family', 'War']), ('rising', ['Border/community/family', 'War']), ('star', ['Border/community/family']), ('brewing', ['News/radio/livestream']), ('trouble', ['War']), ('shapiros', ['War'])]"
judymorris3,2023-10-05 22:12:33+00:00,2,War,0.5034441,negative,0.919894814491272,sadness,0.672211229801178,6.0,Election/debate,0.24607296,"That is indeed WEIRD...get used to it as America gets politically weirder but in a good way. #Democrats are looking pathetic...I don't know of one antiwar Democrat in the House or Senate and that is so sad. Meanwhile, antiwar Republicans are taking a strong stand against funding the crook Zelensky and its war on Russia which is really a US proxy war on Russia.",weird america politically weirder good way looking pathetic know antiwar democrat house senate sad antiwar republican taking strong stand funding crook zelensky war russia proxy war russia,"[('russia', [2, 4]), ('know', [2, 4]), ('war', [2, 4]), ('way', [2, 6]), ('sad', [2, 4]), ('taking', [2, 4]), ('america', [2, 6]), ('funding', [2, 4]), ('house', [4, 6]), ('good', [2, 6]), ('republican', [6, 4]), ('democrat', [2, 4]), ('pathetic', [2, 4]), ('senate', [6, 4]), ('stand', [2, 6]), ('weird', [6]), ('looking', [6, 2]), ('zelensky', [2, 4]), ('politically', [4, 6]), ('strong', [6, 2]), ('proxy', [2, 4]), ('crook', [2]), ('antiwar', [4]), ('weirder', [6])]","[('russia', ['War', 'Republicans vs democrats']), ('know', ['War', 'Republicans vs democrats']), ('war', ['War', 'Republicans vs democrats']), ('way', ['War', 'Election/debate']), ('sad', ['War', 'Republicans vs democrats']), ('taking', ['War', 'Republicans vs democrats']), ('america', ['War', 'Election/debate']), ('funding', ['War', 'Republicans vs democrats']), ('house', ['Republicans vs democrats', 'Election/debate']), ('good', ['War', 'Election/debate']), ('republican', ['Election/debate', 'Republicans vs democrats']), ('democrat', ['War', 'Republicans vs democrats']), ('pathetic', ['War', 'Republicans vs democrats']), ('senate', ['Election/debate', 'Republicans vs democrats']), ('stand', ['War', 'Election/debate']), ('weird', ['Election/debate']), ('looking', ['Election/debate', 'War']), ('zelensky', ['War', 'Republicans vs democrats']), ('politically', ['Republicans vs democrats', 'Election/debate']), ('strong', ['Election/debate', 'War']), ('proxy', ['War', 'Republicans vs democrats']), ('crook', ['War']), ('antiwar', ['Republicans vs democrats']), ('weirder', ['Election/debate'])]"
CounterDotNews,2023-10-05 22:14:06+00:00,2,War,0.7076266,positive,0.950226068496704,joy,0.4651554226875305,4.0,Republicans vs democrats,0.041918077,@MAGA__Patriot @VeBo1991 This is pure gold. #Democrats #Biden2024 #BidenDemocrats,pure gold,"[('gold', [2]), ('pure', [2])]","[('gold', ['War']), ('pure', ['War'])]"
DinahFlo,2023-10-05 22:21:27+00:00,2,War,0.70781654,neutral,0.6788927316665649,anger,0.6943932175636292,4.0,Republicans vs democrats,0.041757207,No one should have any doubt that #Democrats supper #AmericaLast https://t.co/rSSWg96dbe,doubt supper,"[('doubt', [2]), ('supper', [2])]","[('doubt', ['War']), ('supper', ['War'])]"
RedInLasVegas,2023-10-05 22:23:32+00:00,2,War,0.44544902,negative,0.9018310904502868,anger,0.7105982899665833,6.0,Election/debate,0.4052031,They don't care about qualifications or experience. Just as long as they will vote #lgbt or #abortion. That's how asinine the liberal left is. #DemocratsAreShit #Democrats #California #Liberal #Republican #Trump2024 https://t.co/SFPrZtqfkV,care qualification experience long vote asinine liberal left,"[('long', [6, 2]), ('vote', [6, 2]), ('liberal', [2, 6]), ('left', [2, 6]), ('care', [2, 1]), ('qualification', [6, 2]), ('experience', [6, 1]), ('asinine', [2])]","[('long', ['Election/debate', 'War']), ('vote', ['Election/debate', 'War']), ('liberal', ['War', 'Election/debate']), ('left', ['War', 'Election/debate']), ('care', ['War', 'American/economics/health']), ('qualification', ['Election/debate', 'War']), ('experience', ['Election/debate', 'American/economics/health']), ('asinine', ['War'])]"
TheRobertMarley,2023-10-05 22:26:47+00:00,2,War,0.82494944,negative,0.946055829524994,anger,0.701408326625824,6.0,Election/debate,0.025015116,"The #Left is the party of Hate, Racism, and Destruction!! #Democrats #DemocratsCultOfHATE #DemocratsHateAmerica",party hate racism destruction,"[('hate', [2]), ('party', [2]), ('racism', [2]), ('destruction', [2])]","[('hate', ['War']), ('party', ['War']), ('racism', ['War']), ('destruction', ['War'])]"
PhineasPhatt,2023-10-05 22:30:08+00:00,2,War,0.7254298,negative,0.8725059628486633,anger,0.6096451282501221,5.0,Border/community/family,0.20613454,"Yanno, I'm old enough to remember that 'leadership' meant something. Integrity, compassion and morals. Thanks #Republicans you destroyed that too.",yanno old remember leadership meant integrity compassion moral thanks destroyed,"[('old', [2, 5]), ('meant', [2, 5]), ('compassion', [2, 5]), ('leadership', [2, 5]), ('thanks', [5, 2]), ('remember', [2, 5]), ('destroyed', [2, 5]), ('integrity', [2, 5]), ('moral', [2, 5]), ('yanno', [2])]","[('old', ['War', 'Border/community/family']), ('meant', ['War', 'Border/community/family']), ('compassion', ['War', 'Border/community/family']), ('leadership', ['War', 'Border/community/family']), ('thanks', ['Border/community/family', 'War']), ('remember', ['War', 'Border/community/family']), ('destroyed', ['War', 'Border/community/family']), ('integrity', ['War', 'Border/community/family']), ('moral', ['War', 'Border/community/family']), ('yanno', ['War'])]"
WashTimesOpEd,2023-10-05 22:33:39+00:00,2,War,0.58921146,negative,0.7947916388511658,disgust,0.5246862769126892,3.0,News/radio/livestream,0.30346817,"Pope Francis is dead wrong on climate change, again https://t.co/hDgmOLSecW",pope francis dead wrong climate change,"[('change', [2]), ('climate', [2]), ('wrong', [2]), ('dead', [2]), ('francis', [3]), ('pope', [3])]","[('change', ['War']), ('climate', ['War']), ('wrong', ['War']), ('dead', ['War']), ('francis', ['News/radio/livestream']), ('pope', ['News/radio/livestream'])]"
VivekGRamaswamy,2023-10-05 22:34:48+00:00,2,War,0.5759985,positive,0.5876516699790955,anger,0.5298795104026794,6.0,Election/debate,0.22048968,The Establishment in both parties is corrupt to the core &amp; it can’t be fixed with incrementalism. Well done by both @mattgaetz and @RoKhanna here. This is the kind of bipartisanship we *actually* need. 🇺🇸,establishment party corrupt core fixed incrementalism kind bipartisanship actually need,"[('core', [2, 7]), ('need', [2, 6]), ('party', [2, 6]), ('actually', [2, 6]), ('corrupt', [2, 6]), ('kind', [2, 6]), ('fixed', [6]), ('establishment', [2, 6]), ('bipartisanship', [7]), ('incrementalism', [2])]","[('core', ['War', 'Abortion/rights/guns']), ('need', ['War', 'Election/debate']), ('party', ['War', 'Election/debate']), ('actually', ['War', 'Election/debate']), ('corrupt', ['War', 'Election/debate']), ('kind', ['War', 'Election/debate']), ('fixed', ['Election/debate']), ('establishment', ['War', 'Election/debate']), ('bipartisanship', ['Abortion/rights/guns']), ('incrementalism', ['War'])]"
aseitzwald,2023-10-05 22:34:51+00:00,2,War,0.6151228,negative,0.8535369634628296,sadness,0.8088535666465759,4.0,Republicans vs democrats,0.31658626,"Mike Lindell tells @darehgregorian he's broke. ""We've lost everything, every dime... All of it is gone."" His lawyers say he owes them millions. https://t.co/2ei4HzTRRy",mike lindell tell broke lost dime gone lawyer owes million,"[('million', [4, 2]), ('lost', [2, 4]), ('broke', [2, 4]), ('tell', [2, 4]), ('lawyer', [4]), ('mike', [2, 4]), ('lindell', [2]), ('gone', [2, 4]), ('owes', [2]), ('dime', [2])]","[('million', ['Republicans vs democrats', 'War']), ('lost', ['War', 'Republicans vs democrats']), ('broke', ['War', 'Republicans vs democrats']), ('tell', ['War', 'Republicans vs democrats']), ('lawyer', ['Republicans vs democrats']), ('mike', ['War', 'Republicans vs democrats']), ('lindell', ['War']), ('gone', ['War', 'Republicans vs democrats']), ('owes', ['War']), ('dime', ['War'])]"
miksu2006,2023-10-05 22:37:56+00:00,2,War,0.6038014,negative,0.9164316058158876,disgust,0.4954987168312073,5.0,Border/community/family,0.31275532,So #democRATS really DO actually get away with murder....! #menendez's wife has been free for FIVE YEARS after killing a man... @BobMenendezNJ https://t.co/q31olD8bHq,actually away murder  wife free year killing man,"[('murder', [2, 5]), ('year', [5, 2]), ('man', [2, 5]), ('away', [2, 5]), ('actually', [2]), ('wife', [5]), ('killing', [2, 5]), ('free', [2, 5])]","[('murder', ['War', 'Border/community/family']), ('year', ['Border/community/family', 'War']), ('man', ['War', 'Border/community/family']), ('away', ['War', 'Border/community/family']), ('actually', ['War']), ('wife', ['Border/community/family']), ('killing', ['War', 'Border/community/family']), ('free', ['War', 'Border/community/family'])]"
froufroufoxes_,2023-10-05 22:44:56+00:00,2,War,0.753722,negative,0.910385012626648,anger,0.7000377178192139,7.0,Abortion/rights/guns,0.15212552,@themexicanbjork She’s endorsed Trump her entire career yet no one makes a peep about it..hate her,endorsed trump entire career make peep hate,"[('hate', [2, 7]), ('trump', [2, 7]), ('entire', [2]), ('make', [2, 7]), ('career', [2]), ('endorsed', [2]), ('peep', [7])]","[('hate', ['War', 'Abortion/rights/guns']), ('trump', ['War', 'Abortion/rights/guns']), ('entire', ['War']), ('make', ['War', 'Abortion/rights/guns']), ('career', ['War']), ('endorsed', ['War']), ('peep', ['Abortion/rights/guns'])]"
aukletqd,2023-10-05 22:46:38+00:00,2,War,0.78600705,negative,0.741603672504425,anger,0.5826572179794312,4.0,Republicans vs democrats,0.156225,"@KamalaHarris As usual, #Democrats want two groups to be heavily armed - the government, and violent criminals (but I repeat myself) - and peaceful citizens to be disarmed. #2A",usual want group heavily armed government violent criminal repeat peaceful citizen disarmed,"[('citizen', [2, 4]), ('violent', [2, 4]), ('group', [2, 4]), ('armed', [2, 4]), ('government', [2, 4]), ('criminal', [2, 4]), ('want', [2, 4]), ('usual', [2]), ('heavily', [2]), ('repeat', [4]), ('peaceful', [2, 4]), ('disarmed', [2])]","[('citizen', ['War', 'Republicans vs democrats']), ('violent', ['War', 'Republicans vs democrats']), ('group', ['War', 'Republicans vs democrats']), ('armed', ['War', 'Republicans vs democrats']), ('government', ['War', 'Republicans vs democrats']), ('criminal', ['War', 'Republicans vs democrats']), ('want', ['War', 'Republicans vs democrats']), ('usual', ['War']), ('heavily', ['War']), ('repeat', ['Republicans vs democrats']), ('peaceful', ['War', 'Republicans vs democrats']), ('disarmed', ['War'])]"
VarelaCortizo,2023-10-05 22:51:34+00:00,2,War,0.6120334,negative,0.8197002410888672,anger,0.5364641547203064,7.0,Abortion/rights/guns,0.27249593,"One has to be naive on steroids to believe an action voted by all #HouseDemocrats and only eight (8) #Republicans - corrupt, bribed Troy horses - represents a victory for ""conservatives"" Bet your house funds for #Ukraine will be rushed in no time; everything else, fujk bgatye fd",naive steroid believe action voted corrupt bribed troy horse represents victory conservative bet house fund rushed time fujk bgatye ,"[('action', [2, 7]), ('believe', [2, 7]), ('fund', [2, 7]), ('house', [7, 2]), ('time', [2, 7]), ('bet', [2]), ('voted', [2, 7]), ('bribed', [7]), ('conservative', [7, 2]), ('corrupt', [2]), ('victory', [7, 5]), ('represents', [2, 5]), ('rushed', [7]), ('horse', [2, 5]), ('troy', [2]), ('naive', [2]), ('steroid', [5]), ('bgatye', [2]), ('fujk', [2])]","[('action', ['War', 'Abortion/rights/guns']), ('believe', ['War', 'Abortion/rights/guns']), ('fund', ['War', 'Abortion/rights/guns']), ('house', ['Abortion/rights/guns', 'War']), ('time', ['War', 'Abortion/rights/guns']), ('bet', ['War']), ('voted', ['War', 'Abortion/rights/guns']), ('bribed', ['Abortion/rights/guns']), ('conservative', ['Abortion/rights/guns', 'War']), ('corrupt', ['War']), ('victory', ['Abortion/rights/guns', 'Border/community/family']), ('represents', ['War', 'Border/community/family']), ('rushed', ['Abortion/rights/guns']), ('horse', ['War', 'Border/community/family']), ('troy', ['War']), ('naive', ['War']), ('steroid', ['Border/community/family']), ('bgatye', ['War']), ('fujk', ['War'])]"
VivekGRamaswamy,2023-10-05 22:52:33+00:00,2,War,0.56228954,neutral,0.5815660953521729,joy,0.6906465888023376,3.0,News/radio/livestream,0.06253007,This was ironic.,ironic,"[('ironic', [2])]","[('ironic', ['War'])]"
WangNoodle4,2023-10-05 22:53:14+00:00,2,War,0.6780441,negative,0.8809968829154968,anger,0.6731672883033752,7.0,Abortion/rights/guns,0.24683551,"https://t.co/bSnSuOn1zU ""Christian"" Republicans won't dare stand up to their Jewish masters. There is no such thing as a Christian Republican. #Republican #usa #americans #republicans #Christian #Christianity #IsraeliApartheid #IsraeliCrimes #Conservatives #Jews",christian republican dare stand jewish master thing christian republican,"[('republican', [2, 7]), ('thing', [2, 7]), ('master', [2]), ('stand', [2, 7]), ('christian', [2, 7]), ('jewish', [2]), ('dare', [7])]","[('republican', ['War', 'Abortion/rights/guns']), ('thing', ['War', 'Abortion/rights/guns']), ('master', ['War']), ('stand', ['War', 'Abortion/rights/guns']), ('christian', ['War', 'Abortion/rights/guns']), ('jewish', ['War']), ('dare', ['Abortion/rights/guns'])]"
WashTimesOpEd,2023-10-05 22:54:12+00:00,2,War,0.53241533,negative,0.8300573229789734,disgust,0.4721653759479522,3.0,News/radio/livestream,0.18984284,"Chinese President Xi Jinping demands unquestioning obedience to his dictatorial regime. Mobilizing his police state to control China's population and commit human rights atrocities, most notably against the Uyghurs, Mr. Xi has imposed an Orwellian... https://t.co/IlA38Bd4ma",chinese president  jinping demand unquestioning obedience dictatorial regime mobilizing police state control china  population commit human right atrocity notably uyghurs   imposed orwellian,"[('state', [2, 8]), ('police', [2, 5]), ('control', [2, 5]), ('president', [2, 5]), ('china', [2, 8]), ('right', [2, 8]), ('regime', [2]), ('human', [2, 5]), ('population', [5, 8]), ('demand', [2, 8]), ('imposed', [3, 8]), ('chinese', [2, 8]), ('dictatorial', [3]), ('mobilizing', [8]), ('uyghurs', [3]), ('atrocity', [2]), ('commit', [2]), ('jinping', [2]), ('obedience', [3]), ('orwellian', [5]), ('notably', [2]), ('unquestioning', [3, 2])]","[('state', ['War', 'Infrastructure/job/energy']), ('police', ['War', 'Border/community/family']), ('control', ['War', 'Border/community/family']), ('president', ['War', 'Border/community/family']), ('china', ['War', 'Infrastructure/job/energy']), ('right', ['War', 'Infrastructure/job/energy']), ('regime', ['War']), ('human', ['War', 'Border/community/family']), ('population', ['Border/community/family', 'Infrastructure/job/energy']), ('demand', ['War', 'Infrastructure/job/energy']), ('imposed', ['News/radio/livestream', 'Infrastructure/job/energy']), ('chinese', ['War', 'Infrastructure/job/energy']), ('dictatorial', ['News/radio/livestream']), ('mobilizing', ['Infrastructure/job/energy']), ('uyghurs', ['News/radio/livestream']), ('atrocity', ['War']), ('commit', ['War']), ('jinping', ['War']), ('obedience', ['News/radio/livestream']), ('orwellian', ['Border/community/family']), ('notably', ['War']), ('unquestioning', ['News/radio/livestream', 'War'])]"
DJLegacy23,2023-10-05 22:55:14+00:00,2,War,0.8296897,negative,0.9017066955566406,anger,0.7023863792419434,3.0,News/radio/livestream,0.101987705,The reason I'm nit a #Republican &amp; both parties are as bad for #America as the #Democrats. The spineless RINOs have always been a problem. This is why #DrainTheSwamp was a thing &amp; still needs to be done by some means.,reason nit party bad spineless rinos problem thing need mean,"[('problem', [2]), ('reason', [2]), ('need', [2]), ('thing', [2]), ('party', [2]), ('bad', [2]), ('mean', [2]), ('rinos', [2]), ('spineless', [3]), ('nit', [2])]","[('problem', ['War']), ('reason', ['War']), ('need', ['War']), ('thing', ['War']), ('party', ['War']), ('bad', ['War']), ('mean', ['War']), ('rinos', ['War']), ('spineless', ['News/radio/livestream']), ('nit', ['War'])]"
LadybugGreen7,2023-10-05 23:08:33+00:00,2,War,0.49233362,negative,0.6195357441902161,disgust,0.4289839267730713,7.0,Abortion/rights/guns,0.35658658,know what it means. #Republicans have gone full out Machievellian.,know mean gone machievellian,"[('know', [2, 7]), ('mean', [2, 7]), ('gone', [2, 7]), ('machievellian', [7])]","[('know', ['War', 'Abortion/rights/guns']), ('mean', ['War', 'Abortion/rights/guns']), ('gone', ['War', 'Abortion/rights/guns']), ('machievellian', ['Abortion/rights/guns'])]"
realTuckFrumper,2023-10-05 23:11:36+00:00,2,War,0.5195838,negative,0.8314633369445801,sadness,0.9112244844436646,1.0,American/economics/health,0.2660568,"'We've lost everything, every dime': Mike Lindell explains why he can't pay his legal bills https://t.co/gqsYDIyOEN",lost dime mike lindell explains pay legal bill,"[('lost', [2, 1]), ('pay', [1, 2]), ('bill', [1, 4]), ('legal', [4, 1]), ('explains', [2]), ('mike', [2, 4]), ('lindell', [2]), ('dime', [2])]","[('lost', ['War', 'American/economics/health']), ('pay', ['American/economics/health', 'War']), ('bill', ['American/economics/health', 'Republicans vs democrats']), ('legal', ['Republicans vs democrats', 'American/economics/health']), ('explains', ['War']), ('mike', ['War', 'Republicans vs democrats']), ('lindell', ['War']), ('dime', ['War'])]"
DrDaveSalisbury,2023-10-05 23:13:37+00:00,2,War,0.7029751,negative,0.7303444743156433,anger,0.5881887078285217,7.0,Abortion/rights/guns,0.20305347,@SenWhitehouse Today's reminder that #Democrats are upset the #SupremeCourt is no longer a reliable #leftist super-legislature.,today  reminder upset longer reliable super legislature,"[('today', [7, 2]), ('longer', [2, 7]), ('upset', [2]), ('super', [2]), ('reliable', [2]), ('reminder', [2, 7]), ('legislature', [7, 2])]","[('today', ['Abortion/rights/guns', 'War']), ('longer', ['War', 'Abortion/rights/guns']), ('upset', ['War']), ('super', ['War']), ('reliable', ['War']), ('reminder', ['War', 'Abortion/rights/guns']), ('legislature', ['Abortion/rights/guns', 'War'])]"
doogieapparel,2023-10-05 23:17:46+00:00,2,War,0.5054609,negative,0.8370969295501709,anger,0.8022550344467163,8.0,Infrastructure/job/energy,0.38717812,Do you really think DemocRats 🐀 Give a flying F*** About Foundational Black Americans ✅ #usa #RATS #Democrats #votetrump @NBMArchive @DeeTubman2 @tariqnasheed #BlackTwitter #blackmedia @ABC7 https://t.co/UZurm9qdYm,think democrat flying  foundational black american,"[('american', [2, 8]), ('black', [2]), ('think', [2]), ('democrat', [2, 8]), ('flying', [8]), ('foundational', [8])]","[('american', ['War', 'Infrastructure/job/energy']), ('black', ['War']), ('think', ['War']), ('democrat', ['War', 'Infrastructure/job/energy']), ('flying', ['Infrastructure/job/energy']), ('foundational', ['Infrastructure/job/energy'])]"
SwampPump,2023-10-05 23:24:43+00:00,2,War,0.46362785,neutral,0.7746495008468628,optimism,0.8609181046485901,7.0,Abortion/rights/guns,0.38619348,#Democrats are supporting a new Freedom. The Freedom of Consequences.,supporting freedom freedom consequence,"[('freedom', [7, 2]), ('supporting', [2]), ('consequence', [2, 7])]","[('freedom', ['Abortion/rights/guns', 'War']), ('supporting', ['War']), ('consequence', ['War', 'Abortion/rights/guns'])]"
kk131066,2023-10-05 23:25:24+00:00,2,War,0.57329077,negative,0.8814330697059631,anger,0.6692819595336914,4.0,Republicans vs democrats,0.37661606,https://t.co/Mv2Alnk7SW #GQP the Walking Dead Their brain is dead #Democrats called for unity with the Walking Dead They have no brains What's the difference btw GQP &amp; Dems NONE They're doing the same thing #Biden #Trump #racism #Fascism #asylum #UkraineRussiaWar #Russian,walking dead brain dead called unity walking dead brain difference way gqp dems thing,"[('way', [2, 4]), ('called', [2, 4]), ('brain', [2]), ('thing', [2, 4]), ('difference', [4, 2]), ('dems', [4, 2]), ('walking', [4]), ('dead', [2, 4]), ('gqp', [4]), ('unity', [2])]","[('way', ['War', 'Republicans vs democrats']), ('called', ['War', 'Republicans vs democrats']), ('brain', ['War']), ('thing', ['War', 'Republicans vs democrats']), ('difference', ['Republicans vs democrats', 'War']), ('dems', ['Republicans vs democrats', 'War']), ('walking', ['Republicans vs democrats']), ('dead', ['War', 'Republicans vs democrats']), ('gqp', ['Republicans vs democrats']), ('unity', ['War'])]"
DanDcucich,2023-10-05 23:37:25+00:00,2,War,0.7808465,negative,0.9452221989631652,anger,0.7350010871887207,4.0,Republicans vs democrats,0.03138534,"Matt, you are a destructive, tool of the #Democrats",matt destructive tool,"[('destructive', [2]), ('tool', [2]), ('matt', [2])]","[('destructive', ['War']), ('tool', ['War']), ('matt', ['War'])]"
pattipetersonny,2023-10-05 23:41:38+00:00,2,War,0.38992727,negative,0.7341249585151672,anger,0.7700906991958618,1.0,American/economics/health,0.35993588,@seanhannity Blame #Republicans. They ❤️ guns!,blame gun,"[('gun', [1, 2]), ('blame', [2, 1])]","[('gun', ['American/economics/health', 'War']), ('blame', ['War', 'American/economics/health'])]"
fledermonk,2023-10-05 23:42:32+00:00,2,War,0.62487,negative,0.954649031162262,anger,0.7569426894187927,4.0,Republicans vs democrats,0.173661,That's Bullshit #GOP #Republicans #fascist Anti-American Assholes are the problem fuck you #MAGA Retardicans . Shove your #Kremlin #KGB #Soviet propaganda up your ass. https://t.co/JXfpWZfPbl,bullshit anti american asshole problem fuck retardicans shove propaganda ,"[('american', [2, 7]), ('problem', [2, 4]), ('propaganda', [2, 4]), ('anti', [2, 7]), ('fuck', [2]), ('asshole', [7]), ('bullshit', [2, 4]), ('shove', [4]), ('retardicans', [2])]","[('american', ['War', 'Abortion/rights/guns']), ('problem', ['War', 'Republicans vs democrats']), ('propaganda', ['War', 'Republicans vs democrats']), ('anti', ['War', 'Abortion/rights/guns']), ('fuck', ['War']), ('asshole', ['Abortion/rights/guns']), ('bullshit', ['War', 'Republicans vs democrats']), ('shove', ['Republicans vs democrats']), ('retardicans', ['War'])]"
RealJamesWoods,2023-10-05 23:44:41+00:00,2,War,0.33117124,negative,0.8881211280822754,anger,0.8252522349357605,5.0,Border/community/family,0.28244734,"If you were to transcribe this speech word for word and post it on social media today, your life would over. They would crucify you. This guy? Free pass. https://t.co/MMy7oI3JTW",transcribe speech word word post social medium today life crucify guy free pas,"[('today', [5, 4]), ('medium', [4, 2]), ('post', [4, 2]), ('social', [4, 1]), ('speech', [4, 2]), ('life', [5, 2]), ('guy', [4, 2]), ('pas', [5, 1]), ('word', [2, 4]), ('free', [2, 5]), ('transcribe', [5]), ('crucify', [2])]","[('today', ['Border/community/family', 'Republicans vs democrats']), ('medium', ['Republicans vs democrats', 'War']), ('post', ['Republicans vs democrats', 'War']), ('social', ['Republicans vs democrats', 'American/economics/health']), ('speech', ['Republicans vs democrats', 'War']), ('life', ['Border/community/family', 'War']), ('guy', ['Republicans vs democrats', 'War']), ('pas', ['Border/community/family', 'American/economics/health']), ('word', ['War', 'Republicans vs democrats']), ('free', ['War', 'Border/community/family']), ('transcribe', ['Border/community/family']), ('crucify', ['War'])]"
MikeSington,2023-10-05 23:45:19+00:00,2,War,0.91229707,negative,0.869551956653595,disgust,0.3909409940242767,4.0,Republicans vs democrats,0.012544879,"Mike Lindell is broke: “We’ve lost everything, every dime. All of it is gone.” It’s called the Trump effect. https://t.co/8rXLkWsQAX",mike lindell broke lost dime gone called trump effect,"[('called', [2]), ('trump', [2]), ('lost', [2]), ('broke', [2]), ('mike', [2]), ('lindell', [2]), ('gone', [2]), ('effect', [2]), ('dime', [2])]","[('called', ['War']), ('trump', ['War']), ('lost', ['War']), ('broke', ['War']), ('mike', ['War']), ('lindell', ['War']), ('gone', ['War']), ('effect', ['War']), ('dime', ['War'])]"
KarenLee1956,2023-10-05 23:46:14+00:00,2,War,0.7685756,negative,0.8906774520874023,anger,0.6658093333244324,5.0,Border/community/family,0.16291757,"This is who #Republicans want to make #Speaker? #Trump is a #Traitor &amp; I guess since the Republicans support him, they're Traitors too. Especially #MattGaetz who I think he’s planing to #ShutTheGovernmentDown &amp; they don't want to support #Ukraine, &amp; I https://t.co/UCRmPfIQS9",want guess republican support traitor especially think  planing want support,"[('support', [2, 5]), ('republican', [2, 5]), ('think', [2, 5]), ('especially', [2, 5]), ('want', [2, 5]), ('guess', [2]), ('traitor', [2]), ('planing', [5])]","[('support', ['War', 'Border/community/family']), ('republican', ['War', 'Border/community/family']), ('think', ['War', 'Border/community/family']), ('especially', ['War', 'Border/community/family']), ('want', ['War', 'Border/community/family']), ('guess', ['War']), ('traitor', ['War']), ('planing', ['Border/community/family'])]"
