username,date,first_topic,first_topic_name,first_topic_prob,sentiment,sentiment_prob,emotion,emotion_prob,second_topic,second_topic_name,second_topic_prob,text,lemmatized_text,per_word_topics,per_word_topics_name
RobertKennedyJr,2023-06-17 00:10:40+00:00,2,War,0.35974753,negative,0.856626033782959,anger,0.6162471771240234,4.0,Republicans vs democrats,0.22764237,"Today, similarly brave whistleblowers and truth-tellers are persecuted. That will change under my administration. #ReclaimDemocracy #Kennedy24",today similarly brave whistleblower truth teller persecuted change administration,"[('today', [5, 7]), ('administration', [2, 5]), ('truth', [4, 2]), ('change', [2, 4]), ('whistleblower', [4]), ('brave', [5, 4]), ('similarly', [2]), ('teller', [7]), ('persecuted', [2])]","[('today', ['Border/community/family', 'Abortion/rights/guns']), ('administration', ['War', 'Border/community/family']), ('truth', ['Republicans vs democrats', 'War']), ('change', ['War', 'Republicans vs democrats']), ('whistleblower', ['Republicans vs democrats']), ('brave', ['Border/community/family', 'Republicans vs democrats']), ('similarly', ['War']), ('teller', ['Abortion/rights/guns']), ('persecuted', ['War'])]"
TulsiGabbard,2023-06-17 13:06:34+00:00,2,War,0.25764346,negative,0.9049012064933776,anger,0.6167282462120056,1.0,American/economics/health,0.22582616,"Today’s Dem Party, MSM, &amp; ‘woke’ activists are undermining families, stripping away parental rights, sexualizing our kids, mutilating/poisoning kids with “gender-affirming care,” and normalizing pedophilia and infanticide. We must stop this insanity before it’s too late. https://t.co/j1NjITLiBP",today dem party msm woke activist undermining family stripping away parental right sexualizing kid mutilating poisoning kid gender affirming care normalizing pedophilia infanticide stop insanity late,"[('today', [6, 1]), ('late', [6, 1]), ('away', [7, 2]), ('right', [7, 2]), ('activist', [2, 7]), ('gender', [7, 1]), ('woke', [2, 1]), ('party', [2, 6]), ('family', [1, 5]), ('care', [1, 7]), ('affirming', [1]), ('kid', [1, 2]), ('stop', [2, 1]), ('dem', [6, 4]), ('sexualizing', [2]), ('insanity', [2, 4]), ('parental', [6]), ('undermining', [7, 1]), ('stripping', [6]), ('normalizing', [4]), ('poisoning', [2, 1]), ('msm', [2, 4]), ('mutilating', [3]), ('pedophilia', [5]), ('infanticide', [7])]","[('today', ['Election/debate', 'American/economics/health']), ('late', ['Election/debate', 'American/economics/health']), ('away', ['Abortion/rights/guns', 'War']), ('right', ['Abortion/rights/guns', 'War']), ('activist', ['War', 'Abortion/rights/guns']), ('gender', ['Abortion/rights/guns', 'American/economics/health']), ('woke', ['War', 'American/economics/health']), ('party', ['War', 'Election/debate']), ('family', ['American/economics/health', 'Border/community/family']), ('care', ['American/economics/health', 'Abortion/rights/guns']), ('affirming', ['American/economics/health']), ('kid', ['American/economics/health', 'War']), ('stop', ['War', 'American/economics/health']), ('dem', ['Election/debate', 'Republicans vs democrats']), ('sexualizing', ['War']), ('insanity', ['War', 'Republicans vs democrats']), ('parental', ['Election/debate']), ('undermining', ['Abortion/rights/guns', 'American/economics/health']), ('stripping', ['Election/debate']), ('normalizing', ['Republicans vs democrats']), ('poisoning', ['War', 'American/economics/health']), ('msm', ['War', 'Republicans vs democrats']), ('mutilating', ['News/radio/livestream']), ('pedophilia', ['Border/community/family']), ('infanticide', ['Abortion/rights/guns'])]"
marwilliamson,2023-06-17 18:28:40+00:00,2,War,0.7820455,negative,0.5449867248535156,anger,0.3564323484897613,1.0,American/economics/health,0.16416976,Corporate power in this country now forms a single matrix of inexorable control. We need to end that control before it ends us. Full interview with @RustyRockets https://t.co/rtoVVpu7N6 https://t.co/40bLvDLm2i,corporate power country form single matrix inexorable control need end control end interview,"[('interview', [2]), ('control', [2, 1]), ('form', [2, 1]), ('power', [2, 1]), ('need', [2, 1]), ('country', [2, 1]), ('single', [2, 1]), ('end', [2, 1]), ('corporate', [1, 2]), ('matrix', [2]), ('inexorable', [2])]","[('interview', ['War']), ('control', ['War', 'American/economics/health']), ('form', ['War', 'American/economics/health']), ('power', ['War', 'American/economics/health']), ('need', ['War', 'American/economics/health']), ('country', ['War', 'American/economics/health']), ('single', ['War', 'American/economics/health']), ('end', ['War', 'American/economics/health']), ('corporate', ['American/economics/health', 'War']), ('matrix', ['War']), ('inexorable', ['War'])]"
CNN,2023-06-18 14:20:42+00:00,2,War,0.44461787,negative,0.7839401960372925,fear,0.93965482711792,7.0,Abortion/rights/guns,0.39439815,"At least 10 people were hurt after an overnight shooting at a Juneteenth celebration in Willowbrook, Illinois, police say. https://t.co/YrEpK7Tn4F",people hurt overnight shooting juneteenth celebration willowbrook illinois police,"[('people', [2, 7]), ('police', [2, 5]), ('hurt', [2]), ('shooting', [2, 5]), ('illinois', [7, 5]), ('celebration', [7, 5]), ('juneteenth', [7]), ('overnight', [7]), ('willowbrook', [2])]","[('people', ['War', 'Abortion/rights/guns']), ('police', ['War', 'Border/community/family']), ('hurt', ['War']), ('shooting', ['War', 'Border/community/family']), ('illinois', ['Abortion/rights/guns', 'Border/community/family']), ('celebration', ['Abortion/rights/guns', 'Border/community/family']), ('juneteenth', ['Abortion/rights/guns']), ('overnight', ['Abortion/rights/guns']), ('willowbrook', ['War'])]"
RyanBinkley,2023-06-18 19:41:06+00:00,2,War,0.7078679,positive,0.8059196472167969,optimism,0.8515227437019348,1.0,American/economics/health,0.041761268,It’s time for UNITY! #Believe #Binkley2024 https://t.co/Amyn7NAntM,time unity,"[('time', [2]), ('unity', [2])]","[('time', ['War']), ('unity', ['War'])]"
RobertKennedyJr,2023-06-19 16:01:52+00:00,2,War,0.4969283,negative,0.7930057048797607,anger,0.5650836229324341,8.0,Infrastructure/job/energy,0.24996468,Looks like the Biden Administration deployed Boris Johnson to scuttle a tentative peace agreement between Russia and Ukraine in spring 2022. This was never about the Ukrainian people. It was always about engineering a war against Russia. #Kennedy24 https://t.co/SYyFEqy5El,look like biden administration deployed boris johnson scuttle tentative peace agreement russia ukraine spring ukrainian people engineering war russia,"[('russia', [2]), ('biden', [2, 8]), ('war', [2]), ('administration', [2, 8]), ('people', [2, 8]), ('ukraine', [2]), ('like', [2, 8]), ('peace', [2, 6]), ('look', [2, 8]), ('ukrainian', [2]), ('johnson', [6]), ('agreement', [8]), ('spring', [6, 8]), ('engineering', [8]), ('boris', [8]), ('deployed', [3, 6]), ('tentative', [3]), ('scuttle', [2, 3])]","[('russia', ['War']), ('biden', ['War', 'Infrastructure/job/energy']), ('war', ['War']), ('administration', ['War', 'Infrastructure/job/energy']), ('people', ['War', 'Infrastructure/job/energy']), ('ukraine', ['War']), ('like', ['War', 'Infrastructure/job/energy']), ('peace', ['War', 'Election/debate']), ('look', ['War', 'Infrastructure/job/energy']), ('ukrainian', ['War']), ('johnson', ['Election/debate']), ('agreement', ['Infrastructure/job/energy']), ('spring', ['Election/debate', 'Infrastructure/job/energy']), ('engineering', ['Infrastructure/job/energy']), ('boris', ['Infrastructure/job/energy']), ('deployed', ['News/radio/livestream', 'Election/debate']), ('tentative', ['News/radio/livestream']), ('scuttle', ['War', 'News/radio/livestream'])]"
CollinRugg,2023-06-19 16:18:01+00:00,2,War,0.3536736,negative,0.5741812586784363,anticipation,0.3318716883659363,5.0,Border/community/family,0.3326518,"BREAKING: Secretary of State Anthony Blinken gives China the green light to invade Taiwan during his visit to Beijing, China. ""We do not support Taiwan independence."" What a pivot from Biden’s previous comments from just months ago. What happened? ""Yes, if in fact, there was an unprecedented attack,” Biden said after being asked if he would defend Taiwan from a Chinese invasion.",secretary state anthony blinken give china green light invade taiwan visit beijing china support taiwan independence pivot bidens previous comment month ago happened yes fact unprecedented attack biden said asked defend taiwan chinese invasion,"[('beijing', [2]), ('attack', [5, 4]), ('biden', [4, 2]), ('state', [5, 4]), ('comment', [2, 4]), ('said', [4, 2]), ('support', [5, 2]), ('happened', [2, 5]), ('asked', [4, 5]), ('month', [5, 4]), ('china', [2, 4]), ('invade', [5]), ('taiwan', [2, 5]), ('fact', [4, 2]), ('yes', [2, 4]), ('ago', [5, 4]), ('bidens', [4, 5]), ('anthony', [4]), ('unprecedented', [5, 4]), ('secretary', [5, 4]), ('blinken', [4, 2]), ('light', [5, 4]), ('give', [5, 4]), ('independence', [5, 4]), ('defend', [5, 2]), ('pivot', [2]), ('visit', [5, 2]), ('invasion', [5, 2]), ('green', [2, 5]), ('previous', [4]), ('chinese', [2, 4])]","[('beijing', ['War']), ('attack', ['Border/community/family', 'Republicans vs democrats']), ('biden', ['Republicans vs democrats', 'War']), ('state', ['Border/community/family', 'Republicans vs democrats']), ('comment', ['War', 'Republicans vs democrats']), ('said', ['Republicans vs democrats', 'War']), ('support', ['Border/community/family', 'War']), ('happened', ['War', 'Border/community/family']), ('asked', ['Republicans vs democrats', 'Border/community/family']), ('month', ['Border/community/family', 'Republicans vs democrats']), ('china', ['War', 'Republicans vs democrats']), ('invade', ['Border/community/family']), ('taiwan', ['War', 'Border/community/family']), ('fact', ['Republicans vs democrats', 'War']), ('yes', ['War', 'Republicans vs democrats']), ('ago', ['Border/community/family', 'Republicans vs democrats']), ('bidens', ['Republicans vs democrats', 'Border/community/family']), ('anthony', ['Republicans vs democrats']), ('unprecedented', ['Border/community/family', 'Republicans vs democrats']), ('secretary', ['Border/community/family', 'Republicans vs democrats']), ('blinken', ['Republicans vs democrats', 'War']), ('light', ['Border/community/family', 'Republicans vs democrats']), ('give', ['Border/community/family', 'Republicans vs democrats']), ('independence', ['Border/community/family', 'Republicans vs democrats']), ('defend', ['Border/community/family', 'War']), ('pivot', ['War']), ('visit', ['Border/community/family', 'War']), ('invasion', ['Border/community/family', 'War']), ('green', ['War', 'Border/community/family']), ('previous', ['Republicans vs democrats']), ('chinese', ['War', 'Republicans vs democrats'])]"
RobertKennedyJr,2023-06-19 18:17:05+00:00,2,War,0.52659756,negative,0.5733495950698853,anger,0.6213277578353882,4.0,Republicans vs democrats,0.30550644,"The Biden administration plan, which Blinken and others have explicitly admitted on numerous occasions, is to use Ukraine to achieve the larger geopolitical goal of weakening Russia. In other words, the Ukrainians are cannon fodder in a U.S. proxy war against Russia. #Kennedy24",biden administration plan blinken explicitly admitted numerous occasion use ukraine achieve larger geopolitical goal weakening russia word ukrainian cannon fodder  proxy war russia,"[('russia', [2, 4]), ('biden', [4, 2]), ('war', [2, 4]), ('administration', [2, 4]), ('ukraine', [2, 4]), ('use', [2, 4]), ('ukrainian', [2, 4]), ('plan', [4, 6]), ('word', [2, 4]), ('numerous', [6]), ('blinken', [2, 4]), ('admitted', [4]), ('occasion', [2]), ('goal', [4, 6]), ('cannon', [4]), ('proxy', [2, 4]), ('achieve', [4, 6]), ('larger', [4, 6]), ('weakening', [2]), ('explicitly', [7]), ('geopolitical', [2]), ('fodder', [2])]","[('russia', ['War', 'Republicans vs democrats']), ('biden', ['Republicans vs democrats', 'War']), ('war', ['War', 'Republicans vs democrats']), ('administration', ['War', 'Republicans vs democrats']), ('ukraine', ['War', 'Republicans vs democrats']), ('use', ['War', 'Republicans vs democrats']), ('ukrainian', ['War', 'Republicans vs democrats']), ('plan', ['Republicans vs democrats', 'Election/debate']), ('word', ['War', 'Republicans vs democrats']), ('numerous', ['Election/debate']), ('blinken', ['War', 'Republicans vs democrats']), ('admitted', ['Republicans vs democrats']), ('occasion', ['War']), ('goal', ['Republicans vs democrats', 'Election/debate']), ('cannon', ['Republicans vs democrats']), ('proxy', ['War', 'Republicans vs democrats']), ('achieve', ['Republicans vs democrats', 'Election/debate']), ('larger', ['Republicans vs democrats', 'Election/debate']), ('weakening', ['War']), ('explicitly', ['Abortion/rights/guns']), ('geopolitical', ['War']), ('fodder', ['War'])]"
RyanBinkley,2023-06-19 19:19:30+00:00,2,War,0.47760868,positive,0.8435599207878113,optimism,0.8108927607536316,8.0,Infrastructure/job/energy,0.19823167,"At the GOP Convention in Georgia I encouraged Republicans to broaden our tent. Our youth, our urban communities, and our entire great nation need unity. United we stand! #Believe #Binkley2024 https://t.co/xtuqqxDFdt",gop convention georgia encouraged republican broaden tent youth urban community entire great nation need unity united stand,"[('united', [2, 8]), ('republican', [6, 2]), ('need', [2, 8]), ('entire', [2, 4]), ('gop', [6, 2]), ('great', [6, 8]), ('community', [8, 6]), ('stand', [2, 8]), ('nation', [8, 2]), ('georgia', [6, 4]), ('tent', [2, 6]), ('youth', [2, 6]), ('urban', [8, 4]), ('convention', [2, 4]), ('unity', [2, 6]), ('encouraged', [4]), ('broaden', [2])]","[('united', ['War', 'Infrastructure/job/energy']), ('republican', ['Election/debate', 'War']), ('need', ['War', 'Infrastructure/job/energy']), ('entire', ['War', 'Republicans vs democrats']), ('gop', ['Election/debate', 'War']), ('great', ['Election/debate', 'Infrastructure/job/energy']), ('community', ['Infrastructure/job/energy', 'Election/debate']), ('stand', ['War', 'Infrastructure/job/energy']), ('nation', ['Infrastructure/job/energy', 'War']), ('georgia', ['Election/debate', 'Republicans vs democrats']), ('tent', ['War', 'Election/debate']), ('youth', ['War', 'Election/debate']), ('urban', ['Infrastructure/job/energy', 'Republicans vs democrats']), ('convention', ['War', 'Republicans vs democrats']), ('unity', ['War', 'Election/debate']), ('encouraged', ['Republicans vs democrats']), ('broaden', ['War'])]"
MarshaBlackburn,2023-06-19 19:22:34+00:00,2,War,0.53414726,negative,0.8435401916503906,anger,0.7928993701934814,5.0,Border/community/family,0.3190751,Blinken flew to Communist China to appease Xi Jinping and state the Biden administration does not support Taiwan’s independence. Why won't this administration stand up to bullies and stand for freedom?,blinken flew communist china appease  jinping state biden administration support taiwan independence administration stand bully stand freedom,"[('biden', [2, 5]), ('freedom', [5, 2]), ('state', [5, 2]), ('support', [2, 5]), ('administration', [5, 2]), ('china', [2, 5]), ('taiwan', [2, 5]), ('communist', [2, 5]), ('stand', [2, 5]), ('blinken', [2, 4]), ('independence', [5, 4]), ('bully', [2]), ('flew', [5]), ('jinping', [2]), ('appease', [4])]","[('biden', ['War', 'Border/community/family']), ('freedom', ['Border/community/family', 'War']), ('state', ['Border/community/family', 'War']), ('support', ['War', 'Border/community/family']), ('administration', ['Border/community/family', 'War']), ('china', ['War', 'Border/community/family']), ('taiwan', ['War', 'Border/community/family']), ('communist', ['War', 'Border/community/family']), ('stand', ['War', 'Border/community/family']), ('blinken', ['War', 'Republicans vs democrats']), ('independence', ['Border/community/family', 'Republicans vs democrats']), ('bully', ['War']), ('flew', ['Border/community/family']), ('jinping', ['War']), ('appease', ['Republicans vs democrats'])]"
SenateGOP,2023-06-19 19:54:41+00:00,2,War,0.4919717,negative,0.8241006731987,anger,0.7714365720748901,5.0,Border/community/family,0.36802322,RT @Blinken flew to Communist China to appease Xi Jinping and state the Biden administration does not support Taiwan’s independence. Why won't this administration stand up to bullies and stand for freedom?,flew communist china appease  jinping state biden administration support taiwan independence administration stand bully stand freedom,"[('biden', [2, 5]), ('freedom', [5, 2]), ('state', [5, 2]), ('support', [2, 5]), ('administration', [5, 2]), ('china', [2, 5]), ('taiwan', [2, 5]), ('communist', [2, 5]), ('stand', [2, 5]), ('independence', [5]), ('bully', [2]), ('flew', [5]), ('jinping', [2]), ('appease', [4])]","[('biden', ['War', 'Border/community/family']), ('freedom', ['Border/community/family', 'War']), ('state', ['Border/community/family', 'War']), ('support', ['War', 'Border/community/family']), ('administration', ['Border/community/family', 'War']), ('china', ['War', 'Border/community/family']), ('taiwan', ['War', 'Border/community/family']), ('communist', ['War', 'Border/community/family']), ('stand', ['War', 'Border/community/family']), ('independence', ['Border/community/family']), ('bully', ['War']), ('flew', ['Border/community/family']), ('jinping', ['War']), ('appease', ['Republicans vs democrats'])]"
CollinRugg,2023-06-19 20:06:50+00:00,2,War,0.2996191,negative,0.5355082154273987,sadness,0.4996425211429596,4.0,Republicans vs democrats,0.2368456,Milley checking my location after being embarrassed by my tweet. https://t.co/TCMMBtgAb5,milley checking location embarrassed tweet,"[('location', [6, 4]), ('checking', [2]), ('milley', [4]), ('tweet', [2, 6]), ('embarrassed', [3])]","[('location', ['Election/debate', 'Republicans vs democrats']), ('checking', ['War']), ('milley', ['Republicans vs democrats']), ('tweet', ['War', 'Election/debate']), ('embarrassed', ['News/radio/livestream'])]"
NateSilver538,2023-06-20 06:56:23+00:00,2,War,0.5311397,neutral,0.5263386964797974,joy,0.4608223438262939,7.0,Abortion/rights/guns,0.28208724,Bad karma to make poker brags before the tournament is over but gonna make an exception because I was down to one blind (45k) and ran it up to 13.3m in the @WSOP MonsterStack. About 40 of us left for Day 4 from 8000+ originally. https://t.co/WMOZdhZ0uH,bad karma poker brag tournament going exception blind ran  monsterstack left day originally,"[('blind', [2, 7]), ('day', [7, 2]), ('originally', [2, 4]), ('going', [2, 4]), ('ran', [2, 4]), ('left', [2, 7]), ('bad', [2, 4]), ('exception', [7]), ('brag', [2]), ('tournament', [7]), ('poker', [7]), ('karma', [4]), ('monsterstack', [2])]","[('blind', ['War', 'Abortion/rights/guns']), ('day', ['Abortion/rights/guns', 'War']), ('originally', ['War', 'Republicans vs democrats']), ('going', ['War', 'Republicans vs democrats']), ('ran', ['War', 'Republicans vs democrats']), ('left', ['War', 'Abortion/rights/guns']), ('bad', ['War', 'Republicans vs democrats']), ('exception', ['Abortion/rights/guns']), ('brag', ['War']), ('tournament', ['Abortion/rights/guns']), ('poker', ['Abortion/rights/guns']), ('karma', ['Republicans vs democrats']), ('monsterstack', ['War'])]"
marwilliamson,2023-06-20 09:36:48+00:00,2,War,0.5290047,negative,0.5218021273612976,optimism,0.683230996131897,1.0,American/economics/health,0.22514808,Our system is a little more than a giveaway to the rich at the expense of the poor. And status quo will not disrupt itself.,system little giveaway rich expense poor status quo disrupt,"[('system', [8, 2]), ('little', [2, 1]), ('status', [2, 8]), ('rich', [2, 1]), ('disrupt', [8]), ('poor', [2, 1]), ('giveaway', [2]), ('expense', [1]), ('quo', [2])]","[('system', ['Infrastructure/job/energy', 'War']), ('little', ['War', 'American/economics/health']), ('status', ['War', 'Infrastructure/job/energy']), ('rich', ['War', 'American/economics/health']), ('disrupt', ['Infrastructure/job/energy']), ('poor', ['War', 'American/economics/health']), ('giveaway', ['War']), ('expense', ['American/economics/health']), ('quo', ['War'])]"
RobertKennedyJr,2023-06-20 13:35:58+00:00,2,War,0.34750047,neutral,0.5598370432853699,anger,0.5398887395858765,4.0,Republicans vs democrats,0.26935816,"In March 2022, Israeli Prime Minister Naftali Bennett traveled to Moscow to mediate between Putin and Zelensky. He extracted significant concessions from Putin. But then, he said, the U.S. blocked any deal. War was the plan all along. #Kennedy24 https://t.co/nFMtE8zlOX",march israeli prime minister naftali bennett traveled moscow mediate putin zelensky extracted significant concession putin said  blocked deal war plan,"[('putin', [2, 5]), ('war', [2, 5]), ('said', [4, 2]), ('israeli', [2, 4]), ('significant', [8, 4]), ('minister', [5, 4]), ('plan', [4, 8]), ('moscow', [8]), ('deal', [4, 2]), ('blocked', [2]), ('prime', [5, 8]), ('march', [5, 4]), ('zelensky', [2, 4]), ('traveled', [8]), ('concession', [2]), ('bennett', [4]), ('naftali', [4]), ('mediate', [5]), ('extracted', [4])]","[('putin', ['War', 'Border/community/family']), ('war', ['War', 'Border/community/family']), ('said', ['Republicans vs democrats', 'War']), ('israeli', ['War', 'Republicans vs democrats']), ('significant', ['Infrastructure/job/energy', 'Republicans vs democrats']), ('minister', ['Border/community/family', 'Republicans vs democrats']), ('plan', ['Republicans vs democrats', 'Infrastructure/job/energy']), ('moscow', ['Infrastructure/job/energy']), ('deal', ['Republicans vs democrats', 'War']), ('blocked', ['War']), ('prime', ['Border/community/family', 'Infrastructure/job/energy']), ('march', ['Border/community/family', 'Republicans vs democrats']), ('zelensky', ['War', 'Republicans vs democrats']), ('traveled', ['Infrastructure/job/energy']), ('concession', ['War']), ('bennett', ['Republicans vs democrats']), ('naftali', ['Republicans vs democrats']), ('mediate', ['Border/community/family']), ('extracted', ['Republicans vs democrats'])]"
dscc,2023-06-20 15:58:27+00:00,2,War,0.34546357,neutral,0.5125943422317505,anger,0.5438588857650757,6.0,Election/debate,0.3379295,RT @“Rich people love running for office. But campaigns can expose these candidates to embarrassing disclosures and personal attacks” #wvsen #mtsen #pasen #wisen https://t.co/FqVVz3GA7S,people love running office campaign expose candidate embarrassing disclosure personal attack,"[('attack', [7, 2]), ('office', [6, 7]), ('people', [2, 6]), ('personal', [7, 2]), ('candidate', [6, 7]), ('love', [2, 6]), ('running', [6, 7]), ('campaign', [6, 2]), ('disclosure', [7]), ('expose', [2]), ('embarrassing', [2])]","[('attack', ['Abortion/rights/guns', 'War']), ('office', ['Election/debate', 'Abortion/rights/guns']), ('people', ['War', 'Election/debate']), ('personal', ['Abortion/rights/guns', 'War']), ('candidate', ['Election/debate', 'Abortion/rights/guns']), ('love', ['War', 'Election/debate']), ('running', ['Election/debate', 'Abortion/rights/guns']), ('campaign', ['Election/debate', 'War']), ('disclosure', ['Abortion/rights/guns']), ('expose', ['War']), ('embarrassing', ['War'])]"
SenateGOP,2023-06-20 17:28:43+00:00,2,War,0.35103643,negative,0.8790703415870667,anger,0.6526121497154236,4.0,Republicans vs democrats,0.25054508,RT @Did we forget communist China had a spy balloon in our backyard just 4 months ago? Sec. Blinken’s trip to China for the Big Guy to ‘ease tensions’ is an embarrassment. Since when did America go to her bullies to ask them to play nice? Peace through STRENGTH.,forget communist china spy balloon backyard month ago sec blinkens trip china big guy ease tension embarrassment america bully ask play nice peace strength,"[('tension', [4, 5]), ('america', [2, 5]), ('month', [5, 4]), ('ask', [4, 2]), ('china', [2, 4]), ('peace', [5, 2]), ('sec', [4, 5]), ('ago', [5, 4]), ('embarrassment', [4]), ('big', [4, 6]), ('guy', [4, 2]), ('trip', [5, 2]), ('communist', [2, 4]), ('nice', [2, 4]), ('backyard', [8]), ('spy', [2, 5]), ('play', [4, 2]), ('forget', [5, 4]), ('bully', [2]), ('strength', [5, 2]), ('ease', [6]), ('balloon', [2, 5]), ('blinkens', [4])]","[('tension', ['Republicans vs democrats', 'Border/community/family']), ('america', ['War', 'Border/community/family']), ('month', ['Border/community/family', 'Republicans vs democrats']), ('ask', ['Republicans vs democrats', 'War']), ('china', ['War', 'Republicans vs democrats']), ('peace', ['Border/community/family', 'War']), ('sec', ['Republicans vs democrats', 'Border/community/family']), ('ago', ['Border/community/family', 'Republicans vs democrats']), ('embarrassment', ['Republicans vs democrats']), ('big', ['Republicans vs democrats', 'Election/debate']), ('guy', ['Republicans vs democrats', 'War']), ('trip', ['Border/community/family', 'War']), ('communist', ['War', 'Republicans vs democrats']), ('nice', ['War', 'Republicans vs democrats']), ('backyard', ['Infrastructure/job/energy']), ('spy', ['War', 'Border/community/family']), ('play', ['Republicans vs democrats', 'War']), ('forget', ['Border/community/family', 'Republicans vs democrats']), ('bully', ['War']), ('strength', ['Border/community/family', 'War']), ('ease', ['Election/debate']), ('balloon', ['War', 'Border/community/family']), ('blinkens', ['Republicans vs democrats'])]"
Jim_Jordan,2023-06-20 22:19:24+00:00,2,War,0.37499925,negative,0.7756847143173218,anger,0.5331916809082031,1.0,American/economics/health,0.3747226,The Swamp always protects its own.,swamp protects,"[('swamp', [2]), ('protects', [1])]","[('swamp', ['War']), ('protects', ['American/economics/health'])]"
