username,date,first_topic,first_topic_name,first_topic_prob,sentiment,sentiment_prob,emotion,emotion_prob,second_topic,second_topic_name,second_topic_prob,text,lemmatized_text,per_word_topics,per_word_topics_name
BLMMF1,2023-10-05 00:19:41+00:00,2,War,0.58696806,negative,0.8716590404510498,joy,0.4166402518749237,6.0,Election/debate,0.28390265,What a joke! A little late for Mace &amp; Ingraham to be talking about giving women a reason to vote for them or the GOP. That ship has sailed! #WomenVoteBlue #Biden2024 🤮⏰💪🇺🇸,joke little late mace ingraham talking giving woman reason vote gop ship sailed,"[('vote', [6, 2]), ('reason', [2, 6]), ('late', [6, 2]), ('giving', [2, 6]), ('joke', [2, 6]), ('gop', [6, 2]), ('woman', [2, 6]), ('talking', [2, 6]), ('little', [2, 6]), ('ship', [2]), ('mace', [8]), ('sailed', [2]), ('ingraham', [2])]","[('vote', ['Election/debate', 'War']), ('reason', ['War', 'Election/debate']), ('late', ['Election/debate', 'War']), ('giving', ['War', 'Election/debate']), ('joke', ['War', 'Election/debate']), ('gop', ['Election/debate', 'War']), ('woman', ['War', 'Election/debate']), ('talking', ['War', 'Election/debate']), ('little', ['War', 'Election/debate']), ('ship', ['War']), ('mace', ['Infrastructure/job/energy']), ('sailed', ['War']), ('ingraham', ['War'])]"
LanaResists,2023-10-05 01:03:05+00:00,2,War,0.70818526,positive,0.9748129844665528,joy,0.9486798048019408,6.0,Election/debate,0.041724265,@ResisterSis20 The perfect tweet. 👏🏽 #Biden2024 https://t.co/q7xC6Lqxlf,perfect tweet,"[('perfect', [2]), ('tweet', [2])]","[('perfect', ['War']), ('tweet', ['War'])]"
MarioNawfal,2023-10-05 01:07:11+00:00,2,War,0.34764716,negative,0.6209993958473206,disgust,0.5526322722434998,1.0,American/economics/health,0.3433918,"🚨BREAKING: UKRAINE ‘FREAKING OUT’ BILLIONS OF AID MAY STOP AFTER MCCARTHY OUSTER When McCarthy was ousted, the aid to Ukraine was named as one of the reasons Ukrainian officials are at a loss as to what might happen next. “We are freaking out. For us it is a disaster. We are interested in getting things sorted out so American democracy can function, and so we can restore the bipartisan consensus on supporting their own national interest by supporting Ukraine.” - Senior Ukrainian MP Should U.S Taxpayers continue to fund the Ukraine war?",ukraine freaking billion aid stop mccarthy ouster mccarthy ousted aid ukraine named reason ukrainian official loss happen freaking disaster interested getting thing sorted american democracy function restore bipartisan consensus supporting national interest supporting ukraine senior ukrainian   taxpayer continue fund ukraine war,"[('national', [1, 2]), ('american', [1, 2]), ('democracy', [2, 4]), ('war', [2, 1]), ('supporting', [2, 1]), ('interest', [1, 4]), ('official', [4, 1]), ('senior', [1, 4]), ('aid', [2, 1]), ('billion', [1, 2]), ('fund', [1, 2]), ('taxpayer', [1, 4]), ('ukraine', [2, 4]), ('happen', [2, 1]), ('reason', [2, 1]), ('getting', [1, 4]), ('thing', [2, 4]), ('freaking', [4]), ('ukrainian', [2, 4]), ('continue', [1, 2]), ('stop', [2, 1]), ('named', [4, 6]), ('mccarthy', [4, 1]), ('function', [1, 2]), ('bipartisan', [1]), ('disaster', [1, 4]), ('loss', [1, 2]), ('restore', [1]), ('ousted', [2]), ('consensus', [6]), ('interested', [4, 2]), ('sorted', [3]), ('ouster', [2, 3])]","[('national', ['American/economics/health', 'War']), ('american', ['American/economics/health', 'War']), ('democracy', ['War', 'Republicans vs democrats']), ('war', ['War', 'American/economics/health']), ('supporting', ['War', 'American/economics/health']), ('interest', ['American/economics/health', 'Republicans vs democrats']), ('official', ['Republicans vs democrats', 'American/economics/health']), ('senior', ['American/economics/health', 'Republicans vs democrats']), ('aid', ['War', 'American/economics/health']), ('billion', ['American/economics/health', 'War']), ('fund', ['American/economics/health', 'War']), ('taxpayer', ['American/economics/health', 'Republicans vs democrats']), ('ukraine', ['War', 'Republicans vs democrats']), ('happen', ['War', 'American/economics/health']), ('reason', ['War', 'American/economics/health']), ('getting', ['American/economics/health', 'Republicans vs democrats']), ('thing', ['War', 'Republicans vs democrats']), ('freaking', ['Republicans vs democrats']), ('ukrainian', ['War', 'Republicans vs democrats']), ('continue', ['American/economics/health', 'War']), ('stop', ['War', 'American/economics/health']), ('named', ['Republicans vs democrats', 'Election/debate']), ('mccarthy', ['Republicans vs democrats', 'American/economics/health']), ('function', ['American/economics/health', 'War']), ('bipartisan', ['American/economics/health']), ('disaster', ['American/economics/health', 'Republicans vs democrats']), ('loss', ['American/economics/health', 'War']), ('restore', ['American/economics/health']), ('ousted', ['War']), ('consensus', ['Election/debate']), ('interested', ['Republicans vs democrats', 'War']), ('sorted', ['News/radio/livestream']), ('ouster', ['War', 'News/radio/livestream'])]"
citidotio,2023-10-05 01:33:56+00:00,2,War,0.4936353,neutral,0.68099445104599,disgust,0.53215092420578,8.0,Infrastructure/job/energy,0.31865016,Why was the #US #HouseSpeaker just ousted from his job? And what does it mean for the #RepublicanParty? #Republicans #McCarthy #Democrats #USPolitics https://t.co/GMllJ0Re4r via @citidotio,ousted job mean,"[('job', [8, 2]), ('mean', [2, 8]), ('ousted', [2])]","[('job', ['Infrastructure/job/energy', 'War']), ('mean', ['War', 'Infrastructure/job/energy']), ('ousted', ['War'])]"
RonDeSantis,2023-10-05 01:41:58+00:00,2,War,0.73182946,negative,0.6010100245475769,optimism,0.5773000717163086,1.0,American/economics/health,0.12230435,"DC politics revolves around rhetoric, virtue signaling, and entertainment. I operate differently, and that’s why we have delivered more on America First policies than anyone. https://t.co/TohG734d1e", politics revolves rhetoric virtue signaling entertainment operate differently delivered america policy,"[('america', [2, 1]), ('policy', [2, 1]), ('politics', [2, 1]), ('signaling', [2]), ('virtue', [2]), ('rhetoric', [2]), ('delivered', [1]), ('differently', [2]), ('operate', [2]), ('entertainment', [3]), ('revolves', [2])]","[('america', ['War', 'American/economics/health']), ('policy', ['War', 'American/economics/health']), ('politics', ['War', 'American/economics/health']), ('signaling', ['War']), ('virtue', ['War']), ('rhetoric', ['War']), ('delivered', ['American/economics/health']), ('differently', ['War']), ('operate', ['War']), ('entertainment', ['News/radio/livestream']), ('revolves', ['War'])]"
miriamcosic,2023-10-05 02:11:09+00:00,2,War,0.70740324,neutral,0.6157607436180115,anticipation,0.3110601902008056,4.0,Republicans vs democrats,0.041942906,What a list. Scroll through them … #USPolitics,list scroll,"[('list', [2]), ('scroll', [2])]","[('list', ['War']), ('scroll', ['War'])]"
miriamcosic,2023-10-05 02:14:50+00:00,2,War,0.5257162,negative,0.8375471830368042,anger,0.7698360681533813,4.0,Republicans vs democrats,0.4239629,‘His menacing words toward Mark Milley and Letitia James should not be shrugged off’ Trump’s escalating violent rhetoric is straight out of the autocrat’s playbook - by @Sulliview #USPolitics https://t.co/BhjQ8CRbUu,menacing word mark milley letitia james shrugged trump escalating violent rhetoric straight autocrat playbook,"[('violent', [2, 4]), ('trump', [4, 2]), ('word', [2, 4]), ('playbook', [2]), ('mark', [4]), ('rhetoric', [2]), ('james', [4, 2]), ('autocrat', [2]), ('milley', [4]), ('menacing', [4]), ('escalating', [2]), ('straight', [2, 4]), ('letitia', [4]), ('shrugged', [2])]","[('violent', ['War', 'Republicans vs democrats']), ('trump', ['Republicans vs democrats', 'War']), ('word', ['War', 'Republicans vs democrats']), ('playbook', ['War']), ('mark', ['Republicans vs democrats']), ('rhetoric', ['War']), ('james', ['Republicans vs democrats', 'War']), ('autocrat', ['War']), ('milley', ['Republicans vs democrats']), ('menacing', ['Republicans vs democrats']), ('escalating', ['War']), ('straight', ['War', 'Republicans vs democrats']), ('letitia', ['Republicans vs democrats']), ('shrugged', ['War'])]"
Gege53555240,2023-10-05 02:51:11+00:00,2,War,0.3249543,negative,0.768243134021759,anger,0.386426568031311,6.0,Election/debate,0.24542576,"@_ThatTomGuy_ @ButterflyThp @OccupyDemocrats Nah, afraid. Dude, the base is 31% your the minority &amp; his not gonna win ppl are sick of him. What are you gonna do/say when he loses in 24. Keep sending him your hard earned $ &amp; I'll keep 🤣 see ya in Nov. #VoteBlue2024 #Biden2024 #Bidenomics #GenZ #ItsOver #GOPMockery 🤣🤣🤣 https://t.co/jffONC2nYu",nah afraid dude base minority going win people sick going loses sending hard earned  november,"[('base', [6, 2]), ('people', [2, 1]), ('going', [2, 6]), ('november', [6, 1]), ('sending', [2, 4]), ('hard', [1, 6]), ('afraid', [4, 2]), ('win', [6, 2]), ('sick', [1, 2]), ('loses', [2, 4]), ('earned', [1]), ('minority', [4, 6]), ('dude', [3]), ('nah', [2])]","[('base', ['Election/debate', 'War']), ('people', ['War', 'American/economics/health']), ('going', ['War', 'Election/debate']), ('november', ['Election/debate', 'American/economics/health']), ('sending', ['War', 'Republicans vs democrats']), ('hard', ['American/economics/health', 'Election/debate']), ('afraid', ['Republicans vs democrats', 'War']), ('win', ['Election/debate', 'War']), ('sick', ['American/economics/health', 'War']), ('loses', ['War', 'Republicans vs democrats']), ('earned', ['American/economics/health']), ('minority', ['Republicans vs democrats', 'Election/debate']), ('dude', ['News/radio/livestream']), ('nah', ['War'])]"
guardian,2023-10-05 02:55:45+00:00,2,War,0.9123815,neutral,0.5421527624130249,fear,0.9583688378334044,4.0,Republicans vs democrats,0.012539454,Biden admits he is worried Republican infighting could hurt Ukraine aid – video https://t.co/FtnF3PqOdQ,biden admits worried republican infighting hurt ukraine aid video,"[('biden', [2]), ('aid', [2]), ('ukraine', [2]), ('republican', [2]), ('hurt', [2]), ('video', [2]), ('admits', [2]), ('worried', [2]), ('infighting', [2])]","[('biden', ['War']), ('aid', ['War']), ('ukraine', ['War']), ('republican', ['War']), ('hurt', ['War']), ('video', ['War']), ('admits', ['War']), ('worried', ['War']), ('infighting', ['War'])]"
TopEndDownUnda,2023-10-05 03:02:24+00:00,2,War,0.44599694,negative,0.9229986667633056,anger,0.7797477841377258,4.0,Republicans vs democrats,0.30835915,"@ADL @JGreenblattADL Why are you still ignoring the #Canadian parliament cheering for a SS nazi? Is it because you're all hypocrites? When someone asks how can a Jew like George Soros work with nazis, I show them the ADL. History repeats. #ADLisaHateGroup #cdnpoli #USPolitics",ignoring parliament cheering  nazi hypocrite asks jew like george soros work nazi adl history repeat,"[('jew', [2]), ('like', [2, 4]), ('work', [5, 2]), ('history', [5, 4]), ('nazi', [2, 5]), ('parliament', [5]), ('asks', [4, 5]), ('ignoring', [2, 4]), ('adl', [3]), ('hypocrite', [2, 4]), ('cheering', [2]), ('george', [4, 5]), ('repeat', [4]), ('soros', [4, 2])]","[('jew', ['War']), ('like', ['War', 'Republicans vs democrats']), ('work', ['Border/community/family', 'War']), ('history', ['Border/community/family', 'Republicans vs democrats']), ('nazi', ['War', 'Border/community/family']), ('parliament', ['Border/community/family']), ('asks', ['Republicans vs democrats', 'Border/community/family']), ('ignoring', ['War', 'Republicans vs democrats']), ('adl', ['News/radio/livestream']), ('hypocrite', ['War', 'Republicans vs democrats']), ('cheering', ['War']), ('george', ['Republicans vs democrats', 'Border/community/family']), ('repeat', ['Republicans vs democrats']), ('soros', ['Republicans vs democrats', 'War'])]"
amriana,2023-10-05 03:37:19+00:00,2,War,0.87491167,negative,0.9313557147979736,anger,0.590351939201355,4.0,Republicans vs democrats,0.017880615,"No, please no!!! We don't want to see his face anymore!!! #Republicans are totally dysfunctional!!! #RepublicansCantGovern #Republicans are a DANGER to #America!!! https://t.co/RknWlwOm2o",want face anymore totally dysfunctional danger,"[('totally', [2]), ('want', [2]), ('face', [2]), ('anymore', [2]), ('danger', [2]), ('dysfunctional', [2])]","[('totally', ['War']), ('want', ['War']), ('face', ['War']), ('anymore', ['War']), ('danger', ['War']), ('dysfunctional', ['War'])]"
TheRedPill333,2023-10-05 03:38:28+00:00,2,War,0.54330057,negative,0.8406320810317993,anger,0.7965525984764099,5.0,Border/community/family,0.38155973,@SecBlinken @aliciabarcena This is a #Mexico and #Texas cluster fuk Sir. #Republicans are doing it on purpose and Mexico doesn't care who crosses. That's the bottom line Sir.,cluster fuk sir purpose mexico care cross line sir,"[('care', [2, 5]), ('purpose', [2, 5]), ('line', [5, 2]), ('cross', [5, 2]), ('mexico', [5]), ('sir', [2]), ('cluster', [2]), ('fuk', [5])]","[('care', ['War', 'Border/community/family']), ('purpose', ['War', 'Border/community/family']), ('line', ['Border/community/family', 'War']), ('cross', ['Border/community/family', 'War']), ('mexico', ['Border/community/family']), ('sir', ['War']), ('cluster', ['War']), ('fuk', ['Border/community/family'])]"
WittyNewsDaily,2023-10-05 03:38:44+00:00,2,War,0.76054734,negative,0.889812707901001,disgust,0.4937301278114319,5.0,Border/community/family,0.15594727,"What do you get when you mix Biden, Republicans, and Ukraine? Confusion, chaos, and no aid in sight. #Biden #Ukraine #Republicans https://t.co/Z9udKguR00",mix biden republican ukraine confusion chaos aid sight,"[('biden', [2, 5]), ('aid', [2, 5]), ('ukraine', [2, 5]), ('chaos', [2, 5]), ('republican', [2, 5]), ('confusion', [2]), ('sight', [5]), ('mix', [2])]","[('biden', ['War', 'Border/community/family']), ('aid', ['War', 'Border/community/family']), ('ukraine', ['War', 'Border/community/family']), ('chaos', ['War', 'Border/community/family']), ('republican', ['War', 'Border/community/family']), ('confusion', ['War']), ('sight', ['Border/community/family']), ('mix', ['War'])]"
anarchoedgelord,2023-10-05 03:42:41+00:00,2,War,0.7400347,negative,0.8136705160140991,anger,0.7563169598579407,4.0,Republicans vs democrats,0.21822102,"When it comes to #Democrats and #Republicans, a reasonable thinker already knows what collectives either party would commit violence upon. Point still stands. If you're a citizen, voter, you cannot be righteous. You believe in violence upon the otherwise peaceful in some form.",come reasonable thinker know collective party commit violence point stand citizen voter righteous believe violence peaceful form,"[('come', [2, 4]), ('know', [2, 4]), ('citizen', [2, 4]), ('believe', [2, 4]), ('form', [2, 4]), ('point', [2, 4]), ('party', [2, 4]), ('violence', [2, 4]), ('thinker', [4]), ('stand', [2, 4]), ('voter', [4, 2]), ('righteous', [2]), ('collective', [2]), ('reasonable', [2, 4]), ('commit', [2, 4]), ('peaceful', [2, 4])]","[('come', ['War', 'Republicans vs democrats']), ('know', ['War', 'Republicans vs democrats']), ('citizen', ['War', 'Republicans vs democrats']), ('believe', ['War', 'Republicans vs democrats']), ('form', ['War', 'Republicans vs democrats']), ('point', ['War', 'Republicans vs democrats']), ('party', ['War', 'Republicans vs democrats']), ('violence', ['War', 'Republicans vs democrats']), ('thinker', ['Republicans vs democrats']), ('stand', ['War', 'Republicans vs democrats']), ('voter', ['Republicans vs democrats', 'War']), ('righteous', ['War']), ('collective', ['War']), ('reasonable', ['War', 'Republicans vs democrats']), ('commit', ['War', 'Republicans vs democrats']), ('peaceful', ['War', 'Republicans vs democrats'])]"
IsabellaMDeLuca,2023-10-05 03:49:45+00:00,2,War,0.78085375,negative,0.8140938878059387,anger,0.7482897043228149,8.0,Infrastructure/job/energy,0.031422548,White supremacy strikes again https://t.co/HhsCoT5a2o,white supremacy strike,"[('strike', [2]), ('white', [2]), ('supremacy', [2])]","[('strike', ['War']), ('white', ['War']), ('supremacy', ['War'])]"
JeffBelonger,2023-10-05 03:57:08+00:00,2,War,0.6056502,negative,0.8884689211845398,anger,0.7099365592002869,4.0,Republicans vs democrats,0.33170554,"@MeghanMcCain Meghan, you are a disgrace! We need to be strong with the #Republicans! And McCarthy has gotten stuff done! Some things that many didn't think would be possible. You are a disgrace!",meghan disgrace need strong mccarthy gotten stuff thing think possible disgrace,"[('need', [2, 4]), ('thing', [2, 4]), ('think', [2, 4]), ('possible', [2, 4]), ('mccarthy', [4, 2]), ('stuff', [2, 4]), ('meghan', [4]), ('strong', [2, 4]), ('gotten', [2, 4]), ('disgrace', [2])]","[('need', ['War', 'Republicans vs democrats']), ('thing', ['War', 'Republicans vs democrats']), ('think', ['War', 'Republicans vs democrats']), ('possible', ['War', 'Republicans vs democrats']), ('mccarthy', ['Republicans vs democrats', 'War']), ('stuff', ['War', 'Republicans vs democrats']), ('meghan', ['Republicans vs democrats']), ('strong', ['War', 'Republicans vs democrats']), ('gotten', ['War', 'Republicans vs democrats']), ('disgrace', ['War'])]"
wrenaissanceman,2023-10-05 04:10:56+00:00,2,War,0.707984,neutral,0.6827066540718079,anger,0.4731387495994568,5.0,Border/community/family,0.0418242,"@joncoopertweets Yes. Remember, they're #Republicans.",yes remember,"[('yes', [2]), ('remember', [2])]","[('yes', ['War']), ('remember', ['War'])]"
Praetorian27,2023-10-05 04:11:41+00:00,2,War,0.48460615,negative,0.88507080078125,anger,0.815276563167572,5.0,Border/community/family,0.4629917,"The yobs are a dime a dozen. They have always been with us. The Klan, the Know Nothings, John Birch Society, QAnon, the Anti-Vax dunces... they feed on civil society. They are parasites. #racism #WhiteNationalism #Republicans #Fascism",yob dime dozen klan know nothing john birch society qanon anti vax dunce feed civil society parasite,"[('dozen', [5]), ('know', [2, 5]), ('civil', [2, 5]), ('feed', [2, 5]), ('john', [5]), ('society', [2, 5]), ('anti', [2, 5]), ('vax', [5]), ('qanon', [5]), ('dime', [2]), ('klan', [2]), ('birch', [2, 5]), ('dunce', [2, 5]), ('nothing', [2, 5]), ('parasite', [5]), ('yob', [2, 5])]","[('dozen', ['Border/community/family']), ('know', ['War', 'Border/community/family']), ('civil', ['War', 'Border/community/family']), ('feed', ['War', 'Border/community/family']), ('john', ['Border/community/family']), ('society', ['War', 'Border/community/family']), ('anti', ['War', 'Border/community/family']), ('vax', ['Border/community/family']), ('qanon', ['Border/community/family']), ('dime', ['War']), ('klan', ['War']), ('birch', ['War', 'Border/community/family']), ('dunce', ['War', 'Border/community/family']), ('nothing', ['War', 'Border/community/family']), ('parasite', ['Border/community/family']), ('yob', ['War', 'Border/community/family'])]"
RadarResist,2023-10-05 04:26:01+00:00,2,War,0.5473463,neutral,0.8487922549247742,joy,0.5266637206077576,4.0,Republicans vs democrats,0.3841747,"@ResisterChic @lauraboerman @DaveHibbard3 @CarlyJA22 @customcore7 @CamiLee13 @Sunflwrgirl2 @younakaEVH @PappyParki @Zee207702 @GroovyChic1960s @rotterdamvvg @crygood @lemonadeblue693 @dindin6 @RonSuder @HeinzRudolf155 @Zen_Soul @bonmondieu @HLStockenstrom @Eathbound420 @immerse_ur_soul @ltwlauren @michelle_spenc @beachlifelinda1 @doxie53 @RhymesRadical @BonHanson79 @LanceUSA70 @kanekavi @New_AllyO @SuePetrovek @justryin2live @ButtersKatz @EPennysworth @CokoGay @ConnieBabe4 @Getyourfoxyback @afforsyth @Damaan4u33 @BlueStormComin1 @enrich1212 @Texy_Liz @ResistersUniteX @ericasmombubbe3 @UniversalSp1r1t @StephensVina @wiredowl @SmackeyCracks @RedStateBlues_ Wow Patti,that’s a fav list of Resister’s, ty . Don’t make this the last election we have. Keep our democracy intact. Vote these fascists out 🫶💙. #LockHimUpAlready #LockHimUpForever #Biden2024 https://t.co/13vjmMO7zh",wow patti fav list resister  election democracy intact vote fascist,"[('democracy', [2, 4]), ('wow', [4, 2]), ('election', [4, 2]), ('vote', [2, 4]), ('list', [4, 2]), ('intact', [2]), ('fascist', [2]), ('fav', [4]), ('patti', [2]), ('resister', [2])]","[('democracy', ['War', 'Republicans vs democrats']), ('wow', ['Republicans vs democrats', 'War']), ('election', ['Republicans vs democrats', 'War']), ('vote', ['War', 'Republicans vs democrats']), ('list', ['Republicans vs democrats', 'War']), ('intact', ['War']), ('fascist', ['War']), ('fav', ['Republicans vs democrats']), ('patti', ['War']), ('resister', ['War'])]"
marklevinshow,2023-10-05 04:43:23+00:00,2,War,0.281384,negative,0.9212146401405334,anger,0.6809704899787903,4.0,Republicans vs democrats,0.2812216,Nancy Mace is a disgrace,nancy mace disgrace,"[('nancy', [4]), ('mace', [8]), ('disgrace', [2])]","[('nancy', ['Republicans vs democrats']), ('mace', ['Infrastructure/job/energy']), ('disgrace', ['War'])]"
WashTimesOpEd,2023-10-05 05:05:42+00:00,2,War,0.43016362,negative,0.9171262383461,anger,0.6500501036643982,4.0,Republicans vs democrats,0.3887719,"Donald Trump is not a great man. His rhetoric, which has included denunciations of those who have served in the military (while he dodged the draft five times with a limp excuse about bone spurs), ought to disgust all but those who are in complete... https://t.co/hR3gQAyHBv",donald trump great man rhetoric included denunciation served military dodged draft time limp excuse bone spur ought disgust complete,"[('military', [2, 4]), ('donald', [4, 2]), ('trump', [4, 2]), ('man', [2, 4]), ('time', [4, 2]), ('dodged', [4]), ('great', [2, 8]), ('bone', [2, 8]), ('ought', [2, 1]), ('served', [4, 1]), ('rhetoric', [2]), ('excuse', [2, 4]), ('complete', [4, 2]), ('included', [1, 8]), ('draft', [4, 8]), ('denunciation', [2]), ('spur', [8]), ('limp', [2]), ('disgust', [4])]","[('military', ['War', 'Republicans vs democrats']), ('donald', ['Republicans vs democrats', 'War']), ('trump', ['Republicans vs democrats', 'War']), ('man', ['War', 'Republicans vs democrats']), ('time', ['Republicans vs democrats', 'War']), ('dodged', ['Republicans vs democrats']), ('great', ['War', 'Infrastructure/job/energy']), ('bone', ['War', 'Infrastructure/job/energy']), ('ought', ['War', 'American/economics/health']), ('served', ['Republicans vs democrats', 'American/economics/health']), ('rhetoric', ['War']), ('excuse', ['War', 'Republicans vs democrats']), ('complete', ['Republicans vs democrats', 'War']), ('included', ['American/economics/health', 'Infrastructure/job/energy']), ('draft', ['Republicans vs democrats', 'Infrastructure/job/energy']), ('denunciation', ['War']), ('spur', ['Infrastructure/job/energy']), ('limp', ['War']), ('disgust', ['Republicans vs democrats'])]"
MsMarieB,2023-10-05 05:16:52+00:00,2,War,0.5728067,negative,0.8756436109542847,anger,0.7724412083625793,6.0,Election/debate,0.37680665,"The new North American absurdity: chuckleheads using the word ""tyranny"", when the democratic process and the rule of law don't work for them. #cdnpoli #uspolitics and hey, @CPC_HQ soyez sage.",north american absurdity chuckleheads word tyranny democratic process rule law work hey soyez sage,"[('american', [2, 6]), ('law', [2, 6]), ('work', [6, 2]), ('process', [6]), ('rule', [2, 6]), ('word', [2, 6]), ('north', [6]), ('democratic', [6, 2]), ('hey', [2, 6]), ('absurdity', [2]), ('tyranny', [2]), ('sage', [6]), ('chuckleheads', [2]), ('soyez', [2])]","[('american', ['War', 'Election/debate']), ('law', ['War', 'Election/debate']), ('work', ['Election/debate', 'War']), ('process', ['Election/debate']), ('rule', ['War', 'Election/debate']), ('word', ['War', 'Election/debate']), ('north', ['Election/debate']), ('democratic', ['Election/debate', 'War']), ('hey', ['War', 'Election/debate']), ('absurdity', ['War']), ('tyranny', ['War']), ('sage', ['Election/debate']), ('chuckleheads', ['War']), ('soyez', ['War'])]"
OrangeManMuyBad,2023-10-05 05:45:34+00:00,2,War,0.8006656,negative,0.768792986869812,anger,0.7512070536613464,4.0,Republicans vs democrats,0.14143439,@Roxanne58103369 @Sketti_Smash @xPuritanPerry @KIM510 @GovStitt Why should we care? Only live for yourself! Trumptards can go away! #Biden2024 #RidingwithBiden #TrumpSucks! Liberals are just better people than trash cons. Cons are hardly even people.,care live trumptards away liberal better people trash con con hardly people,"[('people', [2, 4]), ('liberal', [2, 4]), ('away', [2, 4]), ('better', [2, 4]), ('care', [2, 4]), ('live', [2, 4]), ('hardly', [4]), ('trash', [2]), ('con', [2]), ('trumptards', [2])]","[('people', ['War', 'Republicans vs democrats']), ('liberal', ['War', 'Republicans vs democrats']), ('away', ['War', 'Republicans vs democrats']), ('better', ['War', 'Republicans vs democrats']), ('care', ['War', 'Republicans vs democrats']), ('live', ['War', 'Republicans vs democrats']), ('hardly', ['Republicans vs democrats']), ('trash', ['War']), ('con', ['War']), ('trumptards', ['War'])]"
