username,date,first_topic,first_topic_name,first_topic_prob,sentiment,sentiment_prob,emotion,emotion_prob,second_topic,second_topic_name,second_topic_prob,text,lemmatized_text,per_word_topics,per_word_topics_name
VivekGRamaswamy,2023-08-23 01:02:29+00:00,2,War,0.46457568,negative,0.5033093690872192,disgust,0.4162107706069946,1.0,American/economics/health,0.3476942,RT @michaeljknowles: ✅ destroyed ✅ with facts ✅ and logic https://t.co/pKts7kJIil,destroyed fact logic,"[('fact', [2, 1]), ('destroyed', [2]), ('logic', [1])]","[('fact', ['War', 'American/economics/health']), ('destroyed', ['War']), ('logic', ['American/economics/health'])]"
marklevinshow,2023-08-23 03:18:13+00:00,2,War,0.73202115,negative,0.7477733492851257,anger,0.4443389177322387,3.0,News/radio/livestream,0.1606562,Climate change Marxists exploit all human tragedies https://t.co/djjIUpQzyD,climate change marxist exploit human tragedy,"[('marxist', [3]), ('change', [2]), ('human', [2]), ('climate', [2]), ('tragedy', [2]), ('exploit', [2])]","[('marxist', ['News/radio/livestream']), ('change', ['War']), ('human', ['War']), ('climate', ['War']), ('tragedy', ['War']), ('exploit', ['War'])]"
HouseGOP,2023-08-23 15:30:27+00:00,2,War,0.39348125,negative,0.9210788011550904,anger,0.5014390349388123,4.0,Republicans vs democrats,0.27095413,RT @The 9/11 conspirators should be punished to the fullest extent of the law for the pain they inflicted on America. Offering plea deals to these terrorists is a slap in the face to the families who lost loved ones. https://t.co/xzSvTWyaIw,conspirator punished fullest extent law pain inflicted america offering plea deal terrorist slap face family lost loved one,"[('terrorist', [2, 5]), ('america', [2, 5]), ('extent', [4]), ('fullest', [3]), ('law', [4, 5]), ('lost', [5, 2]), ('family', [5, 4]), ('slap', [4]), ('face', [2, 4]), ('offering', [2, 5]), ('deal', [4, 2]), ('plea', [4]), ('punished', [2]), ('loved', [5, 2]), ('one', [5, 2]), ('pain', [2, 5]), ('inflicted', [2, 5]), ('conspirator', [2])]","[('terrorist', ['War', 'Border/community/family']), ('america', ['War', 'Border/community/family']), ('extent', ['Republicans vs democrats']), ('fullest', ['News/radio/livestream']), ('law', ['Republicans vs democrats', 'Border/community/family']), ('lost', ['Border/community/family', 'War']), ('family', ['Border/community/family', 'Republicans vs democrats']), ('slap', ['Republicans vs democrats']), ('face', ['War', 'Republicans vs democrats']), ('offering', ['War', 'Border/community/family']), ('deal', ['Republicans vs democrats', 'War']), ('plea', ['Republicans vs democrats']), ('punished', ['War']), ('loved', ['Border/community/family', 'War']), ('one', ['Border/community/family', 'War']), ('pain', ['War', 'Border/community/family']), ('inflicted', ['War', 'Border/community/family']), ('conspirator', ['War'])]"
HouseGOP,2023-08-23 15:30:42+00:00,2,War,0.608995,negative,0.871650755405426,anger,0.5118311047554016,4.0,Republicans vs democrats,0.2556124,"RT @I was banned from traveling to Iran— no plans to visit anyways. I was sanctioned by Russia — not going there either. Now, China hacked my email — the CCP wants me to remain silent on Uyghurs, Tibet, &amp; Taiwan. I won’t. You can tell a lot about a person by their enemies.",banned traveling iran plan visit anyways sanctioned russia going china hacked email ccp want remain silent uyghurs tibet taiwan tell lot person enemy,"[('russia', [2, 4]), ('person', [2, 4]), ('traveling', [2]), ('china', [2, 4]), ('iran', [2]), ('taiwan', [2]), ('going', [2, 4]), ('lot', [2, 4]), ('email', [4]), ('tell', [2, 4]), ('want', [2, 4]), ('plan', [4, 2]), ('enemy', [2, 4]), ('hacked', [3, 2]), ('remain', [4]), ('visit', [2, 4]), ('ccp', [2, 4]), ('sanctioned', [2, 4]), ('banned', [4]), ('silent', [2, 4]), ('anyways', [3]), ('tibet', [2]), ('uyghurs', [3])]","[('russia', ['War', 'Republicans vs democrats']), ('person', ['War', 'Republicans vs democrats']), ('traveling', ['War']), ('china', ['War', 'Republicans vs democrats']), ('iran', ['War']), ('taiwan', ['War']), ('going', ['War', 'Republicans vs democrats']), ('lot', ['War', 'Republicans vs democrats']), ('email', ['Republicans vs democrats']), ('tell', ['War', 'Republicans vs democrats']), ('want', ['War', 'Republicans vs democrats']), ('plan', ['Republicans vs democrats', 'War']), ('enemy', ['War', 'Republicans vs democrats']), ('hacked', ['News/radio/livestream', 'War']), ('remain', ['Republicans vs democrats']), ('visit', ['War', 'Republicans vs democrats']), ('ccp', ['War', 'Republicans vs democrats']), ('sanctioned', ['War', 'Republicans vs democrats']), ('banned', ['Republicans vs democrats']), ('silent', ['War', 'Republicans vs democrats']), ('anyways', ['News/radio/livestream']), ('tibet', ['War']), ('uyghurs', ['News/radio/livestream'])]"
NikkiHaley,2023-08-23 16:29:48+00:00,2,War,0.3779763,neutral,0.6058406233787537,anger,0.5066105723381042,1.0,American/economics/health,0.3487239,"RT @.@NikkiHaley strong-armed China at the UN and stared down dictators and despots who wanted America to fail. She knows the threats our homeland faces—and she's honest about how we need to deal with them. Americans don't want rhetoric, we want results. https://t.co/jZ1hIIBy3V",strong armed china  stared dictator despot wanted america fail know threat homeland facesand honest need deal american want rhetoric want result,"[('american', [1, 2]), ('know', [2, 4]), ('wanted', [4, 2]), ('america', [2, 1]), ('armed', [2, 1]), ('threat', [2, 4]), ('china', [2, 4]), ('need', [1, 2]), ('homeland', [4, 1]), ('want', [2, 1]), ('deal', [1, 4]), ('rhetoric', [2]), ('result', [1, 4]), ('honest', [4, 1]), ('strong', [1, 2]), ('dictator', [2]), ('fail', [1, 4]), ('despot', [1]), ('facesand', [2, 1]), ('stared', [2, 1])]","[('american', ['American/economics/health', 'War']), ('know', ['War', 'Republicans vs democrats']), ('wanted', ['Republicans vs democrats', 'War']), ('america', ['War', 'American/economics/health']), ('armed', ['War', 'American/economics/health']), ('threat', ['War', 'Republicans vs democrats']), ('china', ['War', 'Republicans vs democrats']), ('need', ['American/economics/health', 'War']), ('homeland', ['Republicans vs democrats', 'American/economics/health']), ('want', ['War', 'American/economics/health']), ('deal', ['American/economics/health', 'Republicans vs democrats']), ('rhetoric', ['War']), ('result', ['American/economics/health', 'Republicans vs democrats']), ('honest', ['Republicans vs democrats', 'American/economics/health']), ('strong', ['American/economics/health', 'War']), ('dictator', ['War']), ('fail', ['American/economics/health', 'Republicans vs democrats']), ('despot', ['American/economics/health']), ('facesand', ['War', 'American/economics/health']), ('stared', ['War', 'American/economics/health'])]"
NikkiHaley,2023-08-23 16:32:02+00:00,2,War,0.85401857,positive,0.6572957634925842,optimism,0.8592446446418762,7.0,Abortion/rights/guns,0.020870186,You should know this about me: I will always stand up for America and stand up to our enemies. https://t.co/keVViM2eQN,know stand america stand enemy,"[('know', [2]), ('america', [2]), ('enemy', [2]), ('stand', [2])]","[('know', ['War']), ('america', ['War']), ('enemy', ['War']), ('stand', ['War'])]"
AndrewYang,2023-08-23 18:21:55+00:00,2,War,0.5575126,negative,0.5757201313972473,disgust,0.3697473108768463,5.0,Border/community/family,0.37986997,"RT @""Our leaders should do what the communities they represent actually want."" Sounds so simple yet the two legacy parties make it so hard for the people.",leader community represent actually want sound simple legacy party hard people,"[('people', [2, 5]), ('simple', [2]), ('party', [2, 5]), ('hard', [5, 2]), ('actually', [2]), ('want', [2, 5]), ('community', [5]), ('sound', [2, 5]), ('leader', [5, 2]), ('represent', [2, 5]), ('legacy', [5])]","[('people', ['War', 'Border/community/family']), ('simple', ['War']), ('party', ['War', 'Border/community/family']), ('hard', ['Border/community/family', 'War']), ('actually', ['War']), ('want', ['War', 'Border/community/family']), ('community', ['Border/community/family']), ('sound', ['War', 'Border/community/family']), ('leader', ['Border/community/family', 'War']), ('represent', ['War', 'Border/community/family']), ('legacy', ['Border/community/family'])]"
AndrewYang,2023-08-23 19:34:34+00:00,2,War,0.6989237,negative,0.7419650554656982,anger,0.2382149845361709,1.0,American/economics/health,0.09680115,“You can no longer run a country properly if the elites don’t understand technology in the same way they understand economics or ideology or propaganda.” - Tom Steinberg,longer run country properly elite understand technology way understand economics ideology propaganda tom steinberg,"[('way', [2, 1]), ('longer', [2, 1]), ('technology', [8, 1]), ('country', [2, 1]), ('run', [2, 1]), ('propaganda', [2]), ('elite', [2]), ('properly', [7]), ('ideology', [2, 1]), ('understand', [2, 7]), ('economics', [1]), ('tom', [2]), ('steinberg', [2])]","[('way', ['War', 'American/economics/health']), ('longer', ['War', 'American/economics/health']), ('technology', ['Infrastructure/job/energy', 'American/economics/health']), ('country', ['War', 'American/economics/health']), ('run', ['War', 'American/economics/health']), ('propaganda', ['War']), ('elite', ['War']), ('properly', ['Abortion/rights/guns']), ('ideology', ['War', 'American/economics/health']), ('understand', ['War', 'Abortion/rights/guns']), ('economics', ['American/economics/health']), ('tom', ['War']), ('steinberg', ['War'])]"
WillHurd,2023-08-23 19:57:02+00:00,2,War,0.56960386,negative,0.92390239238739,disgust,0.4406836330890655,7.0,Abortion/rights/guns,0.37672594,Vladimir Putin is a murderous dictator. Anyone who thinks America should be sucking up to him is dangerously unprepared to be President and a threat to our national security. https://t.co/ty9SNeo91x,vladimir putin murderous dictator think america sucking dangerously unprepared president threat national security,"[('national', [7, 2]), ('putin', [2]), ('security', [7, 2]), ('america', [2, 7]), ('president', [2, 7]), ('threat', [2, 7]), ('vladimir', [2]), ('think', [2, 7]), ('dictator', [2]), ('murderous', [7]), ('sucking', [2]), ('dangerously', [7]), ('unprepared', [7])]","[('national', ['Abortion/rights/guns', 'War']), ('putin', ['War']), ('security', ['Abortion/rights/guns', 'War']), ('america', ['War', 'Abortion/rights/guns']), ('president', ['War', 'Abortion/rights/guns']), ('threat', ['War', 'Abortion/rights/guns']), ('vladimir', ['War']), ('think', ['War', 'Abortion/rights/guns']), ('dictator', ['War']), ('murderous', ['Abortion/rights/guns']), ('sucking', ['War']), ('dangerously', ['Abortion/rights/guns']), ('unprepared', ['Abortion/rights/guns'])]"
marklevinshow,2023-08-23 23:20:19+00:00,2,War,0.79170555,negative,0.9308303594589232,anger,0.8132534027099609,3.0,News/radio/livestream,0.12486754,"Truly disgusting and disgraceful, and corrupt Democrat Party media love it https://t.co/4RT5eWZzS8",truly disgusting disgraceful corrupt democrat party medium love,"[('medium', [2]), ('party', [2]), ('love', [2]), ('truly', [2]), ('democrat', [2]), ('corrupt', [2]), ('disgusting', [2]), ('disgraceful', [3])]","[('medium', ['War']), ('party', ['War']), ('love', ['War']), ('truly', ['War']), ('democrat', ['War']), ('corrupt', ['War']), ('disgusting', ['War']), ('disgraceful', ['News/radio/livestream'])]"
WhiteHouse,2023-08-24 01:00:01+00:00,2,War,0.3723134,neutral,0.623862624168396,fear,0.4442532360553741,7.0,Abortion/rights/guns,0.3491955,"In 1994, President Biden led the fight to ban assault weapons. And, in the 10 years after the ban became law, mass shootings went down. But after Congressional Republicans let the law expire in 2004, mass shootings tripled.",president biden led fight ban assault weapon year ban law mass shooting went congressional republican let law expire mass shooting tripled,"[('ban', [7, 1]), ('weapon', [2, 1]), ('biden', [2, 1]), ('year', [1, 7]), ('went', [2, 1]), ('let', [7, 2]), ('law', [7, 1]), ('president', [1, 2]), ('republican', [1, 7]), ('fight', [7, 1]), ('mass', [2]), ('congressional', [7, 1]), ('shooting', [2]), ('led', [7, 1]), ('assault', [2, 7]), ('expire', [1, 2]), ('tripled', [7])]","[('ban', ['Abortion/rights/guns', 'American/economics/health']), ('weapon', ['War', 'American/economics/health']), ('biden', ['War', 'American/economics/health']), ('year', ['American/economics/health', 'Abortion/rights/guns']), ('went', ['War', 'American/economics/health']), ('let', ['Abortion/rights/guns', 'War']), ('law', ['Abortion/rights/guns', 'American/economics/health']), ('president', ['American/economics/health', 'War']), ('republican', ['American/economics/health', 'Abortion/rights/guns']), ('fight', ['Abortion/rights/guns', 'American/economics/health']), ('mass', ['War']), ('congressional', ['Abortion/rights/guns', 'American/economics/health']), ('shooting', ['War']), ('led', ['Abortion/rights/guns', 'American/economics/health']), ('assault', ['War', 'Abortion/rights/guns']), ('expire', ['American/economics/health', 'War']), ('tripled', ['Abortion/rights/guns'])]"
RonDeSantis,2023-08-24 03:27:08+00:00,2,War,0.87475944,neutral,0.4714228212833404,anger,0.6871592402458191,6.0,Election/debate,0.01790535,"As president, I will never let the Deep State bureaucrats lock you down. https://t.co/SaaCHUzacf",president let deep state bureaucrat lock,"[('state', [2]), ('let', [2]), ('president', [2]), ('lock', [2]), ('deep', [2]), ('bureaucrat', [2])]","[('state', ['War']), ('let', ['War']), ('president', ['War']), ('lock', ['War']), ('deep', ['War']), ('bureaucrat', ['War'])]"
NikkiHaley,2023-08-24 03:28:06+00:00,2,War,0.49232876,negative,0.5719540119171143,anger,0.6667773723602295,1.0,American/economics/health,0.44508928,"When I’m president, we’ll roll back Joe Biden’s green energy handouts and mandates that make America more dependent on China.",president roll joe bidens green energy handout mandate america dependent china,"[('america', [2, 1]), ('joe', [2, 1]), ('president', [1, 2]), ('china', [2, 1]), ('bidens', [1, 2]), ('mandate', [2, 1]), ('roll', [2, 1]), ('energy', [1]), ('green', [1, 2]), ('dependent', [2]), ('handout', [1])]","[('america', ['War', 'American/economics/health']), ('joe', ['War', 'American/economics/health']), ('president', ['American/economics/health', 'War']), ('china', ['War', 'American/economics/health']), ('bidens', ['American/economics/health', 'War']), ('mandate', ['War', 'American/economics/health']), ('roll', ['War', 'American/economics/health']), ('energy', ['American/economics/health']), ('green', ['American/economics/health', 'War']), ('dependent', ['War']), ('handout', ['American/economics/health'])]"
NikkiHaley,2023-08-24 03:34:19+00:00,2,War,0.51400495,positive,0.4909607768058777,optimism,0.8274582624435425,5.0,Border/community/family,0.44181263,I’m not pro-life because I’m Republican. I’m pro-life because I had trouble having my children. I'm pro-life because my husband was adopted. I'm pro-life because I’m surrounded by blessings.,pro life republican pro life trouble having child pro life husband adopted pro life surrounded blessing,"[('pro', [2]), ('republican', [2, 5]), ('life', [5, 2]), ('child', [5, 2]), ('surrounded', [5, 2]), ('having', [5, 2]), ('husband', [5, 2]), ('trouble', [2]), ('adopted', [2]), ('blessing', [5])]","[('pro', ['War']), ('republican', ['War', 'Border/community/family']), ('life', ['Border/community/family', 'War']), ('child', ['Border/community/family', 'War']), ('surrounded', ['Border/community/family', 'War']), ('having', ['Border/community/family', 'War']), ('husband', ['Border/community/family', 'War']), ('trouble', ['War']), ('adopted', ['War']), ('blessing', ['Border/community/family'])]"
VivekGRamaswamy,2023-08-24 03:57:32+00:00,2,War,0.32777378,neutral,0.5719957947731018,fear,0.3404705226421356,4.0,Republicans vs democrats,0.23289171,"Don’t remove guns from law-abiding citizens. Remove violent, psychiatrically deranged people from their communities and be willing to involuntarily commit them. Revive mental health institutions: less reliance on pharmaceuticals, more reliance on faith-based approaches that restore purpose to people’s lives. We know from the 1990s how to stop violent crime. The real question is if we have the spine to do it. I do – and I’ll use the power of the purse to accomplish it just as Reagan did in the 1980s.",remove gun law abiding citizen remove violent psychiatrically deranged people community willing involuntarily commit revive mental health institution reliance pharmaceutical reliance faith based approach restore purpose people life know  stop violent crime real question spine ill use power purse accomplish reagan ,"[('know', [4, 2]), ('citizen', [2, 4]), ('violent', [2, 4]), ('people', [2, 1]), ('law', [1, 8]), ('question', [4, 2]), ('crime', [4, 2]), ('power', [2, 4]), ('life', [1, 2]), ('health', [1, 8]), ('mental', [1, 4]), ('real', [1, 4]), ('use', [2, 1]), ('community', [8, 1]), ('gun', [1, 2]), ('stop', [2, 1]), ('ill', [1, 6]), ('purpose', [2, 4]), ('faith', [2, 8]), ('based', [4, 1]), ('remove', [4, 2]), ('accomplish', [8]), ('willing', [2, 4]), ('deranged', [4, 2]), ('reagan', [6]), ('approach', [1, 4]), ('restore', [1, 8]), ('institution', [2, 8]), ('abiding', [2]), ('purse', [4]), ('commit', [2, 4]), ('pharmaceutical', [8]), ('revive', [2, 1]), ('spine', [4, 2]), ('reliance', [3]), ('involuntarily', [2]), ('psychiatrically', [2])]","[('know', ['Republicans vs democrats', 'War']), ('citizen', ['War', 'Republicans vs democrats']), ('violent', ['War', 'Republicans vs democrats']), ('people', ['War', 'American/economics/health']), ('law', ['American/economics/health', 'Infrastructure/job/energy']), ('question', ['Republicans vs democrats', 'War']), ('crime', ['Republicans vs democrats', 'War']), ('power', ['War', 'Republicans vs democrats']), ('life', ['American/economics/health', 'War']), ('health', ['American/economics/health', 'Infrastructure/job/energy']), ('mental', ['American/economics/health', 'Republicans vs democrats']), ('real', ['American/economics/health', 'Republicans vs democrats']), ('use', ['War', 'American/economics/health']), ('community', ['Infrastructure/job/energy', 'American/economics/health']), ('gun', ['American/economics/health', 'War']), ('stop', ['War', 'American/economics/health']), ('ill', ['American/economics/health', 'Election/debate']), ('purpose', ['War', 'Republicans vs democrats']), ('faith', ['War', 'Infrastructure/job/energy']), ('based', ['Republicans vs democrats', 'American/economics/health']), ('remove', ['Republicans vs democrats', 'War']), ('accomplish', ['Infrastructure/job/energy']), ('willing', ['War', 'Republicans vs democrats']), ('deranged', ['Republicans vs democrats', 'War']), ('reagan', ['Election/debate']), ('approach', ['American/economics/health', 'Republicans vs democrats']), ('restore', ['American/economics/health', 'Infrastructure/job/energy']), ('institution', ['War', 'Infrastructure/job/energy']), ('abiding', ['War']), ('purse', ['Republicans vs democrats']), ('commit', ['War', 'Republicans vs democrats']), ('pharmaceutical', ['Infrastructure/job/energy']), ('revive', ['War', 'American/economics/health']), ('spine', ['Republicans vs democrats', 'War']), ('reliance', ['News/radio/livestream']), ('involuntarily', ['War']), ('psychiatrically', ['War'])]"
RonDeSantis,2023-08-24 03:59:31+00:00,2,War,0.4916744,negative,0.9400964975357056,anger,0.6340836882591248,4.0,Republicans vs democrats,0.47248212,Our cities are being hollowed out because of George Soros funding these radical left-wing district attorneys. There is one guy in this entire country that’s done anything about it: me. They are victimizing innocent people in every corner of this country. It will stop when I get into office.,city hollowed george soros funding radical left wing district attorney guy entire country victimizing innocent people corner country stop office,"[('office', [4, 2]), ('people', [2, 4]), ('funding', [2, 4]), ('country', [2, 4]), ('city', [2, 4]), ('left', [2, 4]), ('entire', [2, 4]), ('guy', [4, 2]), ('attorney', [4]), ('stop', [2, 4]), ('innocent', [2, 4]), ('district', [4]), ('radical', [2, 4]), ('wing', [4, 2]), ('corner', [4]), ('george', [4]), ('soros', [4, 2]), ('hollowed', [2]), ('victimizing', [2])]","[('office', ['Republicans vs democrats', 'War']), ('people', ['War', 'Republicans vs democrats']), ('funding', ['War', 'Republicans vs democrats']), ('country', ['War', 'Republicans vs democrats']), ('city', ['War', 'Republicans vs democrats']), ('left', ['War', 'Republicans vs democrats']), ('entire', ['War', 'Republicans vs democrats']), ('guy', ['Republicans vs democrats', 'War']), ('attorney', ['Republicans vs democrats']), ('stop', ['War', 'Republicans vs democrats']), ('innocent', ['War', 'Republicans vs democrats']), ('district', ['Republicans vs democrats']), ('radical', ['War', 'Republicans vs democrats']), ('wing', ['Republicans vs democrats', 'War']), ('corner', ['Republicans vs democrats']), ('george', ['Republicans vs democrats']), ('soros', ['Republicans vs democrats', 'War']), ('hollowed', ['War']), ('victimizing', ['War'])]"
TheDemocrats,2023-08-24 04:13:27+00:00,2,War,0.5086284,negative,0.7305902242660522,anger,0.654172956943512,6.0,Election/debate,0.23210162,"One thing is clear: Ron DeSantis is willing to give Putin a free pass at the expense of Ukraine, our allies, and democracy. https://t.co/rFh0MC2PrH",thing clear ron desantis willing putin free pas expense ukraine ally democracy,"[('putin', [2]), ('democracy', [2, 6]), ('clear', [2, 1]), ('ukraine', [2, 1]), ('thing', [2, 6]), ('desantis', [6, 2]), ('pas', [1, 2]), ('free', [2, 1]), ('ally', [2, 6]), ('willing', [2, 1]), ('ron', [6]), ('expense', [1])]","[('putin', ['War']), ('democracy', ['War', 'Election/debate']), ('clear', ['War', 'American/economics/health']), ('ukraine', ['War', 'American/economics/health']), ('thing', ['War', 'Election/debate']), ('desantis', ['Election/debate', 'War']), ('pas', ['American/economics/health', 'War']), ('free', ['War', 'American/economics/health']), ('ally', ['War', 'Election/debate']), ('willing', ['War', 'American/economics/health']), ('ron', ['Election/debate']), ('expense', ['American/economics/health'])]"
WillHurd,2023-08-24 04:17:20+00:00,2,War,0.45179713,negative,0.5922398567199707,optimism,0.3678038716316223,5.0,Border/community/family,0.33575857,"No one wants a forever war in Ukraine. But here’s the reality: We’ve only spent 5% of the Defense budget on dismantling the Russian military without sending our sons and daughters and spouses to fight. That's a pretty good deal. If Russia wins, America loses.",want forever war ukraine reality spent defense budget dismantling russian military sending son daughter spouse fight pretty good deal russia win america loses,"[('russia', [2, 5]), ('military', [5, 2]), ('war', [2, 5]), ('america', [2, 5]), ('ukraine', [2, 5]), ('russian', [2, 5]), ('defense', [5, 2]), ('good', [2, 5]), ('son', [5, 1]), ('sending', [2, 5]), ('fight', [5, 1]), ('want', [2, 5]), ('daughter', [5, 2]), ('win', [2, 5]), ('spent', [5, 1]), ('budget', [1, 8]), ('deal', [2, 1]), ('spouse', [8]), ('pretty', [2]), ('loses', [2]), ('reality', [5, 2]), ('forever', [5, 2]), ('dismantling', [2, 5])]","[('russia', ['War', 'Border/community/family']), ('military', ['Border/community/family', 'War']), ('war', ['War', 'Border/community/family']), ('america', ['War', 'Border/community/family']), ('ukraine', ['War', 'Border/community/family']), ('russian', ['War', 'Border/community/family']), ('defense', ['Border/community/family', 'War']), ('good', ['War', 'Border/community/family']), ('son', ['Border/community/family', 'American/economics/health']), ('sending', ['War', 'Border/community/family']), ('fight', ['Border/community/family', 'American/economics/health']), ('want', ['War', 'Border/community/family']), ('daughter', ['Border/community/family', 'War']), ('win', ['War', 'Border/community/family']), ('spent', ['Border/community/family', 'American/economics/health']), ('budget', ['American/economics/health', 'Infrastructure/job/energy']), ('deal', ['War', 'American/economics/health']), ('spouse', ['Infrastructure/job/energy']), ('pretty', ['War']), ('loses', ['War']), ('reality', ['Border/community/family', 'War']), ('forever', ['Border/community/family', 'War']), ('dismantling', ['War', 'Border/community/family'])]"
NikkiHaley,2023-08-24 04:19:02+00:00,2,War,0.575405,neutral,0.5942476391792297,optimism,0.8794018626213074,7.0,Abortion/rights/guns,0.3563253,A win for Russia is a win for China. This is not a territorial dispute. This is a fight for freedom and a fight we have to win.,win russia win china territorial dispute fight freedom fight win,"[('russia', [2]), ('freedom', [7, 2]), ('china', [2]), ('fight', [7, 2]), ('win', [2, 7]), ('territorial', [2]), ('dispute', [2])]","[('russia', ['War']), ('freedom', ['Abortion/rights/guns', 'War']), ('china', ['War']), ('fight', ['Abortion/rights/guns', 'War']), ('win', ['War', 'Abortion/rights/guns']), ('territorial', ['War']), ('dispute', ['War'])]"
