username,date,first_topic,first_topic_name,first_topic_prob,sentiment,sentiment_prob,emotion,emotion_prob,second_topic,second_topic_name,second_topic_prob,text,lemmatized_text,per_word_topics,per_word_topics_name
NRSC,2023-08-25 16:00:21+00:00,2,War,0.5109341,neutral,0.9268475770950316,anticipation,0.6877490282058716,6.0,Election/debate,0.42080843,RT @MikeKBerg: 👀 Jon Tester challenger hits vulnerable Democrat with drag queen story hour ad. #MTSen https://t.co/GsNQKmObdZ,jon tester challenger hit vulnerable democrat drag queen story hour ,"[('hour', [6, 2]), ('story', [6, 2]), ('hit', [6, 2]), ('democrat', [2, 6]), ('vulnerable', [6, 2]), ('drag', [2]), ('queen', [2, 6]), ('jon', [2]), ('challenger', [6]), ('tester', [2])]","[('hour', ['Election/debate', 'War']), ('story', ['Election/debate', 'War']), ('hit', ['Election/debate', 'War']), ('democrat', ['War', 'Election/debate']), ('vulnerable', ['Election/debate', 'War']), ('drag', ['War']), ('queen', ['War', 'Election/debate']), ('jon', ['War']), ('challenger', ['Election/debate']), ('tester', ['War'])]"
marwilliamson,2023-08-25 16:30:25+00:00,2,War,0.46496207,neutral,0.7650631666183472,optimism,0.7703734040260315,8.0,Infrastructure/job/energy,0.44115153,We need a mass mobilization from a dirty economy to a clean economy. #Marianne2024 #ClimateCrisis https://t.co/PeZucjxF9J,need mass mobilization dirty economy clean economy,"[('need', [8, 2]), ('mass', [2]), ('economy', [8, 2]), ('dirty', [2]), ('clean', [8]), ('mobilization', [2])]","[('need', ['Infrastructure/job/energy', 'War']), ('mass', ['War']), ('economy', ['Infrastructure/job/energy', 'War']), ('dirty', ['War']), ('clean', ['Infrastructure/job/energy']), ('mobilization', ['War'])]"
marwilliamson,2023-08-25 16:33:03+00:00,2,War,0.28494674,positive,0.7091014981269836,joy,0.7231863141059875,6.0,Election/debate,0.24950579,"I’m thrilled about this. Absolutely infuriating that grad students were selling their plasma in order to make ends meet! It’s clear what to do in these situations: Form for a union. Stick with it. Persevere. Congratulations, guys!",thrilled absolutely infuriating grad student selling plasma order end meet clear situation form union stick persevere congratulation guy,"[('situation', [2, 6]), ('clear', [7, 2]), ('form', [7, 2]), ('order', [7, 6]), ('student', [8, 7]), ('union', [8, 2]), ('end', [2, 7]), ('guy', [2, 6]), ('absolutely', [2, 6]), ('congratulation', [7, 8]), ('selling', [2, 8]), ('meet', [6, 8]), ('stick', [6]), ('grad', [6]), ('thrilled', [8, 6]), ('persevere', [2]), ('infuriating', [7]), ('plasma', [7])]","[('situation', ['War', 'Election/debate']), ('clear', ['Abortion/rights/guns', 'War']), ('form', ['Abortion/rights/guns', 'War']), ('order', ['Abortion/rights/guns', 'Election/debate']), ('student', ['Infrastructure/job/energy', 'Abortion/rights/guns']), ('union', ['Infrastructure/job/energy', 'War']), ('end', ['War', 'Abortion/rights/guns']), ('guy', ['War', 'Election/debate']), ('absolutely', ['War', 'Election/debate']), ('congratulation', ['Abortion/rights/guns', 'Infrastructure/job/energy']), ('selling', ['War', 'Infrastructure/job/energy']), ('meet', ['Election/debate', 'Infrastructure/job/energy']), ('stick', ['Election/debate']), ('grad', ['Election/debate']), ('thrilled', ['Infrastructure/job/energy', 'Election/debate']), ('persevere', ['War']), ('infuriating', ['Abortion/rights/guns']), ('plasma', ['Abortion/rights/guns'])]"
VivekGRamaswamy,2023-08-25 16:38:46+00:00,2,War,0.47020036,negative,0.7761171460151672,anger,0.8253735899925232,8.0,Infrastructure/job/energy,0.32255217,"RT @If your going to trash my guest, at least put some effort into your research. @VivekGRamaswamy is not a WEF guy. In fact, it’s quit the opposite of you do your research. https://t.co/WBTL8c8t48",going trash guest effort research wef guy fact quit opposite research,"[('fact', [2, 6]), ('going', [2, 6]), ('guy', [2, 6]), ('effort', [8, 6]), ('quit', [8, 6]), ('guest', [6]), ('research', [8, 6]), ('opposite', [2]), ('trash', [2]), ('wef', [2])]","[('fact', ['War', 'Election/debate']), ('going', ['War', 'Election/debate']), ('guy', ['War', 'Election/debate']), ('effort', ['Infrastructure/job/energy', 'Election/debate']), ('quit', ['Infrastructure/job/energy', 'Election/debate']), ('guest', ['Election/debate']), ('research', ['Infrastructure/job/energy', 'Election/debate']), ('opposite', ['War']), ('trash', ['War']), ('wef', ['War'])]"
VivekGRamaswamy,2023-08-25 17:27:27+00:00,2,War,0.3765845,negative,0.5774192214012146,anger,0.5383018851280212,8.0,Infrastructure/job/energy,0.24015607,"The Establishment's position on Taiwan right now is a total joke: embrace the “One China"" policy, refuse to state whether we'll defend Taiwan, & criticize Trump for *picking up the phone* when the Taiwanese president called. I'll speak TRUTH with clarity: we WILL vigorously defend Taiwan *at least* until we achieve semiconductor independence while building up other deterrence strategies in the meantime. This is how we stop Chinese aggression & advance U.S. interests while avoiding World War III.",establishment  position taiwan right total joke embrace china policy refuse state defend taiwan criticize trump picking phone taiwanese president called speak truth clarity vigorously defend taiwan achieve semiconductor independence building deterrence strategy meantime stop chinese aggression advance  interest avoiding world war iii,"[('building', [8, 5]), ('state', [8, 5]), ('war', [2, 5]), ('world', [2, 8]), ('interest', [4, 2]), ('position', [2, 4]), ('called', [2, 4]), ('trump', [4, 2]), ('phone', [4, 8]), ('president', [4, 2]), ('china', [2, 8]), ('taiwan', [2, 8]), ('right', [2, 4]), ('truth', [4, 2]), ('joke', [2, 4]), ('total', [4, 2]), ('stop', [2, 4]), ('strategy', [2, 8]), ('refuse', [2, 4]), ('policy', [2, 4]), ('criticize', [8]), ('advance', [8, 4]), ('aggression', [2, 5]), ('iii', [5]), ('speak', [2, 4]), ('picking', [4]), ('independence', [5, 8]), ('defend', [2, 5]), ('chinese', [2, 4]), ('avoiding', [2, 8]), ('clarity', [2]), ('achieve', [8, 5]), ('semiconductor', [8]), ('embrace', [5, 8]), ('establishment', [2, 4]), ('vigorously', [4]), ('deterrence', [8]), ('meantime', [8]), ('taiwanese', [5])]","[('building', ['Infrastructure/job/energy', 'Border/community/family']), ('state', ['Infrastructure/job/energy', 'Border/community/family']), ('war', ['War', 'Border/community/family']), ('world', ['War', 'Infrastructure/job/energy']), ('interest', ['Republicans vs democrats', 'War']), ('position', ['War', 'Republicans vs democrats']), ('called', ['War', 'Republicans vs democrats']), ('trump', ['Republicans vs democrats', 'War']), ('phone', ['Republicans vs democrats', 'Infrastructure/job/energy']), ('president', ['Republicans vs democrats', 'War']), ('china', ['War', 'Infrastructure/job/energy']), ('taiwan', ['War', 'Infrastructure/job/energy']), ('right', ['War', 'Republicans vs democrats']), ('truth', ['Republicans vs democrats', 'War']), ('joke', ['War', 'Republicans vs democrats']), ('total', ['Republicans vs democrats', 'War']), ('stop', ['War', 'Republicans vs democrats']), ('strategy', ['War', 'Infrastructure/job/energy']), ('refuse', ['War', 'Republicans vs democrats']), ('policy', ['War', 'Republicans vs democrats']), ('criticize', ['Infrastructure/job/energy']), ('advance', ['Infrastructure/job/energy', 'Republicans vs democrats']), ('aggression', ['War', 'Border/community/family']), ('iii', ['Border/community/family']), ('speak', ['War', 'Republicans vs democrats']), ('picking', ['Republicans vs democrats']), ('independence', ['Border/community/family', 'Infrastructure/job/energy']), ('defend', ['War', 'Border/community/family']), ('chinese', ['War', 'Republicans vs democrats']), ('avoiding', ['War', 'Infrastructure/job/energy']), ('clarity', ['War']), ('achieve', ['Infrastructure/job/energy', 'Border/community/family']), ('semiconductor', ['Infrastructure/job/energy']), ('embrace', ['Border/community/family', 'Infrastructure/job/energy']), ('establishment', ['War', 'Republicans vs democrats']), ('vigorously', ['Republicans vs democrats']), ('deterrence', ['Infrastructure/job/energy']), ('meantime', ['Infrastructure/job/energy']), ('taiwanese', ['Border/community/family'])]"
IngrahamAngle,2023-08-25 17:30:10+00:00,2,War,0.7807862,neutral,0.6584056615829468,joy,0.8670060634613037,6.0,Election/debate,0.03142606,Stop to watch the butterflies. https://t.co/UuzMiWhBYc,stop watch butterfly,"[('watch', [2]), ('stop', [2]), ('butterfly', [2])]","[('watch', ['War']), ('stop', ['War']), ('butterfly', ['War'])]"
NikkiHaley,2023-08-25 17:38:32+00:00,2,War,0.92695326,negative,0.6299898028373718,anger,0.4851375222206116,6.0,Election/debate,0.010455736,"RT @.@NikkiHaley says Putin 'killed Prigozhin,' blasts Ramaswamy for 'choosing a murderer' over pro-America Ukraine https://t.co/qxa8s1Kpwq",say putin killed prigozhin blast ramaswamy choosing murderer pro america ukraine,"[('putin', [2]), ('america', [2]), ('ukraine', [2]), ('pro', [2]), ('killed', [2]), ('blast', [2]), ('say', [2]), ('ramaswamy', [2]), ('prigozhin', [2]), ('murderer', [2]), ('choosing', [2])]","[('putin', ['War']), ('america', ['War']), ('ukraine', ['War']), ('pro', ['War']), ('killed', ['War']), ('blast', ['War']), ('say', ['War']), ('ramaswamy', ['War']), ('prigozhin', ['War']), ('murderer', ['War']), ('choosing', ['War'])]"
VivekGRamaswamy,2023-08-25 20:02:20+00:00,2,War,0.68322814,negative,0.6076700091362,optimism,0.3429018259048462,5.0,Border/community/family,0.28048056,"The foreign policy establishment needs to wake up from its slumber: the USSR doesn't exist anymore, but Communist China does & the CCP powers our entire way of life today. If that were a Russian spy balloon flying over our homeland, we'd have shot it down in an instant & ratcheted up sanctions. But we didn't because we depend on China, in ways we never depended on the USSR. I will lead us towards economic independence from the CCP & disband the Russia-China alliance – this is how we deter Chinese aggression while avoiding World War III.",foreign policy establishment need wake slumber ussr exist anymore communist china ccp power entire way life today russian spy balloon flying homeland shot instant ratcheted sanction depend china way depended ussr lead economic independence ccp disband russia china alliance deter chinese aggression avoiding world war iii,"[('russia', [2, 5]), ('today', [5, 2]), ('war', [2, 5]), ('way', [2, 5]), ('world', [2, 5]), ('shot', [2, 5]), ('lead', [2, 5]), ('russian', [2, 5]), ('china', [2, 5]), ('power', [2, 5]), ('need', [2, 5]), ('life', [5, 2]), ('homeland', [5]), ('wake', [2]), ('entire', [2, 5]), ('flying', [5]), ('communist', [2, 5]), ('policy', [2, 5]), ('alliance', [5]), ('aggression', [2, 5]), ('exist', [2, 5]), ('foreign', [2, 5]), ('iii', [5]), ('spy', [2, 5]), ('independence', [5]), ('anymore', [2]), ('sanction', [2, 5]), ('ccp', [2, 5]), ('chinese', [2, 5]), ('avoiding', [2]), ('instant', [5]), ('economic', [2]), ('deter', [5]), ('depend', [2]), ('establishment', [2, 5]), ('balloon', [2, 5]), ('slumber', [3]), ('ussr', [2]), ('ratcheted', [2]), ('disband', [2, 5]), ('depended', [2])]","[('russia', ['War', 'Border/community/family']), ('today', ['Border/community/family', 'War']), ('war', ['War', 'Border/community/family']), ('way', ['War', 'Border/community/family']), ('world', ['War', 'Border/community/family']), ('shot', ['War', 'Border/community/family']), ('lead', ['War', 'Border/community/family']), ('russian', ['War', 'Border/community/family']), ('china', ['War', 'Border/community/family']), ('power', ['War', 'Border/community/family']), ('need', ['War', 'Border/community/family']), ('life', ['Border/community/family', 'War']), ('homeland', ['Border/community/family']), ('wake', ['War']), ('entire', ['War', 'Border/community/family']), ('flying', ['Border/community/family']), ('communist', ['War', 'Border/community/family']), ('policy', ['War', 'Border/community/family']), ('alliance', ['Border/community/family']), ('aggression', ['War', 'Border/community/family']), ('exist', ['War', 'Border/community/family']), ('foreign', ['War', 'Border/community/family']), ('iii', ['Border/community/family']), ('spy', ['War', 'Border/community/family']), ('independence', ['Border/community/family']), ('anymore', ['War']), ('sanction', ['War', 'Border/community/family']), ('ccp', ['War', 'Border/community/family']), ('chinese', ['War', 'Border/community/family']), ('avoiding', ['War']), ('instant', ['Border/community/family']), ('economic', ['War']), ('deter', ['Border/community/family']), ('depend', ['War']), ('establishment', ['War', 'Border/community/family']), ('balloon', ['War', 'Border/community/family']), ('slumber', ['News/radio/livestream']), ('ussr', ['War']), ('ratcheted', ['War']), ('disband', ['War', 'Border/community/family']), ('depended', ['War'])]"
VivekGRamaswamy,2023-08-25 21:22:09+00:00,2,War,0.7810058,positive,0.6858079433441162,joy,0.9230381846427916,4.0,Republicans vs democrats,0.031350046,RT @ScottAdamsSays: Kinda perfect answer.,kind perfect answer,"[('answer', [2]), ('perfect', [2]), ('kind', [2])]","[('answer', ['War']), ('perfect', ['War']), ('kind', ['War'])]"
WashTimesOpEd,2023-08-25 23:18:56+00:00,2,War,0.3771823,neutral,0.8585841059684753,fear,0.7974700331687927,3.0,News/radio/livestream,0.17676955,"Trevor Lewis and @TheFrackingGuy: ""The world is finally waking up to the danger of reliance on Russia, Iran and other adversaries for energy."" https://t.co/3e0vP9Gm6g",trevor lewis world finally waking danger reliance russia iran adversary energy,"[('russia', [2, 4]), ('world', [2, 1]), ('waking', [4]), ('iran', [2]), ('finally', [1, 4]), ('energy', [1, 4]), ('danger', [2, 4]), ('trevor', [3]), ('lewis', [7]), ('adversary', [2, 4]), ('reliance', [3])]","[('russia', ['War', 'Republicans vs democrats']), ('world', ['War', 'American/economics/health']), ('waking', ['Republicans vs democrats']), ('iran', ['War']), ('finally', ['American/economics/health', 'Republicans vs democrats']), ('energy', ['American/economics/health', 'Republicans vs democrats']), ('danger', ['War', 'Republicans vs democrats']), ('trevor', ['News/radio/livestream']), ('lewis', ['Abortion/rights/guns']), ('adversary', ['War', 'Republicans vs democrats']), ('reliance', ['News/radio/livestream'])]"
VivekGRamaswamy,2023-08-25 23:55:29+00:00,2,War,0.6440819,positive,0.7639637589454651,optimism,0.8865573406219482,6.0,Election/debate,0.23565435,"Excellence over victimhood. Merit over grievance. Self-governance over aristocracy. That’s what it means to be American. If the GOP owns that, we win 2024 in a landslide. 📍 Newton, Iowa https://t.co/SqzXcXuskC",excellence victimhood merit grievance self governance aristocracy mean american gop owns win landslide newton iowa,"[('american', [2, 6]), ('gop', [6, 2]), ('win', [6, 2]), ('mean', [2, 6]), ('self', [2, 6]), ('iowa', [6, 5]), ('merit', [2]), ('grievance', [2]), ('owns', [2]), ('governance', [2, 6]), ('landslide', [6]), ('excellence', [5]), ('victimhood', [2]), ('aristocracy', [2]), ('newton', [2])]","[('american', ['War', 'Election/debate']), ('gop', ['Election/debate', 'War']), ('win', ['Election/debate', 'War']), ('mean', ['War', 'Election/debate']), ('self', ['War', 'Election/debate']), ('iowa', ['Election/debate', 'Border/community/family']), ('merit', ['War']), ('grievance', ['War']), ('owns', ['War']), ('governance', ['War', 'Election/debate']), ('landslide', ['Election/debate']), ('excellence', ['Border/community/family']), ('victimhood', ['War']), ('aristocracy', ['War']), ('newton', ['War'])]"
TheDemocrats,2023-08-26 01:39:13+00:00,2,War,0.659516,neutral,0.5611305236816406,anticipation,0.5999970436096191,6.0,Election/debate,0.2570391,2024 Republican candidates don’t think that human behavior is causing climate change. https://t.co/gkr1xUNC17,republican candidate think human behavior causing climate change,"[('republican', [6, 2]), ('think', [2, 6]), ('candidate', [6]), ('change', [2, 6]), ('human', [2]), ('climate', [2, 6]), ('behavior', [2]), ('causing', [2])]","[('republican', ['Election/debate', 'War']), ('think', ['War', 'Election/debate']), ('candidate', ['Election/debate']), ('change', ['War', 'Election/debate']), ('human', ['War']), ('climate', ['War', 'Election/debate']), ('behavior', ['War']), ('causing', ['War'])]"
WashTimesOpEd,2023-08-26 05:26:51+00:00,2,War,0.48890737,negative,0.6527658700942993,disgust,0.4585149586200714,5.0,Border/community/family,0.44280118,"""The fact is, the Mexican government is not a partner of the United States, no matter how much this administration declares it to be so,"" writes @Mariah_Selene. https://t.co/IIblcFXZjg",fact mexican government partner united state matter administration declares writes,"[('state', [5, 2]), ('united', [5, 2]), ('administration', [5, 2]), ('fact', [2, 5]), ('government', [2, 5]), ('mexican', [5]), ('partner', [5]), ('matter', [2, 5]), ('declares', [2]), ('writes', [2, 5])]","[('state', ['Border/community/family', 'War']), ('united', ['Border/community/family', 'War']), ('administration', ['Border/community/family', 'War']), ('fact', ['War', 'Border/community/family']), ('government', ['War', 'Border/community/family']), ('mexican', ['Border/community/family']), ('partner', ['Border/community/family']), ('matter', ['War', 'Border/community/family']), ('declares', ['War']), ('writes', ['War', 'Border/community/family'])]"
WashTimesOpEd,2023-08-26 06:30:11+00:00,2,War,0.56331354,neutral,0.7850562334060669,anticipation,0.5844757556915283,1.0,American/economics/health,0.31134757,Spacefaring nations should mind their manners on the moon https://t.co/amOKIg2EZk,spacefaring nation mind manner moon,"[('mind', [2, 1]), ('nation', [1, 2]), ('manner', [2]), ('moon', [1]), ('spacefaring', [2])]","[('mind', ['War', 'American/economics/health']), ('nation', ['American/economics/health', 'War']), ('manner', ['War']), ('moon', ['American/economics/health']), ('spacefaring', ['War'])]"
WashTimesOpEd,2023-08-26 07:00:19+00:00,2,War,0.32334873,negative,0.8767798542976379,anger,0.5261062383651733,8.0,Infrastructure/job/energy,0.28065735,"""Antisemitism has not only been used as an instrument of cultural Marxism here at home, but also employed as a tool to isolate, weaken and destroy Israel, the Jewish homeland and one of the most important U.S. allies."" @heritage https://t.co/IIrT37AOQn",antisemitism instrument cultural marxism home employed tool isolate weaken destroy israel jewish homeland important  ally,"[('antisemitism', [7]), ('israel', [2, 5]), ('homeland', [5]), ('important', [8, 6]), ('home', [8, 5]), ('tool', [8, 2]), ('marxism', [6]), ('ally', [2, 8]), ('destroy', [2, 5]), ('employed', [6]), ('jewish', [2, 5]), ('cultural', [8, 6]), ('weaken', [8, 2]), ('isolate', [8]), ('instrument', [2])]","[('antisemitism', ['Abortion/rights/guns']), ('israel', ['War', 'Border/community/family']), ('homeland', ['Border/community/family']), ('important', ['Infrastructure/job/energy', 'Election/debate']), ('home', ['Infrastructure/job/energy', 'Border/community/family']), ('tool', ['Infrastructure/job/energy', 'War']), ('marxism', ['Election/debate']), ('ally', ['War', 'Infrastructure/job/energy']), ('destroy', ['War', 'Border/community/family']), ('employed', ['Election/debate']), ('jewish', ['War', 'Border/community/family']), ('cultural', ['Infrastructure/job/energy', 'Election/debate']), ('weaken', ['Infrastructure/job/energy', 'War']), ('isolate', ['Infrastructure/job/energy']), ('instrument', ['War'])]"
larryelder,2023-08-26 12:55:50+00:00,2,War,0.3921552,negative,0.8634388446807861,anger,0.720272421836853,3.0,News/radio/livestream,0.19371045,"“(Trump is a) vile, racist, anti-democracy buffoon.” —Joy Reid, @MSNBC 8/24/23 (ICYMI) Larry Elder Show: How Racist is Trump Toward Black Americans? https://t.co/dF1xyL5hL5 #DemocratsAndTheRaceCard",trump vile racist anti democracy buffoon joy reid icymi larry elder racist trump black american,"[('american', [2, 7]), ('democracy', [7, 2]), ('trump', [2, 7]), ('black', [2, 7]), ('racist', [2, 7]), ('joy', [5, 2]), ('larry', [3]), ('anti', [2, 7]), ('icymi', [3, 8]), ('vile', [7]), ('elder', [3]), ('reid', [8]), ('buffoon', [5])]","[('american', ['War', 'Abortion/rights/guns']), ('democracy', ['Abortion/rights/guns', 'War']), ('trump', ['War', 'Abortion/rights/guns']), ('black', ['War', 'Abortion/rights/guns']), ('racist', ['War', 'Abortion/rights/guns']), ('joy', ['Border/community/family', 'War']), ('larry', ['News/radio/livestream']), ('anti', ['War', 'Abortion/rights/guns']), ('icymi', ['News/radio/livestream', 'Infrastructure/job/energy']), ('vile', ['Abortion/rights/guns']), ('elder', ['News/radio/livestream']), ('reid', ['Infrastructure/job/energy']), ('buffoon', ['Border/community/family'])]"
packers,2023-08-26 14:00:01+00:00,2,War,0.7056612,positive,0.5506289601325989,anticipation,0.4533348083496094,3.0,News/radio/livestream,0.04204851,It's the preseason finale! #SEAvsGB | #GoPackGo https://t.co/OJaaJUPbdh,preseason finale,"[('finale', [2]), ('preseason', [2])]","[('finale', ['War']), ('preseason', ['War'])]"
WashTimesOpEd,2023-08-26 15:01:42+00:00,2,War,0.5056456,negative,0.8384268283843994,anger,0.5031999349594116,4.0,Republicans vs democrats,0.27313626,".@Judgenap: ""Nothing is more destructive of human decency, nothing is less fruitful in seeking truth, nothing is more totalitarian and nothing so undermines the government’s own cases as its use of torture."" https://t.co/aH3dJ2Cpm0",destructive human decency fruitful seeking truth totalitarian undermines government case use torture,"[('destructive', [2]), ('seeking', [4, 2]), ('truth', [2, 4]), ('government', [2, 4]), ('case', [4, 7]), ('use', [2, 4]), ('human', [2, 7]), ('totalitarian', [2, 7]), ('undermines', [7]), ('torture', [2]), ('decency', [4]), ('fruitful', [2])]","[('destructive', ['War']), ('seeking', ['Republicans vs democrats', 'War']), ('truth', ['War', 'Republicans vs democrats']), ('government', ['War', 'Republicans vs democrats']), ('case', ['Republicans vs democrats', 'Abortion/rights/guns']), ('use', ['War', 'Republicans vs democrats']), ('human', ['War', 'Abortion/rights/guns']), ('totalitarian', ['War', 'Abortion/rights/guns']), ('undermines', ['Abortion/rights/guns']), ('torture', ['War']), ('decency', ['Republicans vs democrats']), ('fruitful', ['War'])]"
RobertKennedyJr,2023-08-26 18:10:04+00:00,2,War,0.61729723,negative,0.8973729014396667,anger,0.6543876528739929,1.0,American/economics/health,0.22005205,"Destroying Ukraine in order to save it. Sobering article on depleted uranium munitions. Needless to say, as President I will put a stop to this reckless and inhuman policy. #Kennedy24 https://t.co/bZxJoVGYNK",destroying ukraine order save sobering article depleted uranium munition needle president stop reckless inhuman policy,"[('ukraine', [2, 1]), ('president', [2, 1]), ('order', [1, 2]), ('stop', [2, 1]), ('policy', [2, 1]), ('save', [1, 2]), ('article', [2, 1]), ('destroying', [2, 1]), ('reckless', [1]), ('munition', [2]), ('needle', [2]), ('sobering', [2]), ('uranium', [3]), ('depleted', [3, 1]), ('inhuman', [2])]","[('ukraine', ['War', 'American/economics/health']), ('president', ['War', 'American/economics/health']), ('order', ['American/economics/health', 'War']), ('stop', ['War', 'American/economics/health']), ('policy', ['War', 'American/economics/health']), ('save', ['American/economics/health', 'War']), ('article', ['War', 'American/economics/health']), ('destroying', ['War', 'American/economics/health']), ('reckless', ['American/economics/health']), ('munition', ['War']), ('needle', ['War']), ('sobering', ['War']), ('uranium', ['News/radio/livestream']), ('depleted', ['News/radio/livestream', 'American/economics/health']), ('inhuman', ['War'])]"
WashTimesOpEd,2023-08-26 18:23:51+00:00,2,War,0.6657136,negative,0.8955705761909485,sadness,0.8545517325401306,1.0,American/economics/health,0.29253137,"""Watching the video of the president’s remarks in Maui, his continuing confusion, his inappropriate jokes, and attempts to identify with the pain Maui residents feel is painful in itself,"" writes @calthomas. https://t.co/pp9cXiR8N7",watching video president remark maui continuing confusion inappropriate joke attempt identify pain maui resident feel painful writes,"[('president', [2, 1]), ('feel', [2, 1]), ('joke', [2]), ('video', [2, 1]), ('confusion', [2, 1]), ('resident', [1]), ('attempt', [2, 1]), ('maui', [2, 1]), ('watching', [2]), ('identify', [2, 1]), ('continuing', [1]), ('writes', [2]), ('inappropriate', [2]), ('remark', [1]), ('pain', [2, 1]), ('painful', [2])]","[('president', ['War', 'American/economics/health']), ('feel', ['War', 'American/economics/health']), ('joke', ['War']), ('video', ['War', 'American/economics/health']), ('confusion', ['War', 'American/economics/health']), ('resident', ['American/economics/health']), ('attempt', ['War', 'American/economics/health']), ('maui', ['War', 'American/economics/health']), ('watching', ['War']), ('identify', ['War', 'American/economics/health']), ('continuing', ['American/economics/health']), ('writes', ['War']), ('inappropriate', ['War']), ('remark', ['American/economics/health']), ('pain', ['War', 'American/economics/health']), ('painful', ['War'])]"
AndrewYang,2023-08-26 18:39:58+00:00,2,War,0.62337273,positive,0.8830432295799255,joy,0.7349338531494141,4.0,Republicans vs democrats,0.22550169,"I recommend Barbie, Oppenheimer and/or TMNT. 😀",recommend barbie oppenheimer tmnt,"[('oppenheimer', [2]), ('recommend', [2]), ('barbie', [4]), ('tmnt', [2])]","[('oppenheimer', ['War']), ('recommend', ['War']), ('barbie', ['Republicans vs democrats']), ('tmnt', ['War'])]"
