username,date,first_topic,first_topic_name,first_topic_prob,sentiment,sentiment_prob,emotion,emotion_prob,second_topic,second_topic_name,second_topic_prob,text,lemmatized_text,per_word_topics,per_word_topics_name
jamesrhenson,2023-06-10 21:20:41+00:00,1,American/economics/health,0.2822485,positive,0.9495307207107544,joy,0.9072293043136596,7.0,Abortion/rights/guns,0.2740759,"A nice and very deserved appreciation of Wade Goodwyn from his NPR colleagues. Talked to Wade a few times for Texas stories, and always admired an approach that was both smart and artful. NPR correspondent Wade Goodwyn dies : NPR https://t.co/WHx1lZW9zd",nice deserved appreciation wade goodwyn npr colleague talked wade time texas story admired approach smart artful npr correspondent wade goodwyn  npr,"[('story', [4, 5]), ('time', [1, 4]), ('texas', [4, 7]), ('deserved', [7, 1]), ('talked', [4, 5]), ('nice', [4, 7]), ('colleague', [1, 7]), ('smart', [1, 7]), ('approach', [1, 4]), ('wade', [7]), ('correspondent', [4]), ('appreciation', [5]), ('admired', [3]), ('artful', [7]), ('goodwyn', [7, 1]), ('npr', [1])]","[('story', ['Republicans vs democrats', 'Border/community/family']), ('time', ['American/economics/health', 'Republicans vs democrats']), ('texas', ['Republicans vs democrats', 'Abortion/rights/guns']), ('deserved', ['Abortion/rights/guns', 'American/economics/health']), ('talked', ['Republicans vs democrats', 'Border/community/family']), ('nice', ['Republicans vs democrats', 'Abortion/rights/guns']), ('colleague', ['American/economics/health', 'Abortion/rights/guns']), ('smart', ['American/economics/health', 'Abortion/rights/guns']), ('approach', ['American/economics/health', 'Republicans vs democrats']), ('wade', ['Abortion/rights/guns']), ('correspondent', ['Republicans vs democrats']), ('appreciation', ['Border/community/family']), ('admired', ['News/radio/livestream']), ('artful', ['Abortion/rights/guns']), ('goodwyn', ['Abortion/rights/guns', 'American/economics/health']), ('npr', ['American/economics/health'])]"
RonDeSantis,2023-06-11 01:30:45+00:00,1,American/economics/health,0.28640297,positive,0.486509621143341,optimism,0.912552297115326,7.0,Abortion/rights/guns,0.21845359,"In Florida and Oklahoma, we stand up for freedom — freedom to raise your family without radical ideology being crammed down your throat; freedom to worship and live your faith as you see fit; freedom to run your business and control your finances without corporate activists injecting a woke ideology into the marketplace. We are on a mission to ensure that freedom prevails across the land. Thank you, @GovStitt and @RepJBridenstine!",florida oklahoma stand freedom freedom raise family radical ideology crammed throat freedom worship live faith fit freedom run business control finance corporate activist injecting woke ideology marketplace mission ensure freedom prevails land thank,"[('freedom', [7, 5]), ('control', [2, 7]), ('activist', [7, 2]), ('woke', [2, 1]), ('family', [1, 5]), ('florida', [7, 1]), ('land', [7, 5]), ('business', [1, 4]), ('run', [2, 6]), ('marketplace', [1]), ('stand', [7, 2]), ('raise', [1, 6]), ('faith', [2, 5]), ('finance', [1, 4]), ('live', [6, 1]), ('thank', [5, 1]), ('ideology', [2, 1]), ('radical', [1, 7]), ('fit', [2, 5]), ('ensure', [1, 7]), ('oklahoma', [6]), ('corporate', [1, 4]), ('throat', [2, 6]), ('prevails', [4]), ('injecting', [1]), ('mission', [5, 7]), ('worship', [5]), ('crammed', [2, 7])]","[('freedom', ['Abortion/rights/guns', 'Border/community/family']), ('control', ['War', 'Abortion/rights/guns']), ('activist', ['Abortion/rights/guns', 'War']), ('woke', ['War', 'American/economics/health']), ('family', ['American/economics/health', 'Border/community/family']), ('florida', ['Abortion/rights/guns', 'American/economics/health']), ('land', ['Abortion/rights/guns', 'Border/community/family']), ('business', ['American/economics/health', 'Republicans vs democrats']), ('run', ['War', 'Election/debate']), ('marketplace', ['American/economics/health']), ('stand', ['Abortion/rights/guns', 'War']), ('raise', ['American/economics/health', 'Election/debate']), ('faith', ['War', 'Border/community/family']), ('finance', ['American/economics/health', 'Republicans vs democrats']), ('live', ['Election/debate', 'American/economics/health']), ('thank', ['Border/community/family', 'American/economics/health']), ('ideology', ['War', 'American/economics/health']), ('radical', ['American/economics/health', 'Abortion/rights/guns']), ('fit', ['War', 'Border/community/family']), ('ensure', ['American/economics/health', 'Abortion/rights/guns']), ('oklahoma', ['Election/debate']), ('corporate', ['American/economics/health', 'Republicans vs democrats']), ('throat', ['War', 'Election/debate']), ('prevails', ['Republicans vs democrats']), ('injecting', ['American/economics/health']), ('mission', ['Border/community/family', 'Abortion/rights/guns']), ('worship', ['Border/community/family']), ('crammed', ['War', 'Abortion/rights/guns'])]"
marwilliamson,2023-06-11 01:37:05+00:00,1,American/economics/health,0.42924684,neutral,0.5204565525054932,optimism,0.9409069418907166,5.0,Border/community/family,0.31874493,"The values of the Declaration of Independence are profoundly humanitarian: All men are created equal, with inalienable rights (given by God) to life, liberty and the pursuit of happiness. The values of trickle-down hyper-capitalistic economics are values-neutral, acknowledging no ethical responsibility to people or planet but only fiduciary responsibility to corporate stockholders. Our generation is confronted by the need to decide between the two.",value declaration independence profoundly humanitarian men created equal inalienable right given god life liberty pursuit happiness value trickle hyper capitalistic economics value neutral acknowledging ethical responsibility people planet fiduciary responsibility corporate stockholder generation confronted need decide,"[('people', [1, 5]), ('god', [5, 3]), ('need', [1, 5]), ('right', [1, 7]), ('responsibility', [1, 5]), ('life', [5, 1]), ('men', [5, 7]), ('created', [1, 5]), ('given', [5, 2]), ('declaration', [5, 1]), ('confronted', [3, 5]), ('generation', [5, 1]), ('liberty', [5, 7]), ('pursuit', [5, 3]), ('value', [5, 1]), ('independence', [5, 1]), ('planet', [1, 5]), ('corporate', [1, 2]), ('equal', [7, 1]), ('decide', [1, 7]), ('humanitarian', [5, 2]), ('happiness', [5]), ('trickle', [1]), ('economics', [1]), ('neutral', [1, 7]), ('ethical', [2]), ('acknowledging', [3]), ('stockholder', [1]), ('profoundly', [1]), ('fiduciary', [1]), ('inalienable', [2]), ('capitalistic', [2]), ('hyper', [1])]","[('people', ['American/economics/health', 'Border/community/family']), ('god', ['Border/community/family', 'News/radio/livestream']), ('need', ['American/economics/health', 'Border/community/family']), ('right', ['American/economics/health', 'Abortion/rights/guns']), ('responsibility', ['American/economics/health', 'Border/community/family']), ('life', ['Border/community/family', 'American/economics/health']), ('men', ['Border/community/family', 'Abortion/rights/guns']), ('created', ['American/economics/health', 'Border/community/family']), ('given', ['Border/community/family', 'War']), ('declaration', ['Border/community/family', 'American/economics/health']), ('confronted', ['News/radio/livestream', 'Border/community/family']), ('generation', ['Border/community/family', 'American/economics/health']), ('liberty', ['Border/community/family', 'Abortion/rights/guns']), ('pursuit', ['Border/community/family', 'News/radio/livestream']), ('value', ['Border/community/family', 'American/economics/health']), ('independence', ['Border/community/family', 'American/economics/health']), ('planet', ['American/economics/health', 'Border/community/family']), ('corporate', ['American/economics/health', 'War']), ('equal', ['Abortion/rights/guns', 'American/economics/health']), ('decide', ['American/economics/health', 'Abortion/rights/guns']), ('humanitarian', ['Border/community/family', 'War']), ('happiness', ['Border/community/family']), ('trickle', ['American/economics/health']), ('economics', ['American/economics/health']), ('neutral', ['American/economics/health', 'Abortion/rights/guns']), ('ethical', ['War']), ('acknowledging', ['News/radio/livestream']), ('stockholder', ['American/economics/health']), ('profoundly', ['American/economics/health']), ('fiduciary', ['American/economics/health']), ('inalienable', ['War']), ('capitalistic', ['War']), ('hyper', ['American/economics/health'])]"
atrupar,2023-06-11 02:22:26+00:00,1,American/economics/health,0.41771784,neutral,0.7180488109588623,anger,0.5164511799812317,5.0,Border/community/family,0.28489387,Trump claims that while president he was on a call with Russia and Saudi where he pleaded for higher oil prices https://t.co/9eMlsdOZUs,trump claim president russia saudi pleaded higher oil price,"[('russia', [5, 4]), ('trump', [4, 1]), ('president', [1, 4]), ('claim', [1, 4]), ('price', [1, 5]), ('oil', [1]), ('pleaded', [5]), ('higher', [1, 4]), ('saudi', [5, 4])]","[('russia', ['Border/community/family', 'Republicans vs democrats']), ('trump', ['Republicans vs democrats', 'American/economics/health']), ('president', ['American/economics/health', 'Republicans vs democrats']), ('claim', ['American/economics/health', 'Republicans vs democrats']), ('price', ['American/economics/health', 'Border/community/family']), ('oil', ['American/economics/health']), ('pleaded', ['Border/community/family']), ('higher', ['American/economics/health', 'Republicans vs democrats']), ('saudi', ['Border/community/family', 'Republicans vs democrats'])]"
SenAmyKlobuchar,2023-06-11 02:23:28+00:00,1,American/economics/health,0.7337951,positive,0.95619535446167,optimism,0.6264012455940247,5.0,Border/community/family,0.23731355,We passed the PACT Act to make sure our brave veterans get the care they have earned and deserve. Thanks to Wadena County Veterans Service Officer David Anderson for helping spread the word about this important law and new benefits and care available. https://t.co/di5ZpNw7hN,passed pact act sure brave veteran care earned deserve thanks wadena county veteran service officer david anderson helping spread word important law benefit care available,"[('officer', [5, 1]), ('law', [1, 5]), ('helping', [1, 5]), ('act', [1, 5]), ('service', [1, 5]), ('available', [1, 5]), ('important', [1, 5]), ('care', [1, 5]), ('county', [5, 1]), ('sure', [1, 5]), ('benefit', [1]), ('passed', [1, 5]), ('deserve', [1, 5]), ('word', [1, 5]), ('thanks', [1, 5]), ('david', [1, 5]), ('veteran', [1, 5]), ('spread', [1, 5]), ('earned', [1]), ('brave', [5, 1]), ('pact', [1]), ('anderson', [5]), ('wadena', [1])]","[('officer', ['Border/community/family', 'American/economics/health']), ('law', ['American/economics/health', 'Border/community/family']), ('helping', ['American/economics/health', 'Border/community/family']), ('act', ['American/economics/health', 'Border/community/family']), ('service', ['American/economics/health', 'Border/community/family']), ('available', ['American/economics/health', 'Border/community/family']), ('important', ['American/economics/health', 'Border/community/family']), ('care', ['American/economics/health', 'Border/community/family']), ('county', ['Border/community/family', 'American/economics/health']), ('sure', ['American/economics/health', 'Border/community/family']), ('benefit', ['American/economics/health']), ('passed', ['American/economics/health', 'Border/community/family']), ('deserve', ['American/economics/health', 'Border/community/family']), ('word', ['American/economics/health', 'Border/community/family']), ('thanks', ['American/economics/health', 'Border/community/family']), ('david', ['American/economics/health', 'Border/community/family']), ('veteran', ['American/economics/health', 'Border/community/family']), ('spread', ['American/economics/health', 'Border/community/family']), ('earned', ['American/economics/health']), ('brave', ['Border/community/family', 'American/economics/health']), ('pact', ['American/economics/health']), ('anderson', ['Border/community/family']), ('wadena', ['American/economics/health'])]"
marwilliamson,2023-06-11 11:48:05+00:00,1,American/economics/health,0.49928358,negative,0.8038839101791382,anger,0.3545658886432647,5.0,Border/community/family,0.31799355,"No phrase has been used more manipulatively than ""national security."" How many imperialistic wars have been fought, millions of lives wasted, and fortunes squandered because we were led to believe it was for the sake of ""national security?"" Our military madness has not made us more secure; it has made us less secure. and it has weakened us in the eyes of the world. We need to redefine ""national security."" We will be *secure* when our access to health care is secure, our access to education is secure, our children's safety is secure, our way to make a living wage is secure, our access to housing is secure, the safety of our water and food are secure, and our democracy is secure. First we change the conversation; then we can start to change the world.",phrase manipulatively national security imperialistic war fought million life wasted fortune squandered led believe sake national security military madness secure secure weakened eye world need redefine national security secure access health care secure access education secure child  safety secure way living wage secure access housing secure safety water food secure democracy secure change conversation start change world,"[('national', [1, 5]), ('security', [1, 5]), ('democracy', [7, 5]), ('military', [5, 1]), ('war', [5, 1]), ('way', [1, 5]), ('world', [5, 1]), ('million', [1, 5]), ('believe', [1, 7]), ('sake', [7, 2]), ('start', [1, 5]), ('need', [1, 5]), ('life', [5, 1]), ('housing', [1, 5]), ('care', [1, 7]), ('child', [1, 5]), ('health', [1, 7]), ('conversation', [5, 1]), ('water', [1, 5]), ('education', [1, 5]), ('fought', [1, 5]), ('change', [1, 5]), ('safety', [1, 5]), ('access', [1, 7]), ('living', [1, 5]), ('secure', [5, 1]), ('eye', [5, 7]), ('led', [1, 5]), ('fortune', [5]), ('wage', [1]), ('food', [1, 5]), ('phrase', [2]), ('wasted', [7]), ('madness', [1, 2]), ('weakened', [5]), ('imperialistic', [1, 5]), ('manipulatively', [1, 5]), ('redefine', [7]), ('squandered', [7])]","[('national', ['American/economics/health', 'Border/community/family']), ('security', ['American/economics/health', 'Border/community/family']), ('democracy', ['Abortion/rights/guns', 'Border/community/family']), ('military', ['Border/community/family', 'American/economics/health']), ('war', ['Border/community/family', 'American/economics/health']), ('way', ['American/economics/health', 'Border/community/family']), ('world', ['Border/community/family', 'American/economics/health']), ('million', ['American/economics/health', 'Border/community/family']), ('believe', ['American/economics/health', 'Abortion/rights/guns']), ('sake', ['Abortion/rights/guns', 'War']), ('start', ['American/economics/health', 'Border/community/family']), ('need', ['American/economics/health', 'Border/community/family']), ('life', ['Border/community/family', 'American/economics/health']), ('housing', ['American/economics/health', 'Border/community/family']), ('care', ['American/economics/health', 'Abortion/rights/guns']), ('child', ['American/economics/health', 'Border/community/family']), ('health', ['American/economics/health', 'Abortion/rights/guns']), ('conversation', ['Border/community/family', 'American/economics/health']), ('water', ['American/economics/health', 'Border/community/family']), ('education', ['American/economics/health', 'Border/community/family']), ('fought', ['American/economics/health', 'Border/community/family']), ('change', ['American/economics/health', 'Border/community/family']), ('safety', ['American/economics/health', 'Border/community/family']), ('access', ['American/economics/health', 'Abortion/rights/guns']), ('living', ['American/economics/health', 'Border/community/family']), ('secure', ['Border/community/family', 'American/economics/health']), ('eye', ['Border/community/family', 'Abortion/rights/guns']), ('led', ['American/economics/health', 'Border/community/family']), ('fortune', ['Border/community/family']), ('wage', ['American/economics/health']), ('food', ['American/economics/health', 'Border/community/family']), ('phrase', ['War']), ('wasted', ['Abortion/rights/guns']), ('madness', ['American/economics/health', 'War']), ('weakened', ['Border/community/family']), ('imperialistic', ['American/economics/health', 'Border/community/family']), ('manipulatively', ['American/economics/health', 'Border/community/family']), ('redefine', ['Abortion/rights/guns']), ('squandered', ['Abortion/rights/guns'])]"
RepKenBuck,2023-06-11 17:03:24+00:00,1,American/economics/health,0.9452639,negative,0.8836324214935303,disgust,0.4996981024742126,,,,"Republicans in Congress - both @freedomcaucus members and moderates - voted against this debt ceiling ""deal"" because it's a bad plan. The debt trajectory we are on is unsustainable. We must get serious about addressing this debt. https://t.co/eiKwzDGeJH",republican congress member moderate voted debt ceiling deal bad plan debt trajectory unsustainable addressing debt,"[('congress', [1]), ('republican', [1]), ('member', [1]), ('bad', [1]), ('plan', [1]), ('voted', [1]), ('deal', [1]), ('debt', [1]), ('ceiling', [1]), ('addressing', [1]), ('moderate', [1]), ('unsustainable', [1]), ('trajectory', [1])]","[('congress', ['American/economics/health']), ('republican', ['American/economics/health']), ('member', ['American/economics/health']), ('bad', ['American/economics/health']), ('plan', ['American/economics/health']), ('voted', ['American/economics/health']), ('deal', ['American/economics/health']), ('debt', ['American/economics/health']), ('ceiling', ['American/economics/health']), ('addressing', ['American/economics/health']), ('moderate', ['American/economics/health']), ('unsustainable', ['American/economics/health']), ('trajectory', ['American/economics/health'])]"
NewsbySmiley,2023-06-11 18:28:15+00:00,1,American/economics/health,0.41491392,neutral,0.910256564617157,fear,0.5904377102851868,4.0,Republicans vs democrats,0.26663047,RT @The Herald’s climate team on a risk we are all already dealing with. From @NicolasFuRivero and @harrisalexc.,herald climate team risk dealing,"[('team', [4, 1]), ('dealing', [4, 1]), ('climate', [1]), ('risk', [1, 4]), ('herald', [7])]","[('team', ['Republicans vs democrats', 'American/economics/health']), ('dealing', ['Republicans vs democrats', 'American/economics/health']), ('climate', ['American/economics/health']), ('risk', ['American/economics/health', 'Republicans vs democrats']), ('herald', ['Abortion/rights/guns'])]"
KamalaHarris,2023-06-11 18:34:00+00:00,1,American/economics/health,0.9204098,positive,0.80569988489151,optimism,0.698989987373352,8.0,Infrastructure/job/energy,0.011374419,"Unemployment has remained near record lows. President @JoeBiden and I are delivering for working families, and we'll continue to do that.",unemployment remained near record low president delivering working family continue,"[('near', [1]), ('record', [1]), ('president', [1]), ('working', [1]), ('family', [1]), ('continue', [1]), ('low', [1]), ('unemployment', [1]), ('remained', [1]), ('delivering', [1])]","[('near', ['American/economics/health']), ('record', ['American/economics/health']), ('president', ['American/economics/health']), ('working', ['American/economics/health']), ('family', ['American/economics/health']), ('continue', ['American/economics/health']), ('low', ['American/economics/health']), ('unemployment', ['American/economics/health']), ('remained', ['American/economics/health']), ('delivering', ['American/economics/health'])]"
laurenboebert,2023-06-11 19:38:18+00:00,1,American/economics/health,0.9416142,negative,0.8607205152511597,disgust,0.5077285170555115,,,,"RT @Republicans in Congress - both @freedomcaucus members and moderates - voted against this debt ceiling ""deal"" because it's a bad plan. The debt trajectory we are on is unsustainable. We must get serious about addressing this debt. https://t.co/eiKwzDGeJH",congress member moderate voted debt ceiling deal bad plan debt trajectory unsustainable addressing debt,"[('congress', [1]), ('member', [1]), ('bad', [1]), ('plan', [1]), ('voted', [1]), ('deal', [1]), ('debt', [1]), ('ceiling', [1]), ('addressing', [1]), ('moderate', [1]), ('unsustainable', [1]), ('trajectory', [1])]","[('congress', ['American/economics/health']), ('member', ['American/economics/health']), ('bad', ['American/economics/health']), ('plan', ['American/economics/health']), ('voted', ['American/economics/health']), ('deal', ['American/economics/health']), ('debt', ['American/economics/health']), ('ceiling', ['American/economics/health']), ('addressing', ['American/economics/health']), ('moderate', ['American/economics/health']), ('unsustainable', ['American/economics/health']), ('trajectory', ['American/economics/health'])]"
NNUBonnie,2023-06-11 20:22:00+00:00,1,American/economics/health,0.9484463,negative,0.5226828455924988,optimism,0.3775530457496643,,,,"Nurses know there are enough nurses to safely staff our hospitals, there is just a lack of will on the part of the hospital industry because they put profits before patient care. It's time we make them care. We will not continue to be ignored. https://t.co/LD4EOoSyPq",nurse know nurse safely staff hospital lack hospital industry profit patient care time care continue ignored,"[('know', [1]), ('hospital', [1]), ('staff', [1]), ('ignored', [1]), ('time', [1]), ('care', [1]), ('continue', [1]), ('lack', [1]), ('patient', [1]), ('profit', [1]), ('nurse', [1]), ('industry', [1]), ('safely', [1])]","[('know', ['American/economics/health']), ('hospital', ['American/economics/health']), ('staff', ['American/economics/health']), ('ignored', ['American/economics/health']), ('time', ['American/economics/health']), ('care', ['American/economics/health']), ('continue', ['American/economics/health']), ('lack', ['American/economics/health']), ('patient', ['American/economics/health']), ('profit', ['American/economics/health']), ('nurse', ['American/economics/health']), ('industry', ['American/economics/health']), ('safely', ['American/economics/health'])]"
RobertKennedyJr,2023-06-11 22:52:39+00:00,1,American/economics/health,0.5852543,neutral,0.4544074237346649,anger,0.4341304004192352,7.0,Abortion/rights/guns,0.2349165,"Join me in unraveling the corrupt corporate control of our government. For too long, politicians have sold out American interests to the highest bidder. I am running against moneyed interests and need your help. Please make a contribution today at https://t.co/OfQ9MpJPkH + share this video with your friends and family. Let’s take back our country! 🇺🇸",join unraveling corrupt corporate control government long politician sold american interest highest bidder running moneyed interest need help contribution today share video friend family let country,"[('american', [1, 7]), ('today', [1, 7]), ('interest', [1, 4]), ('let', [1, 7]), ('long', [1, 7]), ('control', [1, 7]), ('need', [1, 7]), ('country', [1, 7]), ('help', [1, 4]), ('government', [1, 4]), ('sold', [1, 4]), ('video', [4, 1]), ('family', [1, 7]), ('running', [4, 1]), ('politician', [7, 1]), ('highest', [1, 7]), ('friend', [7, 1]), ('share', [1, 7]), ('corrupt', [4, 1]), ('join', [1, 7]), ('corporate', [1, 4]), ('contribution', [7, 1]), ('unraveling', [7]), ('bidder', [7]), ('moneyed', [7, 1])]","[('american', ['American/economics/health', 'Abortion/rights/guns']), ('today', ['American/economics/health', 'Abortion/rights/guns']), ('interest', ['American/economics/health', 'Republicans vs democrats']), ('let', ['American/economics/health', 'Abortion/rights/guns']), ('long', ['American/economics/health', 'Abortion/rights/guns']), ('control', ['American/economics/health', 'Abortion/rights/guns']), ('need', ['American/economics/health', 'Abortion/rights/guns']), ('country', ['American/economics/health', 'Abortion/rights/guns']), ('help', ['American/economics/health', 'Republicans vs democrats']), ('government', ['American/economics/health', 'Republicans vs democrats']), ('sold', ['American/economics/health', 'Republicans vs democrats']), ('video', ['Republicans vs democrats', 'American/economics/health']), ('family', ['American/economics/health', 'Abortion/rights/guns']), ('running', ['Republicans vs democrats', 'American/economics/health']), ('politician', ['Abortion/rights/guns', 'American/economics/health']), ('highest', ['American/economics/health', 'Abortion/rights/guns']), ('friend', ['Abortion/rights/guns', 'American/economics/health']), ('share', ['American/economics/health', 'Abortion/rights/guns']), ('corrupt', ['Republicans vs democrats', 'American/economics/health']), ('join', ['American/economics/health', 'Abortion/rights/guns']), ('corporate', ['American/economics/health', 'Republicans vs democrats']), ('contribution', ['Abortion/rights/guns', 'American/economics/health']), ('unraveling', ['Abortion/rights/guns']), ('bidder', ['Abortion/rights/guns']), ('moneyed', ['Abortion/rights/guns', 'American/economics/health'])]"
