username,date,first_topic,first_topic_name,first_topic_prob,sentiment,sentiment_prob,emotion,emotion_prob,second_topic,second_topic_name,second_topic_prob,text,lemmatized_text,per_word_topics,per_word_topics_name
Mike_Pence,2023-08-31 00:42:37+00:00,2,War,0.6344349,negative,0.7564144730567932,anger,0.6729061603546143,7.0,Abortion/rights/guns,0.26752898,.@VivekGRamaswamy announcing that he will not use military force to defend Israel against Iran demonstrates a profound lack of understanding about defending American interests and our most cherished ally. Weakness Arouses Evil. Vivek’s hesitation to send a clear message of support for Israel will only embolden the radical Islamic mullahs in Tehran as they continue to target innocent American civilians and threaten to annihilate Israel. Peace comes through strength. America Stands With Israel! 🇺🇸🇮🇱,announcing use military force defend israel iran demonstrates profound lack understanding defending american interest cherished ally weakness arouses evil viveks hesitation send clear message support israel embolden radical islamic mullah tehran continue target innocent american civilian threaten annihilate israel peace come strength america stand israel,"[('come', [2, 7]), ('american', [2, 7]), ('military', [7, 2]), ('support', [2, 7]), ('force', [2, 7]), ('interest', [2, 5]), ('israel', [2, 5]), ('clear', [2, 7]), ('america', [2, 7]), ('islamic', [2]), ('iran', [2]), ('peace', [2, 5]), ('tehran', [2]), ('defending', [2, 7]), ('send', [2, 7]), ('use', [2, 7]), ('evil', [2]), ('continue', [7, 2]), ('innocent', [2, 5]), ('message', [2, 7]), ('stand', [2, 7]), ('profound', [5, 6]), ('radical', [2, 7]), ('ally', [2, 7]), ('lack', [2, 7]), ('announcing', [2, 6]), ('defend', [7, 2]), ('target', [2, 7]), ('understanding', [2, 5]), ('threaten', [2, 7]), ('strength', [2, 7]), ('annihilate', [7]), ('civilian', [2, 5]), ('weakness', [2]), ('viveks', [6]), ('hesitation', [7]), ('arouses', [2, 7]), ('cherished', [7]), ('demonstrates', [7]), ('embolden', [7]), ('mullah', [7])]","[('come', ['War', 'Abortion/rights/guns']), ('american', ['War', 'Abortion/rights/guns']), ('military', ['Abortion/rights/guns', 'War']), ('support', ['War', 'Abortion/rights/guns']), ('force', ['War', 'Abortion/rights/guns']), ('interest', ['War', 'Border/community/family']), ('israel', ['War', 'Border/community/family']), ('clear', ['War', 'Abortion/rights/guns']), ('america', ['War', 'Abortion/rights/guns']), ('islamic', ['War']), ('iran', ['War']), ('peace', ['War', 'Border/community/family']), ('tehran', ['War']), ('defending', ['War', 'Abortion/rights/guns']), ('send', ['War', 'Abortion/rights/guns']), ('use', ['War', 'Abortion/rights/guns']), ('evil', ['War']), ('continue', ['Abortion/rights/guns', 'War']), ('innocent', ['War', 'Border/community/family']), ('message', ['War', 'Abortion/rights/guns']), ('stand', ['War', 'Abortion/rights/guns']), ('profound', ['Border/community/family', 'Election/debate']), ('radical', ['War', 'Abortion/rights/guns']), ('ally', ['War', 'Abortion/rights/guns']), ('lack', ['War', 'Abortion/rights/guns']), ('announcing', ['War', 'Election/debate']), ('defend', ['Abortion/rights/guns', 'War']), ('target', ['War', 'Abortion/rights/guns']), ('understanding', ['War', 'Border/community/family']), ('threaten', ['War', 'Abortion/rights/guns']), ('strength', ['War', 'Abortion/rights/guns']), ('annihilate', ['Abortion/rights/guns']), ('civilian', ['War', 'Border/community/family']), ('weakness', ['War']), ('viveks', ['Election/debate']), ('hesitation', ['Abortion/rights/guns']), ('arouses', ['War', 'Abortion/rights/guns']), ('cherished', ['Abortion/rights/guns']), ('demonstrates', ['Abortion/rights/guns']), ('embolden', ['Abortion/rights/guns']), ('mullah', ['Abortion/rights/guns'])]"
marklevinshow,2023-08-31 02:22:03+00:00,2,War,0.5133503,negative,0.8984115719795227,anger,0.6671605706214905,8.0,Infrastructure/job/energy,0.22520274,"THIS will get absolutely no attention from the corrupt Democrat Party media -- that is, the ""climate change"" agenda is built on bullsh*t. But it is used by Marxists and the Democrat Party to destroy capitalism, prosperity, private property rights, and liberty. https://t.co/HHwR9hUYkV",absolutely attention corrupt democrat party medium climate change agenda built bullsh  marxist democrat party destroy capitalism prosperity private property right liberty,"[('medium', [2, 4]), ('built', [8, 2]), ('right', [2, 8]), ('property', [4, 8]), ('party', [2, 4]), ('marxist', [3]), ('democrat', [2, 4]), ('change', [2, 8]), ('absolutely', [2, 4]), ('corrupt', [2, 4]), ('climate', [8, 2]), ('destroy', [2, 4]), ('liberty', [2, 4]), ('private', [8, 2]), ('agenda', [2, 8]), ('attention', [2, 4]), ('prosperity', [8]), ('capitalism', [3, 8]), ('bullsh', [3])]","[('medium', ['War', 'Republicans vs democrats']), ('built', ['Infrastructure/job/energy', 'War']), ('right', ['War', 'Infrastructure/job/energy']), ('property', ['Republicans vs democrats', 'Infrastructure/job/energy']), ('party', ['War', 'Republicans vs democrats']), ('marxist', ['News/radio/livestream']), ('democrat', ['War', 'Republicans vs democrats']), ('change', ['War', 'Infrastructure/job/energy']), ('absolutely', ['War', 'Republicans vs democrats']), ('corrupt', ['War', 'Republicans vs democrats']), ('climate', ['Infrastructure/job/energy', 'War']), ('destroy', ['War', 'Republicans vs democrats']), ('liberty', ['War', 'Republicans vs democrats']), ('private', ['Infrastructure/job/energy', 'War']), ('agenda', ['War', 'Infrastructure/job/energy']), ('attention', ['War', 'Republicans vs democrats']), ('prosperity', ['Infrastructure/job/energy']), ('capitalism', ['News/radio/livestream', 'Infrastructure/job/energy']), ('bullsh', ['News/radio/livestream'])]"
VivekGRamaswamy,2023-08-31 03:11:06+00:00,2,War,0.68241894,negative,0.832664966583252,anger,0.6957781910896301,5.0,Border/community/family,0.21027564,"Sorry Karl Rove, I’m still not going to invade Iraq again. https://t.co/859HuwjaoA",sorry karl rove going invade iraq,"[('iraq', [2, 5]), ('invade', [5]), ('going', [2, 5]), ('sorry', [2, 5]), ('karl', [2]), ('rove', [2])]","[('iraq', ['War', 'Border/community/family']), ('invade', ['Border/community/family']), ('going', ['War', 'Border/community/family']), ('sorry', ['War', 'Border/community/family']), ('karl', ['War']), ('rove', ['War'])]"
marwilliamson,2023-08-31 09:32:23+00:00,2,War,0.36928982,neutral,0.627559244632721,anticipation,0.5451987385749817,7.0,Abortion/rights/guns,0.32094142,"If Thomas Paine were alive today, I think he’d be traveling with this group.",thomas paine alive today think traveling group,"[('today', [5, 7]), ('traveling', [7, 5]), ('group', [2, 7]), ('think', [2, 7]), ('thomas', [7, 2]), ('alive', [5, 2]), ('paine', [2])]","[('today', ['Border/community/family', 'Abortion/rights/guns']), ('traveling', ['Abortion/rights/guns', 'Border/community/family']), ('group', ['War', 'Abortion/rights/guns']), ('think', ['War', 'Abortion/rights/guns']), ('thomas', ['Abortion/rights/guns', 'War']), ('alive', ['Border/community/family', 'War']), ('paine', ['War'])]"
WashTimesOpEd,2023-08-31 11:26:15+00:00,2,War,0.59334993,neutral,0.6904963254928589,optimism,0.6216976642608643,6.0,Election/debate,0.24922995,"""Only Mr. Trump echoes the overarching sentiment of the GOP base — the Ukraine war must end, and compromises will have to be made. It’s time to put America first,"" writes @KellyRiddell. https://t.co/lNn29jVm6n", trump echo overarching sentiment gop base ukraine war end compromise time america writes,"[('base', [2, 6]), ('war', [2, 1]), ('america', [2, 6]), ('ukraine', [2, 6]), ('trump', [2, 6]), ('time', [2, 6]), ('gop', [6, 2]), ('end', [2, 1]), ('writes', [2, 6]), ('sentiment', [1]), ('compromise', [6]), ('echo', [2]), ('overarching', [2])]","[('base', ['War', 'Election/debate']), ('war', ['War', 'American/economics/health']), ('america', ['War', 'Election/debate']), ('ukraine', ['War', 'Election/debate']), ('trump', ['War', 'Election/debate']), ('time', ['War', 'Election/debate']), ('gop', ['Election/debate', 'War']), ('end', ['War', 'American/economics/health']), ('writes', ['War', 'Election/debate']), ('sentiment', ['American/economics/health']), ('compromise', ['Election/debate']), ('echo', ['War']), ('overarching', ['War'])]"
IngrahamAngle,2023-08-31 12:56:48+00:00,2,War,0.4707151,negative,0.7435864210128784,anger,0.5067721009254456,1.0,American/economics/health,0.454196,The establishment will always prioritize helping the Chinese Communist Party over helping any of you in middle America. https://t.co/sQIU0bcNHM,establishment prioritize helping chinese communist party helping middle america,"[('middle', [1, 2]), ('america', [2, 1]), ('helping', [1]), ('party', [2, 1]), ('communist', [2]), ('chinese', [2]), ('prioritize', [1]), ('establishment', [2])]","[('middle', ['American/economics/health', 'War']), ('america', ['War', 'American/economics/health']), ('helping', ['American/economics/health']), ('party', ['War', 'American/economics/health']), ('communist', ['War']), ('chinese', ['War']), ('prioritize', ['American/economics/health']), ('establishment', ['War'])]"
TheInsiderPaper,2023-08-31 13:36:28+00:00,2,War,0.3484423,neutral,0.8420058488845825,anticipation,0.4090757966041565,8.0,Infrastructure/job/energy,0.2254702,WATCH 🚨 Nebraska police pull over man with a bull riding in the passenger’s seat https://t.co/nAstuGnf5s,watch nebraska police pull man bull riding passenger seat,"[('police', [2, 5]), ('man', [2, 5]), ('passenger', [8]), ('watch', [6, 2]), ('riding', [5]), ('pull', [2, 6]), ('seat', [6, 8]), ('bull', [2]), ('nebraska', [8])]","[('police', ['War', 'Border/community/family']), ('man', ['War', 'Border/community/family']), ('passenger', ['Infrastructure/job/energy']), ('watch', ['Election/debate', 'War']), ('riding', ['Border/community/family']), ('pull', ['War', 'Election/debate']), ('seat', ['Election/debate', 'Infrastructure/job/energy']), ('bull', ['War']), ('nebraska', ['Infrastructure/job/energy'])]"
VivekGRamaswamy,2023-08-31 15:18:11+00:00,2,War,0.42664653,neutral,0.6382848620414734,optimism,0.3867948949337005,8.0,Infrastructure/job/energy,0.33086428,"The real threat to the U.S. isn’t Russia’s invasion of Ukraine. It’s the China-Russia alliance. Together, they outmatch the U.S. in every area of great power competition: geographic footprint, economic potential, industrial manufacturing might, conventional military power + nuclear weapons. The U.S. has fulfilled our commitments in Ukraine. Put America First. End the war in Ukraine by negotiating peace with Putin in return for Russia exiting its alliance with China.",real threat  russia invasion ukraine china russia alliance outmatch  area great power competition geographic footprint economic potential industrial manufacturing conventional military power nuclear weapon  fulfilled commitment ukraine america end war ukraine negotiating peace putin return russia exiting alliance china,"[('nuclear', [2, 8]), ('putin', [2, 5]), ('russia', [2, 5]), ('weapon', [2, 8]), ('military', [2, 5]), ('war', [2, 5]), ('potential', [8, 5]), ('america', [2, 8]), ('ukraine', [2, 5]), ('threat', [2, 8]), ('area', [8, 5]), ('china', [2, 8]), ('peace', [2, 5]), ('power', [2, 8]), ('end', [2, 5]), ('great', [8, 5]), ('real', [2, 8]), ('return', [8, 5]), ('alliance', [8, 5]), ('commitment', [8, 5]), ('industrial', [8, 7]), ('invasion', [2, 5]), ('competition', [8, 5]), ('fulfilled', [8]), ('economic', [8, 2]), ('manufacturing', [8]), ('footprint', [2, 7]), ('geographic', [7, 2]), ('negotiating', [8]), ('conventional', [4]), ('exiting', [5]), ('outmatch', [2, 8])]","[('nuclear', ['War', 'Infrastructure/job/energy']), ('putin', ['War', 'Border/community/family']), ('russia', ['War', 'Border/community/family']), ('weapon', ['War', 'Infrastructure/job/energy']), ('military', ['War', 'Border/community/family']), ('war', ['War', 'Border/community/family']), ('potential', ['Infrastructure/job/energy', 'Border/community/family']), ('america', ['War', 'Infrastructure/job/energy']), ('ukraine', ['War', 'Border/community/family']), ('threat', ['War', 'Infrastructure/job/energy']), ('area', ['Infrastructure/job/energy', 'Border/community/family']), ('china', ['War', 'Infrastructure/job/energy']), ('peace', ['War', 'Border/community/family']), ('power', ['War', 'Infrastructure/job/energy']), ('end', ['War', 'Border/community/family']), ('great', ['Infrastructure/job/energy', 'Border/community/family']), ('real', ['War', 'Infrastructure/job/energy']), ('return', ['Infrastructure/job/energy', 'Border/community/family']), ('alliance', ['Infrastructure/job/energy', 'Border/community/family']), ('commitment', ['Infrastructure/job/energy', 'Border/community/family']), ('industrial', ['Infrastructure/job/energy', 'Abortion/rights/guns']), ('invasion', ['War', 'Border/community/family']), ('competition', ['Infrastructure/job/energy', 'Border/community/family']), ('fulfilled', ['Infrastructure/job/energy']), ('economic', ['Infrastructure/job/energy', 'War']), ('manufacturing', ['Infrastructure/job/energy']), ('footprint', ['War', 'Abortion/rights/guns']), ('geographic', ['Abortion/rights/guns', 'War']), ('negotiating', ['Infrastructure/job/energy']), ('conventional', ['Republicans vs democrats']), ('exiting', ['Border/community/family']), ('outmatch', ['War', 'Infrastructure/job/energy'])]"
valdemings,2023-08-31 15:19:16+00:00,2,War,0.35238275,negative,0.9160865545272828,anger,0.6150352954864502,4.0,Republicans vs democrats,0.2910059,"While Gov. DeSantis is hell bent on making Florida the place where ""woke goes to die,"" he's also hell bent on making Florida the place where white supremacists go to live. The hate they spew and the acts of violence they commit against our neighbors are totally unacceptable.",gov desantis hell bent making florida place woke  die hell bent making florida place white supremacist live hate spew act violence commit neighbor totally unacceptable,"[('hate', [2, 4]), ('making', [1, 2]), ('totally', [2, 4]), ('place', [2, 6]), ('act', [1, 4]), ('woke', [2, 4]), ('violence', [2, 1]), ('desantis', [6, 4]), ('florida', [6, 4]), ('white', [4, 2]), ('hell', [2, 4]), ('die', [2, 1]), ('live', [6, 2]), ('gov', [6, 4]), ('neighbor', [6, 1]), ('unacceptable', [1, 2]), ('supremacist', [2]), ('commit', [2, 4]), ('bent', [4]), ('spew', [4])]","[('hate', ['War', 'Republicans vs democrats']), ('making', ['American/economics/health', 'War']), ('totally', ['War', 'Republicans vs democrats']), ('place', ['War', 'Election/debate']), ('act', ['American/economics/health', 'Republicans vs democrats']), ('woke', ['War', 'Republicans vs democrats']), ('violence', ['War', 'American/economics/health']), ('desantis', ['Election/debate', 'Republicans vs democrats']), ('florida', ['Election/debate', 'Republicans vs democrats']), ('white', ['Republicans vs democrats', 'War']), ('hell', ['War', 'Republicans vs democrats']), ('die', ['War', 'American/economics/health']), ('live', ['Election/debate', 'War']), ('gov', ['Election/debate', 'Republicans vs democrats']), ('neighbor', ['Election/debate', 'American/economics/health']), ('unacceptable', ['American/economics/health', 'War']), ('supremacist', ['War']), ('commit', ['War', 'Republicans vs democrats']), ('bent', ['Republicans vs democrats']), ('spew', ['Republicans vs democrats'])]"
VivekGRamaswamy,2023-08-31 15:22:51+00:00,2,War,0.9561933,negative,0.8920761942863464,anger,0.6315615177154541,,,,TRUTH: far more people die of bad climate change *policies* than of climate change itself. I will abandon the anti-carbon cult in the U.S. &amp; refuse to let the rest of the world bully us about it either.,truth far people die bad climate change policy climate change abandon anti carbon cult  refuse let rest world bully,"[('world', [2]), ('let', [2]), ('people', [2]), ('truth', [2]), ('cult', [2]), ('far', [2]), ('bad', [2]), ('change', [2]), ('refuse', [2]), ('policy', [2]), ('abandon', [2]), ('die', [2]), ('climate', [2]), ('anti', [2]), ('carbon', [2]), ('rest', [2]), ('bully', [2])]","[('world', ['War']), ('let', ['War']), ('people', ['War']), ('truth', ['War']), ('cult', ['War']), ('far', ['War']), ('bad', ['War']), ('change', ['War']), ('refuse', ['War']), ('policy', ['War']), ('abandon', ['War']), ('die', ['War']), ('climate', ['War']), ('anti', ['War']), ('carbon', ['War']), ('rest', ['War']), ('bully', ['War'])]"
WashTimesOpEd,2023-08-31 15:42:01+00:00,2,War,0.66767114,negative,0.5383016467094421,optimism,0.3036744296550751,8.0,Infrastructure/job/energy,0.17260438,"""Labor unions—notably the SEIU—like to point a lot of fingers. But as they scour the country searching for bad bosses, perhaps they should start by looking in their own backyard,"" writes @Mike_Saltsman. https://t.co/jRQR3U34wi",labor unionsnotably seiulike point lot finger scour country searching bad boss start looking backyard writes,"[('start', [2, 8]), ('country', [2, 5]), ('lot', [2, 5]), ('point', [2, 8]), ('bad', [2, 5]), ('looking', [2, 8]), ('backyard', [8]), ('labor', [8, 5]), ('writes', [2, 5]), ('finger', [2, 5]), ('searching', [5]), ('boss', [2]), ('scour', [2]), ('seiulike', [2]), ('unionsnotably', [2])]","[('start', ['War', 'Infrastructure/job/energy']), ('country', ['War', 'Border/community/family']), ('lot', ['War', 'Border/community/family']), ('point', ['War', 'Infrastructure/job/energy']), ('bad', ['War', 'Border/community/family']), ('looking', ['War', 'Infrastructure/job/energy']), ('backyard', ['Infrastructure/job/energy']), ('labor', ['Infrastructure/job/energy', 'Border/community/family']), ('writes', ['War', 'Border/community/family']), ('finger', ['War', 'Border/community/family']), ('searching', ['Border/community/family']), ('boss', ['War']), ('scour', ['War']), ('seiulike', ['War']), ('unionsnotably', ['War'])]"
WashTimesOpEd,2023-08-31 16:05:05+00:00,2,War,0.39407724,neutral,0.7026936411857605,optimism,0.8718717098236084,3.0,News/radio/livestream,0.29020908,#ICYMI from @ckchumley and @RealFreedomTalk on #boldandblunt: Socialism cannot co-exist with God-given freedom. https://t.co/zVuFpklASv,socialism  exist god given freedom,"[('freedom', [7, 2]), ('god', [3, 2]), ('given', [2, 7]), ('socialism', [3]), ('exist', [2])]","[('freedom', ['Abortion/rights/guns', 'War']), ('god', ['News/radio/livestream', 'War']), ('given', ['War', 'Abortion/rights/guns']), ('socialism', ['News/radio/livestream']), ('exist', ['War'])]"
NikkiHaley,2023-08-31 16:18:08+00:00,2,War,0.45632136,negative,0.8293722867965698,anger,0.493593692779541,4.0,Republicans vs democrats,0.42067158,".@VivekGRamaswamy must have missed that the fanatical terrorist regime in Iran regularly calls for ‘Death to America.' If he doesn’t see a nuclear Iran as a threat to American security, then he should take his place beside AOC and the Squad and get nowhere near the White House.",missed fanatical terrorist regime iran regularly call death america nuclear iran threat american security place aoc squad near white house,"[('nuclear', [2, 4]), ('security', [4, 2]), ('american', [2, 4]), ('near', [4, 5]), ('terrorist', [2, 4]), ('america', [2, 4]), ('house', [4, 2]), ('threat', [2, 4]), ('iran', [2, 5]), ('call', [4, 2]), ('place', [2, 5]), ('aoc', [4, 2]), ('white', [4, 2]), ('squad', [4]), ('death', [2, 4]), ('regime', [2, 4]), ('missed', [4, 5]), ('regularly', [2, 4]), ('fanatical', [4])]","[('nuclear', ['War', 'Republicans vs democrats']), ('security', ['Republicans vs democrats', 'War']), ('american', ['War', 'Republicans vs democrats']), ('near', ['Republicans vs democrats', 'Border/community/family']), ('terrorist', ['War', 'Republicans vs democrats']), ('america', ['War', 'Republicans vs democrats']), ('house', ['Republicans vs democrats', 'War']), ('threat', ['War', 'Republicans vs democrats']), ('iran', ['War', 'Border/community/family']), ('call', ['Republicans vs democrats', 'War']), ('place', ['War', 'Border/community/family']), ('aoc', ['Republicans vs democrats', 'War']), ('white', ['Republicans vs democrats', 'War']), ('squad', ['Republicans vs democrats']), ('death', ['War', 'Republicans vs democrats']), ('regime', ['War', 'Republicans vs democrats']), ('missed', ['Republicans vs democrats', 'Border/community/family']), ('regularly', ['War', 'Republicans vs democrats']), ('fanatical', ['Republicans vs democrats'])]"
marklevinshow,2023-08-31 18:33:10+00:00,2,War,0.59548813,neutral,0.6514933109283447,anger,0.3683246076107025,6.0,Election/debate,0.31038067,Putin's plan doesn’t end with Ukraine. It’s only the beginning. Join us on LevinTV. https://t.co/epuvGey8tL,putin  plandoesnt end ukraine beginning join levintv,"[('putin', [2]), ('ukraine', [2, 6]), ('end', [2, 6]), ('beginning', [6]), ('join', [6]), ('levintv', [2, 6]), ('plandoesnt', [2])]","[('putin', ['War']), ('ukraine', ['War', 'Election/debate']), ('end', ['War', 'Election/debate']), ('beginning', ['Election/debate']), ('join', ['Election/debate']), ('levintv', ['War', 'Election/debate']), ('plandoesnt', ['War'])]"
NikkiHaley,2023-08-31 19:50:24+00:00,2,War,0.54903024,negative,0.8391322493553162,fear,0.6986373066902161,5.0,Border/community/family,0.39730158,"RT @Also, Vivek must have missed that #Iran is the biggest state sponsor of terrorism in the world … a nuclear Iran is a direct threat to Israel and to the world",vivek missed biggest state sponsor terrorism world nuclear iran direct threat israel world,"[('nuclear', [2, 5]), ('state', [5, 2]), ('world', [2, 5]), ('israel', [2, 5]), ('threat', [2, 5]), ('iran', [2, 5]), ('vivek', [2]), ('biggest', [2, 5]), ('missed', [5]), ('terrorism', [2, 5]), ('direct', [5]), ('sponsor', [5])]","[('nuclear', ['War', 'Border/community/family']), ('state', ['Border/community/family', 'War']), ('world', ['War', 'Border/community/family']), ('israel', ['War', 'Border/community/family']), ('threat', ['War', 'Border/community/family']), ('iran', ['War', 'Border/community/family']), ('vivek', ['War']), ('biggest', ['War', 'Border/community/family']), ('missed', ['Border/community/family']), ('terrorism', ['War', 'Border/community/family']), ('direct', ['Border/community/family']), ('sponsor', ['Border/community/family'])]"
SenatorTimScott,2023-08-31 20:00:02+00:00,2,War,0.53542143,negative,0.904931366443634,anger,0.5620540380477905,1.0,American/economics/health,0.4020178,American kids should not be exposed to Chinese Communist Party propaganda in school. We cannot stand by and allow this to continue. https://t.co/fOsfdFnMdg,american kid exposed chinese communist party propaganda school stand allow continue,"[('american', [1, 2]), ('party', [2, 1]), ('school', [1, 2]), ('kid', [1, 2]), ('continue', [1, 2]), ('propaganda', [2]), ('allow', [2, 1]), ('communist', [2]), ('exposed', [1, 2]), ('stand', [2, 1]), ('chinese', [2])]","[('american', ['American/economics/health', 'War']), ('party', ['War', 'American/economics/health']), ('school', ['American/economics/health', 'War']), ('kid', ['American/economics/health', 'War']), ('continue', ['American/economics/health', 'War']), ('propaganda', ['War']), ('allow', ['War', 'American/economics/health']), ('communist', ['War']), ('exposed', ['American/economics/health', 'War']), ('stand', ['War', 'American/economics/health']), ('chinese', ['War'])]"
