username,date,first_topic,first_topic_name,first_topic_prob,sentiment,sentiment_prob,emotion,emotion_prob,second_topic,second_topic_name,second_topic_prob,text,lemmatized_text,per_word_topics,per_word_topics_name
SenatorTimScott,2023-03-24 20:25:43+00:00,2,War,0.5587069,negative,0.5303305983543396,fear,0.424917608499527,5.0,Border/community/family,0.4017533,"China doesn’t want to be like America – it wants to BEAT America. We must wake up to China’s threats against the US so America can remain a shining city on the hill, an example for the whole world to follow. https://t.co/x30ACetpFu",china want like america want beat america wake china threat america remain shining city hill example world follow,"[('world', [2, 5]), ('america', [2, 5]), ('like', [2, 5]), ('threat', [2, 5]), ('china', [2, 5]), ('city', [5, 2]), ('wake', [2]), ('follow', [5, 2]), ('want', [2, 5]), ('beat', [5, 2]), ('example', [2, 5]), ('hill', [2, 5]), ('remain', [5]), ('shining', [5])]","[('world', ['War', 'Border/community/family']), ('america', ['War', 'Border/community/family']), ('like', ['War', 'Border/community/family']), ('threat', ['War', 'Border/community/family']), ('china', ['War', 'Border/community/family']), ('city', ['Border/community/family', 'War']), ('wake', ['War']), ('follow', ['Border/community/family', 'War']), ('want', ['War', 'Border/community/family']), ('beat', ['Border/community/family', 'War']), ('example', ['War', 'Border/community/family']), ('hill', ['War', 'Border/community/family']), ('remain', ['Border/community/family']), ('shining', ['Border/community/family'])]"
MichaelSinghDC,2023-03-24 23:58:52+00:00,2,War,0.59855783,neutral,0.8218994140625,anticipation,0.6197500228881836,8.0,Infrastructure/job/energy,0.33313358,"Given how advanced Iran's nuclear progress now is, ""is this a policy change"" is less pressing a question than ""what is the policy?""",given advanced iran  nuclear progress policy change pressing question policy,"[('nuclear', [2, 8]), ('question', [2]), ('iran', [2]), ('change', [2, 8]), ('given', [2]), ('advanced', [8, 2]), ('policy', [2, 8]), ('progress', [8]), ('pressing', [8])]","[('nuclear', ['War', 'Infrastructure/job/energy']), ('question', ['War']), ('iran', ['War']), ('change', ['War', 'Infrastructure/job/energy']), ('given', ['War']), ('advanced', ['Infrastructure/job/energy', 'War']), ('policy', ['War', 'Infrastructure/job/energy']), ('progress', ['Infrastructure/job/energy']), ('pressing', ['Infrastructure/job/energy'])]"
jonathanvswan,2023-03-25 01:45:31+00:00,2,War,0.5249447,neutral,0.8482232093811035,anticipation,0.5910775661468506,8.0,Infrastructure/job/energy,0.39991707,"RT @Given how advanced Iran's nuclear progress now is, ""is this a policy change"" is less pressing a question than ""what is the policy?""",advanced iran  nuclear progress policy change pressing question policy,"[('nuclear', [2, 8]), ('question', [2]), ('iran', [2]), ('change', [2, 8]), ('advanced', [8, 2]), ('policy', [2, 8]), ('progress', [8]), ('pressing', [8])]","[('nuclear', ['War', 'Infrastructure/job/energy']), ('question', ['War']), ('iran', ['War']), ('change', ['War', 'Infrastructure/job/energy']), ('advanced', ['Infrastructure/job/energy', 'War']), ('policy', ['War', 'Infrastructure/job/energy']), ('progress', ['Infrastructure/job/energy']), ('pressing', ['Infrastructure/job/energy'])]"
JohnDelaney,2023-03-25 16:12:38+00:00,2,War,0.4842942,positive,0.893161416053772,optimism,0.7077346444129944,8.0,Infrastructure/job/energy,0.36549,Our minds are the most powerful tool to harness,mind powerful tool harness,"[('mind', [2, 8]), ('tool', [8, 2]), ('powerful', [2]), ('harness', [8])]","[('mind', ['War', 'Infrastructure/job/energy']), ('tool', ['Infrastructure/job/energy', 'War']), ('powerful', ['War']), ('harness', ['Infrastructure/job/energy'])]"
meridithmcgraw,2023-03-25 21:09:29+00:00,2,War,0.5652333,neutral,0.5943723917007446,anger,0.6108971238136292,5.0,Border/community/family,0.20422758,Ted Nugent is signing the National Anthem at Trump’s rally but begins with a mini speech himself: “I’m here in Waco with the real shit kickers and this doesn’t suck…A moment of silence for the political prisoners in the gulags of Washington DC.”,ted nugent signing national anthem trump rally begin mini speech waco real shit kicker sucka moment silence political prisoner gulag washington ,"[('national', [5, 6]), ('speech', [2, 6]), ('political', [2, 6]), ('trump', [2, 6]), ('washington', [5, 6]), ('rally', [6, 2]), ('real', [2, 6]), ('ted', [6]), ('moment', [2, 5]), ('begin', [2, 6]), ('silence', [2]), ('anthem', [2]), ('signing', [5, 6]), ('shit', [2, 6]), ('kicker', [5]), ('prisoner', [2]), ('mini', [5]), ('gulag', [2]), ('nugent', [2]), ('sucka', [2]), ('waco', [2])]","[('national', ['Border/community/family', 'Election/debate']), ('speech', ['War', 'Election/debate']), ('political', ['War', 'Election/debate']), ('trump', ['War', 'Election/debate']), ('washington', ['Border/community/family', 'Election/debate']), ('rally', ['Election/debate', 'War']), ('real', ['War', 'Election/debate']), ('ted', ['Election/debate']), ('moment', ['War', 'Border/community/family']), ('begin', ['War', 'Election/debate']), ('silence', ['War']), ('anthem', ['War']), ('signing', ['Border/community/family', 'Election/debate']), ('shit', ['War', 'Election/debate']), ('kicker', ['Border/community/family']), ('prisoner', ['War']), ('mini', ['Border/community/family']), ('gulag', ['War']), ('nugent', ['War']), ('sucka', ['War']), ('waco', ['War'])]"
jonathanvswan,2023-03-25 21:26:51+00:00,2,War,0.47814682,neutral,0.5991376042366028,joy,0.4278821349143982,6.0,Election/debate,0.2828605,"RT @atrupar: Ted Nugent kicks off the Trump rally in Waco by calling Zelenskyy a ""homosexual weirdo"" to cheers https://t.co/21d6x3mI5F",ted nugent kick trump rally waco calling zelenskyy homosexual weirdo cheer,"[('trump', [6, 2]), ('rally', [6, 2]), ('calling', [2, 1]), ('zelenskyy', [2]), ('ted', [6]), ('kick', [6]), ('cheer', [3]), ('weirdo', [1]), ('nugent', [2]), ('waco', [2]), ('homosexual', [2])]","[('trump', ['Election/debate', 'War']), ('rally', ['Election/debate', 'War']), ('calling', ['War', 'American/economics/health']), ('zelenskyy', ['War']), ('ted', ['Election/debate']), ('kick', ['Election/debate']), ('cheer', ['News/radio/livestream']), ('weirdo', ['American/economics/health']), ('nugent', ['War']), ('waco', ['War']), ('homosexual', ['War'])]"
jonathanvswan,2023-03-25 21:42:08+00:00,2,War,0.68673694,neutral,0.6262505650520325,anger,0.636532723903656,5.0,Border/community/family,0.27741733,RT @Ted Nugent is signing the National Anthem at Trump’s rally but begins with a mini speech himself: “I’m here in Waco with the real shit kickers and this doesn’t suck…A moment of silence for the political prisoners in the gulags of Washington DC.”,nugent signing national anthem trump rally begin mini speech waco real shit kicker sucka moment silence political prisoner gulag washington ,"[('national', [5, 2]), ('speech', [2, 5]), ('political', [2]), ('trump', [2, 5]), ('washington', [5]), ('rally', [2]), ('real', [2, 5]), ('moment', [2, 5]), ('begin', [2, 5]), ('silence', [2]), ('anthem', [2]), ('signing', [5]), ('shit', [2]), ('kicker', [5]), ('prisoner', [2]), ('mini', [5]), ('gulag', [2]), ('nugent', [2]), ('sucka', [2]), ('waco', [2])]","[('national', ['Border/community/family', 'War']), ('speech', ['War', 'Border/community/family']), ('political', ['War']), ('trump', ['War', 'Border/community/family']), ('washington', ['Border/community/family']), ('rally', ['War']), ('real', ['War', 'Border/community/family']), ('moment', ['War', 'Border/community/family']), ('begin', ['War', 'Border/community/family']), ('silence', ['War']), ('anthem', ['War']), ('signing', ['Border/community/family']), ('shit', ['War']), ('kicker', ['Border/community/family']), ('prisoner', ['War']), ('mini', ['Border/community/family']), ('gulag', ['War']), ('nugent', ['War']), ('sucka', ['War']), ('waco', ['War'])]"
