username,date,first_topic,first_topic_name,first_topic_prob,sentiment,sentiment_prob,emotion,emotion_prob,second_topic,second_topic_name,second_topic_prob,text,lemmatized_text,per_word_topics,per_word_topics_name
CollinRugg,2023-06-20 23:42:42+00:00,2,War,0.43717948,positive,0.5228754281997681,joy,0.7102480530738831,4.0,Republicans vs democrats,0.34274557,JUST IN: Black Rock recruiter admits on camera that most Washington politicians are bought off and that the elites secretly love the Ukraine war because it’s “good for business.” Thank you @JamesOKeefeIII for doing the job the media refuses to do. https://t.co/54lWDUtpQN,black rock recruiter admits camera washington politician bought elite secretly love ukraine war good business thank job medium refuse,"[('war', [2, 4]), ('medium', [4, 2]), ('job', [8, 4]), ('ukraine', [2, 4]), ('black', [2, 4]), ('good', [8, 2]), ('camera', [4]), ('washington', [4, 8]), ('love', [2, 4]), ('politician', [2, 4]), ('business', [8, 4]), ('secretly', [4]), ('elite', [2, 4]), ('refuse', [2, 4]), ('bought', [2]), ('rock', [2]), ('admits', [4, 2]), ('thank', [8, 4]), ('recruiter', [8])]","[('war', ['War', 'Republicans vs democrats']), ('medium', ['Republicans vs democrats', 'War']), ('job', ['Infrastructure/job/energy', 'Republicans vs democrats']), ('ukraine', ['War', 'Republicans vs democrats']), ('black', ['War', 'Republicans vs democrats']), ('good', ['Infrastructure/job/energy', 'War']), ('camera', ['Republicans vs democrats']), ('washington', ['Republicans vs democrats', 'Infrastructure/job/energy']), ('love', ['War', 'Republicans vs democrats']), ('politician', ['War', 'Republicans vs democrats']), ('business', ['Infrastructure/job/energy', 'Republicans vs democrats']), ('secretly', ['Republicans vs democrats']), ('elite', ['War', 'Republicans vs democrats']), ('refuse', ['War', 'Republicans vs democrats']), ('bought', ['War']), ('rock', ['War']), ('admits', ['Republicans vs democrats', 'War']), ('thank', ['Infrastructure/job/energy', 'Republicans vs democrats']), ('recruiter', ['Infrastructure/job/energy'])]"
RonDeSantis,2023-06-21 01:34:14+00:00,2,War,0.4783182,negative,0.5808910727500916,optimism,0.5353098511695862,8.0,Infrastructure/job/energy,0.19308802,Leadership matters. Cities like San Francisco that have embraced leftist policies have destroyed the quality of life of their citizens and sparked an exodus of productive people to greener pastures. We need to restore sanity across this country. https://t.co/LF86omZ1e6,leadership matter city like san francisco embraced leftist policy destroyed quality life citizen sparked exodus productive people greener pasture need restore sanity country,"[('citizen', [2, 5]), ('people', [2, 6]), ('like', [2, 6]), ('need', [2, 8]), ('country', [2, 5]), ('life', [2, 5]), ('city', [2, 5]), ('leadership', [2, 8]), ('policy', [2, 6]), ('san', [6, 8]), ('matter', [2, 6]), ('francisco', [6]), ('destroyed', [2, 8]), ('restore', [8, 5]), ('quality', [8, 6]), ('productive', [8]), ('embraced', [2]), ('sparked', [5]), ('leftist', [2]), ('greener', [2]), ('sanity', [2]), ('exodus', [6]), ('pasture', [2])]","[('citizen', ['War', 'Border/community/family']), ('people', ['War', 'Election/debate']), ('like', ['War', 'Election/debate']), ('need', ['War', 'Infrastructure/job/energy']), ('country', ['War', 'Border/community/family']), ('life', ['War', 'Border/community/family']), ('city', ['War', 'Border/community/family']), ('leadership', ['War', 'Infrastructure/job/energy']), ('policy', ['War', 'Election/debate']), ('san', ['Election/debate', 'Infrastructure/job/energy']), ('matter', ['War', 'Election/debate']), ('francisco', ['Election/debate']), ('destroyed', ['War', 'Infrastructure/job/energy']), ('restore', ['Infrastructure/job/energy', 'Border/community/family']), ('quality', ['Infrastructure/job/energy', 'Election/debate']), ('productive', ['Infrastructure/job/energy']), ('embraced', ['War']), ('sparked', ['Border/community/family']), ('leftist', ['War']), ('greener', ['War']), ('sanity', ['War']), ('exodus', ['Election/debate']), ('pasture', ['War'])]"
Mike_Pence,2023-06-21 03:25:13+00:00,2,War,0.32291272,positive,0.6015241146087646,optimism,0.9452399015426636,7.0,Abortion/rights/guns,0.3213467,"I'm pro-life and I don't apologize for it. There’s no question in my mind that what we need today is an unapologetic advocacy of the right to life. We need to take our case to every corner of this country, and we need to express compassion and principle. https://t.co/Nno8Zl1KB5",pro life apologize question mind need today unapologetic advocacy right life need case corner country need express compassion principle,"[('today', [7, 5]), ('pro', [2, 7]), ('question', [2, 7]), ('need', [1, 2]), ('country', [2, 7]), ('right', [7, 2]), ('mind', [2, 5]), ('life', [5, 1]), ('compassion', [2, 5]), ('case', [7, 1]), ('principle', [7, 5]), ('apologize', [2]), ('express', [2, 5]), ('corner', [7, 5]), ('advocacy', [7, 1]), ('unapologetic', [1])]","[('today', ['Abortion/rights/guns', 'Border/community/family']), ('pro', ['War', 'Abortion/rights/guns']), ('question', ['War', 'Abortion/rights/guns']), ('need', ['American/economics/health', 'War']), ('country', ['War', 'Abortion/rights/guns']), ('right', ['Abortion/rights/guns', 'War']), ('mind', ['War', 'Border/community/family']), ('life', ['Border/community/family', 'American/economics/health']), ('compassion', ['War', 'Border/community/family']), ('case', ['Abortion/rights/guns', 'American/economics/health']), ('principle', ['Abortion/rights/guns', 'Border/community/family']), ('apologize', ['War']), ('express', ['War', 'Border/community/family']), ('corner', ['Abortion/rights/guns', 'Border/community/family']), ('advocacy', ['Abortion/rights/guns', 'American/economics/health']), ('unapologetic', ['American/economics/health'])]"
marwilliamson,2023-06-21 13:45:19+00:00,2,War,0.43214226,negative,0.8792034983634949,sadness,0.827187716960907,1.0,American/economics/health,0.26358777,"The reason there’s so much despair around humanity’s most serious challenges is not because we don’t have the genius or creativity with which to solve them, but because their solutions don’t align with our dominant economic paradigm. 🧵",reason despair humanity challenge genius creativity solve solution align dominant economic paradigm,"[('reason', [2, 6]), ('solve', [1, 6]), ('challenge', [6, 1]), ('solution', [1, 6]), ('dominant', [6]), ('paradigm', [6]), ('economic', [1, 2]), ('align', [2]), ('genius', [2]), ('humanity', [2]), ('despair', [2, 1]), ('creativity', [2])]","[('reason', ['War', 'Election/debate']), ('solve', ['American/economics/health', 'Election/debate']), ('challenge', ['Election/debate', 'American/economics/health']), ('solution', ['American/economics/health', 'Election/debate']), ('dominant', ['Election/debate']), ('paradigm', ['Election/debate']), ('economic', ['American/economics/health', 'War']), ('align', ['War']), ('genius', ['War']), ('humanity', ['War']), ('despair', ['War', 'American/economics/health']), ('creativity', ['War'])]"
marwilliamson,2023-06-21 13:55:44+00:00,2,War,0.4506427,negative,0.888644814491272,anger,0.5174629092216492,8.0,Infrastructure/job/energy,0.3180574,"The problem is a sclerotic, corrupted political system that does more to obstruct than to facilitate the expression of the will of the people.",problem sclerotic corrupted political system obstruct facilitate expression people,"[('people', [2, 8]), ('political', [2]), ('problem', [2, 5]), ('system', [8, 2]), ('obstruct', [8]), ('facilitate', [8, 5]), ('expression', [2, 5]), ('corrupted', [5]), ('sclerotic', [2, 8])]","[('people', ['War', 'Infrastructure/job/energy']), ('political', ['War']), ('problem', ['War', 'Border/community/family']), ('system', ['Infrastructure/job/energy', 'War']), ('obstruct', ['Infrastructure/job/energy']), ('facilitate', ['Infrastructure/job/energy', 'Border/community/family']), ('expression', ['War', 'Border/community/family']), ('corrupted', ['Border/community/family']), ('sclerotic', ['War', 'Infrastructure/job/energy'])]"
politicalwire,2023-06-21 17:23:05+00:00,2,War,0.7164197,negative,0.5006615519523621,anger,0.7652175426483154,7.0,Abortion/rights/guns,0.17611687,Samuel L. Jackson Says Trump Is a Racist ‘Redneck’ https://t.co/lvv8Fgxe5Q via @politicalwire,samuel  jackson say trump racist redneck,"[('trump', [2, 7]), ('say', [2, 7]), ('racist', [2]), ('redneck', [2]), ('jackson', [7]), ('samuel', [2])]","[('trump', ['War', 'Abortion/rights/guns']), ('say', ['War', 'Abortion/rights/guns']), ('racist', ['War']), ('redneck', ['War']), ('jackson', ['Abortion/rights/guns']), ('samuel', ['War'])]"
SpeakerMcCarthy,2023-06-21 20:42:05+00:00,2,War,0.5020564,neutral,0.6774990558624268,anger,0.6172971725463867,4.0,Republicans vs democrats,0.2477134,"RT @JudiciaryGOP: Found your collusion, @RepAdamSchiff. #Durham https://t.co/mp7iCVPG8W",found collusion,"[('found', [4, 2]), ('collusion', [2])]","[('found', ['Republicans vs democrats', 'War']), ('collusion', ['War'])]"
NRSC,2023-06-21 21:21:33+00:00,2,War,0.85405695,neutral,0.5301777124404907,anger,0.5264246463775635,6.0,Election/debate,0.020870486,Liberal Jon Tester will vote for anything @JoeBiden wants,liberal jon tester vote want,"[('vote', [2]), ('liberal', [2]), ('want', [2]), ('jon', [2]), ('tester', [2])]","[('vote', ['War']), ('liberal', ['War']), ('want', ['War']), ('jon', ['War']), ('tester', ['War'])]"
CollinRugg,2023-06-22 00:27:21+00:00,2,War,0.35381386,negative,0.7704193592071533,disgust,0.5226346850395203,1.0,American/economics/health,0.31810254,When will @CNN give a comment on how their producer was paying off a mother so he could rape her child? https://t.co/hSgsRyDsx8,comment producer paying mother rape child,"[('comment', [2, 1]), ('child', [1, 2]), ('paying', [1, 8]), ('producer', [8]), ('mother', [1, 2]), ('rape', [2])]","[('comment', ['War', 'American/economics/health']), ('child', ['American/economics/health', 'War']), ('paying', ['American/economics/health', 'Infrastructure/job/energy']), ('producer', ['Infrastructure/job/energy']), ('mother', ['American/economics/health', 'War']), ('rape', ['War'])]"
CollinRugg,2023-06-22 00:53:04+00:00,2,War,0.5614161,negative,0.7492386698722839,anger,0.7858445644378662,4.0,Republicans vs democrats,0.3046166,BREAKING: Democrat Adam Schiff has been censured by Congress for continuously lying to the American people about the Trump-Russia hoax. Good job. Now fine him too. https://t.co/WNKhrq4nsa,democrat adam schiff censured congress continuously lying american people trump russia hoax good job fine,"[('russia', [2, 4]), ('american', [2, 4]), ('job', [4, 2]), ('congress', [4, 2]), ('people', [2, 4]), ('trump', [4, 2]), ('lying', [2, 4]), ('good', [2, 4]), ('democrat', [2, 4]), ('adam', [4, 2]), ('fine', [2, 4]), ('hoax', [2, 4]), ('schiff', [4, 2]), ('censured', [7]), ('continuously', [2])]","[('russia', ['War', 'Republicans vs democrats']), ('american', ['War', 'Republicans vs democrats']), ('job', ['Republicans vs democrats', 'War']), ('congress', ['Republicans vs democrats', 'War']), ('people', ['War', 'Republicans vs democrats']), ('trump', ['Republicans vs democrats', 'War']), ('lying', ['War', 'Republicans vs democrats']), ('good', ['War', 'Republicans vs democrats']), ('democrat', ['War', 'Republicans vs democrats']), ('adam', ['Republicans vs democrats', 'War']), ('fine', ['War', 'Republicans vs democrats']), ('hoax', ['War', 'Republicans vs democrats']), ('schiff', ['Republicans vs democrats', 'War']), ('censured', ['Abortion/rights/guns']), ('continuously', ['War'])]"
GovChristie,2023-06-22 15:46:30+00:00,2,War,0.4590885,negative,0.7648429274559021,anger,0.6995905041694641,4.0,Republicans vs democrats,0.26663253,"Trump on basically everyone: ""No politician in history — and I say this with great surety — has been treated worse or more unfairly.”",trump basically politician history great surety treated worse unfairly,"[('trump', [4, 2]), ('history', [4, 2]), ('politician', [2, 4]), ('great', [8, 2]), ('worse', [2, 4]), ('basically', [2, 4]), ('treated', [4, 2]), ('unfairly', [8]), ('surety', [2])]","[('trump', ['Republicans vs democrats', 'War']), ('history', ['Republicans vs democrats', 'War']), ('politician', ['War', 'Republicans vs democrats']), ('great', ['Infrastructure/job/energy', 'War']), ('worse', ['War', 'Republicans vs democrats']), ('basically', ['War', 'Republicans vs democrats']), ('treated', ['Republicans vs democrats', 'War']), ('unfairly', ['Infrastructure/job/energy']), ('surety', ['War'])]"
NRSC,2023-06-22 19:52:31+00:00,2,War,0.43690944,negative,0.7922254204750061,anger,0.5188803672790527,1.0,American/economics/health,0.17765096,Jon Tester and Joe Manchin sided with Biden to turn millions of law abiding gun owners into felons.,jon tester joe manchin sided biden turn million law abiding gun owner felon,"[('biden', [2, 1]), ('million', [1, 8]), ('joe', [2, 1]), ('law', [1, 8]), ('gun', [1, 2]), ('turn', [2, 6]), ('owner', [8, 1]), ('jon', [2]), ('sided', [7]), ('abiding', [2]), ('tester', [2]), ('felon', [6]), ('manchin', [2, 6])]","[('biden', ['War', 'American/economics/health']), ('million', ['American/economics/health', 'Infrastructure/job/energy']), ('joe', ['War', 'American/economics/health']), ('law', ['American/economics/health', 'Infrastructure/job/energy']), ('gun', ['American/economics/health', 'War']), ('turn', ['War', 'Election/debate']), ('owner', ['Infrastructure/job/energy', 'American/economics/health']), ('jon', ['War']), ('sided', ['Abortion/rights/guns']), ('abiding', ['War']), ('tester', ['War']), ('felon', ['Election/debate']), ('manchin', ['War', 'Election/debate'])]"
Mike_Pence,2023-06-22 20:44:02+00:00,2,War,0.32079414,positive,0.5304474234580994,optimism,0.944384515285492,7.0,Abortion/rights/guns,0.3194089,"RT @I'm pro-life and I don't apologize for it. There’s no question in my mind that what we need today is an unapologetic advocacy of the right to life. We need to take our case to every corner of this country, and we need to express compassion and principle. https://t.co/Nno8Zl1KB5", pro life apologize question mind need today unapologetic advocacy right life need case corner country need express compassion principle,"[('today', [7, 5]), ('pro', [2, 7]), ('question', [2, 7]), ('need', [1, 2]), ('country', [2, 7]), ('right', [7, 2]), ('mind', [2, 5]), ('life', [5, 1]), ('compassion', [2, 5]), ('case', [7, 1]), ('principle', [7, 5]), ('apologize', [2]), ('express', [2, 5]), ('corner', [7, 5]), ('advocacy', [7, 1]), ('unapologetic', [1])]","[('today', ['Abortion/rights/guns', 'Border/community/family']), ('pro', ['War', 'Abortion/rights/guns']), ('question', ['War', 'Abortion/rights/guns']), ('need', ['American/economics/health', 'War']), ('country', ['War', 'Abortion/rights/guns']), ('right', ['Abortion/rights/guns', 'War']), ('mind', ['War', 'Border/community/family']), ('life', ['Border/community/family', 'American/economics/health']), ('compassion', ['War', 'Border/community/family']), ('case', ['Abortion/rights/guns', 'American/economics/health']), ('principle', ['Abortion/rights/guns', 'Border/community/family']), ('apologize', ['War']), ('express', ['War', 'Border/community/family']), ('corner', ['Abortion/rights/guns', 'Border/community/family']), ('advocacy', ['Abortion/rights/guns', 'American/economics/health']), ('unapologetic', ['American/economics/health'])]"
jonathanvswan,2023-06-23 14:14:04+00:00,2,War,0.3770773,neutral,0.9270508885383606,anticipation,0.5594393014907837,6.0,Election/debate,0.2992204,RT @semaforben: The debate over using Russian assets to rebuild Ukraine is just beginning | ⁦@jaysolomon⁩ https://t.co/zvgtE3vxbf,debate russian asset rebuild ukraine beginning,"[('asset', [8, 2]), ('ukraine', [2, 6]), ('russian', [2]), ('debate', [6, 2]), ('beginning', [6]), ('rebuild', [8])]","[('asset', ['Infrastructure/job/energy', 'War']), ('ukraine', ['War', 'Election/debate']), ('russian', ['War']), ('debate', ['Election/debate', 'War']), ('beginning', ['Election/debate']), ('rebuild', ['Infrastructure/job/energy'])]"
RobertKennedyJr,2023-06-23 18:41:25+00:00,2,War,0.64419585,negative,0.5267522931098938,optimism,0.4797562956809997,7.0,Abortion/rights/guns,0.21357559,This is precisely the kind of thing my uncle warned against in his 1963 Peace Speech when he warned against “unnecessary irritants and purely rhetorical hostility.” All the more true today than during the Cold War. https://t.co/mX2nCcJATf,precisely kind thing uncle warned peace speech warned unnecessary irritant purely rhetorical hostility true today cold war,"[('today', [7, 6]), ('war', [2]), ('speech', [2, 6]), ('peace', [2, 6]), ('thing', [2, 6]), ('warned', [2]), ('true', [2, 7]), ('cold', [6]), ('kind', [2, 6]), ('purely', [2]), ('uncle', [7]), ('unnecessary', [2]), ('precisely', [7]), ('hostility', [7]), ('rhetorical', [2]), ('irritant', [2])]","[('today', ['Abortion/rights/guns', 'Election/debate']), ('war', ['War']), ('speech', ['War', 'Election/debate']), ('peace', ['War', 'Election/debate']), ('thing', ['War', 'Election/debate']), ('warned', ['War']), ('true', ['War', 'Abortion/rights/guns']), ('cold', ['Election/debate']), ('kind', ['War', 'Election/debate']), ('purely', ['War']), ('uncle', ['Abortion/rights/guns']), ('unnecessary', ['War']), ('precisely', ['Abortion/rights/guns']), ('hostility', ['Abortion/rights/guns']), ('rhetorical', ['War']), ('irritant', ['War'])]"
SenateGOP,2023-06-23 18:52:37+00:00,2,War,0.854075,neutral,0.7985942363739014,anger,0.3367567658424377,5.0,Border/community/family,0.020860057,RT @SenatorHagerty: .@POTUS must demonstrate strength against Communist China at every turn.,demonstrate strength communist china turn,"[('china', [2]), ('communist', [2]), ('turn', [2]), ('strength', [2]), ('demonstrate', [2])]","[('china', ['War']), ('communist', ['War']), ('turn', ['War']), ('strength', ['War']), ('demonstrate', ['War'])]"
NRSC,2023-06-23 19:07:23+00:00,2,War,0.8249128,negative,0.8960538506507874,anger,0.6891575455665588,4.0,Republicans vs democrats,0.025029019,Jon Tester is a complete hypocrite,jon tester complete hypocrite,"[('complete', [2]), ('jon', [2]), ('hypocrite', [2]), ('tester', [2])]","[('complete', ['War']), ('jon', ['War']), ('hypocrite', ['War']), ('tester', ['War'])]"
WillHurd,2023-06-23 22:00:02+00:00,2,War,0.27228624,neutral,0.7046565413475037,optimism,0.7370393872261047,1.0,American/economics/health,0.23646049,"We pledge allegiance to the United States, not political leaders. I'm working to fulfill the debate requirements but I'm not going to lie to the American people or my party for the sake of a microphone. https://t.co/UoYuhkfAph",pledge allegiance united state political leader working fulfill debate requirement going lie american people party sake microphone,"[('american', [1, 2]), ('state', [6, 4]), ('united', [2, 1]), ('people', [2, 1]), ('political', [4, 2]), ('sake', [2, 1]), ('going', [2, 6]), ('party', [2, 6]), ('working', [1, 6]), ('debate', [6, 4]), ('leader', [6, 4]), ('lie', [4, 2]), ('fulfill', [1]), ('requirement', [6, 1]), ('allegiance', [2]), ('pledge', [6, 4]), ('microphone', [4])]","[('american', ['American/economics/health', 'War']), ('state', ['Election/debate', 'Republicans vs democrats']), ('united', ['War', 'American/economics/health']), ('people', ['War', 'American/economics/health']), ('political', ['Republicans vs democrats', 'War']), ('sake', ['War', 'American/economics/health']), ('going', ['War', 'Election/debate']), ('party', ['War', 'Election/debate']), ('working', ['American/economics/health', 'Election/debate']), ('debate', ['Election/debate', 'Republicans vs democrats']), ('leader', ['Election/debate', 'Republicans vs democrats']), ('lie', ['Republicans vs democrats', 'War']), ('fulfill', ['American/economics/health']), ('requirement', ['Election/debate', 'American/economics/health']), ('allegiance', ['War']), ('pledge', ['Election/debate', 'Republicans vs democrats']), ('microphone', ['Republicans vs democrats'])]"
laurenboebert,2023-06-23 23:29:52+00:00,2,War,0.44630417,negative,0.5434055328369141,anticipation,0.3554365932941437,4.0,Republicans vs democrats,0.31861585,"The Tulsa Police Chief is saying it might be time to give up a little bit of freedom in exchange for some gun control. ""Ultimately, I’m a Second Amendment guy…But I’m okay giving up some of that freedom, right? We had to give up some of that freedom after 9/11."" No, sir. Slippery slope. The Second Amendment was written with government officials like you in mind. Shall. Not. Be. Infringed.",tulsa police chief saying time little bit freedom exchange gun control ultimately second amendment guybut okay giving freedom right freedom sir slippery slope second amendment written government official like mind shall infringed,"[('freedom', [7, 2]), ('official', [4, 7]), ('second', [4, 7]), ('police', [2, 4]), ('like', [2, 4]), ('control', [2, 7]), ('chief', [4, 2]), ('time', [2, 4]), ('right', [7, 2]), ('giving', [2, 4]), ('saying', [2, 4]), ('government', [2, 4]), ('mind', [2, 4]), ('bit', [2, 4]), ('exchange', [4, 2]), ('amendment', [7, 4]), ('gun', [2, 4]), ('little', [2, 4]), ('okay', [4]), ('written', [7, 4]), ('shall', [2]), ('ultimately', [4]), ('sir', [2]), ('slippery', [2]), ('infringed', [2]), ('tulsa', [2]), ('slope', [2]), ('guybut', [2])]","[('freedom', ['Abortion/rights/guns', 'War']), ('official', ['Republicans vs democrats', 'Abortion/rights/guns']), ('second', ['Republicans vs democrats', 'Abortion/rights/guns']), ('police', ['War', 'Republicans vs democrats']), ('like', ['War', 'Republicans vs democrats']), ('control', ['War', 'Abortion/rights/guns']), ('chief', ['Republicans vs democrats', 'War']), ('time', ['War', 'Republicans vs democrats']), ('right', ['Abortion/rights/guns', 'War']), ('giving', ['War', 'Republicans vs democrats']), ('saying', ['War', 'Republicans vs democrats']), ('government', ['War', 'Republicans vs democrats']), ('mind', ['War', 'Republicans vs democrats']), ('bit', ['War', 'Republicans vs democrats']), ('exchange', ['Republicans vs democrats', 'War']), ('amendment', ['Abortion/rights/guns', 'Republicans vs democrats']), ('gun', ['War', 'Republicans vs democrats']), ('little', ['War', 'Republicans vs democrats']), ('okay', ['Republicans vs democrats']), ('written', ['Abortion/rights/guns', 'Republicans vs democrats']), ('shall', ['War']), ('ultimately', ['Republicans vs democrats']), ('sir', ['War']), ('slippery', ['War']), ('infringed', ['War']), ('tulsa', ['War']), ('slope', ['War']), ('guybut', ['War'])]"
