username,date,first_topic,first_topic_name,first_topic_prob,sentiment,sentiment_prob,emotion,emotion_prob,second_topic,second_topic_name,second_topic_prob,text,lemmatized_text,per_word_topics,per_word_topics_name
Airplaneguy_DC,2023-08-28 00:14:01+00:00,2,War,0.53976494,negative,0.702843427658081,fear,0.978429913520813,6.0,Election/debate,0.36638024,@nexta_tv Europe is very worried that a russian GOP will win the white house.,europe worried russian gop win white house,"[('house', [6, 2]), ('russian', [2]), ('gop', [6, 2]), ('white', [2, 6]), ('win', [6, 2]), ('europe', [2]), ('worried', [2, 6])]","[('house', ['Election/debate', 'War']), ('russian', ['War']), ('gop', ['Election/debate', 'War']), ('white', ['War', 'Election/debate']), ('win', ['Election/debate', 'War']), ('europe', ['War']), ('worried', ['War', 'Election/debate'])]"
Mike_Pence,2023-08-28 00:24:21+00:00,2,War,0.9484509,positive,0.9747296571731568,optimism,0.9356907606124878,,,,"RT @Thank you, America! The Trump-Pence administration proved that you can turn this Country around faster than you can imagine, and I have faith we can do it again because I have faith in the American people and I have faith that God is not done with America yet! 🇺🇸 #GOPDebate https://t.co/Efc5kMciSL",america trump penny administration proved turn country faster imagine faith faith american people faith god america,"[('american', [2]), ('administration', [2]), ('people', [2]), ('america', [2]), ('god', [2]), ('trump', [2]), ('country', [2]), ('imagine', [2]), ('turn', [2]), ('faith', [2]), ('penny', [2]), ('faster', [2]), ('proved', [2])]","[('american', ['War']), ('administration', ['War']), ('people', ['War']), ('america', ['War']), ('god', ['War']), ('trump', ['War']), ('country', ['War']), ('imagine', ['War']), ('turn', ['War']), ('faith', ['War']), ('penny', ['War']), ('faster', ['War']), ('proved', ['War'])]"
JamesAs26859668,2023-08-28 00:28:13+00:00,2,War,0.8247948,negative,0.9134986400604248,sadness,0.3476362228393554,6.0,Election/debate,0.025095884,"""A Russian GOP"" ... sad but true. #voteGOPout #trump4prison #jailTrump #DEMOCRACY24",russian gop sad true,"[('sad', [2]), ('russian', [2]), ('gop', [2]), ('true', [2])]","[('sad', ['War']), ('russian', ['War']), ('gop', ['War']), ('true', ['War'])]"
AndrewYang,2023-08-28 00:30:07+00:00,2,War,0.78103465,negative,0.8577542304992676,disgust,0.3625927865505218,4.0,Republicans vs democrats,0.03131942,Why don’t we trust our politicians anymore? https://t.co/4NzJUPNR4L,trust politician anymore,"[('politician', [2]), ('trust', [2]), ('anymore', [2])]","[('politician', ['War']), ('trust', ['War']), ('anymore', ['War'])]"
NewsbySmiley,2023-08-28 02:02:27+00:00,2,War,0.4952065,neutral,0.6977643966674805,fear,0.7910299301147461,6.0,Election/debate,0.22466797,DeSantis attends vigil for Black shooting victims as crises keep him in Florida https://t.co/KTMHHR2aFP,desantis attends vigil black shooting victim crisis florida,"[('black', [2, 5]), ('crisis', [5, 2]), ('victim', [2, 5]), ('desantis', [6, 2]), ('florida', [6, 5]), ('shooting', [2, 5]), ('vigil', [2]), ('attends', [2])]","[('black', ['War', 'Border/community/family']), ('crisis', ['Border/community/family', 'War']), ('victim', ['War', 'Border/community/family']), ('desantis', ['Election/debate', 'War']), ('florida', ['Election/debate', 'Border/community/family']), ('shooting', ['War', 'Border/community/family']), ('vigil', ['War']), ('attends', ['War'])]"
VivekGRamaswamy,2023-08-28 02:16:56+00:00,2,War,0.3408588,positive,0.8106845021247864,optimism,0.9104503393173218,8.0,Infrastructure/job/energy,0.24686746,"TRUTH: God is real. That shouldn’t be a taboo thing to say — God needn’t be a four-letter word. Believing in something higher than ourselves is unifying, in fact we hunger for it. We all come from different walks but we are bound by a common creed. 🇺🇸 https://t.co/YFmYMr5P2x",truth god real taboo thing god need letter word believing higher unifying fact hunger come different walk bound common creed,"[('come', [2, 8]), ('letter', [4, 8]), ('god', [2, 4]), ('different', [4, 2]), ('fact', [2, 4]), ('need', [8, 1]), ('thing', [2, 4]), ('truth', [4, 2]), ('common', [1, 8]), ('real', [1, 4]), ('word', [2, 4]), ('believing', [2, 4]), ('walk', [2, 4]), ('higher', [1, 8]), ('bound', [4, 8]), ('creed', [8]), ('hunger', [1, 2]), ('taboo', [8]), ('unifying', [8])]","[('come', ['War', 'Infrastructure/job/energy']), ('letter', ['Republicans vs democrats', 'Infrastructure/job/energy']), ('god', ['War', 'Republicans vs democrats']), ('different', ['Republicans vs democrats', 'War']), ('fact', ['War', 'Republicans vs democrats']), ('need', ['Infrastructure/job/energy', 'American/economics/health']), ('thing', ['War', 'Republicans vs democrats']), ('truth', ['Republicans vs democrats', 'War']), ('common', ['American/economics/health', 'Infrastructure/job/energy']), ('real', ['American/economics/health', 'Republicans vs democrats']), ('word', ['War', 'Republicans vs democrats']), ('believing', ['War', 'Republicans vs democrats']), ('walk', ['War', 'Republicans vs democrats']), ('higher', ['American/economics/health', 'Infrastructure/job/energy']), ('bound', ['Republicans vs democrats', 'Infrastructure/job/energy']), ('creed', ['Infrastructure/job/energy']), ('hunger', ['American/economics/health', 'War']), ('taboo', ['Infrastructure/job/energy']), ('unifying', ['Infrastructure/job/energy'])]"
TheDemocrats,2023-08-28 02:52:28+00:00,2,War,0.8198197,negative,0.9265533089637756,sadness,0.7427481412887573,1.0,American/economics/health,0.14556628,"RT @I am heartbroken by yesterday’s shooting in Jacksonville. This act was reportedly driven by racism and hatred, carried out with a weapon of war that should never have been on the streets. These tragedies must stop. We must renew the ban on assault weapons. It is long overdue.",heartbroken yesterday shooting jacksonville thisact wasreportedly driven racism hatred carried weapon war street tragedy stop renew ban onassault weapon long overdue,"[('ban', [2, 1]), ('weapon', [2, 1]), ('street', [2, 1]), ('war', [2, 1]), ('long', [2, 1]), ('yesterday', [1]), ('stop', [2, 1]), ('racism', [2]), ('shooting', [2]), ('tragedy', [2, 1]), ('overdue', [1]), ('carried', [2]), ('driven', [2, 1]), ('hatred', [2]), ('heartbroken', [2]), ('jacksonville', [2]), ('onassault', [2]), ('renew', [2]), ('thisact', [2]), ('wasreportedly', [2])]","[('ban', ['War', 'American/economics/health']), ('weapon', ['War', 'American/economics/health']), ('street', ['War', 'American/economics/health']), ('war', ['War', 'American/economics/health']), ('long', ['War', 'American/economics/health']), ('yesterday', ['American/economics/health']), ('stop', ['War', 'American/economics/health']), ('racism', ['War']), ('shooting', ['War']), ('tragedy', ['War', 'American/economics/health']), ('overdue', ['American/economics/health']), ('carried', ['War']), ('driven', ['War', 'American/economics/health']), ('hatred', ['War']), ('heartbroken', ['War']), ('jacksonville', ['War']), ('onassault', ['War']), ('renew', ['War']), ('thisact', ['War']), ('wasreportedly', ['War'])]"
TulsiGabbard,2023-08-28 11:00:30+00:00,2,War,0.3471799,positive,0.97905832529068,joy,0.896554708480835,7.0,Abortion/rights/guns,0.30169058,"Congratulations @BlessedMMA on yet another great fight, and for lifting the voices and needs of the people of Lahaina and Maui to the world. Mahalo 🙏🏽",congratulation great fight lifting voice need people lahaina maui world mahalo,"[('world', [5, 2]), ('people', [2, 5]), ('need', [2, 5]), ('fight', [7, 5]), ('great', [5, 2]), ('voice', [7, 5]), ('maui', [5, 2]), ('congratulation', [5, 7]), ('lahaina', [2]), ('lifting', [7, 2]), ('mahalo', [2])]","[('world', ['Border/community/family', 'War']), ('people', ['War', 'Border/community/family']), ('need', ['War', 'Border/community/family']), ('fight', ['Abortion/rights/guns', 'Border/community/family']), ('great', ['Border/community/family', 'War']), ('voice', ['Abortion/rights/guns', 'Border/community/family']), ('maui', ['Border/community/family', 'War']), ('congratulation', ['Border/community/family', 'Abortion/rights/guns']), ('lahaina', ['War']), ('lifting', ['Abortion/rights/guns', 'War']), ('mahalo', ['War'])]"
larryelder,2023-08-28 12:14:45+00:00,2,War,0.641424,negative,0.521407425403595,disgust,0.3608317673206329,4.0,Republicans vs democrats,0.11774269,"Fact: As to white-black homicides, there about 750 per yr. 500 whites are killed by blacks; 250 blacks are killed by whites. As to white-black non-homicide violent crime—like attempted murder, rape, aggravated assault—there are about 500K per yr. 85% are black perp/white victim. https://t.co/HmLih4tOZv",fact white black homicide  white killed black black killed white white black non homicide violent crimelike attempted murder rape aggravated assaultthere   black perp white victim,"[('murder', [2, 5]), ('violent', [2, 5]), ('killed', [2, 5]), ('black', [2, 5]), ('fact', [2, 4]), ('victim', [2, 5]), ('white', [2, 4]), ('non', [2, 4]), ('attempted', [5]), ('rape', [2, 4]), ('homicide', [1]), ('aggravated', [4, 2]), ('perp', [2]), ('assaultthere', [2]), ('crimelike', [2])]","[('murder', ['War', 'Border/community/family']), ('violent', ['War', 'Border/community/family']), ('killed', ['War', 'Border/community/family']), ('black', ['War', 'Border/community/family']), ('fact', ['War', 'Republicans vs democrats']), ('victim', ['War', 'Border/community/family']), ('white', ['War', 'Republicans vs democrats']), ('non', ['War', 'Republicans vs democrats']), ('attempted', ['Border/community/family']), ('rape', ['War', 'Republicans vs democrats']), ('homicide', ['American/economics/health']), ('aggravated', ['Republicans vs democrats', 'War']), ('perp', ['War']), ('assaultthere', ['War']), ('crimelike', ['War'])]"
larryelder,2023-08-28 13:04:04+00:00,2,War,0.47751793,negative,0.7287339568138123,anger,0.6485739946365356,5.0,Border/community/family,0.24851337,Ever notice when a racist white person shoots and kills blacks no one blames “easy access to guns.” https://t.co/ZVsAfFKWTf,notice racist white person shoot kill black blame easy access gun,"[('person', [2, 5]), ('black', [2, 5]), ('kill', [2, 5]), ('racist', [2]), ('white', [2, 5]), ('gun', [1, 2]), ('access', [1]), ('blame', [2, 1]), ('easy', [2, 1]), ('notice', [5, 1]), ('shoot', [5])]","[('person', ['War', 'Border/community/family']), ('black', ['War', 'Border/community/family']), ('kill', ['War', 'Border/community/family']), ('racist', ['War']), ('white', ['War', 'Border/community/family']), ('gun', ['American/economics/health', 'War']), ('access', ['American/economics/health']), ('blame', ['War', 'American/economics/health']), ('easy', ['War', 'American/economics/health']), ('notice', ['Border/community/family', 'American/economics/health']), ('shoot', ['Border/community/family'])]"
larryelder,2023-08-28 13:09:04+00:00,2,War,0.50079,negative,0.5574694871902466,anger,0.4858177900314331,4.0,Republicans vs democrats,0.385352,"Did Biden publicly condemn the Tulsa, Oklahoma black man who, in May, walked up behind two white men, shot and killed them execution style—and admitted he did it because they were white? CRICKETS… https://t.co/DowPnzq5B9",biden publicly condemn tulsa oklahoma black man walked white men shot killed execution styleand admitted white cricket,"[('biden', [4, 2]), ('condemn', [2]), ('publicly', [4, 6]), ('shot', [2, 4]), ('killed', [2, 4]), ('man', [2, 4]), ('black', [2, 4]), ('walked', [4]), ('men', [2, 4]), ('white', [4, 2]), ('admitted', [4]), ('oklahoma', [6]), ('cricket', [2]), ('execution', [4]), ('tulsa', [2]), ('styleand', [2])]","[('biden', ['Republicans vs democrats', 'War']), ('condemn', ['War']), ('publicly', ['Republicans vs democrats', 'Election/debate']), ('shot', ['War', 'Republicans vs democrats']), ('killed', ['War', 'Republicans vs democrats']), ('man', ['War', 'Republicans vs democrats']), ('black', ['War', 'Republicans vs democrats']), ('walked', ['Republicans vs democrats']), ('men', ['War', 'Republicans vs democrats']), ('white', ['Republicans vs democrats', 'War']), ('admitted', ['Republicans vs democrats']), ('oklahoma', ['Election/debate']), ('cricket', ['War']), ('execution', ['Republicans vs democrats']), ('tulsa', ['War']), ('styleand', ['War'])]"
marklevinshow,2023-08-28 13:29:08+00:00,2,War,0.49895847,negative,0.6588752865791321,anger,0.6254549622535706,5.0,Border/community/family,0.19729704,"God bless you, sir. The problem is the evil bastard who murdered these poor souls. May God look after them.",god bless sir problem evil bastard murdered poor soul god look,"[('soul', [2, 5]), ('god', [2, 3]), ('problem', [2, 1]), ('look', [2, 5]), ('evil', [2, 5]), ('bless', [3]), ('poor', [2, 1]), ('murdered', [5]), ('sir', [2]), ('bastard', [1])]","[('soul', ['War', 'Border/community/family']), ('god', ['War', 'News/radio/livestream']), ('problem', ['War', 'American/economics/health']), ('look', ['War', 'Border/community/family']), ('evil', ['War', 'Border/community/family']), ('bless', ['News/radio/livestream']), ('poor', ['War', 'American/economics/health']), ('murdered', ['Border/community/family']), ('sir', ['War']), ('bastard', ['American/economics/health'])]"
marklevinshow,2023-08-28 14:20:04+00:00,2,War,0.45786574,negative,0.8267138004302979,anger,0.7582864761352539,4.0,Republicans vs democrats,0.40792993,"The Democrat Party is, in fact, at it again: re-segregating America, CRT, relentless racism, bigoted statements, rejection of a colorblind society, etc. Seems like Vivek is making a very important point here. The Democrat Party is THE party of racism. https://t.co/42XDVy58L2",democrat party fact segregating america crt relentless racism bigoted statement rejection colorblind society etc like vivek making important point democrat party party racism,"[('statement', [4, 2]), ('america', [2, 4]), ('like', [2, 4]), ('making', [2, 4]), ('fact', [4, 2]), ('point', [4, 2]), ('bigoted', [5]), ('important', [4, 5]), ('party', [2, 4]), ('vivek', [4, 2]), ('democrat', [4, 2]), ('racism', [2, 3]), ('society', [2, 5]), ('etc', [4, 2]), ('relentless', [4]), ('crt', [4]), ('colorblind', [3]), ('rejection', [2]), ('segregating', [2, 4])]","[('statement', ['Republicans vs democrats', 'War']), ('america', ['War', 'Republicans vs democrats']), ('like', ['War', 'Republicans vs democrats']), ('making', ['War', 'Republicans vs democrats']), ('fact', ['Republicans vs democrats', 'War']), ('point', ['Republicans vs democrats', 'War']), ('bigoted', ['Border/community/family']), ('important', ['Republicans vs democrats', 'Border/community/family']), ('party', ['War', 'Republicans vs democrats']), ('vivek', ['Republicans vs democrats', 'War']), ('democrat', ['Republicans vs democrats', 'War']), ('racism', ['War', 'News/radio/livestream']), ('society', ['War', 'Border/community/family']), ('etc', ['Republicans vs democrats', 'War']), ('relentless', ['Republicans vs democrats']), ('crt', ['Republicans vs democrats']), ('colorblind', ['News/radio/livestream']), ('rejection', ['War']), ('segregating', ['War', 'Republicans vs democrats'])]"
CollinRugg,2023-08-28 14:51:37+00:00,2,War,0.32672304,negative,0.7968589067459106,anger,0.783125102519989,5.0,Border/community/family,0.22186145,"NEW: Nevada tribal rangers ram through a group of climate protesters with a truck, drag them off the road, and then arrest them all after the group created miles of traffic on a busy single lane road. Well done. The climate protesters were attempting to shut down the Burning Man Arts and Music Festival until the rangers ruined their day. This is how all radical climate activists should be dealt with.",nevada tribal ranger ram group climate protester truck drag road arrest group created mile traffic busy single lane road climate protester attempting shut burning man art music festival ranger ruined day radical climate activist dealt,"[('nevada', [6, 8]), ('group', [2, 8]), ('arrest', [2, 4]), ('day', [5, 8]), ('protester', [2, 4]), ('man', [2, 5]), ('road', [8, 5]), ('activist', [2, 6]), ('single', [2, 5]), ('shut', [2, 4]), ('attempting', [4]), ('created', [8, 5]), ('mile', [8, 5]), ('music', [5, 6]), ('climate', [8, 2]), ('drag', [2, 4]), ('radical', [2, 4]), ('busy', [2, 6]), ('art', [5, 2]), ('burning', [2, 4]), ('dealt', [2]), ('festival', [5]), ('lane', [5]), ('ram', [8]), ('ranger', [3]), ('ruined', [4]), ('traffic', [5, 6]), ('tribal', [8, 5]), ('truck', [3, 5])]","[('nevada', ['Election/debate', 'Infrastructure/job/energy']), ('group', ['War', 'Infrastructure/job/energy']), ('arrest', ['War', 'Republicans vs democrats']), ('day', ['Border/community/family', 'Infrastructure/job/energy']), ('protester', ['War', 'Republicans vs democrats']), ('man', ['War', 'Border/community/family']), ('road', ['Infrastructure/job/energy', 'Border/community/family']), ('activist', ['War', 'Election/debate']), ('single', ['War', 'Border/community/family']), ('shut', ['War', 'Republicans vs democrats']), ('attempting', ['Republicans vs democrats']), ('created', ['Infrastructure/job/energy', 'Border/community/family']), ('mile', ['Infrastructure/job/energy', 'Border/community/family']), ('music', ['Border/community/family', 'Election/debate']), ('climate', ['Infrastructure/job/energy', 'War']), ('drag', ['War', 'Republicans vs democrats']), ('radical', ['War', 'Republicans vs democrats']), ('busy', ['War', 'Election/debate']), ('art', ['Border/community/family', 'War']), ('burning', ['War', 'Republicans vs democrats']), ('dealt', ['War']), ('festival', ['Border/community/family']), ('lane', ['Border/community/family']), ('ram', ['Infrastructure/job/energy']), ('ranger', ['News/radio/livestream']), ('ruined', ['Republicans vs democrats']), ('traffic', ['Border/community/family', 'Election/debate']), ('tribal', ['Infrastructure/job/energy', 'Border/community/family']), ('truck', ['News/radio/livestream', 'Border/community/family'])]"
WashTimesOpEd,2023-08-28 15:35:02+00:00,2,War,0.5618031,neutral,0.4893545806407928,optimism,0.4453887641429901,7.0,Abortion/rights/guns,0.3546235,#ICYMI from @ckchumley and @toddstarnes on #boldandblunt: Freedom-minded patriots may be wearied with the fight. But the left is bound to lose. https://t.co/lidhh7pCul,freedom minded patriot wearied fight left bound lose,"[('freedom', [7, 2]), ('fight', [7, 2]), ('left', [2, 7]), ('lose', [2]), ('minded', [2]), ('patriot', [2]), ('bound', [7]), ('wearied', [2])]","[('freedom', ['Abortion/rights/guns', 'War']), ('fight', ['Abortion/rights/guns', 'War']), ('left', ['War', 'Abortion/rights/guns']), ('lose', ['War']), ('minded', ['War']), ('patriot', ['War']), ('bound', ['Abortion/rights/guns']), ('wearied', ['War'])]"
VivekGRamaswamy,2023-08-28 16:22:03+00:00,2,War,0.7809142,positive,0.6148704290390015,anticipation,0.5558920502662659,4.0,Republicans vs democrats,0.03135359,RT @RandPaul: He was the only one with a good answer on Ukraine.,good answer ukraine,"[('ukraine', [2]), ('good', [2]), ('answer', [2])]","[('ukraine', ['War']), ('good', ['War']), ('answer', ['War'])]"
WashTimesOpEd,2023-08-28 16:35:04+00:00,2,War,0.6066715,negative,0.6251068115234375,anticipation,0.4614410698413849,8.0,Infrastructure/job/energy,0.2381142,"#Editorial: ""Given the aggressive earthly behavior of the two Eurasian powers, there is reason to suspect that 'peaceful purposes' are not necessarily a priority for their future lunar operations."" https://t.co/tUKcEQxyf9",given aggressive earthly behavior eurasian power reason suspect peaceful purpose necessarily priority future lunar operation,"[('power', [2, 8]), ('reason', [2, 5]), ('future', [8, 5]), ('purpose', [2, 5]), ('given', [2, 5]), ('priority', [8, 2]), ('operation', [8, 5]), ('earthly', [2]), ('behavior', [2]), ('suspect', [2]), ('aggressive', [8]), ('necessarily', [2]), ('peaceful', [2, 5]), ('lunar', [5]), ('eurasian', [2])]","[('power', ['War', 'Infrastructure/job/energy']), ('reason', ['War', 'Border/community/family']), ('future', ['Infrastructure/job/energy', 'Border/community/family']), ('purpose', ['War', 'Border/community/family']), ('given', ['War', 'Border/community/family']), ('priority', ['Infrastructure/job/energy', 'War']), ('operation', ['Infrastructure/job/energy', 'Border/community/family']), ('earthly', ['War']), ('behavior', ['War']), ('suspect', ['War']), ('aggressive', ['Infrastructure/job/energy']), ('necessarily', ['War']), ('peaceful', ['War', 'Border/community/family']), ('lunar', ['Border/community/family']), ('eurasian', ['War'])]"
marwilliamson,2023-08-28 17:25:15+00:00,2,War,0.74546295,negative,0.4416066110134125,optimism,0.4381680488586426,8.0,Infrastructure/job/energy,0.1466671,Stop Cop City activists are among the bravest of our generation. They are risking more than we can imagine in an effort to stop an extremely dangerous project of police militarization in America. @ReverendWarnock is silent. @ossoff is silent. Other Democratic leaders are silent. But the Stop Cop City activists are getting it done. Bravo.,stop cop city activist bravest generation risking imagine effort stop extremely dangerous project police militarization america silent silent democratic leader silent stop cop city activist getting bravo,"[('america', [2, 8]), ('police', [2, 7]), ('getting', [2, 8]), ('imagine', [2, 8]), ('project', [8]), ('activist', [2, 7]), ('city', [2, 8]), ('extremely', [2, 7]), ('stop', [2, 7]), ('effort', [8, 2]), ('leader', [2, 8]), ('generation', [8, 7]), ('democratic', [2, 7]), ('bravo', [2]), ('silent', [2]), ('cop', [2]), ('dangerous', [2, 7]), ('bravest', [2]), ('risking', [7]), ('militarization', [2])]","[('america', ['War', 'Infrastructure/job/energy']), ('police', ['War', 'Abortion/rights/guns']), ('getting', ['War', 'Infrastructure/job/energy']), ('imagine', ['War', 'Infrastructure/job/energy']), ('project', ['Infrastructure/job/energy']), ('activist', ['War', 'Abortion/rights/guns']), ('city', ['War', 'Infrastructure/job/energy']), ('extremely', ['War', 'Abortion/rights/guns']), ('stop', ['War', 'Abortion/rights/guns']), ('effort', ['Infrastructure/job/energy', 'War']), ('leader', ['War', 'Infrastructure/job/energy']), ('generation', ['Infrastructure/job/energy', 'Abortion/rights/guns']), ('democratic', ['War', 'Abortion/rights/guns']), ('bravo', ['War']), ('silent', ['War']), ('cop', ['War']), ('dangerous', ['War', 'Abortion/rights/guns']), ('bravest', ['War']), ('risking', ['Abortion/rights/guns']), ('militarization', ['War'])]"
